Author Name,Author ID,Date,Post Text,Replies,Likes,Reshares,Views
massive dynamic,@amando_jason,2022-04-28T13:17:55.000Z,Check out Men's Tee T shirt Shirt  3D Print  Graphic American Flag  https:// 56?mkcid=16&mkevt=1&mkrid=711-127632-2357-0&ssspo=OTpIsKIhQeW&sssrc=2566055&ssuid=&widget_ver=artemis&media=TW … #eBay  via  @eBay,0,0,0,0
IES FERRAN TALLADA,@Ferrantallada,2022-04-28T13:01:40.000Z,"Un grup d’alumnes d’ #ESO  van participar al  #EEBE #3D  Printing Challenge de  @la_UPC  una competició per equips en què s'ha d'imprimir una peça i superar unes proves del jurat. No van guanyar però la seva peça va marcar el rècord de resistència.
+   a  https://",0,2,2,0
Cricket is on the other site too,@strangegutz,2022-04-28T19:49:40.000Z,"Mel may be getting me a resin  3d printer  some time in the new house   I'm still gonna hand sculpt dolls, but it'll be a great way to make accessories",5,49,0,0
"ASU School of Electrical, Computer & Energy Eng",@AsuEnergy,2022-04-28T17:08:25.000Z,"Chao Wang, Yu Yao, and their students have invented a solution-based  additive manufacturing  process to “paint with light” on glass and plastics. Read more here:  https:// ing-with-light/ …",0,0,0,0
BGCWPA_STEM,@BGCWPA_STEM,2022-04-28T19:17:49.000Z,"FREE  #RemakeDaysSWPA  event THIS SATURDAY at our Shadyside Clubhouse from 1-4pm! Make a  3D printed , light-up Iron Man arc reactor! See our new  #makerspace !  #RemakeDays #WhenYouWonder #CareerReadyPA #RemakeDaysPA @RemakeDays @bgcwpa  Register at  https:// ClubsofWesternPennsylvania#/selectSessions/3111137 …",0,1,2,0
Jason Cummings - Imperial 3D Printing & Design,@Imperial_3D,2022-04-28T13:20:57.000Z,Imperial  3D Printing  & Design Live Stream  https://  via  @YouTube  printing @cinderwing3 Crystal Dragon in  @3DDPLUS  rainbow PETG filament and Baby Rose Dragon in black marble.   #3Dprinting,0,0,0,0
OpenSource Economy,@OpenSourceTimes,2022-04-28T14:59:03.000Z,3D-printed  reefs can be antidote to coral reef devastation - ISRAEL21c  http://,0,0,0,0
Kim Miller,@Miller17Kim,2022-04-28T19:00:45.000Z,"FOOD DAY is a good day! The class has been working on  3D printing  plates, utensils, & cups and today was the day to put it to use. Who knew pancakes, eggs and fruit would be so entertaining?!  @PHSPiratePride",0,4,1,0
Loftin & Company Printers,@ActionPrints,2022-04-28T13:24:22.000Z,"See how a substantial  3D printer  built the walls of a 2,000-square-foot luxury home in Austin in 8 days.  https:// ates-a-Luxury-Texas-Home …",0,0,0,0
nobodyatallreally,@cordyceps12,2022-04-28T18:51:02.000Z,Does anyone know of a claylike filament for 3d printers? Do you think its possible to do photogrammatry from one side of a display case to turn the photos into a 3dprintable object you could print using a  3d printer  and a clay like filament?,0,0,0,0
Spatial Integrated Systems - SIS Inc.,@SISINC1,2022-04-28T15:01:10.000Z,"Learn how top  #manufacturers  are planning for the future, and what you need to know about  #3D  printing and how it will change your product development. Adopt a new way of designing!  https:// #whitepaper #techclarity #PLM",0,0,0,0
Kirkland Printing,@kirklandprtg,2022-04-28T15:30:30.000Z,"See how a substantial  3D printer  built the walls of a 2,000-square-foot luxury home in Austin in 8 days.  https:// ates-a-Luxury-Texas-Home …",0,0,0,0
ThePrizeCounter TFF,@ThePrizeCounter,2022-04-28T19:34:11.000Z,"Want fursuit updates?
This'll include fur updates, character designs, upcoming partials, 3d Models,  3d printing  and more!

you can join the telegram chat at the l!nk below!",1,1,1,0
Cadalyst Magazine,@Cadalyst_Mag,2022-04-28T17:05:00.000Z,"Aerojet Rocketdyne uses metal  3D printing  technology from Velo3D and implicit CAD modeling from nTopology to make a critical flight component lighter, smaller, and much less expensive than its predecessors. Read part 3 of our series on AM! >> https://",0,0,0,0
David Jerome Meachem,@DavidMeachem,2022-04-28T16:30:01.000Z,Your Next Home Could Be  3D Printed https:// rinted?id=38a2 …,0,0,0,0
Early Charm,@earlycharm,2022-04-28T14:26:55.000Z,"News: Materic portfolio company, Danae, has its  3D printed  prosthetic cover featured in a special  @smithsonian  Arts and Industries Building exhibit called ""Futures that Unite."" Read more:  https:// #3Dprinting #3Dmodeling #AdvancedMaterials #ProstheticDesign",0,0,0,0
Production Machining,@PMProdMachining,2022-04-28T14:30:53.000Z,"For  #CNC  machine shops, ever considered giving (or loaning) a  3D printer  to an employee to play with at home? Here’s why Derek Korn asks.  http:// a-3d-printer-to-an-employee?utm_source=twitter&utm_medium=social&utm_campaign=social22&utm_content=ForCNCmach …",0,0,0,0
Urban Sloths-PRESALE IS LIVE,@USloths,2022-04-28T18:58:41.000Z,"2nd Roadmap Update The Metaverse is far too large for our sloths to ignore.There will be a new 3D Sloths collection made. Your new Sloth will be Metaverse-ready, which means you'll get a 3D model to utilize for gamification, avatars,  3D printing , and more.
1/2",1,2,2,0
Wevolver,@WevolverApp,2022-04-28T16:45:12.000Z,"Register now for the first international 4D Materials Design and  Additive Manufacturing  2022 (4DMDA 2022) Conference.

The conference will be hosted as an online event and take place on September 1-2, 2022.

Learn more:  https:// 22/ … #engineering #technology #AM #4D",0,12,5,0
I4MS,@I4MS_Europe,2022-04-28T15:01:39.000Z,@pulsateeu  is looking for SMEs or slightly bigger companies that represent high-potential business use cases to implement Laser-Based Advanced and  Additive Manufacturing  technology in their processes. Find out all about it in our Newsletter!  https:// 2hu393re5-13772389 …,0,0,0,0
3D-zakaz,@3dzakaz3d,2022-04-28T18:39:12.000Z,"Персонажи Майнкрафт. Из заказов для детей. 3д печать
Minecraft characters. From orders for children.  3d printing",0,0,0,0
Dav3,@Dav3Theking,2022-04-28T17:20:10.000Z,These are some of my  3D printed  creations…,0,0,0,0
Nanowerk,@Nanowerk,2022-04-28T15:33:23.000Z,Researchers add atomic-layer antireflection coatings to complex  3D printed  micro-optical systems ://www.nanowerk.com/nanotechnology-news2/newsid=60508.php,0,7,1,0
ClearedJobsNet,@ClearedJobsNet,2022-04-28T19:00:00.000Z,Featured employer  @LLNLcareers  is seeking an Applied Polymer Science to characterize the chemical changes & degradations to engineering polymer materials & much more. Exp with polymer material  additive manufacturing  desired.  https:// lymer-science-research-scientist-livermore-california-1065728/ … #securityclearance #jobs #CA,0,0,0,0
Access Manufacturing Systems,@accessmfgsys,2022-04-28T16:01:18.000Z,Introducing the X7 Industrial Carbon Fiber  3D Printer  by  @Markforged #accessmanufacturingsystems #markforged #automation #3dprinted #Metal3Dprinting #Metal #additivemanufacturing #manufacturing #engineeredproductivity #techstories,0,0,0,0
IRICAUCLM.bsky.social,@IRICA_uclm,2022-04-28T13:46:34.000Z,"Ultra-low binder content  3D printed  calcium phosphate graphene scaffolds as resorbable, osteoinductive matrices that support bone formation in vivo  https:// 8-022-10603-3?utm_source=dlvr.it&utm_medium=twitter …",0,0,0,0
Navi of Boomhandia,@NaviGoBoom,2022-04-28T13:17:06.000Z,"RUN
DRACO

( 3D printed  edition)",3,112,10,0
Angsuman Chakraborty,@angsuman,2022-04-28T13:23:00.000Z,Laser-based volumetric  additive manufacturing  can  3D print  glass in seconds  https:// -based-volumetric-additive-manufacturing-method-can-3d-print-glass-seconds …,0,0,0,0
avaxgfxcom,@avaxgfxcom,2022-04-28T16:42:05.000Z,Mia Khalifa as Venom  3D Print https:// rint_models/285582-mia-khalifa-as-venom-3d-print.html …,0,0,0,0
𝕄𝕤. 𝔾𝕒𝕤𝕤𝕖𝕣,@ms_gasser,2022-04-28T15:38:25.000Z,And  3D printing  is going! Got our first student project going!  #3Dprinting #stem #steam #edtech,0,10,3,0
Amy,@He3dU,2022-04-28T13:04:00.000Z,"US $159.0 |HE3D C270 camera laser 3d scanner DIY kit, Reprap 3d Open source Portable for  3d printer |reprap 3d|...  https:// 53.html?channel=twinner …",0,0,0,0
Reindl5th,@Reindl5th1,2022-04-28T16:58:10.000Z,"Busy week at the HS.  Had Mrs Rivecco’s class in stem lab- designing,  3D printing , and virtually riding roller coasters. It has been a good week!   #zSpace #OculusVR  THS",0,0,0,0
Ben Fuller,@BenFullOpoop,2022-04-28T17:25:47.000Z,24 hours into a 30 how  3d print  and I feel like R2-D2 just won't shut up!,0,0,0,0
John pearce #cyber & #technology #news,@techpearce6,2022-04-28T19:25:12.000Z,"Stratasys’ First Sustainability Report Champions  3D Printing  Climate Action, Social Impact, Commitment to ‘Mindful Manufacturing’  https:// 0427005654/en/Stratasys%E2%80%99-First-Sustainability-Report-Champions-3D-Printing-Climate-Action-Social-Impact-Commitment-to-%E2%80%98Mindful-Manufacturing%E2%80%99 …",0,0,0,0
canadianbestseller.com,@kanadianbest,2022-04-28T15:27:19.000Z,"C$16.99 -  #FreeShipping  | Shop more, save more   3D Printer  Direct Drive Conversion Kit,  #AOUTLE https:// #sharious #canadianbestseller #canada #usa #product  #15978377169006   #Conversion #CR10S #Creality #Direct #Drive  .",0,0,0,0
3D Printing Deals,@3dpdeals,2022-04-28T16:15:14.000Z,"$334.65 CREALITY Ender 3 S1 w/ 1kg white PLA
Lightning Deal and $30 off coupon.
Add both to cart separately, PLA should be free.

afflinks
Ender 3 S1:  https:// 1kg White PLA:  https:// Also 50% off grey/black PLA, check Special Offers section",1,0,0,0
3DHEALS,@3dheals,2022-04-28T13:10:02.000Z,China Medical University (CMU) adapted the advancement of  additive manufacturing  technology to fabricate innovative nerve conduits with complex pore patterns and dimensions with high precision.  https://,0,0,0,0
Tuan TRANPHAM,@ttranpham,2022-04-28T21:20:31.000Z,"AMUG ( Additive Manufacturing  Users Group): Meet the newly elected AMUG Board Members for the 2022-2023 term starting July 1, 2022.:  https://  

Mark Abshire, Shannon VanDeren and Jason Dickman will serve as President, Vice President and Dire… https://",0,0,0,0
Bladimir Rondon,@pigbar,2022-04-28T16:33:44.000Z,Laser-Based  3D Printer  Produces Complex Objects in Any Order  https://  by  @theofficialacm,0,0,0,0
Shapeways,@shapeways,2022-04-28T18:00:48.000Z,"Additive manufacturing  is hard, so we simplify it: Instant quotes, advanced technology, quality, and total traceability. Get started:  https:// #3DPrinting #AdditiveManufacturing #Engineering #CNC #Design",0,0,0,0
3D Printing @𝟑𝐃𝐚𝐛𝐥𝐞,@3Dable,2022-04-28T17:55:15.000Z,FA »Mindful Manufacturing: Stratasys Releases First ESG & Sustainability Report«  https:// #3Dable #3DP #3Dprinting #3Dprinter #Prototyping,0,0,0,0
Ondeckeo Video Hub,@OndeckeoVideos,2022-04-28T16:02:08.000Z,"Kornit Showcases the Future of Sustainable Digital Fashion, 3D and Otherwise –  http://  | The Voice of  3D Printing #SocialMediaSuccess #MarketingTrends #Ondeckeo #DigitalMarketing  [Video]  http://",0,0,2,0
3D Printing Dad @3DPrintingDad@fosstodon.org,@MrCarefulGamer,2022-04-28T14:25:14.000Z,"Something interesting I've noticed in my first few days on the  http://  instance of Mastodon: despite the fact that my Mastodon following is a small fraction of my Twitter following, engagement is considerably higher on Mastodon.

I'll be curious to watch and (1/2)",1,3,0,0
Not A Games Dev Ollie,@Reksaurian,2022-04-28T13:48:34.000Z,Neigh.,0,0,0,0
romeisded,@ndrewlord,2022-04-28T16:10:59.000Z,My favorite side of Twitter is some gungrabbing crybaby having an intense debate about something they know nothing about and 30 mfs from the  3D printing  community just start tweeting dope ass videos at them ,0,2,0,0
kumaranz,@Sanatanai07,2022-04-28T15:36:23.000Z,"Industrial  #3D  printing with a digital twin: MasterPrint  #Robotic  gigantic industrial  3D printer , world’s largest device that prints wd thermoplastics. Large parts printed & machined to final shape wd  thesame machine,Manufacturing costs reduced upto 75%!  https:// any/stories/industry/2021/digital-twin-machine-tools-3d-printing-additive-manufacturing-ingersoll.html …",0,0,0,0
Markus Wolf,@3DMetalPrintin1,2022-04-28T13:37:05.000Z,When  3D Printing  Mergers Collapse: Essentium SPAC Fallout with Collider  https:// -printing-mergers-collapse-essentium-spac-fallout-with-collider/?utm_source=dlvr.it&utm_medium=twitter …,0,0,0,0
Katie Rainer,@KatieRainer1,2022-04-28T16:23:08.000Z,I’ve had so much joy in the library this week with students literally skipping out of the book fair with bags full of books and our self contained classroom that is currently obsessed with the  3D printer .,0,6,0,0
Bradley Jon Eaglefeather,@bjeaglefeather,2022-04-28T20:56:08.000Z,"Taking a Closer Look at  3D Printing  Applications in the Maritime Sector: It is common knowledge that  additive manufacturing  is helping the conquest of space, but did you know it can also be found in our…  http://  |  @3Dnatives #MaritimeSector #3DPrinting …",0,1,4,0
Smart Materials 3D,@smartmaterials3,2022-04-28T13:50:24.000Z,"The filament PLA is a biodegradable plastic due to its natural origin (corn, sugarcane or potatoes). In addiction, it is one of the most easy to print materials in the  3D printing  world. https:// #pastel #PLA #3dprint #smartfil #smarttherevolution",0,7,0,0
Jeff Geerling,@geerlingguy,2022-04-28T20:22:33.000Z,3D Printed  Compute Module 4 IO Board to ITX/ATX adapter plate... does such a thing exist? I found one... but it's not full ITX size so it doesn't feel as secure as it should be.,3,30,0,0
Modern information society and innovations,@Innovation_PU,2022-04-28T13:38:14.000Z,"A list of emerging technologies are poised to have strong implications for urban development:
-  3D printing - The Internet of Things (IoT)
- Big Data
- Artificial intelligence (AI)
- Unmanned aerial vehicles (drones)
- Blockchain #blockchain #IoT #ArtificialIntelligence",0,0,0,0
3D Metal Printing Magazine,@3DMetalPrintMag,2022-04-28T15:48:02.000Z,"Derived from the company’s acquisition of ExOne this past fall, Desktop Metal has announced introduction of its X-Series family of binder jetting  3D printing  machines. Learn more:  https:// r/binder-jetting/new-family-of-binder-jetting-printers-for-metal-2c-ceramics-and-composites …",0,0,0,0
(3D Printed Cat) BitJeweler ⍜,@BitJeweler,2022-04-28T12:51:00.000Z,"#NewProfilePic  

go check out Ukrainian artist and architect @AddlineNft on  @orderinbox He blends tradition and bleeding edge with his Motanka Doll NFT collection.  https:// #NFTCommunity #digitalart #Ukraine #NFT #crypto #PolygonNFTs",1,16,8,0
3D Print Mars,@3dprintmars,2022-04-28T13:21:31.000Z,Yep  https:// /DaleStarkA10/status/1519512272351072256 …,0,0,0,0
bubbleistrouble,@bubbleistrouble,2022-04-28T15:40:42.000Z,"3D printed  trash can makes many, beautiful bubbles",0,0,0,0
Engineering.com,@engineeringcom,2022-04-28T13:35:00.000Z,Setup to Success:  3D Printing  for Manufacturers @Ultimaker http://,0,0,0,0
GovCon_Wire,@GovConWire,2022-04-28T15:01:50.000Z,Intelligence community venture capital firm  #In -Q-Tel has made an investment in Fortify to help the Boston-based company further develop its  3D printing  technology for use in electronics design and production. https:// el-invests-in-digital-manufacturing-company-fortify/ …,0,0,0,0
Atipik 3D Print,@3dAtipik,2022-04-28T13:28:35.000Z,"Chez Atipik  3D Print  nous ne faisons pas que de la série ! Nous concevons et fabriquons également vos outils de fabrication, gabarit de contrôle, gabarit de montage et mise en position.

Ci-dessous un très beau cas client ! #fabricationadditive #industriedufutur #impression3d",0,0,0,0
Alison Hinesman,@HINeSMnSTEM,2022-04-28T18:25:17.000Z,3D print  + craft supplies = a fully functioning prototype! Can’t wait to see the finished project at the Toy Convention!  #CFEVS #CFChooseCourage  @MrsKlodor  @ChagrinFallsMIT @MooreCFMS,0,6,1,0
sophie @ ALA,@sophsquare,2022-04-28T16:56:13.000Z,I feel like I’ve had really good luck with my  3d printer . I literally leave it out (with the filament out too) and I went to print something this morning before I left for class and it worked perfectly,1,1,0,0
Charles Russo,@Charles_M_Russo,2022-04-28T13:44:05.000Z,Essentium Fast Tracks COVID-19 Breathalyzer Kiosk Development With High Speed Extrusion  3D Printing #3dprinting https:// re/pr_newswire_stocks/essentium-fast-tracks-covid-19-breathalyzer-kiosk-development-with-high-speed-extrusion-3d-printing/article_4fc692af-da88-5637-88cf-83e22001b627.html …,0,0,0,0
Cayrex,@cayrex2,2022-04-28T13:21:19.000Z,3D printed  flow battery cell prototype - time lapse  #battery #batterytechnology #batterystorage #batteries #3dprinting,0,0,0,0
KauaiCCOCET,@KauaiCCOCET,2022-04-28T20:27:11.000Z,"Every student deserves access to a better future. 
We’re proud to offer # VerizonInnovativeLearning  #STEM  Achievers@KauaiCC&HonCC, a hands-on program where  #students  learn about design thinking,  3D printing &more. # CitizenVerizon Register for free at  https://",0,0,0,0
INTAMSYS,@intamsys_3d,2022-04-28T13:39:41.000Z,#welcometotheteam  Dominic Mannella  Dominic has joined us as a Principal  Additive Manufacturing  Engineer and will be helping us to improve sales through his application expertise also help us to improve our overall customer experience.  #USA #Minneapolis #FFF3Dprinting,0,0,0,0
Make Parts Fast,@MakePartsFast,2022-04-28T13:15:46.000Z,3D printing  a COVID-19 breathalyzer  https://,0,0,0,0
Mike Roberts (Titans_Revenge),@Real_Mike_R,2022-04-28T14:31:56.000Z,My dude  @FedorSosnin  coming through with the  3D printed  RC Plane to follow up his  3D printed  RC crawler! Check it out! https://,1,3,0,0
saturn,@made_in_saturn,2022-04-28T21:07:22.000Z,My  3D printer  trying to pump out all my Ayato special orders:,1,22,0,0
Kit,@KMT82design,2022-04-28T15:33:23.000Z,My  3D printed  painted action figure  #3Dprinting #scifi #comics #kids #toys #conceptart #hotmakes,0,2,0,0
Nabholz,@NabholzCorp,2022-04-28T15:03:08.000Z,"Congrats to Trey Lane, a Nabholz senior VDC specialist, for receiving an award as a 2022 Arkansas Construction Hall of Fame Emerging Professional! He is currently leading a research group investigating construction robotics and  3D printing  technology.  #nabholzcorp #nabholz",0,2,1,0
Avid Product Development,@AvidProduct,2022-04-28T19:56:54.000Z,"Can't wait to experience what awaits at next month's  @RAPID_Event . Stop by Lubrizol  3D Printing  Solutions Booth #2235 at RAPID + TCT, May 17-19, 2022 to see the innovation in person and connect! #AdditiveManufacturing #3DPrinting #Innovation",0,0,0,0
Abby Brown,@abbymath,2022-04-28T15:50:43.000Z,"As my friends and followers know, I'm a huge fan of  @Cults3D ! Saw this  @3DWithUs  article today & they put Cults at the top of their list, but I want to add how genuinely helpful and supportive of the  3D printing  community the Cults team of people are. 1/?",4,24,8,0
GAKI Aiko18+ XMAS SALE!,@gaki_aiko,2022-04-28T13:15:03.000Z,"me: buying slutty outfits
what i actually want: a  3d printer",0,5,0,0
Dav3,@Dav3Theking,2022-04-28T17:20:48.000Z,3D printing …,0,0,0,0
The 3D Print General,@3DPrintGeneral,2022-04-28T19:54:16.000Z,"My upcoming QIDI i-fast review video script is over 4,000 words.  Not looking forward to editing that.",5,22,1,0
Jewish News Syndicate,@JNS_org,2022-04-28T13:01:00.000Z," Using a  3D printer , staff from the plastic surgery department at the Galilee Medical Center created a synthetic prosthesis resembling cartilage and then covered it with skin.
𝗙𝗜𝗡𝗗 𝗢𝗨𝗧 𝗠𝗢𝗥𝗘 ⇣  #israelnews #microtia https:// ns-print-an-ear-to-correct-boys-deformity/ …",0,0,0,0
Not A Games Dev Ollie,@Reksaurian,2022-04-28T20:10:39.000Z,AYYY. OOOH. AYYY. OOOH. AYYY. OHHH.,1,2,0,0
Formlabs,@formlabs,2022-04-28T16:04:42.000Z,Interested in designing your own  3D printed  injection molds? Check out our on-demand masterclass to learn from the experts.  https://,0,2,2,0
Extruder Joe,@ExtruderJoe,2022-04-28T14:16:55.000Z,3D Printing : Could OVF Replace GCODE?  https:// -replace-gcode …,0,0,0,0
Not A Games Dev Ollie,@Reksaurian,2022-04-28T20:15:58.000Z,https:// ?igshid=MDJmNzVkMjY= … @Charalanahzard,0,0,0,0
Cleveland Jewish News,@CleveJN,2022-04-28T17:32:00.000Z,"Israeli doctors  3D-printed  an ear and attached it to a six-year-old boy born with microtia, a deformity that stops the development of a baby’s ear in the womb, usually during the first trimester of pregnancy.  https://",0,0,0,0
Apple Investor News,@AppleInvestNews,2022-04-28T14:36:04.000Z,Leaker compares  3D-printed  iPhone 14 models with iPhone 13 accessories (news@appleinsider.com (Wesley Hilliard)/AppleInsider)  http://,0,0,0,0
MiddlesexCommCollege,@middlesex_cc,2022-04-28T15:15:11.000Z,MCC Mechanical Engineering student Isaac Venezia won first place at the 2022 American Technical Education Association 3 D Futures Competition. His award-winning project was a  3D printed  robotic arm that he designed and built himself.   http://,0,4,1,0
DealBee Deals USA,@DealBeeDealsUSA,2022-04-28T18:34:40.000Z," Haosegd X1  3D Printer  Mini  3D Printer  for Kids Ages 8-10, 12   Only 67.99 $  instead of 79.99 $  (- 15%)   Requested Percentage: 2%  Deal ends at: 8:00 pm https://",0,0,0,0
Bioengineer.org,@bioengineerorg,2022-04-28T15:07:37.000Z,Researchers add antireflection coatings to complex  3D printed  micro-optical systems  https:// #science,0,0,0,0
Concordia Library,@ConcordiaLib,2022-04-28T13:40:02.000Z,"Design for  3D Printing An easy introductory workshop that will provide you with the skills to design for the Sandbox 3D printers. This will also cover the basics of  3D printing .  May 12, 2:00pm - 4:00pm LB 205 Register now!  https:// #CULibrary",0,0,0,0
Wevolver,@WevolverApp,2022-04-28T19:32:01.000Z,"Super large-scale  3D printing  for engineering and design applications is now possible thanks to a new Gel Dispensing Printing (GDP)  #technology . GDP is fast curing and can create large, support-free parts.

Article by  @Massivit3d :  https:// format-printers-use-gel-based-extrusion-to-create-full-scale-parts … #3dprinting #prototyping",0,7,3,0
B L A C K C L O U D,@blac_kloud,2022-04-28T13:26:21.000Z,I like  3d printing,0,0,0,0
3DCars,@3Dcarsdotcom,2022-04-28T14:52:04.000Z,On the Ground with XJet’s New CEO: Ceramics & Metal  3D Printing  Growth On Display  http://,0,0,0,0
3D Platform,@3DPUnlimited,2022-04-28T15:01:02.000Z,3D Print  Process Training -Tips for Large Format  3D Printing  Success Learn More Here:  https:// t-Process-Training … #AdditiveManufacturing #3Dprinting #large3dprint #additivemfg,0,2,0,0
bubbleistrouble,@bubbleistrouble,2022-04-28T18:50:40.000Z,"3D printed  cap makes big, transparent bubbles",0,0,0,0
Bonsai,@Bonsai4Yang,2022-04-28T15:26:27.000Z,"This is a long term project but it’s pretty awesome, the idea of sustainable cities is something I get really excited about, if I was a billionaire this is what I would invest in, and also incorporate  3D printed  houses ",1,4,0,0
Markus Wolf,@3DMetalPrintin1,2022-04-28T14:06:06.000Z,On the Ground with XJet’s New CEO: Ceramics & Metal  3D Printing  Growth On Display  https:// g-xjet-metal-ceramics-3d-printing-growth-on-display/?utm_source=dlvr.it&utm_medium=twitter …,0,2,1,0
nico,@intutawan,2022-04-28T16:46:45.000Z,if you think about it your head is slowly  3D printing  you hair,0,0,0,0
LivePrintCenter.com,@LivePrintCenter,2022-04-28T18:32:15.000Z,"See how a substantial  3D printer  built the walls of a 2,000-square-foot luxury home in Austin in 8 days.  https:// ates-a-Luxury-Texas-Home …",0,0,0,0
Make Parts Fast,@MakePartsFast,2022-04-28T15:05:09.000Z,3D printing  materials with color that offers hyper-realistic look and exact shore values  https://,0,0,0,0
Chaabbz,@Chaabbz,2022-04-28T19:33:18.000Z,"So every time I talk about my  3D printer  projects, my friends say... ""You should open up an Etsy shop!""

So, I went and did the thing! 

If you guys are interested in getting something for yourself, you can check out my etsy store at  https://  !",0,4,2,0
3D Printing Deals,@3dpdeals,2022-04-28T20:31:37.000Z,"$16.79 Giantarm (Geeetech) silk copper PLA ($16.09 blue/black PLA)
afflink:  https://  

30% off promo code: 30SILKCOPPER should auto apply at checkout https:// giantarm-geeetech-silk-copper-pla-16-09-blue-black-pla …",0,0,0,0
8BitofFun-On Vacation,@8BitoffunX,2022-04-28T17:25:50.000Z,On gawd don’t let this flop,0,0,0,0
Phys.org,@physorg_com,2022-04-28T20:06:28.000Z,#Laser -based ultrasound detects defect-producing features in metal  3D printing @Livermore_Lab @SciReports https:// aser-based-ultrasound-defect-producing-features-metal.html …,1,12,5,0
Rocketry Articles,@RocketryArticle,2022-04-28T15:39:55.000Z,Finally had a chance to build my Ukranian R-360 Neptune two-stage rocket. Designed w/  3D printed  parts + BT-60/BT-80 body tubes + 2mm plywood fins (plan to launch w/ D12-0 + C6-5). Apparently a pair of these missiles sank the Russian w...  https:// ments/udk5jy/finally_had_a_chance_to_build_my_ukranian_r360/ …,0,0,0,0
Online Shopping,@os247gbr,2022-04-28T15:30:23.000Z,HATCHBOX ABS  3D Printer  Filament – biały (3D ABS-1KG1.75-WHT)  #eBay https:// 54 …,0,0,0,0
Leslie Langnau,@DW_3DPrinting,2022-04-28T13:50:00.000Z,Additive Manufacturing  Users Group presents DINO awards to three members.  https:// acturing-users-group-presents-dino-awards-to-three-members/ … #3dprinting #AdditiveManufacturing @DesignWorld @AdditiveMFGUG,0,2,1,0
KSP GIFs | Funniest GIFs on Social Media,@KSPGIFs,2022-04-28T14:19:35.000Z,3D printed  dragon head that can be used as a dice tower.  : Joshhawk  #gifs #funny #memes,0,0,0,0
ClaremontPrint,@PrintClaremont,2022-04-28T15:44:13.000Z,"See how a substantial  3D printer  built the walls of a 2,000-square-foot luxury home in Austin in 8 days.  https:// ates-a-Luxury-Texas-Home …",0,0,0,0
