Author Name,Author ID,Date,Post Text,Replies,Likes,Reshares,Views
Leah Berman Williams,@leahwrenn,2022-04-28T16:46:38.000Z,"Folks, this is amazing. I had no idea and I’m really excited! 3D Printing  New Struts for Zometool | Scott’s vZome Designs  https:// g4g/14/gift.html …",0,0,0,0
SME Media,@SMEMediaNews,2022-04-28T21:15:03.000Z,Open  additive manufacturing  systems that accept non-proprietary materials is a cause Andrew Graves of  @covestro  wants to champion. Read more about his thoughts about specific polymer grades vs. equivalent properties in an  @SME_mfg  Voices AMplified article:  https://,0,1,2,0
Nathan Best,@Nathan_Best,2022-04-28T18:04:46.000Z,"I've finally got my first perfect, or nearly perfect,  3D print ! Meet Jugger Hochmann one of the Orc Mercenaries of the Void.

Now it's time to ramp things up a notch  [Model by  @DaybreakMinis ]",0,2,0,0
Pikes Peak Library District,@ppld,2022-04-28T21:00:50.000Z,"May is a great month to try something new! Learn to use the laser machine, CNC machine, or  3D printer  with our free badging classes. These classes are required prior to using the machines. See the upcoming schedule:  https:// ing …",0,0,0,0
Xerox,@Xerox,2022-04-28T15:00:24.000Z,"Excited to announce that Xerox Elem Additive has installed an ElemX  3D printer  at the  @RITtigers  to advance metal  #additivemanufacturing . A longtime collaborator with us in the AM space, the faculty at AMPrint Center have years of experience https://",1,9,4,0
Advantage Oakland,@AdvantageOak,2022-04-28T16:32:18.000Z,Yes! Happening right here in  #OaklandCounty  part of the  3D Printer  Network made up of  @AutomationAlley  Project Diamond companies that we are assisting with Industry 4.0 capabilities.,0,4,0,0
Princess Viola (princessviola.bsky.social),@Sailor_Viola,2022-04-28T14:39:57.000Z,taking my  3d printed  wife to the Pretty Cure Pretty Store .,0,2,0,0
Of3lia Technologies,@Of3liaTech,2022-04-28T19:11:05.000Z,Epson leans further into  3D printing  as subsidiary unveils plans to open new metal powder facility  http://,0,0,0,0
IDT,@InDentalTech,2022-04-28T17:01:39.000Z,"This new type of  3D printed  bone implant has combined column and lentil-shaped holes, resulting in an implant that is stiff enough to withstand chewing forces and porous enough to encourage bone growth.  http://",0,0,0,0
IS&T,@ImagingOrg,2022-04-28T15:35:10.000Z,Researchers add antireflection coatings to complex  3D printed  micro-optical systems  https:// 951158 … #imaging #optics #3dprinting,0,0,0,0
8BitofFun-On Vacation,@8BitoffunX,2022-04-28T20:26:00.000Z,This y’all man!! Bruh GTFO,0,0,0,0
Mashable,@mashable,2022-04-28T14:40:00.000Z,The robot landscapers that  3D printed  a park in China  #FutureBlink,1,24,9,0
RAPID + TCT Event,@RAPID_Event,2022-04-28T21:19:03.000Z,"Are the current standards for  additive manufacturing  part production sufficient? Where can you find them? What works? What doesn’t? Panelists join us from  @Metlflo , 3D Metal Konsultants, VMMI and  @Boeing . Learn more at RAPID + TCT!  #RAPIDevent https://",0,0,0,0
EDC TIPS,@edc_tips,2022-04-28T14:15:02.000Z,"3D Printed  'Draco' AK
  #Firearm #Firearms #Gun #Guns https:// ted-draco-ak/ …",0,0,0,0
bubbleistrouble,@bubbleistrouble,2022-04-28T17:30:42.000Z,"3D printed  trash can makes lots of, juicy bubbles",0,0,0,0
Sumbu Botol,@Arifai777,2022-04-28T16:32:06.000Z,A city of  3D-printed  fish? 7 Viennese startups reinventing urban life  http://,0,0,0,0
MonochromeAgent.bsky.social,@MonochromeAgent,2022-04-28T17:02:00.000Z,Some mask designs I hope to  3D print !,1,10,0,0
TOYLAND HOBBY MODELI,@toylandhobbymod,2022-04-28T14:25:12.000Z,"Minibase
1/48
2002
Su-27K Sea Flanker w/Kh-41 MOSKIT Up-Grade set ( 3D Printed )
Release Date:2022-05-07
1/3",1,8,3,0
Psnuffle,@Psnuffle89,2022-04-28T20:09:42.000Z,"3D printing : if they say you don't need a raft for small pieces, they're lying ",0,0,0,0
Daniel,@L3monbox,2022-04-28T19:40:17.000Z,"Once I find out I have plans for dnd my urge to buy a  3D printer , Dwarven forge, and minis sky rocket.",1,2,0,0
Make Parts Fast,@MakePartsFast,2022-04-28T17:19:16.000Z,Lincoln Electric offers metal  3D printing https://,0,0,0,0
BoostNinja,@Boost_Ninja,2022-04-28T16:07:47.000Z,#3rdgrader  can do everything! A  #3rdgrader  designed  3D printed #InternationalSpaceStation http://    via shapeways,0,0,0,0
Not A Games Dev Ollie,@Reksaurian,2022-04-28T19:47:40.000Z,Fwee work piza. ,0,0,0,0
Checko's Printing,@checkosprinting,2022-04-28T14:11:22.000Z,"See how a substantial  3D printer  built the walls of a 2,000-square-foot luxury home in Austin in 8 days.  https:// ates-a-Luxury-Texas-Home …",0,0,0,0
James Gingerich #B2B #Technology #Influencer,@jamesvgingerich,2022-04-28T17:23:00.000Z,"#3D  Printed,  #AI  Controlled BioPods Can Grow Food in Space. (Interesting Engineering)  #AgTech https://",0,0,0,0
3DMedNet,@3DMedNet_FSG,2022-04-28T15:48:01.000Z,"New Virtual series alert! We’re delighted to have collaborated with six expert speakers to bring you our second ever Virtual series, all about new innovations utilizing  3D printing  in  #dentistry  and  #maxillofacial  surgeries. Watch the FREE talks here>>  https://",0,0,0,0
David Gusitsch,@DavidGusitsch,2022-04-28T18:01:01.000Z,"When  @VivianBirdsall  mentions her students are  3D printing  some pieces for their project with the  @NASA #TechRiseChallenge , you take pics to share with the  @SaxeMS  community!  #SaxeSTEM",0,0,0,0
Jordantherookie,@jordantherookie,2022-04-28T14:33:16.000Z,i lowkey want a  3D printer,0,0,0,0
Eating for Free,@e4fpod,2022-04-28T15:12:15.000Z,"ALERT 3D printed  guns? Home loans on the blockchain? Bitcoin as the second coming of Christ?

In part 2 of our deep dive on  #Bitcoin2022 , we breakdown the new cult following that believes crypto is God’s gift to save us from the apocalypse!",1,6,4,0
4’10 MATTRESS SOAKER,@SpanishxBarbiie,2022-04-28T18:40:11.000Z,3D Printing  The Mandalorian Helmet  https:// 60hk?feature=share …  via  @YouTube,1,1,0,0
Incipient Corp.,@Incipientcorp,2022-04-28T13:34:01.000Z,"After 40 years of development, what will it take for  additive manufacturing  to become more than a niche technology?

Read Full Article -->  https:// Credit:  @McKinsey #3Dprinting #innovation #technology #manufacturing #future",0,0,0,0
"Sister Usagineko, Catgirl of Battle",@mikailborg,2022-04-28T13:48:38.000Z,"Dear Facebook group for owners of a certain brand of resin  3D printer : ""STL"" is an odd choice of keyword to use for auto-rejecting posts. (I know the bootleg STL file sellers are a real problem, but still.)",0,0,0,0
3DHEALS,@3dheals,2022-04-28T15:00:21.000Z,"#Purdue -related startup  #Araqev  creates  #qualitycontrol  software for  additive manufacturing ,  3D printing  processes  https:// inting-processes.html …",0,0,0,0
Not A Games Dev Ollie,@Reksaurian,2022-04-28T16:42:21.000Z,Do.,0,0,0,0
夕凪㌠,@Yuunagi_DAMEYA,2022-04-28T16:50:42.000Z,1/144 scale model manufactured with  3D printer  is on sale. https:// #144scale #3dprinting,0,4,1,0
ShittyRobotBot,@bot_shitty,2022-04-28T20:20:55.000Z,An Amiga 1200 did not write a blog about your  3d printed  fish as soon as you see the blue screen of death,0,0,0,0
Skree B'yat,@SkreeBD,2022-04-28T16:21:11.000Z,It is 2022 why do we not all have home plastic shredder/extruder/ 3D printer  combos that take up the countertop space of a freaking air fryer please,0,2,0,0
Kayleigh Wright | M. Ed.,@thewrightside9,2022-04-28T19:08:54.000Z,Over at  @GRMSTBirds  today in Mr. G’s STEAM class to “judge” pitches for their latest project. Ss designed &  3D printed  their own cookie cutters and are now pitching why their design should be picked to make a custom set of pro. decorated sugar cookies from  #TooSmartCookies,0,0,0,0
3d printed save button,@MrSaveButton,2022-04-28T19:19:33.000Z,یاروی هندی توی یوتیوب برا درس دادن >>>>>>>>,0,0,0,0
3DP@コン兄さん,@3D_printer_KW,2022-04-28T14:11:47.000Z,#ポン子スペースでツイートしてね ぽん子可愛い,0,0,0,0
Hackster.io,@Hacksterio,2022-04-28T18:51:44.000Z,"This ""lofipi""  3D-printed  speaker streams Lo-Fi beats via a  @Raspberry_Pi  — or generates them itself:  https://",0,18,4,0
Caitlin Almon,@cnwalmonphs,2022-04-28T19:22:13.000Z,My student Dallas made this gift for me on our library's  3D printer  with the help of  @HallsHomework . Absolutely epic!  #oregontrail #makerspace,0,7,1,0
Mass Technology Leadership Council,@MassTLC,2022-04-28T18:01:49.000Z,"Join the  @Robotics_Summit  , ""Robotics Design for  Additive Manufacturing  Workshop"" on May 10th. Learn more and register at the link below. MassTLC members - contact ruth@masstlc.org to receive a code for a 25% discount on full conference passes! https://",0,0,0,0
Toy Model Kits,@ToyModelUK,2022-04-28T20:37:05.000Z,Cammy  3D Print  Model Kit 1:8 1:6 1:4 Unpainted Unassembled Garage Kit Figure GK  https:// 77?hash=item526dfe15f1%3Ag%3A3SsAAOSwiC9iajpl&mkcid=1&mkrid=710-53481-19255-0&siteid=3&campid=5338752399&customid=&toolid=10001&mkevt=1 …  eBay,0,0,0,0
Krishna Gupta,@anekoplato,2022-04-28T16:30:36.000Z,3D printing  cute-but-useful things for the lab continues,0,6,1,0
3D Printing Professor,@3DPProfessor,2022-04-28T20:51:35.000Z,Free stepper drivers. I should learn how to use these.,2,20,1,0
Lindener Games,@LindenerGames,2022-04-28T13:32:50.000Z,Concept for my next Squid game Chibi style  3D print  design Project. WIll update with updates #3Dprinting #figure #squidgame #saebyeok #gihun #chibiart #Nendoroid,1,1,0,0
GCC Printing & Graphics,@gcc_printing,2022-04-28T15:31:07.000Z,"See how a substantial  3D printer  built the walls of a 2,000-square-foot luxury home in Austin in 8 days.  https:// ates-a-Luxury-Texas-Home …",0,0,0,0
Matthias Bringezu,@CONSULT3D_COM,2022-04-28T15:50:03.000Z,"2nd part of ‘Introduction to Quality Assurance and Inspection for  Additive Manufacturing ’ by  #AmericaMakes ,  #Castheon  and  #ASTM . Best webinar in a long time, and totally worth the nightshift…due to the 14hrs time difference.  https:// qa …",0,0,0,0
Mark James,@MarkJamesAuthor,2022-04-28T16:57:28.000Z,3D Printing  in Car Production: A Heart-Pounding Supercar Aims to Upend How Cars Are Built  https:// eart-pounding-supercar-aims-to-upend-how-cars-are-built/ …,0,0,0,0
Haemy Lee Masson @hleemasson.bsky.social,@H_Lee_Masson,2022-04-28T15:52:14.000Z,a DIY composting bin made with  3d printing  and Raspberry Pi.,1,3,0,0
Print Central,@PrintCentralMN,2022-04-28T14:10:11.000Z,"See how a substantial  3D printer  built the walls of a 2,000-square-foot luxury home in Austin in 8 days.  https:// ates-a-Luxury-Texas-Home …",0,0,0,0
Maco Amoyo,@BulletGraphics,2022-04-28T12:53:33.000Z,"See how a substantial  3D printer  built the walls of a 2,000-square-foot luxury home in Austin in 8 days.  https:// ates-a-Luxury-Texas-Home …",0,0,0,0
Luke Clayden,@clayden_luke,2022-04-28T20:08:33.000Z,The DB Project: It's Finished! The World's First Full-Scale  3D Printed  C...  https://  via  @YouTube,0,0,0,0
Cold Spray Action Team,@ColdSprayTeam,2022-04-28T16:42:31.000Z,The Cold Spray Action Team is proud to release our 2022 hybrid meeting agenda. The two-day CSAT 2022 Hybrid Meeting will focus on all aspects of Cold Spray  Additive Manufacturing  (CSAM) with speakers representing a wide range of industries.,0,0,0,0
"Well, that’s interesting tech!",@1nterestingTech,2022-04-28T17:25:35.000Z,"""Stratasys' First Sustainability Report Champions  3D Printing  Climate Action, Social Impact""
Read more  https:// ber=653939 … #Tech #UNSDGs #Sustainability",0,0,0,0
CMG Technologies,@CMGTechnologies,2022-04-28T13:17:52.000Z,"As a trusted debinding and sintering service provider on  @BASF_ForwardAM  portal, getting your  3D printed  parts debound and sintered has never been easier. 

Visit their portal and reserve a slot via  @3DGBIRE  now:  https:// sintering-order-managementportal/ … #3DPrinting #AdditiveManufacturing #Portal",0,2,0,0
avaxgfxcom,@avaxgfxcom,2022-04-28T16:18:07.000Z,Medievil Fanart Statue –  3D Print https:// rint_models/285578-medievil-fanart-statue-3d-print.html …,0,0,0,0
KHS STEAM,@khsSTEAM,2022-04-28T14:59:13.000Z,"Sam Aripov has designed,  3D printed  and created his own Arduino control prosthetic hand!  The hand is activated when muscles in arm are contracted.  This is an amazing project since it only cost around $50.   @Siemens @Kings_Schools @Kings_HS",0,19,4,0
MSLA Racing,@MSLARacing,2022-04-28T14:17:00.000Z,Who's ready for some Off-Season MSLA Racing? Join in Friday April 29th at 3pm ET for The MSLA Season 6 Preview Event! Let's run all the Laps tracks a few times where the overall combined winner gets a  3D printed  TROPHY!!!  https:// #MSLA #MarblesOnStream #OffSeason,0,13,4,0
GizChina Greece,@gizchinagr,2022-04-28T15:46:37.000Z,#Flashforge  Adventurer 4: ο  3D Printer  που θα αλλάξει την καθημερινότητά σου  https:// shforge-adventurer-4-o-3d-printer-poy-tha-allaxei-tin-kathimerinotita-soy-2/ …,0,0,0,0
Not A Games Dev Ollie,@Reksaurian,2022-04-28T13:44:06.000Z,Stuffed.  https:// /HeckinGoodDogs/status/1519584710967676929 …,0,0,0,0
Eurofins | EAG Laboratories,@EAGLaboratories,2022-04-28T18:03:10.000Z,Join us for our Polymer  Additive Manufacturing  webinar next week! Learn how analytical techniques are used to characterize defects in  3D-printed  polymeric materials.  #3dprinting #additivemanufacturing #polymers https://,0,0,0,0
B&B Express Printing,@BBPrinting1,2022-04-28T16:50:55.000Z,"See how a substantial  3D printer  built the walls of a 2,000-square-foot luxury home in Austin in 8 days.  https:// ates-a-Luxury-Texas-Home …",0,0,0,0
David A. Marshall,@DavidAMarshall6,2022-04-28T16:42:00.000Z,World’s first digital bakery makes  3D printed  candy.  https:// #3DPrinting #3Dprintedcandy #AdditiveManufacturing,0,0,0,0
ROWDY FIFER,@shawn_demmick,2022-04-28T16:00:18.000Z,I'm in Facebook jail for 30 days because I told a white Democrat I would not partake in  3d printing  this mask for him. I didnt say he couldnt. I said I want no part of it. And yet the call me the racist smh.,0,0,0,0
Nymdok,@Nymdok,2022-04-28T21:07:32.000Z,"Hey guys, Im considering buying a  3d Printer  for  #TTRPG  figs.
Predominately D&D figs, but might want to do some BTech figs later.

Im looking at the Phrozen Sonic Mini 4k.

Any advice?  https:// sin-3d-printer-phrozen/products/sonic-mini-4k-resin-3d-printer-phrozen?variant=39635278692539 …",1,3,0,0
James Gingerich #B2B #Technology #Influencer,@jamesvgingerich,2022-04-28T15:10:00.000Z,.  @Ford  is now using  #Robots  to operate 3D printers without human help. (TechCrunch)  #3DPrinting #Additive #Manufacturing #Robotics #Automation https://,0,0,0,0
Techstead,@techstead3d,2022-04-28T13:18:29.000Z,3D Printing  has acted as a catalyst for technological shifts within various industries. Check out our latest article to learn more! https:// g-has-revolutionised-technology/ … #revolutionary #TechnologyNews #TechnologyDisruption #TechTrends #3D #3Dprinting #Trending #TrendingNow #TrendingTopics,0,2,0,0
Pero,@Pero31038774,2022-04-28T19:41:28.000Z,"Trump Collectible Gift Figure,  3D Printed  Hand Painted Plastic Figurine #trump #president #donaldtrump #3dprint #figurine https:// 634/trump-collectible-gift-figure-3d-printed?click_key=cf458486e50f71bded451091f2d43e6340c228fd%3A573272634&click_sum=8fcf1c5a&ref=shop_home_active_1&frs=1&sca=1 …",0,0,0,0
Sterling Archer,@barlibankroll,2022-04-28T21:03:06.000Z,Just found out somebody was caught  3D printing  a ghost gun in their barracks...what the entire fuck Lmfaooooooooo,0,0,0,0
Lord Reags of Oz,@lord_reags,2022-04-28T13:07:30.000Z,"• Reporter Builds an AK47

Untraceable  3D Printed Semi-Automatic AK47s
APPROVED By US Govt https://  via  @YouTube",0,0,0,0
Gary Beane,@pollinus66,2022-04-28T16:01:30.000Z,"RT Nanowerk ""Researchers add atomic-layer antireflection coatings to complex  3D printed  micro-optical systems :// https:// """,0,0,0,0
SQ4D,@sq4dbuilds,2022-04-28T19:00:00.000Z,"SQ4D is the only company  3D printing footing, foundation wall, and slab. These components
are customizable in the same way the interior and
exterior walls are.  #ratedrookie #NFLDraft #NationalSuperheroDay #sq4d",1,4,0,0
Physics Magazine,@PhysicsMagazine,2022-04-28T17:32:43.000Z,A so-called active-matter system made of  3D-printed  ellipsoids could be key to understanding how our own cells interact with each other. See the story by  @mccornut .  https:// 57 …,0,13,6,0
Leslie Langnau,@DW_3DPrinting,2022-04-28T15:02:56.000Z,3D printing  materials with color that offers hyper-realistic look and exact shore values  https:// terials-with-color-that-offers-hyper-realistic-look-and-exact-shore-values/ … #3dprinting #additivemanufacturing @DesignWorld @3d_printers,0,4,1,0
Burlen,@BURLENCo,2022-04-28T17:24:16.000Z,"Welcome to our new display showing the evolution of the Amal 900 Premier Carburetter. The carb on the left is an original, with the following three being  3D printed . The far right is our brand new aluminium 900.",0,24,6,0
Enderz,@Enderzworld,2022-04-28T17:00:30.000Z,MSLA Fun Run Friday!!! Take part in this Season 6 Preview stream for a chance to win a  3D printed  trophy!!!  #MSLA #MarblesOnStream #Season6 #OffSeason #FunRun,0,5,1,0
Bukovina,@youcef84731359,2022-04-28T14:29:11.000Z,Leaker compares  3D-printed  ‘iPhone 14’ models to iPhone 13 accessories  https:// s-3d-printed-iphone-14-models-to-iphone-13-accessories/ …,0,0,0,0
Aimee Kalnoskas,@EEWorld_Aimee,2022-04-28T16:03:20.000Z,"Want to know how  #additivemanufacturing  can accelerate product cycles in  #EVs ? Get your answers now during  #EEWebinar  from  @HP  Happening now and on-demand (later!) ""Innovation in the Electric Vehicle Ecosystem with Polymer  Additive Manufacturing """,0,0,0,0
Create/Invent Podcast,@createinventpod,2022-04-28T15:29:39.000Z,.@patsheadcom and  @JeremySCook  fascinated and/or confused by the  3D-printed  tooth-wheel-ball thing.,0,3,1,0
IMechE Events & Training,@IMechEevents,2022-04-28T14:55:02.000Z,"A new method of  3D printing  glass ‘microstructures’ is faster and produces objects with higher optical quality, design flexibility and strength, according to its developers at UC Berkeley in California. https:// #3dPrinitng #imechelearning",0,0,0,0
Xometry,@Xometry,2022-04-28T18:40:41.000Z," The latest episode of  #ManufacturingExplained  explores all things  3D printing ! Join host  @XometryGreg  and Tommy Lynch, Senior Application Engineer at Xometry, as they dive into  additive manufacturing . Stream on any podcast hosting network:",0,2,0,0
AMD Magazine,@AMDMag,2022-04-28T14:13:03.000Z,"Aconity3D is now distributing Equispheres’ powders for metal  additive manufacturing !! Find out how Equispheres powder is used to print the AconitySCAN, a key component of the Aconity3D line of printers!! https://",0,0,0,0
bubbleistrouble,@bubbleistrouble,2022-04-28T14:30:41.000Z,3D printed  cap makes abundent fleeting bubbles,0,0,0,0
Tim Ellis,@thetimellis,2022-04-28T20:35:31.000Z,Loved having 4x badass astronauts  @Astro_Nicole @DrSianProctor @Astro_Cady @AnoushehAnsari  as part of  @xprize  tour of Relativity  3D printing  factory today ,10,423,41,0
Stefan Rech,@rechyyy,2022-04-28T20:23:01.000Z,Just finished my Iron Man  3D Print   :),3,17,0,0
M3 Design,@m3designthink,2022-04-28T16:59:13.000Z,Interested in learning more about the process we used to design the awarded HSE™ 240 HT Dual Extruder 3D Printer? Check out our case study for the details.  #ifdesignaward2022 #ifdesign #industrialdesign #additivemanufacturing #3dprinting,0,0,0,0
Same Sky,@sameskydevices,2022-04-28T14:54:02.000Z,The Jellybean 3D project attempts to push and explore the limits of  3D printing  by attempting to  3D print  a car! || Check it out:  https://  via  @hackaday #HackADay #3DPrint #3DPrinted #Engineering #DesignEngineer,0,0,0,0
James Gingerich #B2B #Technology #Influencer,@jamesvgingerich,2022-04-28T16:16:00.000Z,Getting back to basics.  Homes can now be  #3D  printed with earth.   Truly groundbreaking.  (World Economic Forum)  #Environment @wef,2,19,14,0
botloria,@botloria,2022-04-28T16:14:19.000Z,Sent my mom in Ma…. Doing a bit hypomanic so I  3D printed  a rock.,0,0,0,0
avaxgfxcom,@avaxgfxcom,2022-04-28T16:36:12.000Z,Vampires –  3D Print https:// rint_models/285583-vampires-3d-print.html …,0,0,0,0
Jody Wilson,@jodywilsonTL,2022-04-28T19:51:33.000Z,3D printing  challenge:  design a playground. The first project printed.  Hooray! Everyone learning…especially the teacher.  #sd36tl #sd36learn,2,12,1,0
Lars Londot,@LarsLondot,2022-04-28T20:13:33.000Z,Fixed the  3D printer  and had to start printing out something  @RichardsonLax  related.,0,4,0,0
"PaperGraphics, TX",@PaperGraphics,2022-04-28T13:37:39.000Z,"See how a substantial  3D printer  built the walls of a 2,000-square-foot luxury home in Austin in 8 days.  https:// ates-a-Luxury-Texas-Home …",0,0,0,0
Michael Petch,@MichaellPetch,2022-04-28T17:40:59.000Z,Epson leans further into  3D printing  as subsidiary unveils plans to open new metal powder facility  #3DPrinting https:// ns-further-into-3d-printing-as-subsidiary-unveils-plans-to-open-new-metal-powder-facility-208620/?feed_id=7023&_unique_id=626ad1aab1002 …,0,0,0,0
3D Printing World,@dddpworld,2022-04-28T17:46:54.000Z,Here’s a sneak peak of the dual extrusion light saber I made for Starwars day this year! I hope you guys like it. ,5,18,1,0
Arabian YouTubers Gamers,@ArabianYG,2022-04-28T15:09:27.000Z,"Minecraft PvP challenge tonight ! play and win a skeleton headset stand   by :  3D Printer  Universe TN
be there",0,0,0,0
Shapeways,@shapeways,2022-04-28T20:00:45.000Z,Innovation in  3D printing  leads to the advancement of the automotive and aerospace industry. Learn more:  https://,0,4,3,0
Kinsale Insurance,@kinsaleins,2022-04-28T14:01:28.000Z,New @GErenewables facility in  #NewYork  uses  3D printing  to build concrete base of wind turbines  http://  via  @reNEWS_ #RenewableEnergy #WindEnergy #3DPrinting,0,0,0,0
MacHash,@MacHashNews,2022-04-28T16:53:05.000Z,Leaker compares  3D-printed  'iPhone 14' models with iPhone 13 accessories  http:// $AAPL,0,0,0,0
TOYLAND HOBBY MODELI,@toylandhobbymod,2022-04-28T14:35:56.000Z,"Minibase
1/48
8002
Su-33 Flanker-D with Kh-41 Moskit (P-270)
First Batch wth bonus  3D printed  Pilot
Release Date:2022-05-10
1/3",1,13,4,0
Mark Smith,@HiringMark,2022-04-28T17:29:34.000Z,From  3D-printed  noses to pumping hearts  http://,0,0,0,0
Additive Manufacturing Media,@AddMfgMedia,2022-04-28T14:20:19.000Z,Thanks to  @AddUp_solutions  for hosting the  @AddMfgMedia  editors at the company’s North American HQ in Cincinnati. CEO  @RushLaSelle  was on hand to answer questions & share the company’s vision for metal  3D printing  “as reliable as the most reliable automobile.” 1/6,1,4,1,0
bubbleistrouble,@bubbleistrouble,2022-04-28T19:20:41.000Z,"3D printed  trash can makes gargantuan, shinny bubbles",0,0,0,0
Ember,@TheRealEmberz,2022-04-28T14:58:45.000Z,"Yo  @Raasclark  just got permission to use my friends  3D printer  whenever. So I got a question for you, if there is one thing in ark you would want in real life what would it be? I will see if I can print and design it! Also, if you would like one of what ever it is let me know!",2,6,1,0
Coach MacLean,@TMacLean18,2022-04-28T17:41:35.000Z,3D printer  up and running! Big thanks to  @brilliant_labs  for making this happen for our class. It was tricky to build and get set up but a good opportunity to model dealing with setbacks for students. Can't wait to see what they'll print!  #3Dprinting #Elementaryschool,0,10,2,0
RAYSHAPE,@3d_rayshape,2022-04-28T13:57:00.000Z,You may already use  3D printing  but here are some significant facts you may not know #3dprinting #3dprintingindustry #rayshape3d #additivemanufacturing,0,0,0,0
Roni Bandini,@RoniBandini,2022-04-28T13:57:20.000Z,"Fabriqué este Vespa diorama clock con  @dfrobotcn  Firebeetle, un servo sg90, un amp de 3w, un speaker y una base en  3d printing . A lo cuckoo clock, consulta un server NTP y cada hora arranca el motor y mueve la rueda de la Vespa Primavera ET3 1976  #arduino #esp32 #diorama",0,10,4,0
3Dnatives,@3Dnatives,2022-04-28T14:09:20.000Z,Will there soon be  3D printed  Bikes?  German designer Stephan Heinrich recently introduced a brand new bicycle concept using  3D printing . The AM made all-wheel drive bicycle is entirely different than any bike you've ever seen!,0,0,0,0
Spectrum Printing & Marketing,@TheHappyPrinter,2022-04-28T12:58:36.000Z,"See how a substantial  3D printer  built the walls of a 2,000-square-foot luxury home in Austin in 8 days.  https:// ates-a-Luxury-Texas-Home …",0,0,0,0
がんにい,@pikaDAM,2022-04-28T13:39:26.000Z,YoichiroKoga にアカウントを移行しました．良かったらフォローしてください．最近は3D Printing Corporationという会社で最高技術責任者をやっています．ただ、つぶやく内容はほぼかわらないです．,0,0,0,0
3D Printing Professor,@3DPProfessor,2022-04-28T19:14:13.000Z,"This is the part that always makes me most nervous. Am I going to be able to remove these connectors without destroying them, and am I going to be able to put them where they belong?
I've done this 4 times, and it's never not nerve wracking.",8,27,2,0
Tay,@TheLuckiest_Tay,2022-04-28T21:20:27.000Z,I learned that people are  3D printing  cement houses. That blows my mind,0,0,0,0
Rick Truedge alias astronut,@richard79556085,2022-04-28T14:44:01.000Z,is there a  3D printer  that can reproduce itself  ???,0,0,0,0
N.E.W. Printing,@NEW_Prints,2022-04-28T14:09:32.000Z,"See how a substantial  3D printer  built the walls of a 2,000-square-foot luxury home in Austin in 8 days.  https:// ates-a-Luxury-Texas-Home …",0,0,0,0
