Author Name,Author ID,Date,Post Text,Replies,Likes,Reshares,Views
Warhammer,@Warhamm34360112,2022-11-07T18:15:17.000Z,"3d Printed  Land raider achilles 30k Horus Heresy  

Ends Mon 14th Nov @ 2:54pm https:// -Land-raider-achilles-30k-Horus-Heresy-/134318231876?mkrid=710-53481-19255-0&siteid=3&mkcid=1&campid=5338807277&toolid=10001&mkevt=1 … #ad #warhammer #paintingwarhammer #gamesworkshop #warhammercommunity #ageofsigmar #miniaturepainting",0,0,0,0
Objex Unlimited,@ObjexUnlimited,2022-11-07T19:08:05.000Z,"Join Our Live Webinar Next Tuesday! 
Topic: Leveraging  Additive Manufacturing  for Jewellery and Investment Casting
Host: Steve Cory, President & Founder of Objex Unlimited Inc.
When: Tuesday Nov 15th, 2022 11:30 AM EST
Register Now:  https://",0,0,0,0
Wicc,@WiCcc_,2022-11-07T19:01:43.000Z,That  3D printing  the way,0,0,0,0
Academy of Exploration,@AOESPS,2022-11-07T15:23:12.000Z,"According to Nurse Jamie, the proof that she did not steal the  3D printer  is that no one saw her. 
She does, however, believe that whomever stole the  3D printer  should be fired from their job, “or at the very least suspended for a few weeks”  #AOECrimeScene",0,0,0,0
Biologic Models,@BiologicModels,2022-11-07T22:22:01.000Z,Research scientists use  #3DPrinted  hand-held Protein Model to help explain biotechnology research. Submit a request for your own custom  3d printed  protein model.  @caseysteffen #biotech #3Dprint https://,0,0,0,0
PROPHETESS DEBORAH,@debbieknights2,2022-11-07T17:28:34.000Z,3D Printer  Review: Monoprice Voxel Pro  http://,0,0,0,0
AllYourTech,@blovereviews,2022-11-07T21:29:04.000Z,"If the  @FanttikOfficial  vacuum had an optional   Brush attachment like Dyson, it would be the ultimate portable car vacuum for people with dogs. Maybe I should try to  3d print  an adapter ",1,2,1,0
SZ @ X3EM x/acc Ai Robotics 3D print skyscrapers,@3DX3EM,2022-11-07T15:21:13.000Z,https:// srnLw … #ClimateCrisis,0,0,0,0
Eva Blasco,@EvaBlascoPo,2022-11-07T19:50:34.000Z,"We are hiring! We are looking for a postdoc with experience in  3D printing  and microfluidics to work in a fun project in collaboration with  @WaltherLab ,  @Catalyst  and A. Balazs. More details here:  https:// emgeo/oci/akblasco/positions.html …  Deadline: 30.11.2022. RT appreciated!",2,130,64,0
James Gingerich #B2B #Technology #Influencer,@jamesvgingerich,2022-11-07T23:29:00.000Z,Building Value for Additive  #Manufacturing : A Medical Perspective. ( Additive Manufacturing )   https://,0,0,0,0
Gambody,@Gambody_com,2022-11-07T18:03:02.000Z,"Order STL files of Mad Cat MkII  #3Dprinting  Model here  https:// George Mullens  3D printed  Mad Cat at 33 inches high and 22 inches wide with Creality CR-10 and mounted the missal launchers with magnets. Its guns are movable, and its turret/cockpit rotates. ",0,2,0,0
"Senatsverwaltung für Wirtschaft, Energie, Betriebe",@SenWiEnBe,2022-11-07T15:08:52.000Z,"Berlin Newcomer  #Startup  Award 2022-Gewinner:innen gekürt.
1.Platz (10.000€): Mohamed Ali Khan für ""Pillio""
2.Platz (7.500€): Cindy Valdez für ""Thoughtful & Innovative  3D Printer ""
3.Platz (5.000€): Mudar Obaid Dabbous für “Aman Collective” https:// /pressemitteilungen/2022/pressemitteilung.1261929.php … #BNSA22",0,0,0,0
SubSector3d,@SubSector3d,2022-11-08T00:35:10.000Z,"Come over to support Sarah!

Piper Update, Just Chatting, Labradors, Recent Events, Future  3d Printing , Writing  https:// load=true …",0,2,1,0
Equispheres Inc.,@equispheres,2022-11-07T19:16:23.000Z,"Speed is a game-changer. For  additive manufacturing , a faster build rate is crucial to bring part costs down.

Equispheres' powders achieve a 3x speed increase over typical build parameters. See how:  https:// #MetalAM #AdditiveManufacturing #3DPrinting #Disrupt",0,3,2,0
Hollister Lab,@HollisterLab,2022-11-07T16:17:06.000Z,"Congratulations to Ryan Akman on our latest study published in  @ApplMaterToday  with  @HarshaBME  and Adam Verga!  #3Dprinting #biomaterials  

Multimodal  3D printing  of biodegradable shape memory elastomer resins for patient specific soft tissue repair  https:// e/pii/S2352940722003006 …",1,5,2,0
Gizmodo,@Gizmodo,2022-11-07T15:08:03.000Z,Lego's Animated  3D-Printed  Duck Is a Sneak Peak at the Building Toy's Future  http://,2,15,7,0
Julescurrently building Iron Heart suit,@CyberJoules,2022-11-07T19:19:45.000Z,Impromptu  3D printing  stream! Working on Mjolnir 2.0! Expecting the new magnet in today! http://,0,2,1,0
phd-positions.dk,@phd_positionsdk,2022-11-07T18:09:08.000Z,PhD-student in laser metal  Additive Manufacturing  – Process development  https://,0,0,0,0
Energy Solutions,@Energy_Brokers,2022-11-08T00:53:12.000Z,Mighty Buildings completes  3D-printed  net-zero home in southern California  https:// hty-buildings-worlds-first-3d-printed-zero-net-home-california/?utm_source=twitter&utm_medium=contentstudio&utm_campaign=TEC …  via  @dezeen #TECnews,0,0,0,0
ManyBuildSolutions.com,@ManyBuildLabs,2022-11-07T17:03:38.000Z,Additive manufacturing  and “ 3d printed ” buildings are fascinating. Curious to know how we will look back at these structures in 50; 200; and 500 years.,0,0,0,0
Fabbaloo,@fabbaloo,2022-11-07T19:04:10.000Z,EPlus3D Announces Massive Metal  3D Printer https:// #3DPrinting #AdditiveManufacturing,0,0,0,0
KennedyCTE,@CteKennedy,2022-11-07T19:46:44.000Z,Engineering students competing solving Puzzle Cubes today! Fastest assembler wins a  3D printed  prize of their choice,0,11,2,0
Mashable,@mashable,2022-11-07T21:00:01.000Z,This futuristic electric car prototype was entirely  3D printed,0,10,1,0
EmNEm,@EmNEmBot,2022-11-07T21:10:58.000Z,All you other Silm Shadys are just sleepwalking so won't the  3D printed  Slim Shady please take a selfie ?,0,0,0,0
Michael Petch,@MichaellPetch,2022-11-07T18:51:10.000Z,"So it's been a rough week and a bit, hence the delay on announcing the shortlists of the  #3DPIAwards . 

Shout out to the individual who nominated  @Barnacules  as ""an  additive manufacturing  application or process that contributes to sustainability goals."" cheered me up  #3dprinting",2,4,0,0
DealBee Deals USA,@DealBeeDealsUSA,2022-11-07T17:21:41.000Z,"ANYCUBIC Vyper, Upgrade Intelligent Auto Leveling  3D Printer  with TMC2209 32   Only 339.99 $  instead of 489.99 $  (- 30%)    Code:   ANYCUBIC   Deal ends at: 11:40 pm https:// ?psc=1&tag=latashah-20 …",0,0,0,0
Sammerai,@Sammerai619,2022-11-07T19:56:38.000Z,A  3D printing  update  Now trying to get better at painting these miniatures! There’s much more technique than I ever thought there could be,1,12,0,0
Brian Meshkin,@meshkin,2022-11-07T15:20:07.000Z,Astronauts will  3D print  part of a human knee in space | Engadget  #health #Tech #medicaldevice #3dprinting https:// d-printing-human-knee-161941443.html?src=rss …,0,0,0,0
R+D,@rplusddesigns,2022-11-07T21:35:42.000Z,"While you can personalize these earrings to say any number of things, this message is clear: vote! [Beat of Your Own Custom  3D Printed  Earrings on  http:// ] #timetovote #vote #customearrings #3Dprinted #personalized #kitschplease #rplusd",0,0,0,0
GALEA,@Regularett,2022-11-07T15:28:32.000Z,"to save myself a lot of headache I've gone and purchased a  3D printed  face base, and I've modeled over that how I hope to build the head over it... no idea how I'll get the earrings done yet",1,5,1,0
3DLT.com,@3dtemplates,2022-11-07T17:11:03.000Z,"Air Products to Highlight Gas-based Technologies for Laser Cutting,  3D Printing  and Welding at Fabtech 2022  http://",0,0,0,0
Raven & Riddle Dicery - GAMES OPEN,@RavenandRiddle,2022-11-07T19:14:39.000Z,"Alright  #ttrpgcommunity  I’m  3D printing  a bunch of things to up my DM game. I’ve got initiative trackers and condition markers so far, what else should I be looking for?",2,3,0,0
RGM Watch Company,@RGMWatchCompany,2022-11-07T15:28:23.000Z,"RGM Repair & Restoration
We could not open this watch with our standard tools.  The solution / penetrating oil at the edge of the threads and then  3D print  a tool that fits the back perfectly.  #rgmwatches #rgmwatch #watchmaking #watchmaker #watchrepair #watchrestoration",0,12,0,0
Innovolo,@Innovolo_PD,2022-11-07T21:26:56.000Z,"3D printing  is revolutionising product development. 

Just like the printing press democratised the spread of information,  3D printing  makes it possible for anyone with an idea to turn it into a physical product. This opens new possibilities for product innovation and gives bu...",0,0,0,0
Usa Offers Time,@usa_offers_time,2022-11-07T17:20:43.000Z," ANYCUBIC Vyper, Upgrade Intelligent Auto Leveling  3D Printer  with TMC2209 32   Only 339.99 $  instead of 489.99 $  (- 30%)    Code:   ANYCUBIC   Deal ends at: 11:40 pm https://",0,0,0,0
M,@RegenBio,2022-11-07T15:06:55.000Z,"Interested in  #3Dprinting  silicone, PDMS, and other thermosets?  Read our newest publication led by  @stang_maria  ""Embedded  3D Printing  of Thermally-Cured Thermoset Elastomers and the Interdependence of Rheology and Machine Pathing""  @cmu_mse @cmu_bme https:// 02200984 …",2,70,14,0
Studio Lorier,@studiolorier,2022-11-07T15:04:40.000Z,Creating the TapWire in ultra speed :)  #yes #it #is #3d #printed #pla #biosbased #bio #compostable #madetoorder #biodigradable @ultimaker #ultimaker  #2  #timelapse #white #filament https://,0,0,0,0
Mashable,@mashable,2022-11-07T22:20:00.000Z,This artificial human cornea only takes 10 minutes to  3D print,1,42,19,0
WPG Chapter of Women in 3D Printing,@Wi3dpW,2022-11-07T17:07:01.000Z,"Join Winnipeg Women in  3D Printing  for an in person, casual meetup at Amsterdam Tea Room. Make and bring wtih you, a  3D Printing  gift for a Holiday Gift Exchange. 
RSVP is free but required. Our events are open to all!  https:// @Wi3DP",0,0,0,0
夕凪㌠,@Yuunagi_DAMEYA,2022-11-07T16:50:42.000Z,1/144 scale model manufactured with  3D printer  is on sale. https:// #144scale #3dprinting,0,0,0,0
3D Printing World,@dddpworld,2022-11-07T20:47:20.000Z,Not the best rendering.... but I finally figured out how to do a print-in-place angular gripper. It really took me a while to get it figured out. ,1,26,0,0
Kam Latif,@razakam,2022-11-07T19:55:33.000Z,Lego's  3D-Printed  Duck Is a Sneak Peek at the Toy's Future  https:// ng-printable-print-duck-toy-minifig-house-1849751375 …,0,0,0,0
Aviation Week MRO,@AviationWeekMRO,2022-11-07T15:54:06.000Z,"Although  additive manufacturing  adoption is still slow within aviation, experts say the technology could provide significant savings for operators. https://",0,0,0,0
Anatomics,@AnatomicsRX,2022-11-07T19:20:48.000Z,Life-changing surgery thanks to  3D printing  | Sydney Children's Hospitals Network ⁦ @AnatomicsRX ⁩  #anatomics https:// 2022/07/life-changing-surgery-thanks-to-3d-printing …,0,0,0,0
Hallie.BernierPQOT,@bernierpqot,2022-11-08T00:02:54.000Z,"Boys Hoodie Game  3d Printed  Sweatshirt Girls Pullover,Unisex Hooded Long Sleeve GDWJV66 https:// tag=josephine0ef-20 …",0,0,0,0
bubbleistrouble,@bubbleistrouble,2022-11-07T17:10:50.000Z,"3D printed  cap makes fat, shinny bubbles",0,0,0,0
QueerCultureBot,@QueerCultureBot,2022-11-07T20:16:53.000Z,Breaking news:  3D printing  and cantaloupes are non-binary culture now.,0,0,0,0
3Dstore.tn,@3Dstoretn,2022-11-07T16:21:41.000Z,http:// 3D Printing  News Unpeeled: Haas Meltio Hybrid  3D Printer  Installed on Warship  http://,0,3,1,0
Victoria,@victoriamscott,2022-11-07T19:09:54.000Z,My eyesight condition makes it hard to tolerate bright light so  3D printed  moon lamp it is. Tonight purple.  #lamp #moon #purple https:// ?igshid=YTgzYjQ4ZTY= …,0,0,0,0
Anne Meinema,@fotomeinema,2022-11-07T15:47:25.000Z,Ik ben geld aan het inzamelen voor  3D Printer  voor mijn hobby.. Klik om te doneren  https://,0,0,0,0
Grice Connect,@GriceConnect,2022-11-07T20:32:03.000Z,Calling all kids: Try your hand at  3D printed  catapults this Wednesday at free STEM event  http://,0,0,0,0
Alexandros Marinos,@alexandrosM,2022-11-07T19:21:20.000Z,3d printer  finally back in operation. Woah that took a long while.,3,29,0,0
walthamlibrary,@walthamlibrary,2022-11-07T17:03:15.000Z,Come learn the basics of 3D design programs  and how to operate a  3D printer  in our Makerspace on November 8th.,0,0,0,0
Medacta USA,@medactausa,2022-11-07T17:07:53.000Z,"Experience the M.O.R.E. Institute!

Join us Dec 9-10 in Tampa for our next Spine Learning Center focusing on the MIS MySpine MC Platform, Medacta’s  3D-printed , patient-matched solution for the midline cortical approach. 

Request a course:  https:// #Medacta",0,0,0,0
3DHEALS,@3dheals,2022-11-07T23:00:46.000Z,"There’s no question that computer modeling, simulation, and  3D printing  have transformed clinical medicine around the world.  https://",0,0,0,0
Cosine Additive,@cosineadditive,2022-11-07T17:45:06.000Z,Our new video is popping off today ! Over 1k views in less then an hour ! MASSIVE Mandril SPIN Test For INDUSTRIAL  3D Printer #shorts https:// HrjQ?feature=share …  via  @YouTube #3dprinter,0,0,0,0
couponsheap,@couponsheap,2022-11-07T20:20:16.000Z,[US Warehouse] 69% OFF LONGER  3D Printer  Ultrafine Tomtop: Get LONGER  3D Printer  Ultrafine LCD Resin Printer 405nm for $259.99 Free shipping from United States coupon/deal ends Wednesday 30th of November 2022 11:59:59 PM  http://,0,0,0,0
A L(ibrary) Smith,@ALibrarySmith,2022-11-07T19:44:03.000Z,3D printing  some fun earrings at work today! Can't wait to show the new printer to my library students!,1,6,1,0
OmniBox - 3D Printer Electronics Case (inactive),@TheOmniBox,2022-11-07T20:32:36.000Z,"Note for assembly:

If you plan to use lever nuts for chaining fans, the tray works best mounted behind the display. If a fan fails, you won't need to remove the MCU to get to the fan wiring; instead, just remove the display.",0,0,0,0
Silverblue sky noise,@SpacePupSilver,2022-11-07T21:13:42.000Z,"Simply slide your dick into the  3D printer  and molten plastic can be shaped into a perfectly fitting cage!
Inspired by  @Rubberasylum",7,612,65,0
La.Calavera.3D.print,@La_Calavera_3D,2022-11-07T16:25:58.000Z,"The Xenomorph was really fun to design, i love the Alien/Predator lore this week we are gonna update our Wolverine to the assembly mode #3dprint #zbrush #patreon #ender3 #3dmodel #3ddesign #aliens #xenomorph",0,8,0,0
Not A Games Dev Ollie,@Reksaurian,2022-11-07T16:07:25.000Z,"Thats hot, because same dude.",0,0,0,0
Seifert Technologies,@SeifertTech,2022-11-07T19:02:02.000Z,Additive Manufacturing  Markets grew 27% year over year,0,0,0,0
Town of Georgina,@georginatown,2022-11-07T19:25:00.000Z,"Join us for the  3D printing  & modelling workshop on Nov. 13. Kids will be introduced to basic concepts of 3D design & will make a small 3D keychain. Open to ages 7-10 & costs $75 per child. For more info, visit  http:// https://",0,3,2,0
Grumpy Dragon,@GrumpyDragonPro,2022-11-08T00:08:17.000Z,  Check out my friend's awesome  3D Print !,0,2,1,0
3DPrinting.agency,@3DPrintingAgenc,2022-11-07T16:36:53.000Z,"3D Printed  Miniature: Grim Reaper, Tabletop RPG, Highly Detailed, Gamer Collectibles and Gifts

Direct Link HERE:  https:// eaper/?feed_id=9315&_unique_id=6369342528e09 … https://",0,0,0,0
Not A Games Dev Ollie,@Reksaurian,2022-11-07T15:41:29.000Z,https:// rNEo?feature=share … @nalopia,0,0,0,0
Fab Hunt,@hunt_fab,2022-11-07T20:42:19.000Z,#hashtag3  Professional High Accuracy Metal Wi-Fi  3D Printer https:// sional-high-accuracy-metal-wi-fi-3d-printer/ …,0,0,0,0
We Talk Shit,@wetalkshitshow,2022-11-07T18:38:12.000Z,A reminder that we are always accepting builds for our show. We stream every Friday night. There’s always a prize for best build. Just needs to be built by you and no serial numbers. (Doesn’t have to be  3d printed ) submit on,0,0,0,0
Matt Goddard,@godd4rd,2022-11-07T18:30:43.000Z,Should I buy a resin or FDM  3D printer ? Newbie just looking to buy first printer.,0,0,0,0
kalo nimo,@KaloNimo,2022-11-07T21:08:31.000Z,Intelsat orders small GEO satellite from  3D printing  specialist  https:// s-small-geo-satellite-from-3d-printing-specialist/ …,0,0,0,0
Amin Ebrahimi,@_AminEbrahimi_,2022-11-07T16:06:09.000Z,"The first paper of our special issue on ""The Physics of Joining and  Additive Manufacturing "" is now out. 
Impact of the Power-Dependent Beam Diameter During Electron Beam  Additive Manufacturing : A Case Study With γ-TiAl  https:// @Applsci #additivemanufacturing",0,4,1,0
Dennis #RedBull #MV33 #3xWorldchampionF1,@dburgersdijk,2022-11-07T19:33:24.000Z,Super leuk. Collega was aan het stoeien geweest met zijn nieuwe  3D printer  en had als proef dit geprobeerd. Ik vind hem aardig gelukt. ,1,12,0,0
Not A Games Dev Ollie,@Reksaurian,2022-11-07T23:02:55.000Z,Swing and miss. Laundry.,0,0,0,0
All3DP,@All3DP,2022-11-07T17:02:57.000Z,"Oh, snap!  @snapmaker  is about to release its new IDEX  3D printer . Here is what we know about the J1 so far. https:// -review-3d-printer-specs/ …",0,5,0,0
RAC Medical Consulting,@RAC_Medical,2022-11-07T20:31:33.000Z,Point of Pivot:  3D Printing  vs. Injection Molding  https://,0,0,0,0
~Gabo,@GaboMcGamer,2022-11-07T21:45:11.000Z, on  @YouTube : Functional  3D Printed  Clock: Design Update  https:// F9DWo …,0,0,0,0
DaisukeRin,@RealDaisukeRin,2022-11-07T20:07:57.000Z,unboxing and setting up the  3d printer  with panda  https://,0,0,0,0
3D Printing Deals,@3dpdeals,2022-11-07T19:08:34.000Z,"$9.99 LED light strip 32ft
afflink:  https://  

3dpdeals promo code: $3 off

more info here:  https:// ed-light-strip-32ft …",1,1,0,0
Michelle Mueller,@MicheleCMueller,2022-11-07T16:47:52.000Z,Look what’s on the  3D printer  today?  My 5th grade  @VizLowerSchool  girls designed their own bubble wand using  @tinkercad  then learned how to convert the file to gcode for the printer be able to read their design. So many steps but solid skills!   #STEMeducation @UltimakerEd,0,14,3,0
Not A Games Dev Ollie,@Reksaurian,2022-11-07T18:23:05.000Z,https:// 9G/?igshid=MDJmNzVkMjY= …  Your face. I need it.,0,0,0,0
San Draw｜Silicone 3D Printer,@SanDraw3D,2022-11-07T15:40:00.000Z,"Ø9” filter

The accuracy of the printer is very important for large printed items. 

This filter is printed with the S300, and each hole in the picture is 1*1mm.  Making  3D printing  easier Print all your ideas #3Dprinting #silicone #3Dプリンター #シリコーン",0,2,1,0
"AVS 3D Printing, Laser Cutting & Engraving",@AVS3DPrint,2022-11-07T17:27:46.000Z,"Good morning  #ttrpgfamily . Its map week! Artist link in the comments. 

Wishing you all a safe, peaceful, calm & happy.  @LBSamuelsson  @SewingGeekiness @WorldofCordeDnD @MountainGothMom @TabiWritesStuff  @ShinyFluffdnd @Hope4TTRPGS @Works_of_whimsy #ttrpg",2,6,1,0
FSBCIAKGB LIVE,@fsbciakgb,2022-11-07T15:19:04.000Z,"3D printing , buoyant for orthopaedics  https:// ng-buoyant-for-orthopaedics/ …",0,0,0,0
Extruder Joe,@ExtruderJoe,2022-11-07T18:08:39.000Z,3D Printing : MakePrintable Shuts Down!  https:// able-shuts-down …,0,0,0,0
DIY Listings,@DIYListings,2022-11-07T17:28:34.000Z,3D Printer  Review: Monoprice Voxel Pro  http://,0,0,0,0
3D Printing @𝟑𝐃𝐚𝐛𝐥𝐞,@3Dable,2022-11-07T15:04:51.000Z,#3Dable  »EPLUS 3D launches nine-laser metal  3D printer «  https:// acturing-3d-printing-news/metal-additive-manufacturing-news/eplus-3d-launches-nine-laser-metal-3d-printer/ … #3Dp #3Dprinting #3Dprinter #Prototyping,0,0,0,0
"David Thomas. ,",@Thejadelord,2022-11-07T16:35:06.000Z,3d Printing  Carbon Fiber Nylon For Beginners (Ender 3)  https://  via  @YouTube,0,0,0,0
bubbleistrouble,@bubbleistrouble,2022-11-07T15:30:50.000Z,"3D printed  cap makes big, shinny bubbles",0,0,0,0
fisherlr777,@fisherlr777,2022-11-07T22:21:49.000Z,So a few months ago we found out our library has a  3d printer  and we've put in hundreds of hours of prints lol.,0,3,0,0
Daniel Orpheus VTuber,@OrpheusTV,2022-11-07T21:05:27.000Z,"I'm thinking of getting into Warhammer.
I'm gonna use my school's  3D printer  to make a Ta'unar as my entire army",0,0,0,0
ScaleModelKitReview,@ThunderHobbies,2022-11-07T19:54:14.000Z,"#artistsontwitter #ArtistOnTwitter @ThunderHobbies  @gil_reddragon62 La Charra bust completed, painted with acrylics, oils, and inks  3D printed  by  @CreationsNy3",0,0,0,0
Tech News Tube,@TechNewsTube,2022-11-07T17:57:37.000Z,Lego's Animated  3D-Printed  Duck Is a Sneak Peak at the Building Toy's Future  http://,0,0,0,0
Maple Leaf Makers,@MapleLeafMakers,2022-11-08T00:10:24.000Z,"As Canadians, we would be remiss not to mention that tonight's full moon is known as the Beaver Blood Moon, and will be accompanied by a total lunar eclipse.. Obligatory  3D-printed  Moon:",0,4,0,0
Markus Wolf,@3DMetalPrintin1,2022-11-07T15:39:05.000Z,ADDiTEC Introduces First Portable  3D Printing  Robotic Cell  https:// -introduces-first-portable-3d-printing-robotic-cell/?utm_source=dlvr.it&utm_medium=twitter …,0,0,0,0
"David Thomas. ,",@Thejadelord,2022-11-07T16:51:18.000Z,Carbon Fiber  3D Printing  101 | Why All Carbon Filled Filaments Aren't Equal  https://  via  @YouTube,0,0,0,0
ScaleModelKitReview,@ThunderHobbies,2022-11-07T19:52:03.000Z,"#artistsontwitter #ArtistOnTwitter @ThunderHobbies  @gil_reddragon62 La Charra bust completed, painted with acrylics, oils, and inks  3D printed  by  @CreationsNy3",0,2,0,0
An NCO in the war on entropy Ⓥ,@wyoham,2022-11-07T18:53:39.000Z,"OK - not looked, so i'ts likely out there someplace already

My ""Make Shit Monday"" offering 3D printed , in place and complete

2nd pic is how it comes off the bed and it opens up from there

More of a printer test, than anything else - but it works!",2,6,0,0
Clickbabe,@theReal16067419,2022-11-07T19:56:15.000Z,3D-Printed  Heroin Pipes Are Cancelled -- Here's Why,0,0,0,0
Lisa Stoddart,@LisseeJ,2022-11-07T15:15:42.000Z,Lego's Animated  3D-Printed  Duck Is a Sneak Peak at the Building Toy's Future,0,0,0,0
mohak,@mohak_tnbt,2022-11-07T18:05:05.000Z,Summary of How I Met Your  3D Printer  – Daily Tech News Show 4321  https:// mary-of-how-i-met-your-3d-printer-daily-tech-news-show-4321/ …,0,0,0,0
JPG Pics,@JpgpicsCom,2022-11-07T22:33:33.000Z,"New Engineering Software Accelerates Metal  Additive Manufacturing : Additive Flow aims to optimize build parameters within approved CAD geometries to reduce cost, while improving productivity, reliability, and…  http:// #interiordesign #art #architecture",0,0,0,0
Sir 'No.' Mycroft,@sir_mycroft,2022-11-07T21:47:30.000Z,Laughs in  3d printer .,0,0,0,0
Balance Keeper( that 3D Printer Guy)forever@BC2019,@BalanceKeeper3,2022-11-07T19:11:14.000Z,"I don't do this because it's fun or easy. I want Justice. Each post I make, it brings back the memories from 22 years ago. The shame I feel for 'allowing' it to happen. I am still here though. Still fighting and standing.",0,0,0,0
Additive Manufacturing Center of Excellence,@ASTMAMCOE,2022-11-07T16:35:16.000Z," SPEAKER SPOTLIGHT at Standards Forum at  #Formnext2022 Sastry Kandukuri  @DNV_Group  will be presenting ""Digitalization of Standards""

Join  @ExportGov @ASTMIntl @isostandards  for this event on Monday, Nov 14 in Frankfurt Germany https:// sforum/ …",0,0,0,0
bubbleistrouble,@bubbleistrouble,2022-11-07T15:10:50.000Z,"3D printed  trash can makes gargantuan, fleeting bubbles",0,0,0,0
3D Metal Printing Magazine,@3DMetalPrintMag,2022-11-07T19:02:04.000Z,New product launch! Mantle has announced the commercial launch and availability of its metal  additive manufacturing  tech for toolmaking. Check out the details here:  https://,0,0,0,0
KJD_3D_Printer (Real Life Bot),@Kjd3d,2022-11-07T20:55:20.000Z,KJD3D :   Printing is at 75%,0,0,0,0
Not A Games Dev Ollie,@Reksaurian,2022-11-07T18:33:07.000Z,"HEH, 42,000+ people are like, well, no shit brosef.  @PhillyD",1,0,0,0
Paul,@BlueKiteTrainer,2022-11-07T19:59:19.000Z,3D printing  process emissions may compromise cell function and DNA: study  https://,0,0,0,0
"David Thomas. ,",@Thejadelord,2022-11-07T17:26:33.000Z,You won't believe how strong these  3d printed  brackets are! Straight vs ...  https://  via  @YouTube,0,0,0,0
BenNiteShymalan,@BenNiteShymalan,2022-11-08T01:10:04.000Z,"Alright, so,  3D Printing  question I guess...or something that confuses me to fucking death...scale. Like, wtf, when a mini says it's 32 or 25 or whatever mm, does that also take into account how big they are in highet? Do I need to rescale a lot of the ones I print that are at-",1,2,1,0
SZ @ X3EM x/acc Ai Robotics 3D print skyscrapers,@3DX3EM,2022-11-07T15:35:48.000Z,lol. Some Twitter employees now needed or were laid off by mistake https:// 2022-11-06/twitter-now-asks-some-fired-workers-to-please-come-back …,0,0,0,0
Deals & Discounts Online,@HomeShopDigital,2022-11-07T17:40:03.000Z,"Panipat Textile Hub 120 TC Microfiber Single  3D Printed  Flat Bedsheet(Pack of 1, Blue)

 *Shop Now!* https://",0,0,0,0
CT State Norwalk,@ctstatenorwalk,2022-11-07T15:20:00.000Z,Join the Makerspace for their Intro to  3D printing  event! No experience necessary. RSVP at  http:// .,0,0,0,0
SirGrogshire 《VTUBER》,@Sirgrogshire,2022-11-07T15:51:30.000Z,"So I am definitely going to be in the market for new armor next season! The current armor is showing its 3 years of wear and tear.

Been trying to search online for someone who can do custom armor ( 3D printed  and Leather) but can't find any where that will do it.

Help?",0,0,0,0
3D PRINT TECH DESIGN,@AntonMnsson,2022-11-07T20:18:56.000Z,"There is no longer a reason to NOT upload  #3dmodels  to  @printablescom  thanks to the community and incentives  @josefprusa  and  @Prusa3D  have put in place. I don't even own a Prusa  3D Printer , and I will never upload free models elsewhere.   Here's why;",3,7,2,0
mohak,@mohak_tnbt,2022-11-07T19:55:06.000Z,The  3D Printer : Where is it?  https:// -3d-printer-where-is-it/ …,0,0,0,0
