Author Name,Author ID,Date,Post Text,Replies,Likes,Reshares,Views
Not A Games Dev Ollie,@Reksaurian,2022-11-07T19:23:59.000Z,Check out TOS Girls's video!  #TikTok https:// eo/7163354171930840321?_r=1&u_code=e0ejgd53j1amhi&preview_pb=0&language=en&_d=e0ejg0a6535hh2&share_item_id=7163354171930840321&source=h5_m&timestamp=1667848979&user_id=7070665361510728709&sec_user_id=MS4wLjABAAAA2U-wxNGii5_mJxnOe7IdR1pB2ltPtCv2Yo6tiHUsek8XZQvdwpsfnoedA_uV3XNP&utm_source=twitter&utm_campaign=client_share&utm_medium=android&share_iid=7160798850357462789&share_link_id=0fe2b881-539d-496b-8a5e-78194cf201bb&share_app_id=1233&ugbiz_name=Main&ug_btm=b5836 … 16+ hours a day as I leave audiobooks on my phone while I'm asleep but I spend time at my PC after work so. ,0,0,0,0
bubbleistrouble,@bubbleistrouble,2022-11-07T20:30:45.000Z,"3D printed  trash can makes many, beautiful bubbles",0,0,0,0
Not A Games Dev Ollie,@Reksaurian,2022-11-08T00:16:22.000Z,Bad internet connections are the absolute worst but I literally have the best solution available to fix precisely this in progress so its hard to complain. xD,0,0,0,0
WPSCurriculum,@MathWps,2022-11-07T23:54:37.000Z,Drafting students at WTHS with the game boards and pawns they created using a  3D printer .  @worcesterpublic  @OCPLwps,0,2,1,0
bubbleistrouble,@bubbleistrouble,2022-11-07T22:20:45.000Z,"3D printed  cap makes big, beautiful bubbles",0,0,0,0
BoostNinja,@Boost_Ninja,2022-11-07T23:07:47.000Z,#3rdgrader  can do everything! A  #3rdgrader  designed  3D printed #InternationalSpaceStation http://    via shapeways,0,0,0,0
Bree BarnettDreyfuss,@BarnettDreyfuss,2022-11-07T22:49:29.000Z,Found some old dynamics carts sold by Pasco that are almost as old as me. They seem untouched! Other than the fact that the hard plastic wheels are cracked. Maybe  3D print  new ones?,2,14,1,0
ZombiesmasherProps *COMMISSIONS OPEN*,@ZombiesmasherC1,2022-11-07T15:17:16.000Z,My finished  3D printed  replica of the N7 Breather helmet from  @masseffect  in order to celebrate this  #n7day  with style!  3d file available on Thingiverse and printed by  @Cosplus3D . @bioware @Mark_Meer @jhaletweets #MassEffect #n7 #helmet #3dprint #cosplay #videogames,0,0,0,0
Embedded House,@embedded_house,2022-11-07T23:06:35.000Z,"Overengineered Fume Extractor, Version 2: We all know the temptation of adding one more feature to your latest project. [Arnov Sharma] didn’t resist the urge. Building on his  3D-printed  fume extractor, he developed a…  http:// #security #cybersecurity #technology",0,0,0,0
260 auto repair inc,@260autorepairin,2022-11-08T00:28:14.000Z,Little something from the  3d printer #260inc #demolitionunit #fusion360  @ 260 auto repair inc  https:// ff45qUvOhwjspycNie8qBgNhjk0/?igshid=YTgzYjQ4ZTY= …,0,0,0,0
SECURE MetaWork,@SECUREMetaWork,2022-11-07T21:22:50.000Z,"Our  3D Print  Partners are established, and we're onboarding designers to sell their creations!

Mugs, jewelry, sculptures and more can be  3D printed , and shipped, on demand, when purchased from  http:// .

Start your product business with  #MetaWork .",1,1,0,0
bubbleistrouble,@bubbleistrouble,2022-11-07T17:30:50.000Z,"3D printed  trash can makes humongous, slimy bubbles",0,0,0,0
Steven Briggs,@Poisonsong,2022-11-07T20:19:24.000Z,"Synthia , 3d printed  Android #fembot #stevenpaulbriggs #syntheticpeople #AIart",0,0,0,0
212Print3D,@0212Print3D,2022-11-08T00:11:23.000Z,Impresión 3D de metal para estructuras dentales -  3D Printing  & Design  https://,0,0,0,0
bubbleistrouble,@bubbleistrouble,2022-11-07T20:00:47.000Z,"3D printed  trash can makes big, reflective bubbles",0,0,0,0
Bradley Jon Eaglefeather,@bjeaglefeather,2022-11-07T18:05:33.000Z,"Velo3D on Creating Large, Mission Critical Parts With Metal  Additive Manufacturing : Founded in the United States by  @BennyBuller3D , Velo3D…  http://  |  @3Dnatives @VELO3DMetal #Velo3D #Metal #AdditiveManufacturing #3Dnatives",0,1,4,0
Design World,@DesignWorld,2022-11-07T20:15:03.000Z,". @3Dpcb , a supplier of Additively Manufactured Electronics & multi-dimensional polymer, metal & ceramic  Additive Manufacturing  3D printers, will showcase its products & technologies at  @formnext_expo  in Germany, on Nov. 15-18 (Stand C119).

Learn more  https://",0,0,0,0
SelfCAD,@SelfCAD,2022-11-07T17:10:53.000Z,"Add magic to your next  3D printing  project with these  3D printer  libraries. 

Check out this article to learn more about each one :  https:// Which one's your favorite? Tell us in the comments below! 

Tags: #3d #3dmodeling #3dprinting #3dprinter #library #selfcad",4,11,3,0
Mona Shen,@Tronxy3d,2022-11-08T01:10:07.000Z,. Offer Xtras! X5SA PRO DIY large format  3d printer  TR black sensor + Lattice Glass Plate 330mm*330mm*400mm for $398.00,0,0,0,0
Lifeboat Foundation,@LifeboatHQ,2022-11-07T22:48:54.000Z,This company built a  3D-printed  net zero house to decrease carbon dioxide  https:// his-company-built-a-3d-printed-net-zero-house-to-decrease-carbon-dioxide …,0,0,0,0
UBC Mechanical Engineering,@ubcmech,2022-11-07T20:57:47.000Z,"This week we are presenting two online guest seminars on  #biomanufacturing : Nov 9th at 8AM Dr. Ozbolat gives a talk on  3D printing  living tissues and organs, and Nov 10 at 10:30AM Dr. Kim presents on platforms for multiscale tissue regeneration. Details:  https://",0,4,2,0
TexSpace,@texspaceorg,2022-11-07T20:50:27.000Z,"Jason Rainbow with spacenews reports
Intelsat orders small GEO satellite from  3D printing  specialist https:// #spaceflight #explorer #deepspace #universe #space",0,0,0,0
"David Thomas. ,",@Thejadelord,2022-11-07T17:22:53.000Z,3D Printed  Topology Optimized Shelf Brackets  https://  via  @YouTube,0,0,0,0
libertarian Nog!,@NowLibertarian,2022-11-07T17:13:20.000Z,"Dear  @elonmusk , please consider revising this rule regarding firearms and  3d printed  gun parts. There is literally no law anywhere, at all, that makes such activities illegal. Anything outside of the Constitution that tries to go against the Constitution shouldn’t count.  https:// /GhostGCom/status/1589638100183289856 …",0,3,3,0
V,@velsthinez,2022-11-07T16:47:56.000Z,"Hello !

I sculpt fantasy characters for  3D print . If you would like your character to be sculpted, I would love to hear from you!

DM me or email  [velsthinez@gmail.com] #commissionsopen",5,381,65,0
Drinks&Dice,@drinks_dice,2022-11-07T20:32:44.000Z,"So I am thinking about starting to collect and paint minis, I have a small  3d printer , so any advice for a newbie? #ttrpg #miniaturepainting #dnd #WarhammerCommunity #ttrpgfamily",0,0,0,0
Franc Coenen,@madeineuropenu,2022-11-07T19:45:15.000Z,#formnext2022  besteedt veel aandacht aan kwaliteitscontrole in  additive manufacturing . Maar: vaak gaat het om standalone oplossingen of platformen voor data-uitwisseling. Is er ook een geautomatiseerde in-line QC oplossing? AM-Flow… https:// https://,0,0,0,0
Beckhoff USA,@BeckhoffUSA,2022-11-07T19:02:10.000Z," Large scale.   Solid state.   Any metal.

The  additive manufacturing  process pioneered by  @MELDMfg  offers unrivaled benefits.   See how flexible, future-proof  #automation  tech optimizes it:  http:// #Beckhoff #3dPrinting #AdditiveManufacturing #FABTECH2022",0,0,0,0
MooreEngServices,@MooreEngService,2022-11-07T16:34:57.000Z,Be on the lookout for  3D printed  exhibits of trip hazards and friendly smiles ready to chat!,0,0,0,0
Luke Skywhopper 3d Printing,@Lukeskywhopper1,2022-11-07T20:55:24.000Z,"Ever since Musk stepped in as owner of twitter, I have actually found myself using it more. Go  @elonmusk",0,0,0,0
Anarchity,@Anarchity,2022-11-08T00:26:14.000Z,"Started printing my patterns for MFF so people can buy them in person after seeing examples in person, had to order more cardstock! 3d printed  fursuit glasses are printing!

New claw and nose models being resin printed!

Foam heads being cast!

Examples being made!",1,4,0,0
Web Sales Promotion,@websalespromo,2022-11-07T23:07:41.000Z,Student build  3D-printed  prosthetic arm for people with engineers  https:// nt-build-3d-printed-prosthetic-arm-for-people-with-engineers-24757/ …,0,0,0,0
Latest News from Business Wire,@NewsFromBW,2022-11-07T15:49:21.000Z,Global Hearing Aids  3D Printing  Devices Market to Grow by $384.7 Million During 2022-2026 -  http:// http://,0,0,0,0
PhilPage,@PhilPage65,2022-11-07T20:05:09.000Z,Check out christmas advent calendar  3D Printed https:// 47?mkcid=16&mkevt=1&mkrid=711-127632-2357-0&ssspo=s-KQGxRaSkS&sssrc=2051273&ssuid=s-KQGxRaSkS&var=&widget_ver=artemis&media=TW … #eBay  via  @eBay_UK,0,0,0,0
phl make,@phlmake,2022-11-07T16:15:48.000Z,News from MakeZine:  3D Printer  Review: Monoprice Voxel Pro  https://,0,0,0,0
CH Fursuits,@CreatureHaven,2022-11-07T18:42:48.000Z,"I'm the type of maker that'll build just about anything!!
Cute? Horror? Colorful? Natural? Simple? Super complex? Gimme!

Only things I can't/won't do- airbrushing, LEDs, animatronics/electronics, moving jaws,  3D printing  or casting(but I can get parts from others!)",1,7,1,0
IoT Marketing LLC,@iot_marketing,2022-11-07T19:30:00.000Z,Here's a look at how  3D printing  is complementing IoT technology:  https:// g-iot-will-transform-business/ … #3DPrinting #IoT #IoTDevices #SmartTech #IoTMarketingLLC,0,0,0,0
David Boon,@SheepdogNo1,2022-11-07T21:27:56.000Z,Rusty Rails Modelling  3d print  class 60 parts arrived & on with the job of fitting the valance / bogie steps & air horns  #TMRGUK,0,3,1,0
Beth,@prospectorbeth,2022-11-07T18:10:03.000Z,Darrien gave me a  3D Printer . I don't really know what I'm supposed to do with this...,0,0,0,0
ガヤおじdad,@Carrot_req_mayo,2022-11-07T22:30:24.000Z,"3D-Printer の授業はいっちゃんめんどくさいーってか物理的にくさいー
そして熱いー
はいーもう３D-printerの授業しないー",1,0,0,0
Patrick Seaman,@PatrickSeaman,2022-11-07T17:02:56.000Z,A California Startup Says  3D Printing  Batteries Could Double Capacity  https://,1,3,2,0
Adam Marcus,@radadammarcus,2022-11-07T17:02:48.000Z,"Terrific studies in texture, form, nonplanar toolpaths, slumping, and more from the midterm for my Ecological Tectonics seminar. Students are designing and prototyping modular  3d-printed  ceramic systems that provide a range of habitats for plants and ani…  https://",0,0,0,0
Siegfried Treitner,@TreitnerS,2022-11-07T16:54:25.000Z,https:// 78-3-319-61924-8 … @3D @Printing  in  @Medicine,0,0,0,0
3D Printing @𝟑𝐃𝐚𝐛𝐥𝐞,@3Dable,2022-11-07T16:05:45.000Z,#3Dable  »Quickparts UK expands its European presence within the aerospace industry«  https:// acturing-3d-printing-news/latest-additive-manufacturing-3d-printing-news/quickparts-uk-expands-its-european-presence-within-the-aerospace-industry/ … #3Dp #3Dprinting #3Dprinter #Prototyping,0,2,0,0
Not A Games Dev Ollie,@Reksaurian,2022-11-07T19:10:27.000Z,"Check out this video ""TOS PODCAST!!!""  https:// 23361?sr=a&t=1s … @tos_girls @nalopia @Loserfruit",1,0,0,0
The Maritime Executive,@Mar_Ex,2022-11-07T17:00:35.000Z,"U.S. Naval Sea Systems Command has installed a 3D metal printer for stainless steel parts aboard the amphib USS Bataan, expanding on past trials with shipboard  3D printing  in plastic and aluminum materials.  #3Dprinter #shipboard #maritimenews https:// -uss-bataan-can-now-print-spare-parts-in-stainless-steel …",0,0,0,0
Daniel Williams,@willida25,2022-11-07T16:20:25.000Z,Thank you to everyone who participated in our  3D Printing  workshop this morning! Wish we had more time! Just like the rest of the weekend -it was fun & informative! I will be sharing electronic ver of the resources through email or DM me.  #STANYSConference2022 @STANYSorg @NYSMTP,1,12,4,0
3DTide,@3DTide,2022-11-07T17:36:10.000Z,"3D Printed  Combi Burner by  @TRUMPF_News  

To view in 4K and see print info, go to  https:// eering … #3Dprinting",0,2,0,0
Lis Tham,@LisTham_,2022-11-07T17:14:04.000Z,The shots this weekend were so epic! I love cosplaying the Amazon princess! Happy week  #wonderwoman  armor design TeamKyonLee my tiara was  3D printed  I commissioned from  @Berserkercustom,28,1121,102,0
Aroged,@Thearoged,2022-11-07T15:46:59.000Z,AMD Project Quantum: Return of the legendary mini PC as a  3D printing  project  https:// -project-quantum-return-of-the-legendary-mini-pc-as-a-3d-printing-project/ …,0,0,0,0
Joanne's Reviews,@joannesreviews,2022-11-08T00:20:06.000Z,First batch of  3D printer  enclosure parts finished. It’s the first time I have tried printing in ASA and it went well.,0,5,0,0
Beans in Things (beansinthingz),@beansinthingz,2022-11-07T16:05:08.000Z,"How  #DIY  are you? Do you own a  3d printer  or other technical equipment? Show me! 

Did you know? I have a handful of  3d print  files available! Download them instantly and get crafting today! 
*some prior skill nessesary to properly utilize.   

Check o…  http:// 709/download-3d-print-stl-file-fursuit-furry …",0,0,0,0
Purple Porcupine,@Porcupine3d,2022-11-07T18:44:50.000Z,"With the  @OnulisCo  WRAP machine, you can turn your  3D printing  waste resin into solid plastic stock that can be milled into practical use products with the  @RolandGlobal  MDX-50.  #3dprinting #wasteresin #sustainability #cncmill",0,0,0,0
Purple Platypus,@PrintPrototypes,2022-11-07T18:45:24.000Z,"With the  @OnulisCo  WRAP machine, you can turn your  3D printing  waste resin into solid plastic stock that can be milled into practical use products with the  @RolandGlobal  MDX-50.  #3dprinting #wasteresin #sustainability #cncmill",0,0,0,0
Jason Rainbow,@JasonRainbow,2022-11-07T20:35:12.000Z,3D printing  specialist Swissto12 said has sold its first small satellite to Intelsat for a launch to geostationary orbit in 2025 - SpaceNews,0,11,3,0
Engineering Tomorrow,@EngineeringTmrw,2022-11-07T16:38:23.000Z,"Thanks, we love a good shoutout. And we really love bringing STEM content to classrooms.  @ISTEofficial , reach out! Many of our labs have direct  #Math  content: Bridges,  3D Printing , Machine Learning and Aerodynamics, to name a few.  #ISTEchat",0,2,1,0
wcrpaul (Mas: @wcrpaul@maly.io),@wcrpaul,2022-11-07T15:21:32.000Z,Anyone with a  3D printer  can create their own micro-plastic gathering Gilbert...,0,4,2,0
bubbleistrouble,@bubbleistrouble,2022-11-08T00:10:46.000Z,"3D printed  trash can makes lots of, reflective bubbles",0,0,0,0
Ralenes World,@RalenesW,2022-11-07T15:50:15.000Z,"And than build nuclear batteries and than sell them in construction and manufacturing and  3d printing  

And than build nuclear cars.",0,0,0,0
Punctured Artefact,@PuncturedArt,2022-11-07T15:35:38.000Z,"A chop is a small seal, stamp, or impression that identifies the artist. 
This is my  3d printed  chop (2 cm) which I will use to sign my editions. 
It features the diamond logo.",0,0,0,0
MFG Talk Radio,@MFGTalkRadio,2022-11-08T00:30:16.000Z,A California based startup says that  3D printing  could help mass produce batteries. Take a look at what they have planned:  https:// #3Dprinting #Manufacturing #California,0,2,2,0
bubbleistrouble,@bubbleistrouble,2022-11-07T18:20:48.000Z,"3D printed  trash can makes fat, reflective bubbles",0,0,0,0
Chronic Wellness,@chronicwell14,2022-11-07T21:55:11.000Z,3D Printed  Sensors Developed to Aid Lupus Patients  http://,0,0,0,0
藝人である“Ju•NIOR”【】,@aruberutou,2022-11-07T19:24:22.000Z,angew_chem: RT  @ChemSusChem : Polyoxometalate-Enhanced  3D-Printed  Supercapacitors (Pumera and co-workers  @PumeraGroup @FutureEnergyLab @CEITEC_Brno )  #ChemSusVIP https:// https://,0,6,2,0
bubbleistrouble,@bubbleistrouble,2022-11-07T18:00:48.000Z,"3D printed  cap makes ridiculously, shinny bubbles",0,0,0,0
Lund News,@LundOrg,2022-11-07T19:28:48.000Z,Navy’s amphib Bataan receives first permanent metal  3D printer  for parts  https:// ataan-receives-first-permanent-metal-3d-printer-for-parts/ …,0,0,0,0
Jess,@15jessmartinez,2022-11-07T18:39:47.000Z,making a functioning component from a  3D print  is harder than I thought,1,0,0,0
PAUSAFE,@PAUSAFE2,2022-11-07T21:58:36.000Z,A  3d printed  mask to treat glue ear disease. For a 5 years old kid. Working great!  #otovent #otitis #kids #glueear #3d,0,0,0,0
Not A Games Dev Ollie,@Reksaurian,2022-11-07T20:45:46.000Z,"https:// ?igshid=MDJmNzVkMjY= … @tos_girls  

Play a game of marry, fuck, kill? ",0,0,0,0
Valerie Wilde,@inkbrushstudios,2022-11-07T15:41:51.000Z,Lego's Animated  3D-Printed  Duck Is a Sneak Peak at the Building Toy's Future  https://,0,0,0,0
Penn State Mechanical Engineering,@PSUMechEng,2022-11-07T18:52:46.000Z,"Assistant Professor Amrita Basak received a two-year, $498,235  @DARPA  Young Faculty Award for her work in predicting and preventing thermal deformation in multi-laser  additive manufacturing :  http://",0,2,1,0
3DPrinting.agency,@3DPrintingAgenc,2022-11-08T00:40:05.000Z,"3D Printed  Miniature: Cursed Orc Male, Tabletop RPG, Highly Detailed, Gamer Collectibles and Gifts

Direct Link HERE:  https:// -orc-male/?feed_id=9327&_unique_id=6369a5649ccbc … https://",0,0,0,0
Fargo Air Museum,@FargoAirMuseum,2022-11-07T18:10:00.000Z,"Youth Aviation Camp! Last week was  3D Printing , next week is Robots.   sign up now at  http://",0,0,0,0
F2 Collectibles,@FFaustDesign,2022-11-07T18:16:11.000Z,Finished my DC Joker Fan Art. Model is made for  3D printing .,1,0,0,0
Stuart Carroll FCCT,@stuart_carroll1,2022-11-07T20:00:45.000Z,3D printer  arrived last week!  @TMETrust  IT team wasted no time in getting it installed! Yet to have a full 'play' however we did get to create this small Hilbert cube today!  @CastleMeadAcad #CMADT Can't wait for our scholars to start using this as part of their CAD rotation!,0,9,1,0
CTY@LCPS,@CountrysideElem,2022-11-07T18:08:02.000Z,We are officially  3D printing  at  @CountrysideElem  What do you think we are making?,1,3,0,0
Doppel Draconius,@DoppelDraconius,2022-11-07T22:10:36.000Z,"Oh no lol, the 12 hour  3D print  failed.

It appears that the hotend developed a clog. Investigating.",0,0,0,0
Tyler Thorsted,@CHLThor,2022-11-07T15:43:35.000Z,"Floppy disk cookie, made with  3D printed  cookie cutter, captured on a Mavica camera onto a floppy disk.  #meta #megabite",7,302,62,0
Print Shoot Repeat,@printingguns,2022-11-07T17:47:21.000Z,Good news! AEA Arms is now selling the uppers for the Tinck Perun X-16! And  @nguyenkvvn  designed a  3D printed  lower for it!!!,21,405,39,0
Dianyelo G Open for photoshoots & 3D printing,@DianyeloG,2022-11-07T23:53:44.000Z,You are very welcome  @Blodvyx  if you need anything else let me know I got you.  https:// /Blodvyx/status/1589764327825108993 …,0,0,0,0
TheDailyDude,@dude4_daily,2022-11-08T00:23:15.000Z,Starscream and the Star Saber sword. What? wrong Starscream I don’t know what u r talking about  . Bought a  3D printed  Star Saber that is 5mm compatible.  #Transformers #TransformersArmada #toyphotography,0,4,0,0
WestwoodTableSoccer,@Westwood_TS,2022-11-07T20:21:09.000Z,The advent of the  3D printer  has absolutely given Subbuteo people opportunity to get what they never could and I love it. MSB absolutely nailing it ,1,15,1,0
Health and Beauty Website Directory,@youcanbhealthy,2022-11-07T17:32:08.000Z,#interesting 3d printed  my Rick Sanchez mask for halloween! [via  http:// ],0,0,0,0
Extruder Joe,@ExtruderJoe,2022-11-07T18:08:40.000Z,3D Printing : AirLogic:  3D Printed  Pneumatic Computation  https:// 3d-printed-pneumatic-computation …,0,0,0,0
The 3D Print General,@3DPrintGeneral,2022-11-07T15:59:48.000Z,"Can you handle the spookiness? 
Watch the full video here:  https:// Jsro8 … Upper from  @DispensedParts  
Feed ramp from  @RiptideRails  
Design by @Yeezy_Prints",3,78,11,0
Tenkinos| Vtuber | D&D Creator,@Tenkinos,2022-11-07T20:20:06.000Z,I was a bit extra and got a Art for a  #DnD  character designed by @JhonnyAssmann  then 3D modeled and  3D printed  on Fiver. I think it came out Amazing! I may have to get Figure Size  3D printed I get to use her mini tonight! #dungeonsanddragons #art #3Dprinting,1,5,1,0
TheSleepyWargamer,@Simonroberts87,2022-11-07T20:11:49.000Z,Right back on the Twitter wagon now I’m  3D printing . Wanted to introduce  DJ Necroon #necron #warmongers #40k #3Dprinting #imback,2,7,2,0
KJD_3D_Printer (Real Life Bot),@Kjd3d,2022-11-07T21:30:37.000Z,KJD3D :   Printing is done! Took about 2:23:40,0,0,0,0
Fusion3 3D Printers,@Fusion3DPrint,2022-11-07T15:30:31.000Z,"Fusion3 3D printers are quiet for the workplace & classroom. Our EDGE  3D printer  is only 37.5 decibels, barely noticeable above the sounds of a normal office or classroom. Learn more:  https://",0,2,0,0
De3D printed NFT III,@DE3D19,2022-11-07T20:39:21.000Z,"Our price for a custom modelled  3D printed  y00t or DeadGod bust is:

$1111 

Our only wallet is De3D.sol #FeelurNFT Fill in this form to get yours

Degods order form:",0,6,3,0
International Plant Sales,@IPSplant,2022-11-07T15:15:55.000Z,"Seems like  3D printing  within the construction industry is gaining popularity around the world. Including Egypt  for the first time ( https:// inting-construction-technology-to-launch-in-egypt … ), but is it something you can see becoming the norm in construction? #constructionmachinery #3Dprinting #constructionnews",0,0,0,0
Kirk Freeman,@KirkFreemanLaw,2022-11-07T18:04:29.000Z,"Additive Manufacturing  Update:  A client just reported that he bought a metal 3-D printer for a fraction of what I believed them to be.  The future is coming on, is coming on, is coming on. https:// tal-x?utm_source=google&utm_medium=paid-search&utm_campaign=12003716389&utm_content=118905313151&utm_term=metal%20x%203d%20printer&gclid=CjwKCAiA9qKbBhAzEiwAS4yeDb3lNpMFrG-i0TAGJj0Ed1v9xpVBPzS2hpOTny3vN4QXXF3ZByb_TRoCREcQAvD_BwE …",1,0,0,0
Nnetaruquidizose,@Nnetaruquidizo1,2022-11-07T22:56:26.000Z,Do you know about Warner Bros airdrop?  @Cryptob81010493 @BishopOla3 @DRMorais87 @DhangElda @SHOBOGUN1 @3D_Print_NFT  @Bochapeau @dinglebeef00  @MiddleEarthCats @ApesWant https:// /WornerBrosNFT/status/1589726543823376384 …,0,0,0,0
AnarchoFroggoism,@BlackFlagRN,2022-11-08T00:59:49.000Z,"Lmfao cope, you fucking loser.  3D printed  guns are completely legal.",0,2,0,0
MetaDrip,@MetaDripMD,2022-11-07T22:54:45.000Z,"In the Lab   

Exploring  3D printed  toys.. this is really fun. #Web3 #Collectibles #3Dprinting #Art #NFT #MEWS",2,12,4,0
Tuan TRANPHAM,@ttranpham,2022-11-07T19:16:43.000Z,Mandanà Moshiri: Lego's Animated  3D-Printed  Duck Is a Sneak Peek at the Building Toy's Future > The tiny animated duck is a replica of a toy created by the company's founders •  https://  •  #3Dprinting  •  #additivemanufacturing  •… https://,0,0,0,0
Bella'sCraft3D ~ junior sculptor looking for work,@BellasCraft3D,2022-11-07T17:59:28.000Z,"Finally the cutie is tangible  I am so happyyy  I made the 3d model, the cuts and keying for printing,  3d printed  and then sanded, last step is (trying) painting it  #3dprinting #3dprint #3dprinted #3dmodel #zbrush #blender #3dart #3dmaker",8,75,9,0
Gabriel Gheorghiu,@ggheorghiu,2022-11-07T17:16:03.000Z,Hexagon and Raytheon develop new software tool that predicts metal  3D printing  defects  #3DPrinting https:// nd-raytheon-develop-new-software-tool-that-predicts-metal-3d-printing-defects-216537/ …,0,0,0,0
/r/SpacePolicy,@r_SpacePolicy,2022-11-07T21:44:29.000Z,Intelsat orders small GEO satellite from  3D printing  specialist via /r/SpacePolicy  https://,0,0,0,0
Kavin- Skye Riley Fan Forever!!,@kavin_b,2022-11-07T17:07:28.000Z,Should I buy this iPhone  3D Printer  from View Your Deal? Fjskfkskfks  #TheView,0,0,0,0
Tish,@Educator_Hustle,2022-11-07T23:12:04.000Z,#First #3D  print  #ender #3DPrinter,0,0,0,0
Andrea Novicky,@MrsNovicky,2022-11-07T21:36:42.000Z,"3D printing  our lunar landers!  Getting excited for our launch, and the Artemis 1 launch on Nov 14th! #NASAGlennSTEM  @NASAGRC_Edu  @Spartans_Supe @sp_warner #spartansonthemoon",0,2,2,0
The Spirit of Creative Technologies,@TheSpiritofCre1,2022-11-07T17:22:20.000Z,"World Stop is a video game that illustrates dyslexia, drawing on  3D printing  and play to reach New Zealand residents.",0,0,0,0
Tea,@lingechowder,2022-11-07T21:42:21.000Z,"We got our  3d printer  working and I made a hot vampire babe, a rat man and a death knight (arms to be glued)",0,0,0,0
bubbleistrouble,@bubbleistrouble,2022-11-07T19:10:50.000Z,"3D printed  cap makes humongous, transparent bubbles",0,0,0,0
Verge Video,@VergeVideo,2022-11-07T17:00:03.000Z,Researchers developed a way for  3D-printed  objects to connect to WiFi without electronics or batteries.,0,0,0,0
UP-BOARD,@UPbridge_gap,2022-11-07T15:51:26.000Z,Check out our new UP Squared V2 Educational Robot as it uses  3D printing  for its  #Intel  RealSense camera mount. Stay tuned for more details and see the live demo at  @Sido_Paris  this week (8 - 9 Nov) in Booth E15 with  @equipscient #3dprinting #robotics #SIDOParis2022,0,4,4,0
Not A Games Dev Ollie,@Reksaurian,2022-11-07T15:46:36.000Z,"https:// ruit/2966279419582006282?utm_source=ig_story_item_share&igshid=MDJmNzVkMjY= … @Loserfruit  

Now that's how you female gamer geek. Tried to find details about it but Google keeps coming up with trophy details, so...",1,0,0,0
TCT Magazine,@TheTCTMagazine,2022-11-07T16:30:51.000Z,"A ""groundbreaking"" new silicone  3D printing  solution has been launched by  @Lynxter_3D  

The new system is set to be a powerful option for printing medical and industrial grade silicones and polyurethanes according to the company #3Dprinting http://",0,0,0,0
3D-Prints.com,@3D_prints_news,2022-11-08T00:48:01.000Z,"Velo3D on Creating Large, Mission Critical Parts With Metal  Additive Manufacturing https://",0,0,0,0
Sho Nuff Geaux,@GeauxJuan,2022-11-07T23:52:25.000Z,This  3D printing  class is cool.,0,0,0,0
"Edward Bender, MD",@ebender001,2022-11-07T18:33:49.000Z,RT  @DanielleMullis0 : Matthew Park presenting his data at AATS on using the mitraclip vs. Alfieri stitch vs. neochord repair for MVP in the  3D printed  pump  @StanfordCTSurg #aha22,0,0,0,0
