Author Name,Author ID,Date,Post Text,Replies,Likes,Reshares,Views
Prettai,@prettaico,2022-06-17T18:56:31.000Z,"Engineers create single-step, all-in-one  3D printing  method to make robotic materials  http://",0,0,0,0
RegMedNet,@RegMedNet,2022-06-17T15:47:59.000Z,Researchers produce a novel modular  3D-printed  microfluidic system for continuous  #stemcell  manufacturing. Read the latest news article on  @RegMedNet  here >>>  https://,0,0,0,0
錢,@nkchienwayne,2022-06-17T12:22:32.000Z,"3D printed  Suomi SMG prototype
Operate as same as originals!",1,43,14,0
OlalaVN,@olalakl3,2022-06-17T19:40:19.000Z,"The Yangqu Hydropower Station project, which is controlled by an AI-controlled unmanned engineering fleet, is built with  3D printing  technology. If put into production in two years, it will be the world's largest  3D printing  project with a height of 180 meters.",0,14,2,0
avaxgfxcom,@avaxgfxcom,2022-06-17T15:18:05.000Z,Old West William La Saga –  3D Print https:// rintable-models/305797-old-west-william-la-saga-3d-print.html …,0,0,0,0
Fabbing,@fabbing,2022-06-17T14:20:06.000Z,Velo3D Announces Q3 Release for Its Largest Volume  3D Printer  Ever  http://,0,0,0,0
3D Printing @𝟑𝐃𝐚𝐛𝐥𝐞,@3Dable,2022-06-17T18:51:53.000Z,"FA »New AM Materials Round Up, June 17, 2022«  https:// #3Dable #3DP #3Dprinting #3Dprinter #Prototyping",0,0,0,0
TJ,@TJLikesPuddles,2022-06-17T17:00:09.000Z,I joined a  3D printing  group on FB because of a project I was working on. Forgot about it until the greatest image I’ve ever seen was on my feed.,0,0,0,0
Service News,@Modewelt_Online,2022-06-17T18:45:03.000Z,Herrenmode Neuheiten |  3D Print  Herren Freizeitanzug Outfit Andy in Blau | Herrenmode Günstig Online Kaufen  https://,0,0,0,0
Stuart Lyle,@Stu_Lyle,2022-06-17T19:55:30.000Z,"Today, I acquired an epic 1:5000 ( ) scale,  3D printed  model of central London!

AA battery in Parliament Square for scale.

Unsurprisingly, I don't have any miniatures to do a  #wargame  at that scale.

Anyone got any ideas what I can use it for?  @SebastianBae @JaysonGeroux",9,24,2,0
3D Printing Catalog,@3DPcatalog,2022-06-17T19:45:17.000Z,"Current job openings at @Nexa_3D: 

Ventura, CA; Boston, MA and Remote positions.

↓↓↓",1,2,1,0
Bonaport.co.uk,@BonaportU,2022-06-17T17:29:49.000Z,Latest article from Bonaport - Mens Cotton  3D Printed  Tracksuit Bottoms Elasticated Waist Hippie Bloomers Cargo Trousers Lounge Pants Beach Walking Running Jogging Sweatpants - Price: (as of  - Details) -  https:// s-cotton-3d-printed-tracksuit-bottoms-elasticated-waist-hippie-bloomers-cargo-trousers-lounge-pants-beach-walking-running-jogging-sweatpants-2/ … #lgbt,0,0,0,0
Dima Volkov,@Coyote5Ohh,2022-06-17T20:14:25.000Z,"Don't talk to me or my son ever again. 

I fuckin love  3d printing , and yes. Lil Slayer will be painted on stream eventually",2,4,0,0
JacksonvilleInsider,@JaxInsider,2022-06-17T17:15:29.000Z,Equinor Signs Deal With  3D Printing  Start-Up | Rigzone  https:// inor-signs-deal-with-3d-printing-start-up-rigzone/ …,0,0,0,0
Victori_,@Victori__02,2022-06-17T16:02:48.000Z,"Me: wants to start  3d printing  things again

My house built in the 50’s: yeahhhhhh but you have no 3 prong outlets and to install some ones proper would require re-wiring the entire house.",1,0,0,0
Not A Games Dev Ollie,@Reksaurian,2022-06-17T20:48:23.000Z,Busy day. And so very hot.,0,0,0,0
bubbleistrouble,@bubbleistrouble,2022-06-17T15:30:42.000Z,"3D printed  cap makes fat, shinny bubbles",0,0,0,0
Jewel District,@JewelDistrict,2022-06-17T15:29:44.000Z,"3d printing  is hot. From hearts, houses to  #jewelry . Join the fun!  https://",0,0,0,0
Mashable,@mashable,2022-06-17T15:42:00.000Z,3D-printed  jet suit lets rescue teams move at 50mph  #FutureBlink,2,31,8,0
KWSS RADIO,@KWSS_Radio,2022-06-17T15:45:06.000Z,Your Morning Good: Mixing some nerdy news in with this one-  3D printed  ear transplant has been achieved. Just amazing. -Dani  https:// #goodnews #technology #3dprinting,0,0,0,0
Venkat B,@mailmeoften,2022-06-17T15:19:25.000Z,The development of the quadcopter mold continues with  additive manufacturing  in part four of our six-blog digital machine shop series. Check it out!  https:// #3Dprinting #additivemanufacturing #industrial3Dprinting,0,0,0,0
L. García Aretio,@lgaretio,2022-06-17T19:32:46.000Z,"Combining  3D printing  and electronics as a strategy for improving the learning experience
  https:// ando-impresion-3d-y-electronica.html?utm_medium=social&utm_source=twitter …",0,0,0,0
VintageBitch,@VintageBitchAZ,2022-06-17T17:33:56.000Z,Check out this listing I just added to my  #Poshmark  closet:  RELISTED  New Handmade Artisan Black  3D Printed  Dragon Claw Ring.  https:// 2860fded4f6b1a0cfa?utm_source=tw_sh&utm_content=ext_trk%3Dbranch%26feature%3Dsh_li_el_ios%26rfuid%3Dext1%3A87bb1f80-8203-4ef7-b98c-e681be1e5764 … #shopmycloset @poshmarkapp,0,0,0,0
News 4 Social - Talk About Latest Trend,@newsforsocial,2022-06-17T16:38:40.000Z,Creality Sermoon V1 Pro  3D printer  review – Simple enough for beginners like me! – The Gadgeteer  https:// reality-sermoon-v1-pro-3d-printer-review-simple-enough-for-beginners-like-me-the-gadgeteer/ …,0,0,0,0
Battelle,@Battelle,2022-06-17T18:31:01.000Z,". @ORNL  scientists develop ""easily adoptable"" method of upcycling plastic waste into  3D printing  filament -  3D Printing  Industry https://",0,0,0,0
3DPRobo,@3dprinterRobo,2022-06-17T19:42:03.000Z,"Velo3D launches Sapphire XC 1MZ, largest  3D printer  yet – technical specifications and pricing  http://",0,0,0,0
Metal AM,@MetalAMMag,2022-06-17T16:03:08.000Z,"United Performance Metals (UPM) has recently unveiled its new  Additive Manufacturing  solutions centre in Hamilton, Ohio. 

Read more:  http:// #additivemanufacturing #3Dprinting #newfacility",0,0,0,0
KE2YK_HAMRADIO,@ke2yk,2022-06-17T14:17:57.000Z,Xiegu X6100: N2HTT's  3D printed  frame and side rails  https:// x6100-n2htts-3d-printed-frame-and-side-rails/ …,0,0,0,0
somuchdepends,@somuchdependson,2022-06-17T20:16:40.000Z,a  3D printed  running shoes,0,0,0,0
bubbleistrouble,@bubbleistrouble,2022-06-17T18:10:44.000Z,"3D printed  trash can makes humongous, slimy bubbles",0,0,0,0
Wevolver,@WevolverApp,2022-06-17T13:36:25.000Z,"POV from the heatbed of a robotic arm  3D printing  “The Throne”. The Throne is a portable toilet  3D printed  using medical waste plastic from European hospitals

Video/image credits: Nagami, to_creativeactivists, Nachson Mimran, Manuel Jimenez Garcia #engineering #tech #3Dprinting",0,3,0,0
3D Innovations,@3D_Innovations,2022-06-17T20:05:00.000Z,Upcycling plastic waste into new  3D Printing  material. #3DInnovations #R &D  #Manufacturing #3DPrinting #3DDesign #ProductDevelopment #upcycling #3dprintingindustry,0,0,0,0
Roberto Toro r3rt0@mstdn.social r3rt0.bsky.social,@R3RT0,2022-06-17T17:55:18.000Z,hola! We'll arrive to Glasgow tomorrow with  @katjaQheuer ! We'll be most likely sitting in a coffee with good wifi near the OHBM meeting place. Come say hi! We still have little  3d printed  brainzzz! ,1,16,1,0
INNOVATIVE Digital Systems,@digital_ids,2022-06-17T14:00:25.000Z,"3D printers are valuable assets to UV printer owners. Why? Because it’s a great method to make jigs and fixtures. Reminder: Purchase a  #Mimaki  UJF printer before 6/28/22 and not only receive 24 months of coverage, but a free  3D printer  as well. Details:  https:// ter-price-promos/ …",0,0,0,0
avaxgfxcom,@avaxgfxcom,2022-06-17T20:06:07.000Z,Diluc - Genshin Impact –  3D Print https:// rintable-models/305908-diluc-genshin-impact-3d-print.html …,0,0,0,0
Extruder Joe,@ExtruderJoe,2022-06-17T16:09:16.000Z,3D Printing : AON3D 3D Prints Solid Kapton Parts  https:// prints-solid-kapton-parts …,0,0,0,0
Tuan TRANPHAM,@ttranpham,2022-06-17T20:27:22.000Z,Future tech could  3D print  objects inside your body •  https://  •  #3Dprinting  •  #additivemanufacturing  • ttranpham@azul3d.com  https://,0,0,0,0
avaxgfxcom,@avaxgfxcom,2022-06-17T16:24:04.000Z,"Biker Mice from Mars, Modo,Throttle,Vinnie –  3D Print https:// rintable-models/305854-biker-mice-from-mars-modothrottlevinnie-3d-print.html …",0,0,0,0
Bradley Jon Eaglefeather,@bjeaglefeather,2022-06-17T15:55:35.000Z,15 Cool Things to  3D Print : You know that we love to share STL files and ideas for you to print with your desktop  3D printer http://  |  @3Dnatives #3DPrinting #3Ddesign #STLfiles #3Dnatives,0,4,4,0
AskByGeeks,@askbygeeks,2022-06-17T19:25:16.000Z,You can  3D print  your own iPhone Continuity Camera mount right now  https://,0,0,0,0
arXiv CS-GR,@arxiv_csgr,2022-06-17T19:40:48.000Z,Predicting Geometric Errors and Failures in  Additive Manufacturing http://,0,0,0,0
Fabbing,@fabbing,2022-06-17T18:25:03.000Z,"Engineers create single-step, all-in-one  3D printing  method to make robotic materials  http://",0,0,0,0
3DPrint,@3DPrint_com,2022-06-17T13:19:33.000Z,Velo3D Announces Q3 Release for Its Largest Volume  3D Printer  Ever  http:// #3DPrinters #3DPrinting,0,0,6,0
Kim Neal,@neal633,2022-06-17T19:43:31.000Z,The excitement over their  3D printed  boats is contagious ,0,0,0,0
BicycleTravelBlogger,@BTBloggers,2022-06-17T16:01:07.000Z,"Friday Debrief:  3D Printed  Chainrings, Randi Jo Caps, and Hammock Levels -  https:// y=53910 …",0,0,0,0
Zyite,@ZyiteGadgets,2022-06-17T16:01:34.000Z,"Engineers create single-step, all-in-one  3D printing  method to make robotic materials  http://",0,0,0,0
Snek,@HiIamSnek,2022-06-17T14:52:19.000Z,"Soon, I’ll have some extra money thanks to my promotion. With it, I’ll buy a  3D printer & get back into a hobby of  #cosplay . I have ideas on what to make but would love tips

Here are what I want to eventually do (Shredder being a fem-version & Mothra a human version though lol)",1,1,0,0
8BitofFun-On Vacation,@8BitoffunX,2022-06-17T17:21:35.000Z,YOUR KING IN GAMING IS LIVE!! COME BY SAY HI...JOIN THE MADNESS  #Twitch #POC #Streamer,0,15,4,0
Rumpus Brush,@Philb81359863,2022-06-17T13:20:34.000Z,"Day 83-4
Kept messing with  3d printer , finally got last night's print to stick. I haven't checked it out yet but regardless of what it looks like, it's progress. 
Also primed models and built diorama wall. It's simple, but it's something  #hobbystreak",0,6,0,0
ASOTU | More Than Cars,@asotu_,2022-06-17T14:11:23.000Z,The Celestiq “features over 100  3D printed  parts.” Sounds like Fixed Ops departments could eventually manufacture replacement parts on-site. https:// ests-big-in-cadillac-celestiq … #Cadillac #automotiveindustry #automotive #auto,0,0,0,0
avaxgfxcom,@avaxgfxcom,2022-06-17T20:48:07.000Z,Paimon statue - Genshin Impact –  3D Print https:// rintable-models/305961-paimon-statue-genshin-impact-3d-print.html …,0,0,0,0
Linnea Pergola Paintings,@LinneaPergola,2022-06-17T20:00:37.000Z,This is a  3D print  of Saint Mark’s Place in NYC. Located in the East Village and one of the most notable streets.     #3Dprint #3d #NYC #travel #Stmarksplace #NewYorkCity #cityscape   To see this  3D print  by@LinneaPergola https://,0,0,0,0
Jason Wulf,@artofjasonwulf,2022-06-17T20:04:34.000Z,"It’s time yet again to take the hobby back and come up with the next thing. We drew ourselves as hasbros, we created them, now we are all  3D printing  them and nobody has an original idea anymore so it’s time for something new and exciting. July. I’m back. We’re gonna have fun.",0,18,3,0
MDPI,@MDPIOpenAccess,2022-06-17T18:30:03.000Z,"Special Issue includes numerical studies for research in concrete, including topics such as finite element analysis, digital concrete, the reinforcement technique without rebars, and  3D printing .

Guest edited by Dr. Vipul Patel.

Access the reprint book:  https://",0,0,0,0
"AVS 3D Printing, Laser Cutting & Engraving",@AVS3DPrint,2022-06-17T21:00:01.000Z,Newly added to our Ko-Fi shop. This set will allow you to construct a sci-fi Control Tower for your game table.  #ttrrpg #ttrpgfamily #scifiterrain #starfinder,0,0,0,0
avaxgfxcom,@avaxgfxcom,2022-06-17T19:54:07.000Z,Shikibe –  3D Print https:// rintable-models/305905-shikibe-3d-print.html …,0,0,0,0
The 3D Print General,@3DPrintGeneral,2022-06-17T16:40:40.000Z,Is a red dot or green dot better?  Just personal preference?,51,56,2,0
EIN Presswire: Press Releases,@EINPresswirePR,2022-06-17T19:50:22.000Z,M2 Optics Launches a New  3D Printing  Design and Manufacturing Service  http://,0,0,0,0
avaxgfxcom,@avaxgfxcom,2022-06-17T21:01:19.000Z,Beidou V2 –  3D Print https:// rintable-models/305959-beidou-v2-3d-print.html …,0,0,0,0
"Science Feeds, (msk)",@bimahesh,2022-06-17T16:37:04.000Z,"Engineers create single-step, all-in-one  3D printing  method to make robotic materials  http://",0,0,0,0
Data Professionals Network | DPN,@datapronetwork,2022-06-17T16:01:32.000Z,"Engineers create single-step, all-in-one  3D printing  method to make robotic materials  https://",0,0,0,0
Skolkovo Foundation,@sk_en,2022-06-17T13:55:52.000Z,Skolkovo resident  @stereo_tech1  will equip training centres in Kaluga with 5D printers  Polymer printing specialists will be trained there. The entirely Russian invention prints parts that are three times stronger than those made on a  3D printer .,0,0,0,0
M,@Mill4h212,2022-06-17T14:59:44.000Z,When I get a  3D printer  it’s over for everyone,0,0,0,0
RockGnome,@rockgn0me,2022-06-17T18:50:07.000Z,"I'm in crisis mode.. fantasy is leaving me. I haven't felt a proper bite since baldurs gate 3. I've pottered with minis and terrain since but I need something to enthuse me. 2 years ago I felt a lift when I discovered games in the loft and  3d printing , but that's lost its lustre",0,0,0,0
Noel Skum,@skum_noel,2022-06-17T19:13:19.000Z,Idea for an invention: a  3D-printed  mirror that hunts warts. If you don't like it you're a dunce.,0,0,0,0
Theresa Welch,@teachertheresa,2022-06-17T20:33:28.000Z,Be sure to check out this amazing  3d printing  guide!!!! Click below to learn more!,1,1,0,0
Ki4Life,@TheRealKi4Life,2022-06-17T19:36:03.000Z,"I don’t have a  3D printer  but check out this beautiful 3D printable Orchid model

Orchid is Bae   
Go team Firecat  #BringBackKi #WhensKi4",0,13,1,0
𝘎𝘭𝘦𝘯𝘯 𝘙. 𝘍𝘳𝘢𝘯𝘬,@Glenn_R_Frank,2022-06-17T18:10:21.000Z,This was a fun (and LONG) project. I downloaded this set of chess pieces and printed them on my  3d printer .  #3dprinting,1,6,0,0
MOSO3D,@Moso3D,2022-06-17T15:17:34.000Z,A New Tool changer  3D printer  from Moso 3D  https://  via  @YouTube,0,2,2,0
Moran-Mirabal Group,@Moran_MirabalRG,2022-06-17T17:42:22.000Z,"Very proud of Mabel’s accomplishment of winning Best Student Oral Presenter Award in the Soft Materials for  3D Printing , Robotics, and Bioelectronics symposium! Proud supervisor!  #CCCE2022 #CSC2022  @macchemdept  @MacSciResearch",2,46,5,0
SME Media,@SMEMediaNews,2022-06-17T15:05:00.000Z,Why sustainability is the key to  additive manufacturing https:// #mfg,0,0,0,0
Ocado Technology,@OcadoTechnology,2022-06-17T13:11:42.000Z,"#MLOpsWorld2022  crowds meet Dexter – a highly dexterous (see what we did there?) lightweight, low-cost,  3D-printed  robotic arm pouring water from one cup to another with human levels of precision.",0,4,2,0
Tannis Davidson,@tannis_davidson,2022-06-17T14:12:30.000Z,Goldie  #thylacine . WIP model for  3D print . Now obsessed with the idea of casting it in actual gold.,2,19,2,0
MakerGirl,@_MakerGirl,2022-06-17T20:01:05.000Z,After 3 long years we're packing up our 3D printers and driving cross-country to bring  3D printing  to 600+ students across the US! This trip plays a huge role in our mission to provide  #STEM  education to girls in underserved communities! http:// #Fundraising,0,6,3,0
avaxgfxcom,@avaxgfxcom,2022-06-17T20:00:19.000Z,Yelan –  3D Print https:// rintable-models/305906-yelan-3d-print.html …,0,0,0,0
Wowbabytoys - E-news,@Wowbabytoys,2022-06-17T18:47:23.000Z,Julia Fox Wears a  3D-Printed  Top & Drawn-On Eyebrows for Tribeca Film Festival Event  https:// -wears-a-3d-printed-top-drawn-on-eyebrows-for-tribeca-film-festival-event/ …,0,0,0,0
bubbleistrouble,@bubbleistrouble,2022-06-17T19:40:47.000Z,"3D printed  cap makes humongous, reflective bubbles",0,0,0,0
kashinov,@TmKashinov,2022-06-17T13:13:01.000Z,"撮影テスト。
USBカメラ乗せても、動いた！
力が足らんかとも思ったけど。 #3D  scanner #3D  printer",0,0,0,0
E V benjamin,@EVbenjaminIV,2022-06-17T15:12:21.000Z,Alquist Says It Will  3D Print  200 Houses in a Small Virginia Town  https:// -3d-printed-houses-are-going-up-in-virginia/ …,0,0,0,0
Frederik Landgraf,@aussenluft,2022-06-17T16:30:46.000Z,FGC-9  3D-printed  firearm seized in Western Australia  https:// ed-firearm-seized-in-western-australia/?utm_source=rss&utm_medium=rss&utm_campaign=fgc-9-3d-printed-firearm-seized-in-western-australia …,0,0,0,0
PressRelease.cc,@PressRelease_cc,2022-06-17T17:18:24.000Z,"Biohong Group Launches the World’s First Stem Cell-based  3D Printing  Artificial Meat, Creating a New Height for Both Stem Cell Engineering Meat and Plant-based Artificial Meat  https:// hong-group-launches-the-worlds-first-stem-cell-based-3d-printing-artificial-meat-creating-a-new-height-for-both-stem-cell-engineering-meat-and-plant-based-artificial-meat/ …",0,0,0,0
Neil Bodilly,@NeilBodilly,2022-06-17T17:33:33.000Z,Equinor Signs Deal With  3D Printing  Start-Up | Rigzone  http://,0,0,0,0
charlotte,@julesohqra,2022-06-17T15:33:22.000Z,why was my first thought ‘meredith grey and her  3d printer  are needed',0,0,0,0
You-Tarin,@you_tarin,2022-06-17T12:54:22.000Z,"おもしろそう。
Custom NanoLeaf Lights! DIY, Wireless, Modular, Arduino,  3D Printed !  https:// f-Lights-DIY-Wireless-Modular-Arduin/ …",0,2,1,0
Cloud 3D Print,@Cloud_3D_Print,2022-06-17T18:00:00.000Z,"We just did a  3D Printing  demo and tutorial at  @StonehavenES ! Its great to show the next generation the bright future of  3d printing .  If you want us to do a demo at your school, please contact us for a presentation via email or phone!  @YRDSB #3dprinting #education",0,0,0,0
Jim Decker,@jimdecker,2022-06-17T16:05:56.000Z,3D printing  Sequoia style!  #LISST #3D #AdditiveManufacturing,0,0,0,0
Mech Solutions Ltd,@mech_solutions,2022-06-17T17:00:02.000Z,"We just did a  3D Printing  demo and tutorial at  @StonehavenES ! Its great to show the next generation the bright future of  3d printing .  If you want us to do a demo at your school, please contact us for a presentation via email or phone!  @YRDSB #3dprinting #education",0,4,0,0
Tim Rohde,@timrohde,2022-06-17T16:50:48.000Z,"More  #ai : Engineers create single-step, all-in-one  3D printing  method to make robotic materials  https://",0,0,0,0
Farm Design,@FarmPD,2022-06-17T19:32:59.000Z,#3DPrinting :  3D-printed  self-sensing materials - Advanced Science News  https://  by  @vbcorless,0,0,0,0
avaxgfxcom,@avaxgfxcom,2022-06-17T18:30:26.000Z,Illyana Rasputin  3D Print https:// rintable-models/305876-illyana-rasputin-3d-print.html …,0,0,0,0
Mighty Jabba,@mightyjabba,2022-06-17T16:38:45.000Z,I used the Saturn 2 resin  3D printer  from  @Elegoo_Official  to print this amazing statue of Sauron from the Lord of the Rings! Check out my first look review here:  https:// #3dprinting #elegoosaturn2 #lotr,0,5,0,0
Héctor Corte-León,@HCorteLeo,2022-06-17T12:20:18.000Z,"Héctor here, your AFM expert at Nanosurf.
For anybody interested in AFM, SPM, etc, I uploaded to Thingyverse some 3D AFM models in STL format for  3D printing . Feel free to use them for training and explaning how AFM works in your l… https://",0,0,0,0
TyRex Group,@tyrexfamily,2022-06-17T20:25:10.000Z,This month has been about finding entrepreneurship at every position for the TyRex Family with new  3D printing  business programs and opportunities. Special thanks to all our TyRex Family members for their dedication and hard work.,0,0,0,0
Unicun,@UnicunShop,2022-06-17T19:35:17.000Z,3D Printer  Pen https:// nter-pen/ … #UnicunShop,0,0,0,0
Ferlain,@ferlain,2022-06-17T15:37:26.000Z,"We're living in the times of innovations, space exploration,  3D printing , CGI, renewable energy, cancer treatment, online education, equal rights, etc (the tweet won't have enough characters to list all)
And yet Russia barbarically kills Ukrainians daily for the imperial beliefs",0,21,11,0
Tuan TRANPHAM,@ttranpham,2022-06-17T20:38:08.000Z,The answer to the Parthenon marbles dispute: George Osborne and a  3D printer !? •  https://  •  #3Dprinting  •  #additivemanufacturing  • ttranpham@azul3d.com  https://,0,0,0,0
Latin America Network at McMaster University LANMU,@McMasterLAN,2022-06-17T20:39:36.000Z,Felicitaciones Mabel!  Best Student Oral Presenter Award in Soft Materials for  3D Printing !!!,0,7,0,0
3D Printing World,@dddpworld,2022-06-17T16:45:59.000Z,We have “Deaths Edge” assembled and TJ is sanding it now! We have two 3/8” rods going all the thru it so hopefully it will be strong enough.,2,16,0,0
"AVS 3D Printing, Laser Cutting & Engraving",@AVS3DPrint,2022-06-17T19:54:23.000Z,I am working on adding more content to our Ko-Fi not only terms of items in the shop but also  #ttrpg  content.  I have started with an adventure prompt that I will post on the Ko-Fi everyday at 2pm EST. Feel free to suggest additional content you would like to see.  #ttrpgfamily,0,0,0,0
Tomoyo Kisho Streaming Hiatus VTuber,@TomoyoKisho,2022-06-17T19:34:31.000Z,"Thank you for 250 followers! As your reward, here’s my irl abs! Getting a good ab pic is hard lol. Lighting is key.

Next reward at 500 followers is a  3D printed  chibi figure raffle! #vtuber #ENVtuber #VTuberUprising #vtubervsirl",7,13,0,0
CREALITY 3D Printer,@Creality3dP,2022-06-17T13:28:00.000Z,"Can any of you find us in the latest Korean Drama, Cleaning Up? It is the first time that our CR-10 Smart Pro appears on Korea TV! Please share to us if you found it, we would be excited to see! #cr10_smart_pro :  https://",0,3,0,0
Kelvin Fu,@KunFu83233349,2022-06-17T16:07:04.000Z,I will be leading this $3M DOE AMO project to continue our excellence of composite  additive manufacturing  for vehicles!  https:// wards-579-million-reduce-industrial-emissions-and-manufacture-clean-energy …,1,11,0,0
JZKitty Gaming,@JZKitty,2022-06-17T17:00:15.000Z,"Game of Thrones’ Jon Snow set to get his own series https:// Don't forget to visit, like and share for the best  #GamingNews  and  #TechnologyNews !",0,0,0,0
@neil3dprints,@NHengist,2022-06-17T19:26:18.000Z,"So I figured I'd share my  #myprusastory  with you all.  But bear with me, its a long one.
I've been  3d printing  and designing since 2016.
And over the years I've had experience with Flashforge, Makerbot, Creality, Geetech, Cube, Anycubic, 3D systems as well as many other brands.",3,30,3,0
PLASTIX WORKSHOP,@PlastixWorkshop,2022-06-17T12:21:16.000Z,"MPU5 set
Full size  3D Printed  replica #PlastixWorkshop #3dprinting #3Dプリンター #Solidworks #MPU5 #MadeInHongKong #香港製造",0,5,2,0
Bladimir Rondon,@pigbar,2022-06-17T18:33:42.000Z,Engineers Create Single-Step  3D Printing  Method to Make Robotic Materials  https://  by  @theofficialacm,0,0,0,0
Not A Games Dev Ollie,@Reksaurian,2022-06-17T14:09:26.000Z,https:// @Charalanahzard,0,0,0,0
Zulah,@lil_dripp1,2022-06-17T15:28:38.000Z,Finna start  3D printing  blickies with switches,0,0,0,0
Vulne Pro studio,@VulnePro,2022-06-17T14:09:03.000Z,The always cool Miyazaki-esque  3D printed  armor minis from  @TimPopelier  Great little designs with that nostalgic old school Ghibli vibe. Go check 'em out!,0,5,0,0
しおん@フィリピン・マニラ大実業家,@sion_japan,2022-06-17T12:24:14.000Z,"[ 3D printer  house]

3Dプリンターハウスは

・工期短縮
・費用削減
・労働力が10倍減る
・部材ロスが99%削減
・CADにデザインを入力するだけなのでデザイナーハウスのレプリカが創れる

本日学んだこと。",0,0,0,0
bubbleistrouble,@bubbleistrouble,2022-06-17T21:00:49.000Z,"3D printed  cap makes gargantuan, transparent bubbles",0,0,0,0
UK/EU editorial jobs,@journalism_jobs,2022-06-17T14:41:04.000Z,"ICYMI: Technology reporter,  3D Printing  Industry. Salary: DoE. Journalist with at least two years' experience sought for leading print and online publication specialising in the  3D printing  sector  https:// #journalismjobs #journalismjobs",0,0,4,0
All Bags-Mart,@allbagsmart,2022-06-17T13:49:42.000Z,#leather #handbags  Mini  3D Printed  Backpack for Girls  https:// d-printed-backpack-for-girls/ …,0,0,0,0
Leslie Langnau,@DW_3DPrinting,2022-06-17T15:42:00.000Z,Formlabs launches a Dental Academy to advance dental  3D printing .  https:// hes-a-dental-academy-to-advance-dental-3d-printing/ … #3dprinting #AdditiveManufacturing @DesignWorld @formlabs,0,0,0,0
3D Printing Deals,@3dpdeals,2022-06-17T16:39:52.000Z,"$279.65 Sovol SV01 PRO

280x240x300mm build volume
Direct Drive
32-bit TMC2208 board
CR-Touch
Dual Z

Lightning Deal expires Friday June 17th, 2022 10:45pm EDT

afflink: ",0,0,0,0
"AVS 3D Printing, Laser Cutting & Engraving",@AVS3DPrint,2022-06-17T19:00:00.000Z,"To celebrate our new shop & to thank our supporters we are offering 20% off anything in our Ko-fi shop until 6-30-22. 

Just use the code TTRPGFAMILY2022 when you check out. I am adding new items daily.  #ttrpg #ttrpgfamily #dnd #pathfinder",0,0,0,0
"The hymen is a thin, fleshy tissue that's located",@CumHymen,2022-06-17T18:37:54.000Z,how can you  3d print  metal,0,0,0,0
"Libertarian, Homesteading, 3D Printing",@Liberty3DPrints,2022-06-17T13:13:17.000Z,The left wants to sexualize your children so they can groom them into their confused little puppets and use them for whatever they want. It's a pedophile cult and if you haven't realized that then your kids are probably already damaged. Trust me next is legalizing pedophiles.,0,0,0,0
