Author Name,Author ID,Date,Post Text,Replies,Likes,Reshares,Views
Technology,@Technol53581657,2019-02-21T23:16:47.000Z,"Relive The Dot Matrix Glory Days With Your  3D Printer With the cost of 3D printers dropping rapidly, we’ve started to see a trend of hackers re-purposing them for various tasks. It makes perfect sense; with the hotend and extruder turned off (or removed entirely), you’ve go…",0,0,0,0
€nD€R•Ov€RSou£,@EnderOversoul,2019-02-22T04:35:22.000Z,"Scientists  3D print  biohybrid animal with rat heart cells, gold and rubber  https:// ate-first-successful-biohybrid-artificial-animal/ …",0,0,0,0
m,@margo4240,2019-02-22T03:40:57.000Z,tomorrow i get to  3d print  a design i’ve been working on for the past two days and i’m so excited i love college,0,4,0,0
Iter Consulting,@iter_consulting,2019-02-22T07:16:01.000Z,One more product of  3D printing :  #supplychain  disruption via  @SupplyChainDive https://,0,0,0,0
3Ders.org 3D Printing News,@3dersorg,2019-02-22T08:20:29.000Z,Philippine Department of Science and Technology opens Advanced Manufacturing Center http:// 222-philippine-department-of-science-and-technology-opens-advanced-manufacturing-center.html … #3dprinting,0,3,2,0
Curso 3D Printing,@Curso3DPrinting,2019-02-22T09:37:06.000Z,VELO3D enhances Flow software for metal  3D printing https://,0,0,0,0
KazuCrash,@KazuCrash_,2019-02-22T00:25:26.000Z,"I'm just venting here, but it's making my head spin that exporting a .xps file to an .obj file is resulting in the first picture in Blender for reasons that are beyond me, and opening the .obj in 3D Viewer is the same, but opening it in  3D Printer  gives a more accurate result???",1,0,0,0
IoT Expert,@iotexpertit,2019-02-21T22:55:18.000Z,Relive The Dot Matrix Glory Days With Your  3D Printer http:// ive-the-dot-matrix-glory-days-with-your-3d-printer/ …,0,0,0,0
Gary Weston,@GaryWeston11,2019-02-22T10:23:10.000Z,Latin America Just Got Its First Stratasys J750  3D Printer  -  http:// https://,0,0,0,0
BECT Computers & 3D Printing,@bectcomputing,2019-02-22T08:26:07.000Z,SpaceX's Falcon 9 Rocket Returns Safely After Historic Flight  https:// -9-rocket-returns-safely-after-historic-flight …,0,0,0,0
3DHEALS,@3dheals,2019-02-22T00:17:49.000Z,3D printing  could give you a better pill to swallow  @PositiveNewsUK ⠀ @AlderHey #3dprinting #pills #healthcare #Liverpool #medication #FDA #technology #children #JoinTheTribe https:// https://,0,0,0,0
Dinsmore Inc.,@dinsmoreinc,2019-02-22T03:48:52.000Z,We’re here educating the Medical community on  3D Printing  &  Additive Manufacturing  for  @ExchangeMedical  MedTech Mega Mixer.  #3Dprinting #AdditiveManufacturing #irvine,0,0,0,0
BOBBL3D_PH,@bobbl3d,2019-02-22T05:42:52.000Z,"As we live, we make different memories. There are times that we forget some of it. This is why  3D printed  bobbleheads are here to make every event in your life count. 

Don't forget to LIKE/LOVE and SHARE the video!...  https:// os/310147822975933/ …",0,0,0,0
#VideoGames,@VideoGamesFeeds,2019-02-22T03:10:22.000Z,ad:  3D Printer  K5 Plus Fully Enclosed Design with WiFi Touch Screen Smart Leveling with Printable 3D Models High Precision Printing Large Built Volume 7.9''×7.9''×11.8'' -  https://,0,0,0,0
Valley Christian,@VCSAuburn,2019-02-21T22:45:04.000Z,"Auction Item- Class project for 3rd Grade

Because of the generous support of people like you, the VCS annual auction has provided such items as IPads, Chromebooks, a  3D printer , robots, the science...  https:// nSchoolAuburn/posts/2183652211701310 …",0,0,0,0
Daily Deals,@DailyDealFeeds,2019-02-21T22:45:02.000Z,"Dremel Digilab 3D20  3D Printer , Idea Builder for Brand New Hobbyists and Tinkerers  https:// -Printer-Hobbyists-Tinkerers/dp/B00NA00MWS?SubscriptionId=AKIAINK752IUT74DHSYQ&tag=industrial__supply-20&linkCode=xm2&camp=2025&creative=165953&creativeASIN=B00NA00MWS&utm_source=dlvr.it&utm_medium=twitter …",0,0,0,0
Techzine NL-BE,@Techzinenlbe,2019-02-22T09:29:34.000Z,Ultimaker Cloud moet professionele  3D-print  workflow ondersteunen vanuit de cloud  https:// ultimaker-cloud-moet-professionele-3d-print-workflow-ondersteunen-vanuit-de-cloud.html?utm_source=dlvr.it&utm_medium=twitter … #CloudData #3Dprinten #Ultimaker #UltimakerCloud @techzine,0,0,0,0
PressRelease.cc,@PressRelease_cc,2019-02-22T03:45:32.000Z,3D Printing  Dental Device Market: Global Industry Analysis and Opportunity and Forecast 2019 To 2024  https:// printing-dental-device-market-global-industry-analysis-and-opportunity-and-forecast-2019-to-2024-3/ …,0,0,0,0
WDTNN,@WDTNN2,2019-02-22T05:00:05.000Z,PrintLab aims to close  3D printing  skills gap with new license offering -  3D Printing  Industry - PrintLab aims to close  3D printing  skills gap with new license offering  3D Printing  IndustryUK-based  3D printing  curriculum developer PrintLab has launched...  http://,0,0,0,0
Hackster.io,@Hacksterio,2019-02-21T22:54:42.000Z,3D printer  becomes 2D dot matrix printer using web app:  http://,0,4,2,0
Fabricación 4.0,@Fabricacion40,2019-02-22T10:22:26.000Z,"3dprintindustry ""Farsoon Technologies debuts high-speed  3D printing  Flight Technology, partners with Arkema and Autodesk -  http://  -  #3dprinting #OpenForIndustry  FarsoonAmericas  """,0,0,0,0
Kate Fox,@Engineeringkate,2019-02-22T07:08:11.000Z,"If you are looking for something to watch instead of AFLX, find out more about how  3D printing  is changing medical outcomes from the  @Science_Academy  series. Eliza is amazing  @WomenSciAUST  @ResearchRMIT @ARC_ABM @3dmedLab #SuperstarsofSTEM #Wi3DP https:// PDSuQ&feature=youtu.be …",0,9,6,0
Blitz,@Darkspiral_94,2019-02-22T08:06:04.000Z,3D Printer  Table – 5 Most Reliable & Affordable Workbenches - All 3DP  https://,0,0,0,0
Blitz,@Darkspiral_94,2019-02-22T08:06:00.000Z,"The IDTechEx Show! presents  3D Printing  2019 in Berlin, 10-11 April -  http:// https://",0,0,0,0
Dynamism,@dynamism,2019-02-21T22:40:08.000Z,"Learn about advanced and affordable  3D printing #engineering  materials to achieve high levels of tolerance, accuracy and precision: watch this free  #webinar  from  @formlabs http:// #3Dprinting",0,0,0,0
OthielOPS,@OthielStrategic,2019-02-22T10:20:19.000Z,"Essentium, eSUN and Polymaker join Ultimaker's  3D printing  materials alliance  https://",0,0,0,0
Kawan IM3 Pku,@Kawanim3pku,2019-02-22T08:10:13.000Z,"Para pakar meramalkan bahwa di tahun 2020, dunia akan memasuki era Industri 4.0. Di era tersebut, akan banyak bermunculan robot canggih, superkomputer, kendaraan otonom,  3D printing , serta pengoptimasian fungsi otak manusia dengan editing genetik dan perkembangan neuroteknologi.",0,4,0,0
Mikaela skateboarder,@mikaelamarie17,2019-02-22T02:29:17.000Z,Unisex Mens/Womens Halloween Skeleton  3D Print  Hoodie Sweatshirt Pullover Jumper  https://  via  @eBay_UK,0,0,0,0
株式会社3D Printing Corporation,@3DPrintingCorp,2019-02-22T10:01:20.000Z,自然災害への被害の対処にも3Dプリントが利用されています https:// response-and-3d-printing …,0,0,0,0
Nano Dimension,@NanoDimensionX,2019-02-22T01:00:03.000Z,"Hello Shanghai! See you  at  #TCTAsia  from February 21-23 at  Ruite booth W4-D92 to hear more on the DragonFly Pro System, the only professional  #Additive #Manufacturing #System http:// #3dprinting #additivemanufacturing",0,2,2,0
Solzhenixon,@sardonic_greek,2019-02-22T07:52:53.000Z,anarcho-capitalist acceleratory  3D printer  distributism,1,0,0,0
Rello Rackz,@_RelloRackz,2019-02-22T02:58:56.000Z,$4000  3D-Printed  House Could Provide Shelter To The World's Homeless  https:// d-printed-house-could-provide-shelter-to-the-worlds-homeless.html …,0,0,0,0
Wolfpack Library,@WestHillsLIB,2019-02-21T23:33:48.000Z,"It was a treat to see visitors from  @OtterCares  & update them on the Maker Hub, including a keychain just  3D printed  this morning and our Connect Four revived with pieces printed to replace lost ones. We appreciate the daily impact of their generosity!  #whhspack #whhsmakers",0,4,1,0
Media Resources,@mediaresources,2019-02-21T22:16:35.000Z,"IT'S OUT OF THE BAG!  Last fall we  3D printed  & 3D CNC carved, a 23' tall Paul Bunyan for a movie company.  Sworn to secrecy we couldn't say much about the project.  Fortunately for us, other companies were not sworn the same and photos of it...",0,2,0,0
Animevilla,@animevillaa,2019-02-21T23:49:41.000Z,Like and Share if you want this  Naruto Cosplay Beach Shorts  3D Print  Short P ...  https:// -beach-shorts-3d-print-short-pants/ …,0,0,0,0
Haggard & Stocking,@HaggardStocking,2019-02-21T22:06:24.000Z,Ramping up Your  Additive Manufacturing  Game  https://,0,0,0,0
Ajinkya Huddar,@ajinkya0704,2019-02-22T03:56:37.000Z,"This is the  #first_ever #Roller #coaster  model  #printed  on  #3D #printer  displayed during  #Solidworks #world_2019  at  #Dallas ,  #United #states ,TX #Pelfinfotech #Solidworks #VAR #India https://",0,2,0,0
Zeal 3D,@Zeal3d,2019-02-22T10:12:04.000Z,"Do you know you can also  3D print  musical instrument? 
Read more -  https:// #3dprinting #3d #3dprint #technology #innovation #music #musicalinstruments #Zeal3D",4,12,6,0
VoxelMatters,@VoxelMatters,2019-02-22T09:55:46.000Z,". @3d_printers  new J720  3D printer  has over 500,000 colour combinations and capable of multi-material printing  https:// #3dprinting #additivemanufacturing #colour #dental #technology",0,0,0,0
SuperSuperLucky,@SuperSuperLucky,2019-02-21T23:54:42.000Z,The erecoin platform is a symbiosis of  Additive Manufacturing  and Blockchain. Their mission is to make the increasingly complex world safer.  #Erecoin #3DPrinting https://,0,0,0,0
Ray Hammond,@hammondfuturist,2019-02-21T22:36:00.000Z,"Using synthetic collagen made from the tobacco plant, researchers can  3D-print  lung architecture on which stem cells can grown new lungs for human transplant.  #futurist https:// https://",0,0,0,0
Jonathan,@JMLarod,2019-02-22T10:02:20.000Z,"New Stratasys J720 Dental  3D printer  makes full color, multi-material parts in a single run  https://",0,0,0,0
Summer,@Summer21175493,2019-02-22T03:25:08.000Z,"We are searching for distributor / reseller for our Artillery Sidewinder X1
It's a all-in-one cartesian  3D printer  with ultra quiet stepper drivers, direct drive extruder, dual Z axis, AC heated bed, TFT touch screen.
We are Artillery 3D Technology Co., Ltd. in Shenzhen, China.",3,2,0,0
Charles Russo,@Charles_M_Russo,2019-02-22T02:36:22.000Z,"Metal Material Based  3D Printing  Market Size 2024 - Global Industry Sales, Revenue, Price trends and more  http:// -based-3d-printing-market …",0,0,0,0
NEU3D Laboratories,@neu3dlaboratory,2019-02-22T09:56:12.000Z,"3D printing  process.  @NearEastUniv  
3B baskı süreci.  @YakinDoguUni #3d #bioprinter #engineering #tech #technology #bioprinting #hitech #stem #3dprinter #3dprint #3dprinted #3dstuff #3dmakers #themakersmovement #medicine #medical #neareastuniversity #3bbaski #3boyutluyazici #ydü",0,5,2,0
EntreArchitect,@EntreArchitect,2019-02-22T05:02:15.000Z,Columbia University Creates  3D-Printed  Timber Lookalike with Internal Grain Pattern  http://,1,0,0,0
Geoff Wimble,@GeoffWimble1,2019-02-22T08:06:42.000Z,Launcher & AMCM Develop Largest Known  3D Printed  DMLS Rocket Engine Part  https:// r-amcm-develop-largest-known-3d-printed-dmls-rocket-part/ …,0,0,0,0
Penguin Suits,@PenguinSuitsInc,2019-02-21T23:06:10.000Z,The Oscars and Penguin Suits' Annual Oscar Challenge are right around the corner! We've enjoyed  3D-Printing  our Oscar Challenge Award and look forward to handing it out to this year's winner. Have you submitted...  https:// ideos/635188206946122/ …,0,2,0,0
Mrs Palmer,@_MrsCPalmer,2019-02-21T22:57:23.000Z,"Yet another group of young adults using  3D printing  and technology in real-life, authentic contexts. Inspiring young people innovating and creating. @Miss_EJD1  @EUErasmusPlus #DigitalCompetence",0,2,0,0
Colin Lathrop,@LathropDental,2019-02-22T00:35:48.000Z,"In our never ending goal of the highest technology dental practice in the area, we are upgrading our current  3D printing  technology. We currently have 2...  https:// printer/?fbclid=IwAR2CZnA0_p-rlxjsMQNwT-rEIpXS773yoIwCw8PPTlzSsIm-PaASwtMd2ZE#Video …",0,0,0,0
Blitz,@Darkspiral_94,2019-02-22T08:06:15.000Z,3D printing  across Army enhancing logistics - United States Army  https://,0,0,0,0
Gary Weston,@GaryWeston11,2019-02-22T08:04:00.000Z,New SmarTech Report Forecasts  3D Printing  in Eyewear to Generate $3.4 Billion by 2028 - GlobeNewswire  https://,0,0,0,0
Jasmine Escalante,@escalantejq,2019-02-21T22:33:02.000Z,⁦ @SparkTAMU ⁩ I NEED the  3D printer  so I can make this for my room!  #STEM4innovation,1,7,0,0
vishal jadhav,@vrajjadhav1232,2019-02-22T05:46:57.000Z,Global Mini  3D Printer  Market Outlook 2019-2024  https:// bal-mini-3d-printer-market-outlook-2019-2024/ …,0,0,0,0
Fabbing,@fabbing,2019-02-22T09:51:33.000Z,VELO3D enhances Flow software for metal  3D printing http://,0,0,0,0
Valley Christian,@VCSAuburn,2019-02-22T00:10:04.000Z,"Auction Item- Class project for 5th & 6th Grades

Because of the generous support of people like you, the VCS annual auction has provided such items as IPads, Chromebooks, a  3D printer , robots, the...  https:// nSchoolAuburn/posts/2189602814439583 …",0,0,0,0
Not A Games Dev Ollie,@Reksaurian,2019-02-21T22:14:00.000Z,"It’s not red tape, it’s protection from greed  https://",0,0,0,0
nerdlynews,@itsnerdnews,2019-02-21T22:15:27.000Z,Relive The Dot Matrix Glory Days With Your  3D Printer https:// -matrix-glory-days-with-your-3d-printer/ …,0,0,0,0
Amanda Scott,@ThatAmandaScott,2019-02-22T10:02:08.000Z,"It’s amazing what we can now do in construction. 

If you love technology then it’s time to think differently about construction. We need today’s youth to future proof us  World’s longest  3D-printed  concrete bridge opens in Shanghai | Construction Buzz  http:// ion-buzz/3099-world-s-longest-3d-printed-concrete-bridge-opens-in-shanghai-construction-buzz-205?utm_medium=email&utm_term=&utm_content=Read%20more&utm_source=UK%20Construction%20Week&utm_campaign=World%E2%80%99s%20longest%203D%20printed%20bridge%20%7C%20Construction%20Buzz%20%23205 …",0,2,2,0
Bikerumor,@bikerumor,2019-02-22T02:01:00.000Z,Layer a carbon cake on your steerer with these  3D printed  treats from Strata Cake https:// ata-cake-goes-custom-with-3d-printed-carboncake-headset-spacers …,0,0,0,0
Matteo Boldrin,@ZMatteoBoldrin,2019-02-22T08:25:04.000Z,A new  3D-printed  rubber material holds the potential to repair itself.  http://,0,0,0,0
Steve Gough - Little River Research,@gravelbar,2019-02-21T23:28:44.000Z,Testing new  3D printed  propeller for our Emflume.   #FlumeFriday,0,3,3,0
Additive Manufacturing Media,@AddMfgMedia,2019-02-21T22:30:25.000Z,Solvay adds PEEK  #additivemanufacturing  filaments to product offering on e-Xstream’s Digimat-AM platform. https:// rtners-for-simulation-of-high-performance-polymers …,0,0,0,0
Dr. Olaf K. Krueger,@drokkrueger,2019-02-21T22:28:33.000Z,#RT @Seeker : This  3D-printed  home was built in less than a day.,0,0,0,0
iotosphere,@iotosphere,2019-02-21T22:02:06.000Z,"Sit Back, Relax, and Let This  3D-Printed  Robot Mow Your Lawn  https:// -back-relax-and-let-this-3d-printed-robot-mow-your-lawn/ …",0,0,0,0
3DPrinting World,@3DPrinting_W,2019-02-22T07:33:26.000Z,"Top story: TCT Asia: Ultimaker Introduces Cloud-Based Platform and New  3D Printing  Material Alliance Program Partners |  http://  | The Voice of  3D Printing  /  Additive Manufacturing https:// a-ultimaker-cloud-platform-material-alliance-partners/ … , see more  http:// =tnp …",0,0,0,0
Heidi Neltner,@heidinelt,2019-02-21T23:05:22.000Z,One of our Knight Society  @GCSCSTEM 3d print  club Creative Problem Solvers is tackling a unique problem that  @WESWorldLang  has... there is a set of these coming your way to test! Notice the W for  @FTWoodfillES ?,0,5,1,0
Blitz,@Darkspiral_94,2019-02-22T08:35:16.000Z,2019  3D Printing  Industry Awards update Enterprise  3D Printer  of the Year Metal and Polymers -  3D Printing  Industry  https://,0,0,0,0
Abhimanyu Chavan,@Abhimanyu_3DP,2019-02-22T05:48:15.000Z,Answer to Could  3D printing  result in more reliable and functional planes  3D printed ? by Abhimanyu Chavan  https:// ing-result-in-more-reliable-and-functional-planes-3D-printed/answer/Abhimanyu-Chavan-1?srid=uVPdq …,0,0,0,0
Unimarconi,@Uni_Marconi,2019-02-22T09:04:56.000Z,"Ecco il programma degli interventi che si susseguiranno oggi durante il Meeting "" Additive Manufacturing  - Lo stato dell'arte nell'industria meccanica italiana"".  https:// itive-manufacturing/ … #marconindustry40 #unimarconi #federmanager #toscana #BHGE",0,0,0,0
☾༺ℓυa༻☽cazavampitos// ENCARGOS 3D OPEN,@Puchiluh,2019-02-22T07:50:46.000Z,"Me duele la tripa y estoy literalmente tirada en el trabajo.

Enviad ayuda.",4,26,1,0
KTEEA,@KTEEA1,2019-02-22T01:17:55.000Z,"We have a new industry sponsor! Everybody be sure to check out NWA3D ( @NWA3D ) for your  3D Printing  needs in the classroom! Thank you, for supporting the technology teachers of Kansas!  #CTE #TechEd #STEMEd",0,5,2,0
Steve Scor,@3DPrinterDepot1,2019-02-22T10:00:52.000Z,"New Stratasys J720 Dental  3D printer  makes full color, multi-material parts in a single run",0,0,0,0
moldover,@moldover,2019-02-22T01:13:50.000Z,Seriously considering NOT being a  3D printer  owner.,3,3,0,0
Fabbing,@fabbing,2019-02-22T10:21:04.000Z,"Farsoon Technologies debuts high-speed  3D printing  Flight Technology, partners with Arkema and Autodesk  http://",0,0,0,0
Gary Weston,@GaryWeston11,2019-02-22T08:03:57.000Z,3D printing  firm trying to help Alberta girl develop prosthetic hand has hit a snag -  http:// https://,0,0,0,0
Психология Не Курения (П.Н.К),@PNKpsychology,2019-02-22T09:56:59.000Z,"Online Shopping for Cool Gadgets, RC Quadcopter,  3D Printer  at Banggood  https:// 9358c7836213826a88/ …",0,0,0,0
Lawrence Wang,@lawrencewang892,2019-02-22T06:31:46.000Z,"Wax material for  3D printing , for jewelry production.",0,0,0,0
BoostNinja,@Boost_Ninja,2019-02-22T02:07:52.000Z,#3rdgrader  can do everything! A  #3rdgrader  designed  3D printed #InternationalSpaceStation http://    via shapeways,0,0,0,0
Scott White,@scottdwhite1991,2019-02-21T22:50:33.000Z,"3Doodler Introduces Mobile App,  3D Printing  Pen Activity Kits, and Wider Distribution for EDU Learning Packs  https:// r-mobile-app-activity-kits/ …",0,0,0,0
3D Druck Magazin,@3Ddruckmag_ch,2019-02-22T09:41:20.000Z,VELO3D enhances Flow software for metal  3D printing https:// #3dprintindustry #3dprinting,0,0,0,0
Busykids.sg,@BusykidsSg,2019-02-22T02:59:02.000Z,"This March Holiday, join our friend  http://  to learn  3D Printing  and fly Drones in ONE day!   930am-530pm (1 hr lunch break)

Fees: $180  Get EXTRA $20 OFF by quoting…  https:// ?utm_source=ig_twitter_share&igshid=10s6en62e1c38 …",0,0,0,0
Lucie deLaBruere,@techsavvygirl,2019-02-22T08:11:25.000Z,Had lunch with a fascinating woman  @JoanHorvath  the other day!  Handling all the  3D printed  models she shared with me and listening to her talk about them  made me want to  learn calculus.  Is it too late?,1,1,0,0
Gary Weston,@GaryWeston11,2019-02-22T08:04:03.000Z,The Future of  3D Printing  Is in the Materials - DesignNews  https://,0,0,0,0
iotosphere,@iotosphere,2019-02-21T23:02:26.000Z,3D Printer  Becomes 2D Dot Matrix Printer Using Web App  https:// printer-becomes-2d-dot-matrix-printer-using-web-app/ …,0,0,0,0
Rickey Estes,@estes_rickey,2019-02-22T09:02:13.000Z,Orbex Rocket Includes Largest  3D Printed  Part to Be Made in One Piece https:// ket-includes-largest-3d-printed-part-to-be-made-in-one-piece …,0,0,0,0
John McIsaac,@johnpmcisaac,2019-02-22T04:35:44.000Z,*Scientists  3d print  Val Kilmer,0,0,0,0
Chris Taylor,@dftchemist,2019-02-22T02:23:46.000Z,Explain to me how  3D printing  alone will save the 1000 tons of mass needed for building hear stations again?,0,0,0,0
GearBest Coupons,@GBGutscheine,2019-02-22T03:22:45.000Z,"GearBest Deal: Geeetech A30 Aluminum Profile Desktop  3D Printer  - Blue Eyes EU Plug 
►Price: 352,43 €
►Coupon: FLASH SALE
►Link:  https:// -printer-kits/pp_1821953.html?wid=1433363&lkid=15631678 … #GearBest #Deal #Gutschein #Coupon #Rabatt #Cupón #Sconto",0,0,0,0
Bongani Chinkanda,@bonchiachanza,2019-02-22T10:29:20.000Z,"Uber, Airbnb, Mpesa,  3D printing , the list is endless. Disruption is the new normal... #thenext #futureproofing https://",0,0,0,0
Krix Loudspeakers,@KrixSound,2019-02-21T23:51:01.000Z,"Our  3D printer  is hard at work today, what could it be printing?  #experiencesound https:// ?utm_source=ig_twitter_share&igshid=3kqc49ygwyvj …",0,0,0,0
Jonathan Chow,@CleanPowerEra,2019-02-22T08:30:00.000Z,"Wireless IoT sensors, built in  3D printing #InternetofThings #IoT #innovation #TechNews #technology #DeepTech https:// iot-sensors-built-3d-printing …",0,0,0,0
FilamentFoundryUS,@FilamentU,2019-02-22T03:17:05.000Z,Want to make unique bath bombs or soaps in any shape you want? Check out these  3d printed  molds!,0,0,0,0
Blitz,@Darkspiral_94,2019-02-22T08:06:07.000Z,"Innovation, Personalization Power  3D-Printed  Medical Device Market - Healthcare Packaging  https://",0,0,0,0
Metalmite Corp,@MetalmiteCorp,2019-02-21T23:36:54.000Z,New Blog Post -  3D Printing  at Metalmite -  http://,0,0,0,0
Fabbing,@fabbing,2019-02-22T09:55:34.000Z,"New Stratasys J720 Dental  3D printer  makes full color, multi-material parts in a single run  http://",0,0,0,0
Elf Direct,@ElfDirect,2019-02-22T06:10:37.000Z,#hoodies  Black Hoodies  3d Print  USA Flag Sweatshirts,0,0,0,0
Jyri Ylkänen,@JYlkanen,2019-02-22T07:28:52.000Z,"The quality of these  3D printed  parts probably exceeds originals: “We, ...produce safety-critical components that are ready for use under the rough conditions of everyday operations.""  https:// /kg6qhd/status/1098726679285907456 …",0,0,0,0
3Dプリントくん,@3D_PRINT_kun,2019-02-21T23:49:36.000Z,"午前中の脳は、情報をさばく事に向いている。あれやこれや、知恵の輪みたいに絡まった情報がスッと整のう感じ。夜中の脳は妄想を膨らませる脳。とんでもアイデアとか、理屈じゃないものが出てくる。
だから、夜中にアイデア膨らませて朝の自分がそれをさばくみたいな。",0,0,0,0
3D Printing Tech,@MakerWatcher,2019-02-22T00:42:26.000Z,"MyStemKits –  3D Printing  for STEM Education  https:// =1550793931.1792669296264648437500 … , see more  http://",0,0,0,0
Valley Christian,@VCSAuburn,2019-02-21T23:53:03.000Z,"Auction Item- Class project for 4th Grade

Because of the generous support of people like you, the VCS annual auction has provided such items as IPads, Chromebooks, a  3D printer , robots, the science...  https:// nSchoolAuburn/posts/2183653195034545 …",0,0,0,0
Arena Andheri,@Arena_Andheri,2019-02-22T09:13:54.000Z,"3D printing  is a rapidly developing technology.
At AIFF fest, we have arranged  3D  printing  demonstration by India's Biggest  3D Printing  Center,  3D Print  World.
Visit us to explore more on  3D printing ...  https:// tionandheri/posts/2216022838417754 …",0,0,0,0
Celestial Ambidextrous,@mildmeatmilk,2019-02-22T03:28:20.000Z,Just  3d printed  my first human.,0,0,0,0
Science & Tech News,@TamilTechNews,2019-02-22T03:00:02.000Z,3D-printed  Glucose Biosensor for Painless Diabetes Monitoring  https:// E2%80%91printed-glucose-biosensor-for-painless-diabetes-monitoring/https://t.co/vVXIaJhkuJ … #3dPrinting #Diabetes #Health #Medical #Technology,0,0,0,0
Franc Coenen,@madeineuropenu,2019-02-22T06:50:01.000Z,Farsoon  3D print  met puur koper en wil nu toepassingen gaan ontwikkelen  https:// #3dprinting,0,0,0,0
Daily Deals,@DailyDealFeeds,2019-02-22T05:31:51.000Z,"ad: HATCHBOX Silk PLA  3D Printer  Filament, Dimensional Accuracy +/- 0.03 mm, 1 kg Spool, 1.75 mm, Bronze -  https://",0,0,0,0
Sam Wai Sing Ng,@sam_ng_,2019-02-22T09:32:33.000Z,數年前造的3D Printed Fashion Prototype...  #3dPrintedFashion #FashionIndustry #HongKongFashion #HKFashion #FashionDesign #FashionDesignAndMaking #Fashion #時裝設計 #時裝科技 #香港時裝 #香港時裝設計 #香港 #HongKong …  https:// ?utm_source=ig_twitter_share&igshid=7sniwzsktwfj …,0,0,0,0
"Gürbey Demirtürk, M.Ed.",@GrbyDmrtrk,2019-02-21T22:52:30.000Z,3D Printed  Patterns For Metal Casting  https://  via  @YouTube,0,2,0,0
Russ Ogi,@Russ_Ogi,2019-02-21T23:07:23.000Z,Tombo Kabuto continued. On the wings of a dragonfly.  3D printed  wings.  #yujiokumoto #konakitchenlynnwood #samurai #3dfuel #armor #japanese #kabuto #restomod #3dprinted #yoroi #wings #dragonfly,0,0,0,0
Wild Woman Creations,@WildWomancreate,2019-02-22T05:35:44.000Z,Finished  3d printed  hoof! This will be used to make a mold of for resin casting.  #hoof #fursuit #hooves #hoofboots,0,0,0,0
Curso 3D Printing,@Curso3DPrinting,2019-02-22T10:27:45.000Z,"Farsoon Technologies debuts high-speed  3D printing  Flight Technology, partners with Arkema and Autodesk  https://",0,0,0,0
Jonathan,@JMLarod,2019-02-22T10:22:29.000Z,"Farsoon Technologies debuts high-speed  3D printing  Flight Technology, partners with Arkema and Autodesk  https:// https://",0,0,0,0
Sarah-Jayne Gratton,@grattongirl,2019-02-22T00:58:49.000Z,Digitalization and automation enhance successful lean methods to further increase factory competitiveness. Visit to the  @siemensindustry  Electronics Factory Erlagen and to  Additive  Manufacturing  Experience Center. #Industry40 #HM19,0,0,0,0
Joetke • Joetke's Hub,@joetke,2019-02-22T03:21:56.000Z,How can  #Additive #Manufacturing  improve  #safety  equipment? Top 5  #3Dprinted #sports  safety equipment projects: what is possible?  https:// 0/top-5-3d-printed-sports-safety-equipment-projects-what-is-possible/ …  (FR)  #impression3D #imprimante3D  imprimer des dispositifs de  #protection  corporelle en sport? Oui mais pas avec n'importe quoi,0,3,2,0
