Author Name,Author ID,Date,Post Text,Replies,Likes,Reshares,Views
Jonathon Kuehl,@Jonkuehlone,2019-03-01T16:43:02.000Z,"STEM time at  #DupageMiddleEd  
Lego Mindstorm,  #PLTW , VexIQ, Raspbery Pi,  3D Printing .",0,0,0,0
Extruder Joe,@ExtruderJoe,2019-03-01T17:59:30.000Z,3D Printing : LLNL creates multibeam metal  3D printer  to understand laser-material interactions  http:// 301-llnl-creates-multibeam-metal-3d-printer-to-understand-laser-material-interactions.html …,0,0,0,0
Stephen White,@StephenWhiteOH,2019-03-01T17:43:30.000Z,Congrats Aaron Westbrook w/  @form5prosthetic ! Today  @CityofNewAlbany  &  @COSI  announced he will be a Grand Marshal for the upcoming  #COSISciFest ! He‘s inspired others through his work on  3D printed  prosthetics. He will represent NA on May 4! See you there!  http://,0,5,2,0
♔Sire,@UrMajesty_Sire,2019-03-01T16:38:22.000Z,3D-Printed  Paintings Let The Blind “See” Famous Art For The First Time  https:// nted-paintings-let-the-blind-see-famous-art-for-the-first-time/ …,0,0,0,0
Saint Andrew School,@StAndrewCEC,2019-03-01T19:27:46.000Z,This is the same project printing on the  3D printer . Some of our students are so excited to see their idea come to life.  https:// deos/396736204224062/ …,0,0,0,0
3D printing supply CHAIN,@3DChain,2019-03-01T18:44:34.000Z,These new Artificial Intelligence network can make substantial improvement in  #manufacturers  interaction with customers and how they manage their operations.learn at  #3DChain,0,0,0,0
Joel Telling - 3D Printing Nerd,@joeltelling,2019-03-01T16:45:56.000Z,HELLO COFFEE. Tag a friend. I tag  @WebbsMcGee,6,40,3,0
Knives-Shop,@KnivesShop,2019-03-01T15:00:37.000Z,NEWS.-Plate with ball chain Air Force - £2.10: Identification plate of the air force. The plate comes with  3D printing  and the chain of balls.  http://,0,0,0,0
BagMite,@bag_mite,2019-03-01T18:58:20.000Z,#clutch #clutches  Women's Fashion  3D Print  Cosmetic Bag,0,0,0,0
Engineering At UL,@EngineeringAtUL,2019-03-01T16:15:43.000Z,"It’s all about the  3D print ! Thanks to Joseph Mooney,  #CONNECT  funded PhD student  @StokesInst @connect_ie  for hosting Diarmuid Sutton from Castletroy College, Limerick for his year 5 work experience this week.  @sci_engUL @CastletroyC  @07mooney",0,17,7,0
Emily Trammell,@trammellart,2019-03-01T20:29:40.000Z,"Thanks to Bryan, Pierce and  @GeorgeDawsonMS  MM3 teacher, Mr. Burns, for my incredible custom  3D printed  piece",0,3,0,0
Reuters,@Reuters,2019-03-01T15:10:00.000Z,Will the food of the future be printed? This company is  3D printing  vegan steaks,73,215,200,0
FIS 3D Printing Club,@FIS_3dpc,2019-03-01T17:05:47.000Z,Working on some debate tournament swag.  #3DPrinting @FIS_School,0,4,1,0
Chalmers Production,@Production_AoA,2019-03-01T19:33:59.000Z,Early birds! The registration is open  #AAMS2019  (Alloys for  Additive Manufacturing  Symposium) 18-20 Sep. The Centre for  Additive Manufacturing  - Metal  #CAM2  is hosting this world-class event covering  #powder  based  #metal #AM  technologies.  @chalmersuniv https:// 2/conferences%20and%20events/conference%20AAMS2019/Pages/default.aspx …,1,3,3,0
Horton Global,@HortonGlobal,2019-03-01T20:19:03.000Z,3D Printed  Medical Devices Market Is Expected to Register a CAGR of 18.1% over the Forecast Period of 2017-2027 - Press Release - Digital Journal  http://,0,0,0,0
Miuigr,@Miuigr,2019-03-01T18:36:08.000Z,"Καταπληκτικά νέα μας έχει σήμερα το TomTop για όσους ενδιαφέρονται να αποκτήσουν έναν καλό  3D Printer , καθώς το TomTop μας προσφέρει τον αναβαθμισμένο Anet A8 High Precision  3D Printer  Kit στα 114.26€...  https:// recision-3d-printer-kit-tom-top/ …",0,0,0,0
KBIS,@KBIS,2019-03-01T19:19:41.000Z,We’d like to congratulate  @DXV  by American Standard for bringing home Best of KBIS - Best of Show for the Blade  3D Printed  Faucet. Way to go!  http:// #KBIS2019 #BOK2019,1,7,0,0
Christian Putnam,@Christian_Put,2019-03-01T16:46:37.000Z,"We’re tapped into the emerging technologies that are driving  #4IR  and opening the doors to new business models. Find out what IoT, blockchain,  3D printing  and AI mean for your business:  https:// https://",0,0,0,0
Kitchen Art,@KitchenArtLLC,2019-03-01T20:30:10.000Z,"What a beautiful and eclectic  3D printed  faucet! The new kitchen and bathroom trends from the KBIS 2019 show will surely blow your mind.

Click the link below to check out the amazing gallery of the award winners for this year! https:// ds-inspirations/best-of-kbis-2019-award-winners-announced/#slider-1 …",0,0,0,0
Jada Smith,@JadaSmi16197127,2019-03-01T16:12:53.000Z,3D printed  Pickle Rick  https://,0,0,0,0
Mark Patrick,@mrmarkpatrick,2019-03-01T20:29:09.000Z,"RT TCEA: RT rrodgers: Not to rush you or anything, but the deadline to register for the 2019  #TCEA  3d Design Contest is TODAY, so... No  3D printer  required, btw!   https:// ts/3d/ … #3DDesign #MakerEd #EdTech",0,0,0,0
HolySpiritTCDSB,@TCDSBHOLYSPIRIT,2019-03-01T16:32:17.000Z,Gr 4 and 5 Holy Spirit students tinkering with TinkerCad and the  3D printer . Thank you Mr. Wetzel and St. John Paul II staff for teaching us.   @TCDSB @TCDSBdirector @TCDSB21C @PrincipalJPII,0,2,0,0
Chromar,@Chromar_,2019-03-01T15:26:06.000Z,LMAOOOOOOOOO Excel just crashed because my work computer doesn't have enough memory   I just lost 4 hours of progress because my computer has less computing power than a toaster. I will use a  3D printer  from production to make a katana and commit  seppuku...,0,3,0,0
"DEPCO Enterprises, LLC",@DEPCOLLC,2019-03-01T15:02:30.000Z,Stress Test: What is the Strongest  3D Printer  Filament? Putting Stratasys to the test...  https://,0,0,0,0
Vinyl Kaiju Legion,@kaijulegion,2019-03-01T18:26:42.000Z,"“Core Falcon”  3D printed  prototype is in hand. I’m filling in a few gaps and sanding it out. Should be ready for primer and paint this weekend. Core Falcon will be a soft vinyl figure,…  https:// ?utm_source=ig_twitter_share&igshid=1ps9wxgk5pbcc …",0,0,0,0
3DExchangeNet,@3DXNet,2019-03-01T18:58:10.000Z,Job well-done researchers! Our whole mission is to understand the  3D printing  industry's reach and potential and it can only happen when there's the thirst for more #thirstformore #FridayMotivation #3Dprinting #3DX #3Dspace #mergerpreneurs #proacquisition #robustspinoff https:// /3DPrintingIt/status/1101502100658364418 …,0,0,0,0
Women in 3D Printing,@Wi3DP,2019-03-01T19:50:01.000Z,Join us to celebrate International Women Day with  #Womenin3DPrinting  Bolzano!  https://,0,0,0,0
BECT Computers & 3D Printing,@bectcomputing,2019-03-01T17:27:08.000Z,Is Medtech Ready for an On-Demand Manufacturing Model? | MDDI Online  https:// demand-manufacturing-model …,0,0,0,0
Jonathan,@JMLarod,2019-03-01T17:53:04.000Z,LLNL creates multibeam metal  3D printer  to understand laser-material interactions  https://,0,0,0,0
3D Printing Tech,@MakerWatcher,2019-03-01T18:47:27.000Z,"Nexxt Spine to use MTS testing systems for  3D printed  spinal implants -  3D Printing  Industry  https:// ne-to-use-mts-testing-systems-for-3d-printed-spinal-implants-150134/ … , see more  http://",0,3,2,0
Amanda Alderman,@MAlderman73,2019-03-01T20:09:30.000Z,First place  3D print  Tiny House  @TCBOE_LES,0,9,5,0
Medieval-Shop,@Medieval_Shop,2019-03-01T15:00:37.000Z,"NEW.-Plate with ball chain Seals - £2.09: Identification plate of the Seals (Sea, Air, Land). The plate comes with  3D printing  and the chain of balls.  http://",0,0,0,0
nerdlynews,@itsnerdnews,2019-03-01T17:15:05.000Z,A Modular Mounting System Via  3D Printing https:// ting-system-via-3d-printing/ …,0,0,0,0
Hunter Loadholt,@HunterLoadholt,2019-03-01T18:28:16.000Z,"This article is very insightful to the advancements being made to heighten security and of various printed materials through a method called ""nano scale  3D printing ""  @ClemsonGC #gcflexo https:// mbly/3d-printed-holographic-prints-developed-enhanced-security/42743205960149 …",0,0,0,0
Ryan Rieder,@TBKzord,2019-03-01T17:18:15.000Z,"Since I finally have my nice  3D printer , I'm jumping on the patreon train for @mz4250. If you are a DM and have a  3D printer , this guy is probably your most valuable resource for all things  #dnd  models  https://",0,9,1,0
matcha girl,@leenduhsworld,2019-03-01T16:00:54.000Z,Currently in a workshop for  3d printing If only I could print out some motivation and joy ,0,0,0,0
Prime Imaging,@PrimeImaging,2019-03-01T14:53:00.000Z,A Look Into Some Movies That Have Used  3D Printed  Props  https://,0,0,0,0
New Scientist,@newscientist,2019-03-01T19:00:41.000Z,Purple or brown? This  3D-printed  cup changes colour in different light  http://,2,39,15,0
John Smith,@utesco,2019-03-01T15:53:18.000Z,Don't have a  3D Printer  for Terrain? »  http://,0,0,0,0
Techniplas,@TECHNIconnect,2019-03-01T15:45:14.000Z,Patients with spinal cord injury can be helped with  3D printed  implant!  #LiezelLabios #ScottLaFee #UCNewsroom @UC_Newsroom @LiezelLabios #3dprinting #additivemanufacturing #augmentedmanufacturing #spinalcordinjuires http://,0,0,0,0
HIHUB.TECHHealth Innovation Leaders,@HealthInnovaHUB,2019-03-01T19:28:19.000Z,"Parabéns aos organizadores!

Orgulho em estar organizando este evento com palestrantes pioneiros na manufatura aditiva no Brasil  com Fabio Sant'Ana e 3DHEALS LLC

3DHeals Brazil – Healthcare  3D Printing  and Bioprinting, Next Generation! -

  https://",0,0,0,0
Charles Russo,@Charles_M_Russo,2019-03-01T18:15:33.000Z,IDTechEx Showcases Why Boston is at the Heart of the  3D Printing  Revolution  #3dprinting https:// echex-showcases-why-boston-is-at-the-heart-of-the-3d-printing-revolution/ …,0,5,2,0
Marni,@ItsMeMarni,2019-03-01T15:08:12.000Z,Help me win a  3D printer  from  http:// !  https://,0,0,0,0
Not A Games Dev Ollie,@Reksaurian,2019-03-01T16:01:02.000Z,"PROGRAMMING: Bottom left. Shows how many tiles are being rendered from the render function, and a display variable Im using to set up the gamepad which I just used to perform an action once per press of the A Button. This will be used to punch holes in the floor.",0,0,0,0
Herringthorpe Junior,@Herringthorpe,2019-03-01T15:47:32.000Z,Y6M  3D Printing http:// -3d-printing/ …,0,2,0,0
Curso 3D Printing,@Curso3DPrinting,2019-03-01T16:02:54.000Z,"Roboze partners with Neofab, expands high-temperature  3D printing  in France  https://",0,0,0,0
EOS 3D Printing,@EOS3DPrinting,2019-03-01T14:34:08.000Z,What can  #AdditiveManufacturing  do for the medical industry? Visit us at AAOS 2019 to learn more:  https:// #DigitalFabrication #medical #3Dprinting #ShapingFuture,0,4,4,0
Lee Taekyeom,@Taekyeom,2019-03-01T16:28:50.000Z,I made a  3D printed  type “a” speaker.  #speaker #3dprinted #typography #yellow #3dtype #a #taekyeom https:// ?utm_source=ig_twitter_share&igshid=1aua3acyemxca …,0,0,0,0
Charles Russo,@Charles_M_Russo,2019-03-01T18:00:19.000Z,LLNL creates multibeam metal  3D printer  to understand laser-material interactions  http:// 301-llnl-creates-multibeam-metal-3d-printer-to-understand-laser-material-interactions.html …,0,0,0,0
Reliable Auto Service Center,@reliableautoMI,2019-03-01T16:18:36.000Z,3D-printed  self-repairing tires may be in our not-so-distant future! Check it out:  https://,0,0,0,0
White Label Network,@WLNetwork,2019-03-01T15:42:44.000Z,Another landmark for  #design  and  #3Dprinting #technology  the worlds longest  3D printed #bridge .    #ideas #Innovation #engineering #construction #building #tech  https:  http:// ion-buzz/3099-world-s-longest-3d-printed-concrete-bridge-opens-in-shanghai-construction-buzz-205 …,0,2,2,0
Fabbing,@fabbing,2019-03-01T17:49:04.000Z,LLNL creates multibeam metal  3D printer  to understand laser-material interactions  http://,0,0,0,0
3D Printing @𝟑𝐃𝐚𝐛𝐥𝐞,@3Dable,2019-03-01T16:08:14.000Z,"3DPI > Roboze partners with Neofab, expands high-temperature  3D printing  in France >  http:// #3DP #3Dprinting #3Dprinter #Prototyping #RapidPrototyping #AdditiveManufacturing",0,0,0,0
Knives-Shop,@KnivesShop,2019-03-01T15:00:39.000Z,NEWS.-Plate with ball chain Army - £2.10: Identification plate army. The plate comes with  3D printing  and the chain of balls.  http://,0,0,0,0
Jada Smith,@JadaSmi16197127,2019-03-01T20:12:15.000Z,I bought this light up portal gun at hot topic for like less than 20 bucks a year ago. It took me no effort or time to create. I could have  3D printed  one. But what kinda goon has that kinda time?  https://,0,0,0,0
Gary Weston,@GaryWeston11,2019-03-01T15:49:11.000Z,INTERPHEX 2019 Keynote Series Presents Session on  3D Printing  in Pharma - Pharmaceutical Technology Magazine  https://,0,0,0,0
Alessandro Graziani,@W6MOQ,2019-03-01T15:34:13.000Z,"Have some geometric fun with a  3D-printed , light-up icosahedron -  http://",0,0,0,0
Prototype This 3D,@3dThis,2019-03-01T19:55:33.000Z,Can you say laser? Adding one to my  3d printing  arsenal.,0,0,0,0
Adam @ Vector 3D,@Adam_V3D,2019-03-01T16:55:05.000Z,"OK  #3dprinting  community, if you were to print one model to show off your  3d printer , what would it be?",5,4,1,0
Matthew Childress,@ThewTweet,2019-03-01T15:54:23.000Z,"We’re tapped into the emerging technologies that are driving  #4IR  and opening the doors to new business models. Find out what IoT, blockchain,  3D printing  and AI mean for your business:  https:// https://",0,0,0,0
ClevelandClinicNews,@CleClinicNews,2019-03-01T19:57:51.000Z,See how doctors use  3D printing  to reconstruct a baby's malformed heart  http://,1,69,24,0
Tim K (16'h3904),@bjt2n3904,2019-03-01T16:36:33.000Z,Great article from Joshua on  @hackaday  about heat set inserts. My first  3d print !,1,1,0,0
TrendSwap,@trendswap,2019-03-01T17:10:43.000Z,Eddie Hemmings  3D printed  vegan steaks be a solution to the problem of unsustainable livestock farming? This company hopes so,0,0,0,0
Willow Creative,@WillowCreativ,2019-03-01T16:11:02.000Z,reminder to myself to 3d model and  3d print  a guthix bust the way he's seen in World Wakes,1,3,0,0
DeptyDawg,@deptydawgg,2019-03-01T17:32:49.000Z,Wow! People are strange. Printing steaks w a  3D printer ? Please that morsel they call a steak is barley a Nugget & it certainly isn’t meat if it’s made of rice or soy. Stop trying to sell us this garbage. My steak come from cattle. I’ll take a juicy Ribeye any day..medium rare,0,0,0,0
IVI 3D Printer,@ivi3dprinter,2019-03-01T17:42:00.000Z,The photos for the second part of the rock.  #Aquaman #3dprinted #3Dprinter #3Dprinting,0,2,0,0
3dcompareit,@3dcompare_com,2019-03-01T17:00:44.000Z,"Need a spare part? Whether it's a rare car part that you just can't find anywhere, a custom pipe with niche dimensions, some rims that you would like engraved - we can get it made. CNC, Injection Moulding, Laser Cutting and  3D Printing  in a range of materials.",0,0,0,0
Trans Bot,@DumbTransBot,2019-03-01T16:10:33.000Z,"transboys need to the seat in the 1000th time picturing tankies that they make a transphobic your hair? FYI I'm about the biggest bullshit internet of  3d printed  guns tonight. Like, I don't you don't fucking lose some fucking great. don’t seek out to a superior lover to someone",0,0,0,0
Gary Weston,@GaryWeston11,2019-03-01T17:34:46.000Z,IDTechEx Showcases Why Boston is at the Heart of the  3D Printing  Revolution - AiThority  https://,0,0,0,0
Ali Villegas,@alivillegasp,2019-03-01T16:35:15.000Z,A Modular Mounting System Via  3D Printing https://,0,0,0,0
Tia Simmons,@TechTia,2019-03-01T20:27:16.000Z,"RT TCEA: RT rrodgers: Not to rush you or anything, but the deadline to register for the 2019  #TCEA  3d Design Contest is TODAY, so... No  3D printer  required, btw!   https:// ts/3d/ … #3DDesign #MakerEd #EdTech",0,0,0,0
The Ghost,@Zzord_,2019-03-01T19:38:45.000Z,"Almost Done....  3D printing  machine. 

Rule 1; Never let the same flame burn you twice. ",0,0,0,0
Gary Weston,@GaryWeston11,2019-03-01T14:39:27.000Z,"China will become major player in  3D printing , analyst says - ecns  https://",0,0,0,0
Incarnate Word Academy,@IWACCNews,2019-03-01T18:56:59.000Z,"Thank you to all of our students who made our second annual S.T.E.M. Festival such a huge success! Festivalgoers had a blast as they visited over 30 student-led exhibits focused on various S.T.E.M. activities such as robotics,  3D printing , drones, and so much more.  #STEM #iwacc",0,0,0,0
K+,@Kplus3D,2019-03-01T16:01:12.000Z,3D Printed  Curved Vase USD 14.98 https://,0,0,0,0
Gary Weston,@GaryWeston11,2019-03-01T15:59:22.000Z,"China will become major player in  3D printing , analyst says - Chinadaily USA  https://",0,0,0,0
Peter van Woerden,@petervanwoerden,2019-03-01T15:14:29.000Z,3D print  van nieuw te bouwen woning gemaakt. Maquette terug van weggeweest :-)  https:// ?utm_source=ig_twitter_share&igshid=19289r3i125qu …,1,1,0,0
BECT Computers & 3D Printing,@bectcomputing,2019-03-01T17:41:28.000Z,"Grocery store stocks take a beating on report that Amazon will launch…
  @CNBC https:// cery-store-stocks-take-a-beating-on-report-that-amazon-will-launch-its-own-chain-of-supermarkets.html?__source=iosappshare%7Ccom.apple.UIKit.activity.PostToTwitter …",0,0,0,0
DesignReadyControls,@DRC_Controls,2019-03-01T19:10:07.000Z,Introducing the Industrialization of  Additive Manufacturing #additivemanufacturing #manufacturing #industrialization #3dprinting http://,0,2,0,0
Lectrify,@lectrifyit,2019-03-01T14:44:06.000Z,An artist in our building  #1890bryant  tried  3d printing  a portrait he drew with one of these on our  @makerbot  ... cool idea but needed a little cleanup before being printable.  Ended up being mostly supports with all those brushstrokes floating in the air.,1,0,0,0
Los Gatos High School (Official Feed),@LosGatosHigh,2019-03-01T16:36:59.000Z,"Advanced 3D Design - a  3D printed  face, painted, and room inside to plant a succulent  @LosGatosHigh #golgcats",0,0,0,0
the Print House,@Snygge_Home,2019-03-01T16:24:53.000Z,"Day 1. Favourite to make - Our  3d print  guru Jack loved designing these sleek crescent moon pots! The design was challenging and took a while to get the perfect setting on our printers, but we are really pleased with how they turned out - especially in o…  https://",0,2,0,0
Bath Public School,@BathPS_LDSB,2019-03-01T18:39:56.000Z,3D printer  in action today  @BathPS_LDSB  we are making a ruler!!  @MrsBaumlClass #innovation,0,9,3,0
Cambridge Festival,@Cambridge_Fest,2019-03-01T19:30:00.000Z,"3D printing  with chocolate https:// ting-chocolate … This activity involves  #building  a  #3D #printer  and using it to print  #model  buildings.  #Chocolate  is used as a  #material , because it has a  #workable  form and sets solid, much like  #concrete .  @cu_mat",1,5,4,0
Joel Telling - 3D Printing Nerd,@joeltelling,2019-03-01T20:23:25.000Z,My  @limetechnology  unRaid server is coming along nicely. Clearing 9 new disks!,3,41,2,0
Mayer Alloys Corporation,@MayerAlloysCorp,2019-03-01T19:10:51.000Z,What does  3D printing  have to do with hip replacements?  https://,0,0,0,0
"Scarlet Highlord RetPallyJil, the Ashbringer",@RetPallyJil,2019-03-01T18:53:02.000Z,"Shapeways! Home of  3d printed  jewelry! Rings, pendants, charms! https:// #Retnoob #Geek #WoW",0,0,0,0
LEO Lane,@LEOLane3D,2019-03-01T18:35:24.000Z,"While there are many benefits associated with adopting  additive manufacturing  technology, there are also undeniable risks and uncertainties which companies shouldn’t ignore. This week we explore what can be done to sidestep these risks.   https://",0,2,0,0
Jon Iversen,@jiversen,2019-03-01T18:46:30.000Z,"We’re tapped into the emerging technologies that are driving  #4IR  and opening the doors to new business models. Find out what IoT, blockchain,  3D printing  and AI mean for your business:  https:// https://",0,0,0,0
Jason Padley,@jgpadley,2019-03-01T15:41:50.000Z,"We’re tapped into the emerging technologies that are driving  #4IR  and opening the doors to new business models. Find out what IoT, blockchain,  3D printing  and AI mean for your business:  https:// https://",0,0,0,0
Christopher Crow,@chriscrowmusic,2019-03-01T19:17:38.000Z,My ice game is strong  .  Rocking and Rollin tonight at the bulleit  #frontierworks  3D Bar! The worlds first  3D printed  bar and I’m stoked! Cheers to  @lanaloveswhisky  for  having us HNT…  https:// ?utm_source=ig_twitter_share&igshid=2wfsi8qigdrz …,0,0,0,0
AfterDarkGandi,@DerpGandi_xP,2019-03-01T17:22:45.000Z,"Aaand done.
I next week I will travel with my fursuit by plane.
PROBLEM: I only have a big stand for it. Nothing small and compact.

Solution: Two light stands, a peace of round wood, four  3D printed  parts and some screws, nuts & washers.

What do you think?",0,2,1,0
CBS Newspath,@cbsnewspath,2019-03-01T18:50:41.000Z,CONSUMER-  3D PRINTED  STEAKS- Baumgardner 1130a PKG FRI0102- A Spanish company wants to fill the world with 'conscious carnivores' one steak at a time. The company relies on 3-D printers to make their meat stand out. CBS' Gwen Baumgardner reports from London.,0,0,0,0
S1lver Arrow,@S1lverArrow,2019-03-01T16:31:46.000Z,A Modular Mounting System Via  3D Printing http:// #projects #geek #diy,0,0,0,0
News 19,@whnt,2019-03-01T19:30:33.000Z,"3D-PRINTED  VEGAN STEAK: No trip to the grocery store needed to prep for this dinner. A Spanish food company is serving up something a little different, using 3D printers to make “meat.”",8,9,27,0
Denise Saliola,@DeniseSaliola,2019-03-01T19:30:03.000Z,"We’re tapped into the emerging technologies that are driving  #4IR  and opening the doors to new business models. Find out what IoT, blockchain,  3D printing  and AI mean for your business:  https:// https://",0,0,0,0
3D Print Works,@3DPrintWorks,2019-03-01T16:15:11.000Z,3D printing  innovations have spurred across multiple industries and changed the way people approach challenges.  #3dprinting #3d #3dmodels #technology #design #designers http://,0,0,0,0
3D Printing News,@3DPrintGirl,2019-03-01T14:58:25.000Z,UC Santa Barbara Researchers Explore Acoustophoresis in Regulating Electrical Composites for  #3DPrinting https:// ity-california-researchers-explore-acoustophoresis-in-regulating-electrical-composites-3d-printing/ … @ucsantabarbara,0,0,2,0
Daniel Crosslink,@danielcrosslink,2019-03-01T16:47:36.000Z,How to keep  3D printing  an interesting hobby  https://,0,0,0,0
Ecco First,@EccoFirst,2019-03-01T17:59:51.000Z,You've never seen a  3D printer  like this before  https:// s/1101539345973030914/video/1 …,0,0,0,0
Atrapazon,@atrapazon,2019-03-01T16:51:57.000Z,"KOHON KH01 Aluminum Alloy Quick Assembly  3D Printer  - 338.20€ Free Shipping|Gea  #gearbest Ahora: €338.20  Antes: €413.33 Cupón: KOHON11 Precio Final: 329.29€  Unidades: 50

Enlace: ",0,0,0,0
Chroma Camera | Steve Lloyd,@ChromaCamera,2019-03-01T15:13:57.000Z,"As well as building more awesome Chroma cameras, I’ve also been assembling a  3D Printed  mule double dry plate holder   The final moulded version will have the traditional raised top…  https:// ?utm_source=ig_twitter_share&igshid=1u4gsof48115n …",0,3,1,0
Reuters,@Reuters,2019-03-01T17:10:00.000Z,Could  3D printed  vegan steaks be a solution to the problem of unsustainable livestock farming? This company hopes so,40,104,106,0
Charles Russo,@Charles_M_Russo,2019-03-01T18:48:24.000Z,UOW installs custom 3D Alek bioprinter for microtia at Sydney hospital  #3dprinting https:// oprinter-sydney/ …,0,0,0,0
Charles Russo,@Charles_M_Russo,2019-03-01T17:21:20.000Z,"Global  3D Printed  Medical Devices Market 2019- FabRx, Cyfuse Biomedical, Stratasys - Industry Daily Observer  https:// ted-medical-devices-market-2019-fabrx-cyfuse-biomedical-stratasys/26543/ …",0,0,0,0
Zmorph SA,@Zmorph3d,2019-03-01T15:15:06.000Z,You can make beautiful and unique cakes with a  3D printer . Learn more:  https:// #3Dprinting,0,1,2,0
Bidnet Direct by SOVRA,@BidNetDirect,2019-03-01T20:01:32.000Z,"Arizona Purchasing Group  #OpenBid  Statewide: ""Large-Format  3D Printer "" | See more details:  http://",0,0,0,0
Select Residential,@SelectREBRKG,2019-03-01T17:31:30.000Z,"How ICON Is Building the $4,000  3D-Printed  Homes of the Future  http://",0,0,0,0
EPISD Instr. Tech.,@EPISD_InstrTech,2019-03-01T20:25:52.000Z,"RT:TCEA: RT rrodgers: Not to rush you or anything, but the deadline to register for the 2019  #TCEA  3d Design Contest is TODAY, so... No  3D printer  required, btw!   https:// ts/3d/ … #3DDesign #MakerEd #EdTech",0,0,0,0
Pir Arkam,@PirArkam21,2019-03-01T15:24:36.000Z,Check out my recent new  3D Printed  project  https:// HssjM …,1,1,0,0
CAM Contracting of Orlando,@camcontracting,2019-03-01T17:01:03.000Z,"A brief history of  #concrete : from 10,000BC to  3D printed  houses -  http://",0,0,0,0
Celtic3d,@celtic3d,2019-03-01T14:48:42.000Z,Back from our travels and already beavering away on several client's projects.  Really interesting to check out the state of  3d printing  in Asia.,0,0,0,0
3DHEALS,@3dheals,2019-03-01T19:11:54.000Z,Australian researchers research feasibility of  3D printed  ankle/foot orthotics for functionality & comfort  @Sydney_Uni #3dprinting #AFO #medicalimplants #healthcare #technology #innovation #JoinTheTribe https:// https://,0,0,0,0
SARATECH,@Saratech,2019-03-01T19:01:00.000Z,"Join us for our upcoming Solutions Webinar: How to Incorporate  Additive Manufacturing  into Product Development to Save Time and Reduce Costs.

Register Here:  https:// 55387168764418 …",0,0,0,0
Eric Lauwers,@eric_lauwers,2019-03-01T18:27:06.000Z,"A brief history of concrete: from 10,000BC to  3D printed  houses.  #Concrete , the most destructive material on the planet.  https:// b/25/a-brief-history-of-concrete-from-10000bc-to-3d-printed-houses … #SDGs",0,0,0,0
Vincent Brissot,@VincentBrissot,2019-03-01T18:12:00.000Z,Black Panther's Oscar-winning costumes include  3D-printed  designs. https://,0,0,0,0
