Author Name,Author ID,Date,Post Text,Replies,Likes,Reshares,Views
"Foshan Han Yu Technology Co., Ltd.",@uci2lfMkl9oR0yC,2019-12-24T02:25:14.000Z,Show our lab and our production lines for  3d printing  wax.,0,0,0,0
SOLIDWORKS Education,@SOLIDWORKSedu,2019-12-23T23:00:02.000Z,"Virginia Beach City Public Schools have implemented  Additive Manufacturing  within their Engineering Technology classrooms at the Virginia Beach Advanced Technology Center! Come check out this session on Monday, Feb 10 at 10:30 am.  #3DXW20 http://",0,5,0,0
Diacrítica Consultores,@diacriticacon,2019-12-24T01:35:00.000Z,This office building in Dubai was completely  3D printed  — Future Blink  https:// #tech  via  @mashable,0,0,0,0
Pseudo Pharm,@PseudoPharm,2019-12-23T17:34:14.000Z,Introducing our new  3D printed  pieces by @khronickreatio1,0,3,2,0
Free America Network,@stand_4_america,2019-12-23T20:24:43.000Z,Meet the ‘crypto-anarchist’ behind  3D-printed  guns Cody Wilson fired the shot heard around the internet in 2013  http://,0,0,0,0
3D Printing Fans,@3DPrintingFans,2019-12-23T18:38:00.000Z,"State of the Art: Carbon Fiber  #3DPrinting , Part Two https:// f-the-art-carbon-fiber-3d-printing-part-two/ …",0,0,0,0
Mitchell and Son Additive Manufacturing LTD,@MitchellandSon1,2019-12-23T23:18:03.000Z,spinner  http://,0,0,0,0
Vision Miner,@VisionMiner,2019-12-23T18:27:01.000Z,3D Printing  May Revive Old Military Aircrafts:  https://,0,3,0,0
FFJournal,@FFJournalUpdate,2019-12-23T21:00:26.000Z,"Thanks to design flexibility,  3D printed  metal parts can be produced for every application from aerospace to medical. However, AM’s unique designs come with a hitch  http:// @engineeringcom",0,0,0,0
Bluella Deville,@Hihyasmei,2019-12-23T22:04:37.000Z,I wanna play with a  3D printer,0,2,1,0
3d print,@Best3dprint,2019-12-23T18:16:15.000Z,|  #3dprint  | Could  3D Printing  Save The Automotive Industry?  https:// http://,0,0,0,0
3D Printing News,@3DPrintGirl,2019-12-23T19:26:00.000Z,"Tantalum metallurgical products provider Global Advanced Metals will be sponsoring, and exhibiting at, our  Additive Manufacturing  Strategies summit in Boston this February. #3Dprinting https://",0,0,0,0
Infinite Loop,@InfiniteLoopBhx,2019-12-23T17:57:32.000Z,3D Printed  Mockup Allegedly Leaks Design of Apple's Next Generation iPhone [Video]  http://,0,0,0,0
CNBC,@CNBC,2019-12-24T03:40:00.000Z,This floating robotic factory is using  3D printing  to colonize space.  http://,3,23,14,0
Jon Coughlin,@ClickToZoom,2019-12-23T23:43:18.000Z,"I  3D-printed  a faceplate and stand for the  #MiniMeatball  - the first in a series of DIY desktop instruments you can hook up to my games via USB. Electronics available on Amazon, Arduino code and CAD files on GitHub. Early stages of development, but promising :)",0,5,0,0
bubbleistrouble,@bubbleistrouble,2019-12-23T18:33:46.000Z,3D printed  cap makes abundent slimy bubbles,0,0,0,0
Durham 3D Printing,@durham3dprint,2019-12-23T20:00:06.000Z,Lone Man at the Waterfront (Redbubble) https:// /works/40207775-lone-man-at-the-waterfront?asc=u … #Camping #outdoors #pencil #art #redbubble #lake #waterfront #beach #sketch,0,0,0,0
Jöey,@Kapitan_Joey,2019-12-23T19:13:16.000Z,Time to return to my Coding and  3D Printing  lessons...,0,0,0,0
The Homicidal Homemaker,@HomicidalKaci,2019-12-23T17:24:36.000Z," I haven't even officially launched my baking line & saw this comment on a shared post of one of my designs, mentioning how they wanted to buy it:

""I have a  3D printer  & can make for you""

A design I digitally created, 3D modeled, prototyped, & put into semi mass production.",2,15,2,0
3D Innovations,@3D_Innovations,2019-12-23T18:15:02.000Z,"How  3D printing  will transform  #manufacturing  in 2020 and beyond  https:// We’re headed for mixed-materials printing, surfaces innovation, and greater use of software and data management. #3Dprinting #additivemanufacturing #engineering #design #innovation",0,0,0,0
Julie Trzecki,@jtrzecki,2019-12-23T23:53:43.000Z,Beyond excited to know a  3D printer  is heading my way after break!  @HumbleISD_HHE  @HumbleISD_DL,0,9,1,0
The 3D printing belgian #FreeThe3DPGeneral,@3DPBelgian,2019-12-23T19:41:18.000Z,I am sorry but LOL WHAT?,2,4,0,0
Gary McLaughlin,@gtmcl,2019-12-24T03:36:05.000Z,"Super contest to win a  3D printer Try your luck it's free;)
Share and multiply your chances of winning  https://",0,0,0,0
3d Printing and Painting 3DHP,@JERRY_3DHP,2019-12-23T20:32:12.000Z,Not a better time to download and Stream with Family and Friends or go Live online..FREE and Paid versions.,1,2,0,0
Wizebaï Store,@wizebaistore,2019-12-23T19:12:54.000Z,Isn`t it awesome? #GOTTAHAVETHIS  Useful Art Supplies Drawing Tool Multi-shaped Silicone Design Mat For  3D Printing  Pen  https:// FREE Shipping to Canada & the United States!!!  Get it here --->  https:// m/product/useful-art-supplies-drawing-tool-gift-multi-shaped-silicone-design-mat-create-3d-objects-for-3d-printing-pen-basic-template/ …,0,0,0,0
AthexTube - BoardGames and 3D Printing,@athextube,2019-12-24T02:10:03.000Z,Liked on YouTube: Funkoverse Strategy Game: Golden Girls 2-Pack – Rose and Blanche - Unboxing - 4K  https://,0,0,0,0
Deanna Johnson,@DeannaDaisy,2019-12-23T22:00:01.000Z,How would you feel about having a  3D printed  heart implanted in your child? Survey reveals parents’ attitudes toward new health technologies  https://,0,0,0,0
Nation Rodera 3D Printing Studio Arts,@rodera3d,2019-12-24T03:37:45.000Z,HAPPY HALLOWEEN @vertagear @DarkContrEU @Jerkypro   @galvanisedGrips @Dashthreads  @ItsBuildABear  @MLEsportsGG @rsconfederation @UnitedRogue  @NGEN_FloridaMan @NGeniusGaming1 @xBigBeezyx @TeamProlific_ @MTMeSportsGG  @Vertagear @MethodSupps,0,2,1,0
Weldtool,@weldtool2,2019-12-23T23:28:19.000Z,Talking with HP’s head of metal  3D printing https:// #weldnews #weldingnews #blog #weld,0,0,0,0
3d Printing and Painting 3DHP,@JERRY_3DHP,2019-12-23T17:20:57.000Z,"I Wanted to Wish All my Friends
Merry Christmas.
I Hope Santa brings you everything you wanted..
Ho Ho Ho...",1,3,0,0
Instant Time Deals,@InstantTimeDeal,2019-12-23T21:13:13.000Z,"ad: HATCHBOX Magic Stone PLA  3D Printer  Filament, Dimensional Accuracy +/- 0.03 mm, 1 kg Spool, 1.75 mm, Gray -  https:// #3DPrinting",0,0,0,0
The 3D printing belgian #FreeThe3DPGeneral,@3DPBelgian,2019-12-23T19:43:19.000Z,"Boyo taking a nap on me while im shopping  3D printer  stuff and tori is getting her hair done. Also endless super. Simple. Songs.

If I see one more version of baby shark I will scream",0,0,0,0
3DPrint,@3DPrint_com,2019-12-23T20:32:00.000Z,"Additive Orthopaedics, LLC. is another of the great companies exhibiting at our upcoming  Additive Manufacturing  Strategies event in February, which will focus on the business of  #3Dprinting  in metals, medical, and dentistry. https://",0,0,0,0
Lux Art Institute,@luxartinstitute,2019-12-23T19:00:58.000Z,"Art, smiles and memories, register your young artist today!   3D Printing , ceramics, and more. http:// #encinitas #luxart #artclasses #artsmiles  @ Lux Art Institute",0,0,0,0
USSROVER,@USSROVER,2019-12-23T23:05:35.000Z,"Super contest to win a  3D printer Try your luck it's free;)
Share and multiply your chances of winning  https://",0,0,0,0
☾༺ℓυa༻☽cazavampitos// ENCARGOS 3D OPEN,@Puchiluh,2019-12-23T21:28:13.000Z,Suelo ser de esas que se ponen vídeos de granos para aliviar el TOC hasta que el estómago no puede más.,1,6,0,0
Vision Miner,@VisionMiner,2019-12-23T19:43:00.000Z,Nano Tech +  3D Printing  = Stronger + Lighter https://,0,5,0,0
JZKitty Gaming,@JZKitty,2019-12-23T22:16:20.000Z,This is the way!,2,11,1,0
Leonel Castellano (LaczPro19),@Lacz19,2019-12-23T22:14:33.000Z,Do you guys remind about that guy  3D printing  an Aventador with his son? Lamborghini is taking the cake this Christmas!  https://,0,0,0,0
3D Printing News,@3DPrintGirl,2019-12-23T20:32:00.000Z,"Additive Orthopaedics, LLC. is another of the great companies exhibiting at our upcoming  Additive Manufacturing  Strategies event in February, which will focus on the business of  #3Dprinting  in metals, medical, and dentistry. https://",0,0,0,0
3DLT.com,@3dtemplates,2019-12-23T18:41:03.000Z,3D Printing  Industry Review of the year: January 2019  http://,0,0,0,0
JZKitty Gaming,@JZKitty,2019-12-23T20:17:19.000Z,"Don't you HATE when a hashtag sounds SO cool to be true, and it ends up being some shitty thing? We want the OG good old days of RARE to be back !!!!! Let's change the meaning of the hashtag  #RareIsComing  to what it should really be #BanjoKazooie #Conker",0,2,0,0
mikaella balos,@mikaellabalos,2019-12-24T00:13:45.000Z,this has the same energy as when  @sydortiz 3D printed  her head on yoshis body lmaoooo,2,59,0,0
Sintavia,@SintaviaAM,2019-12-23T18:40:38.000Z,"Our fearless leader, Brian Neff, recently gave a TEDx Talk that focused on the significant environmental benefits of  additive manufacturing . Check out the video here!  #TEDx #TEDxTalk #TED #BrianNeff #AdditiveManufacturing #IndustrialEcology https://",0,0,0,0
ZombieBaconDLX,@MJSettlesII,2019-12-23T18:54:50.000Z,"State of the Art: Carbon Fiber  3D Printing , Part Two https://",0,0,0,0
HarfordCC,@HarfordCC,2019-12-23T21:10:10.000Z,"1st yr engineering students worked with Volunteer Medical Engineering to design activity board for a little girl who is both blind and quadriplegic. Interviews, building and re-building prototypes and  3D printing  led to success and sense of fulfillment.  #MakeUsProud",0,0,0,0
THE WORST GENERATION®,@BLOTTERBABY,2019-12-23T19:28:31.000Z,i need a  3d printer  asap,0,0,0,0
luis_bivar,@luis_bivar,2019-12-23T23:54:06.000Z, on  @YouTube : Simple way to make your  3d printed  parts looks Amazing  https://,0,0,0,0
3DPrint,@3DPrint_com,2019-12-23T18:57:34.000Z,Advanced  #3Dprinting  materials company FibreTuff will be exhibiting at our  Additive Manufacturing  Strategies summit in Boston this February.  https://,0,0,0,0
AneesTech,@AneesTechno,2019-12-24T03:06:19.000Z,This office building in Dubai was completely  3D printed  — Future Blink  https:// ilding-in-dubai-was-completely-3d-printed-future-blink/ …,0,0,0,0
3D Printing News,@My3DPrinting,2019-12-23T19:18:00.000Z,Advanced  #3Dprinting  materials company FibreTuff will be exhibiting at our  Additive Manufacturing  Strategies summit in Boston this February.  https://,0,0,0,0
⃤,@notagiggalo,2019-12-23T21:09:18.000Z,This is why I need a  3d printer,0,0,0,0
bubbleistrouble,@bubbleistrouble,2019-12-24T01:13:22.000Z,"3D printed  trash can makes humongous, ephemeral bubbles",0,0,0,0
Fabbaloo,@fabbaloo,2019-12-23T19:03:04.000Z,Admatec's New and Larger  3D Printer https:// #3DPrinting #AdditiveManufacturing,0,0,0,0
Adam from 1UPcard,@1UPcard,2019-12-24T03:16:33.000Z,What I’m  3D printing  tonight.,0,3,0,0
Mitchell and Son Additive Manufacturing LTD,@MitchellandSon1,2019-12-24T02:18:32.000Z,Japanese Doll III (ningyo 3) 人形 multiple color  http://,0,0,0,0
Embodi3D,@Embodi3D,2019-12-24T00:00:31.000Z,"Embodi3D has a  3D printing  service, but typically we cannot print models that are greater than about 40 cm in maximum dimension. There are a few options. http://",0,0,0,0
HealthySimulation.com,@HealthySim,2019-12-23T18:11:47.000Z,"If  3D printing  can build a house, what else can it do in  #healthcare ?  https://",0,0,0,0
Trần Việt Long,@tvlong99,2019-12-23T21:00:16.000Z,Maybe I should start  3D printing  a Bugatti on my own...  https:// -lam-sieu-xe-bang-may-in-3d-cho-con-trai-da-duoc-lamborghini-tang-mot-chiec-aventador-xin.3050608/ …,0,0,0,0
Inner-City Arts,@InnerCityArts,2019-12-23T19:00:53.000Z,"Your kind friendship and support has empowered thousands of children to explore art in our safe oasis in Skid Row!

To thank you, we have student-designed, Creativity Lab robot wallpapers available.  https:// rs/ … Donate by 12/31 to enter a drawing for a  3D-printed  bot!",0,0,0,0
Valerie Hite,@vogueandcoffee,2019-12-24T01:53:10.000Z,New Story's first  3D-printed  houses are now complete  https:// orlds-first-3d-printed-neighborhood-now-has-its-first-houses?partner=apartmenttherapy …,0,0,0,0
The Rotting Root Lord,@ThisMusTake,2019-12-23T23:03:48.000Z,I want a  3D printer  so bad,0,0,0,0
Paul Cumber,@bigman4021,2019-12-23T20:54:49.000Z,My Christmas  three I  3d print  with my monoprice mp select mini  3d printer  with 230 nozzle  bed 60 layer high 4,0,0,0,0
Angel Iglesias Otero,@angeligleote,2019-12-23T21:45:49.000Z,Anatomics proves viability of  3D printed  surgical guides  https:// -proves-viability-of-3d-printed-surgical-guides-166599/?utm_source=twitter&utm_medium=social&utm_campaign=social-pug …,0,0,0,0
bubbleistrouble,@bubbleistrouble,2019-12-23T17:42:26.000Z,"3D printed  trash can makes fat, juicy bubbles",0,0,0,0
Merixxa,@WoWMerixxa,2019-12-23T21:25:19.000Z,I finished my Murloc project!  3D printed  figure and base. Base cased in brown resin with some blue resin for the water. Turned out better than I hoped for!!  #3Dprinting #3Dart #worldofwarcraft #murloc,0,2,0,0
Noel Skum,@skum_noel,2019-12-23T23:43:51.000Z,Idea for an invention: a  3D-printed  chainsaw that lifts cement. If you don't like it you're a nazi.,0,0,0,0
3D Printing News,@3DPrintGirl,2019-12-23T18:04:00.000Z,From design to reality: Windform Composite Materials to Go Beyond  #3DPrinting . Download the  @CRP_Group  whitepaper here:  https:// -whitepaper-registration-page/ … https:// sign-to-reality-windform-composite-materials-to-go-beyond-3d-printing/ …,0,0,0,0
KnightMadDragon $MON,@Jason_Chi7,2019-12-23T18:04:33.000Z,"Today's featured product - Flamingo  3D Printing  Drawstring Backpack. Available at:  http:// ngo-3d-printing-drawstring-backpack?utm_source=twitter&utm_medium=publishing&utm_campaign=random_product&utm_content=text_and_media&utm_term=b1358fe0188b50fc3690dbbe … .
Posted via SumAll  https:// tm_source=twitter&utm_medium=publishing&utm_campaign=random_product&utm_content=text_and_media&utm_term=b1358fe0188b50fc3690dbbe …",0,0,0,0
bubbleistrouble,@bubbleistrouble,2019-12-24T02:24:00.000Z,3D printed  trash can makes abundent fleeting bubbles,0,0,0,0
Nation Rodera 3D Printing Studio Arts,@rodera3d,2019-12-24T03:33:26.000Z,HAPPY CHRISTMAS   @Mad_Zeus @JohnnyGuyzer  @UGM_livestreams @afflixtions @wattsonpaquette @iSkyLines @BDG_eSports  @telliPUBGM  @PUBGMOBILE @BlueDragonGame  @DarkContrEU @JerkyPro @GalvanizedGrips @Vertagear @ezthe_don @fadegrips  @ittzFranknstein   #ApexLegends @TheRogueEnergy,0,5,1,0
Dan Waterman,@_danwaterman_,2019-12-23T19:09:03.000Z,"My first ever  3D print  has worked perfectly  The Elegoo Mars is a great printer!
.
.
. #3dprinting #3dprinted #3dprint #elegoo #elegoomars #resin #resinprinting #rook #elegoorook @elegoo_official https://",1,7,1,0
SolanoCollege,@solanocommcolle,2019-12-24T02:45:28.000Z,"Are you ready to change your dreams from 2D to reality?

Learn everything from  3D printing  to hydraulics at SCC!

Classes start January 13, 2020

If you’re ready to apply, go to  http:// Or use this link find your classes: https:// _finder.p_basic_search …",0,0,0,0
Sparkplug the fox,@sparkplugthefox,2019-12-23T19:52:44.000Z,"I'm putting this handsome guy up for sale! Reduced price because I need him to move people!

22in,  3D printed  eyes, great ventilation, good sight must go!

Price 250$ USD",0,0,0,0
Durham 3D Printing,@durham3dprint,2019-12-23T18:00:06.000Z,200-card Deck & Dice Box for Magic: The Gathering & other TCGs https:// mizeable-companion-crate-durable-deck-dice-box … #3dprinted #MTG #M :TG  #MagicTheGathering #TCG #pokemon #yugioh #CCG,0,0,0,0
Connor Morrison,@SEEMOREDigital,2019-12-24T02:36:03.000Z,This office building in Dubai was completely  3D printed  — Future Blink  http://,0,0,0,0
3D Printing @𝟑𝐃𝐚𝐛𝐥𝐞,@3Dable,2019-12-23T21:43:10.000Z,FA > Five Unending Myths About  3D Printing  >  http:// #3DP #3Dprinting #3Dprinter #Prototyping #RapidPrototyping #AdditiveManufacturing,0,0,0,0
Asianwebshops,@asianwebshop,2019-12-23T20:28:06.000Z,#flashdeal #product  10pcs/lot  3D Printer  Nozzle Mixed Sizes 0.2mm/0.3mm/0.4mm/0.5mm Print Head For 1.75MM filament MK8 nozzle  http:// 442&a=258169&u=https%3A%2F%2Fwww.aliexpress.com%2Fitem%2F10pcs-lot-3D-Printer-Nozzle-Mixed-Sizes-0-2mm-0-3mm-0-4mm-0-5mm-Print%2F32246531754.html …,0,0,0,0
AdditiveMfgUG,@AdditiveMFGUG,2019-12-23T17:20:05.000Z,Are you a student or educator with a passion for  additive manufacturing ? AMUG is accepting Scholarship Applications -  apply today!  http:// #AMUG2020 #3DPrinting,0,3,2,0
duchgroup,@duchgroup1,2019-12-23T19:00:05.000Z,"http:// ell-to-the-cold-3d-printing-soft-octopus.html … 3D printing  technology, which belongs to a kind of rapid prototyping technology, it is a digital model of a file, the use of powdered metal or plastic material can be bonded to construct an object la",0,0,0,0
Steven Williams,@fluidicsandpneu,2019-12-23T21:21:49.000Z,"A comparison of continuous fiber, chopped fiber filled nylon and Stratasys Nylon 12CF and when it's best to use them while  3D printing  parts or prototypes.
By Juan Carlos Gandiaga at TriMech  @TriMech3D http:// #3dprinting #composites #compositematerials",0,0,0,0
MeToo Zoo,@metoozoo,2019-12-23T23:39:29.000Z,Men's Hooded Sweatshirt Casual  3D Print  Hooded Party Long Sleeve Hoodie Blouse Top Sweatshirt -  https:// ed-sweatshirt-casual-3d-print-hooded-party-long-sleeve-hoodie-blouse-top-sweatshirt/ … #metoo #timesup #news,0,0,0,0
CGI Motion,@cgi_motion,2019-12-23T19:02:01.000Z,3D printed  home neighborhood in rural Mexico is the first in the world:  https://  via  @USATODAY #3dprinting,0,0,0,0
China Tech,@ChinaTechFR,2019-12-23T17:54:03.000Z,#Alfawise  U50 DIY  3D Printer  3.5 inch ...  #BonPlan #Deal #Deals #Discount #Gearbest #Imprimante3d #Promotion https:// rbest/alfawise-u50-diy-3d-printer-3-5-inch-touch-screen-black-eu-plug-176-98e/ …,0,0,0,0
al,@alpal_lol,2019-12-24T03:22:35.000Z,My uncle excused himself from dinner bc he has to go see his  3D printing  guy across town...so he can get war game figurines? I wish he just told us he was going to buy drugs,0,23,1,0
SooToday.com,@SooToday,2019-12-23T22:34:02.000Z,"BEYOND LOCAL: Here's some of the biggest medical breakthroughs of the last decade: Gene editing,  3D-printed  prosthetics and ebola vaccines and treatments are just some of the major breakthroughs of the last ten years  https:// /beyond-local-heres-some-of-the-biggest-medical-breakthroughs-of-the-last-decade-1982462?utm_source=dlvr.it&utm_medium=twitter …",0,0,0,0
eshop2018,@eshop2018,2019-12-23T18:28:57.000Z,Check out Premium  3D Printer  Filament 1kg/2.2lb 1.75mm 3mm PLA ABS PETG TPU Wood MakerBot   https://  via  @eBay,0,0,0,0
Not A Games Dev Ollie,@Reksaurian,2019-12-23T19:53:18.000Z,Legend Has It (OC)  https://,0,0,0,0
Sandra,@11111_sandra,2019-12-23T23:45:43.000Z,Damn the  3D printer  is cool.   @leximartone #Unpolished,0,0,0,0
Mike Wazowski,@iWazowski,2019-12-23T19:12:32.000Z,"3D Printed  Mockup Allegedly Leaks Design of Apple's Next Generation iPhone [Video]: A  3D printed  mockup that allegedly reveals the design of Apple's next generation iPhone has surfaced online, reports Macotakara. The site obtained what is purportedly a…  http://",0,0,0,0
3D Printing Industry,@3dprintindustry,2019-12-23T21:01:09.000Z,3D Printing  Industry Review of the year: February 2019 -  http://  -  #3dprinting @UCBerkeley @Evonik @Xerox,0,2,2,0
bubbleistrouble,@bubbleistrouble,2019-12-23T22:53:39.000Z,"3D printed  cap makes big, slimy bubbles",0,0,0,0
Jennifer,@jennipostedthat,2019-12-24T01:35:29.000Z,i want a  3D printer,0,0,0,0
Andy Bradford,@andycb,2019-12-23T20:11:20.000Z,So. I bought a  3D printer ..,0,0,0,0
3D-Printer.com,@DelraySystems,2019-12-23T18:01:03.000Z,"The BigRep GmbH - Large-Scale 3D Printers Studio G2 has a fast-heating print bed and a temperature-controlled chamber!

Call our office TODAY at 248-218-1916 to learn more information about how this  #3Dprinter  can benefit your organization! #BigRepStudioG2 #heatingprintbed",0,0,0,0
☆,@stvrgirlscars,2019-12-24T02:21:41.000Z,I want a  3D printer,0,0,0,0
wide eyes,@FUTONDlSCO,2019-12-23T22:55:48.000Z,alright I’m gonna save up for a  3D printer,0,3,0,0
3D Printing News,@3DPrintGirl,2019-12-23T18:16:48.000Z,"State of the Art: Carbon Fiber  #3DPrinting , Part Two https:// f-the-art-carbon-fiber-3d-printing-part-two/ …",0,1,2,0
KnightMadDragon $MON,@Jason_Chi7,2019-12-23T21:00:19.000Z,"Today's featured product - Flamingo  3D Printing  Drawstring Backpack. Available at:  http:// ngo-3d-printing-drawstring-backpack?utm_source=twitter&utm_medium=publishing&utm_campaign=random_product&utm_content=text_and_media&utm_term=b1358fe0188b50fc3690dbbe … .
Posted via SumAll  https:// tm_source=twitter&utm_medium=publishing&utm_campaign=random_product&utm_content=text_and_media&utm_term=b1358fe0188b50fc3690dbbe …",0,0,0,0
JAW Studio,@jawstudiony,2019-12-24T01:28:34.000Z,EXO collection mentioned in  @3dprintindustry  ‘s SLICED newsletter about the latest in  3D printed  fashion ,1,2,1,0
John Craig,@jccraig,2019-12-23T18:26:43.000Z,"Python for  3D Printing  ( #Kindle ), Using  #Python  to enhance the power of  #OpenSCAD  for  #3D -modeling  https:// #OpenSCAD #coding #makerspace #Python #amazon",0,0,0,0
Mitchell and Son Additive Manufacturing LTD,@MitchellandSon1,2019-12-23T20:18:34.000Z,Anet A8 Y axis Idler  http://,0,0,0,0
Montrealtimes,@mtltimesnews,2019-12-23T22:20:22.000Z,Rochambeau Middle School wins  3D printer https:// dle-school-wins-3d-printer/ …,0,0,0,0
Wizebaï Store,@wizebaistore,2019-12-23T19:02:02.000Z,Who likes it? WOW #BESTDEALS  Ender-3  3D Printer  DIY Kit V-slot I3 FDM Technology MK10 Extruder 220x220x250mm PLA TPU ABS  https:// FREE Shipping to Canada & the United States!!!  Buy one here--->  https:// m/product/ender-3-3d-printer-diy-kit-v-slot-i3-fdm-technology-mk10-extruder-220x220x250mm-size-3d-continuation-printer-pla-tpu-abs-resum/ …,0,0,0,0
"PrintLink Graphic Arts Placement Service, LTD",@printlinktalent,2019-12-23T18:44:34.000Z,"Happy Holidays to everyone! Thinking of giving back to the communities, did you know how much  3D printing  can change the world? Watch this amazing story at  https:// ZoB-I … #HappyHolidays #SeasonOfGiving #GiveBack #3Dprinting #Changetheworld",0,0,0,0
ViewEyewear,@ViewEyewear,2019-12-24T02:37:25.000Z,3D Printed  and ECO friendly material.   #ecofriendly @neubaueyewear #eyewearfashion #eyeweartrends #luxuryglasses #eyewear2020 #luxuryaccessories #eyewearfashion2020 #eyeweartrends2020 …  https:// ?igshid=u06ftogi3c4w …,0,0,0,0
Concept Albums,@ConceptAlbumBot,2019-12-23T23:19:50.000Z,Quill Azalea are due to release a  3D printed  concept album!  Beautiful new musical boundaries with Punk rock Southern rock!,0,0,0,0
Bradley Jon Eaglefeather,@bjeaglefeather,2019-12-23T22:02:33.000Z,"3D Printing  Ind  3D Printing  Industry Review of the year: February 2019: The month of February 2019 saw conferences such as SOLIDWORKS 2019 and TCT ASIA in Shanghai,…  http://  Via  @3dprintindustry #3DPrinting #blog #news #3Dscanning #applications #breakthroughs",0,1,4,0
John E,@Stubby0207,2019-12-24T05:06:12.000Z,"My computer is getting a workout tonight. Watching Tweetdeck, making and post gifs of Jimmy,  3D printing , watching Jimmy on the Bunker Cam, harassing Jason with bad Maple Syrup posts, and typing with one hand and having a GT in the other. @JChurchRadio @jason_quitt #f2b",1,5,1,0
3D Printing Fans,@3DPrintingFans,2019-12-23T17:50:00.000Z,Testing Chemical Modifications and In-Vitro Biological Properties in FDM  #3DPrinting https:// -chemical-modifications-vitro-biological-properties-fdm-3d-printing/ …,0,0,0,0
3D Print .com,@3DPrintBoard,2019-12-23T20:05:24.000Z,State of the Art: Carbon Fiber  #3DPrinting  Part Three https:// f-the-art-carbon-fiber-3d-printing-part-three/ …,0,0,0,0
Kevin,@a90kevin,2019-12-24T04:21:18.000Z,Someone buy me a  3D printer,0,0,0,0
Cindy Smrt,@SmrtCindy,2019-12-23T21:11:21.000Z,now •   3D printing  is an evolving technology that is playing an important role in women’s healthcare. MFM specialists & OB/GYNs are using it to enhance patient care through bonding & clinical education. Learn more here.   https:// #3Dultrasound,0,0,0,0
3DHEALS,@3dheals,2019-12-24T03:09:33.000Z,Artificial intelligence and  3D printing @3dheals #3dprinting #ArtificialIntelligence #AdditiveManufacturing #SLA #technology #Photopolymer #innovation #JointheTribe https:// https://,1,0,1,0
Africa Updates,@africaupdates,2019-12-24T00:40:51.000Z,Is  3D printing  the future of battery design? - via  @techreview https:// -printing-the-future-of-battery-design/?utm_campaign=site_visitor.unpaid.engagement&utm_source=twitter&utm_medium=social_share&utm_content=2019-12-24 …,0,0,0,0
,@_marinnaa,2019-12-23T23:32:28.000Z,Think I want a  3D printer  for Christmas ,0,0,0,0
Carles Dijous (AAlb),@carlesdijous,2019-12-23T17:23:00.000Z,"Evolve Additive CEO says  #3Dprinting  industry ""has been waiting for something like STEP"". Steve Chillscyzn during a press conference on the company’s new STEP (Selective Thermoplastic Electrophotographic Process)  3D printing  technology...  http://",0,0,0,0
Iarla Byrne,@iarlabyrne,2019-12-23T21:22:02.000Z,World's largest  3D-printed  building completes in Dubai  https://,0,0,0,0
Mitchell and Son Additive Manufacturing LTD,@MitchellandSon1,2019-12-23T23:18:04.000Z,Tabletop Terrain Window and Doorway  http://,0,0,0,0
3D Printing Fans,@3DPrintingFans,2019-12-23T20:11:15.000Z,"Additive Orthopaedics, LLC. is another of the great companies exhibiting at our upcoming  Additive Manufacturing  Strategies event in February, which will focus on the business of  #3Dprinting  in metals, medical, and dentistry. https://",0,0,0,0
Fabbaloo,@fabbaloo,2019-12-23T19:03:06.000Z,Could  3D Printing  Save The Automotive Industry?  https:// #3DPrinting #AdditiveManufacturing,0,1,3,0
