Author Name,Author ID,Date,Post Text,Replies,Likes,Reshares,Views
Bioengineer.org,@bioengineerorg,2019-05-22T20:18:45.000Z,NTU Singapore develops technology that can  3D-print  a bathroom unit within a day  https://,0,0,0,0
Sandvik,@SandvikGroup,2019-05-22T19:52:54.000Z,Welcome to our  #Sandvik  booth 727 at  #RAPIDevent  and meet our AM and metal powder experts. Come and see the world’s first  3D printed  diamond composite and our new products.  #AdditiveBySandvik #AdditiveManufacturing .  http://,0,4,0,0
SpaceFactory,@spacefactory_ai,2019-05-22T19:04:03.000Z,"The most dramatic final minutes on the NASA  3D Printed  Habitat Challenge! If you want to know how it played out, watch it here:  https:// pJufs&t=22s …",0,14,6,0
accesoriesmodern,@accesoriesmoder,2019-05-22T21:14:17.000Z,"Renishaw and Identify3D protect metal <b> additive manufacturing </b> processes with upgraded software ...  https:// ishaw-and-identify3d-protect-metal-additive-manufacturing-processes-with-upgraded-software/ …  source: advanced manufacturing today same now&#013;
UK-based additive manufacturing administración",0,0,0,0
bubbleistrouble,@bubbleistrouble,2019-05-23T02:22:40.000Z,"3D printed  trash can makes big, shinny bubbles",0,0,0,0
The William Wagner,@WiJoWa,2019-05-22T20:19:45.000Z,Cura Top Layer Ironing - Great  3D Printing  Top Surface Quality  https://  via  @YouTube,0,0,0,0
Oerlikon Group,@OerlikonGroup,2019-05-22T21:50:40.000Z,"Oerlikon businesses have been operating in the US for a long time. Next week we continue to grow in the US when we celebrate the official opening of our new  additive manufacturing  facility in Huntersville, NC  #OerlikonUSA #OerlikonAM",0,5,0,0
John E,@Stubby0207,2019-05-23T03:13:30.000Z,Just experimenting. Won't be able to  3D print  it tonight. 5 hours to print and I have to be up early in the morning to do another acft layout for the Feds in the morning.  @JChurchRadio #f2b,0,6,0,0
technologies4you - T4Y,@t4y_vienna,2019-05-23T01:58:19.000Z,#plasmo  in  #additive #manufacturing https:// ?igshid=f21gn6kexj80 …,0,0,0,0
UKPRwire,@UKPRwire,2019-05-22T23:23:35.000Z,Discover the Fifth Wave: Metal  Additive Manufacturing http://,0,0,0,0
/r/TheLastAirbender,@reddit_TLA,2019-05-22T19:01:30.000Z,Avatar the last airbender  3D printed  Bison whistle : Ebay  https://,0,2,0,0
Joel Telling - 3D Printing Nerd,@joeltelling,2019-05-22T20:41:47.000Z,Chatted with @dopesoner930 from  @MatterHackers  about how they can service the industrial customers!  #3dprinting #RAPIDEvent,0,21,4,0
Brent Chappell,@bpchapp,2019-05-23T02:45:59.000Z,Yves Béhar and New Story Explain How They're Building Homes in the World's First  3D-Printed  Community  https:// ar-new-story-explain-building-worlds-first-3d-printed-community …,0,0,0,0
Britton George,@BuckeyeSquadron,2019-05-22T21:54:00.000Z,"NY Legislature approves bill banning  3D-printed  guns, undetectable firearms  https:// legislature-approves-bill-banning-3d-printed-guns-undetectable-firearms …",0,0,0,0
bubbleistrouble,@bubbleistrouble,2019-05-23T01:12:37.000Z,3D printed  cap makes abundent fleeting bubbles,0,0,0,0
Charles Russo,@Charles_M_Russo,2019-05-22T19:57:27.000Z,NTU researchers develop way to build  3D printed  bathrooms  #3dprinting https:// /ntu-researchers-develop-way-to-build-3d-printed-bathrooms-video-11556082 …,0,0,0,0
Porkshop Express,@MisterAddons,2019-05-22T21:55:10.000Z,(Most patient)  #MiSTer  acrylic customers rejoice: I found a solution for flattening the buttons: a  3D printed  jig and a belt sander. The sanded side goes face down and the flame polished side faces up. This should be the last obstacle.,1,8,1,0
JZKitty Gaming,@JZKitty,2019-05-22T21:01:01.000Z,"THQ Nordic acquires… Gothic creator Piranha Bytes https:// Don't forget to visit, like and share for the best  #Gaming  and  #Tech  News!",0,2,1,0
3DCars,@3Dcarsdotcom,2019-05-22T18:57:03.000Z,XJet Technology Unlocks 5G Network for UDEL; Marvel Medtech Buys XJet Carmel 1400  3D Printer  for Breast Cancer Prevention  http://,0,0,0,0
3DEO,@3DEOinc,2019-05-22T21:06:11.000Z,"Registration is now open for our next LIVE webinar in our educational webinar series. Join us on June 12th at 11am PST / 2pm EST for our next webinar, ""From Powder to Product: Quality in Metal  Additive Manufacturing "". CLICK HERE TO RESERVE YOUR SEAT:  https://",0,0,0,0
beala_ebooks,@beala_ebooks,2019-05-22T19:50:48.000Z,Looked at some algorithms yesterday that I didn't realize  3D printing  isn't mainstream.,0,0,0,0
JCB Plant Online,@JCBPlantOnline,2019-05-22T21:45:55.000Z,Sandvik creates first  3D printed  diamond composite  http://  The advantage is that,0,0,0,0
WorkHands,@WorkHands,2019-05-22T21:30:12.000Z,"Our newest  #ApprenticeshipMonthly  newsletter celebrates  @IrvineFdn  funding awarded to the Chaffey College  @intech_center  in CA for training probrams in additive  #manufacturing , HVAC, welding, and more.",1,3,1,0
Evey Logan,@uthscsa,2019-05-22T20:28:20.000Z,New  3D-printed  technology lowers cost of common medical test  http://,0,0,0,0
Giancarlo Orsini,@orsini70,2019-05-22T23:45:01.000Z,1st Parts from  3D Printer  in Space About to Get a Close-Up (Video)  http:// ws_dettaglio.aspx?idnews=5837 …,0,3,2,0
Hackster.io,@Hacksterio,2019-05-23T02:59:25.000Z,Want to create 3D shapes on a flexible garment? Add custom designs to fabric? Or even reinforce a soft-circuit project? Here are a few techniques to get you started with  3D printing  on fabric!  http://,1,8,4,0
FHSU Makerspace & Makervan,@FhsuMakerspace,2019-05-22T21:59:57.000Z,New display cabinet to hold the  #fhsumakerspace 3d printing  samples.,0,0,0,0
Technivorous,@Technivorous,2019-05-22T23:24:25.000Z,I told my wife i wanted a  3d printer . When i explained what it was she told me i had watched to much sci-fi and i was thinking of the jetsons so I decided everyone must know about 3D Printers! https:// fVJqY4XnWbTUmH3AmQ … #technology #Robotics #Robots #Robot #code #3dprinters #3dart,0,0,0,0
Azure Magazine,@AzureMagazine,2019-05-22T20:15:32.000Z,"The team of  @ICON3DTech ,  @NewStoryCharity , and  @fuseproject  are bringing low-cost  3D printed  homes to an impoverished community in Latin America.  #3Dprinting",0,11,9,0
Christine McDermott,@tecpartnermcd,2019-05-23T01:39:22.000Z,Jabil Inks  Additive Manufacturing  Agreement with Renault F1® Team  https:// jabil-inks-additive-manufacturing-agreement-with-renault-f1-team/2016236060 …,0,0,0,0
Eight Banal,@Eight_Banal,2019-05-22T21:41:53.000Z,"Philip Nitschke's  3D-printed  ""death pod"" lets users die at the press of a button",1,1,0,0
Sarah Rimini,@sarahrimini3d,2019-05-22T19:35:15.000Z,Women in  3D printing  panel happening NOW at SME Zone. Packed house!!!!  @AmyAlexanderMC   is reppping our medical 3DP community!!!,0,13,2,0
3D Printing Industry,@3dprintindustry,2019-05-23T02:37:05.000Z,Turning  #3Dprinting  on its side  @3dque #RAPIDevent,3,11,4,0
Dave Fay,@DFDentalcompare,2019-05-22T20:38:30.000Z,New Dental Products: Veriguide OS  3D Print  Resin and UViTRON INTELLIRAY UV Curing System from Whip Mix | Dental News  https:// w-Dental-Products-Veriguide-OS-3D-Print-Resin-and-UViTRON-INTELLIRAY-UV-Curing-System-from-Whip-Mix/ …  via  @Dentalcompare,0,0,0,0
Lucky Dawg,@LuckyDawg11,2019-05-22T20:13:47.000Z,"3D Printed  Vienna Giant Wheel @ DeLand, Florida  https:// ?igshid=g9f2txoza5yj …",0,0,0,0
bob lee,@pehelpblog,2019-05-22T23:43:18.000Z,3D-printed  device detects biomarkers of preterm birth  http://,0,0,0,0
Kim Lewis,@kim_sachse,2019-05-22T20:11:38.000Z,"Attending a  @SiemensUSA  event at  @DrPhillipsCtr , and listening to their CEO talk about  3D printing  this motorcycle.  #AmazingTechnolgy",0,0,0,0
Mallorie,@SchonMB,2019-05-22T23:55:58.000Z,First design &  3D print  for my broken screen door bracket. My roomie/brother @keenanschon designed and printed it himself.  #engineering #purduegrad #braggingbigsister https:// G6PXOrHu7vMp0sKWlUpqfN6u-Q0/?igshid=1qbfb7p0qhqpl …,0,0,0,0
Charles Russo,@Charles_M_Russo,2019-05-22T22:54:27.000Z,Parley X Adidas AlphaEdge 4D Drops Next Week: Detailed Photos  #3dprinting https:// s-alphaedge-4d-drops-next-week-detailed-photos-news.80971.html …,0,0,0,0
Rick N. Tumlinson,@RocketRick,2019-05-23T02:35:03.000Z,"With a  #RealityRating  of 6 via  @SpaceFundInc ,  @relativityspace  will debut its first payload into orbit as early as 2021 -- in collaboration w/Spaceflight, a satellite ride-share & mission management specialist -- on a  3D-printed  Terran-1 rocket  https://",0,6,1,0
Charles Russo,@Charles_M_Russo,2019-05-22T22:45:31.000Z,"Global  3D Printing  in Education Market Insights 2019 - Industry Overview, Competitive Players & Forecast 2025  https:// ting-in-education-market-insights-2019-prof-publisher/ …",0,0,0,0
firmenpresse,@firmenpresse,2019-05-22T20:19:03.000Z,Top 10  3D Printing  Medical Devices Market Related Trends To Keep In View 2019  http://,0,0,0,0
EUPRwire,@EUPRwire,2019-05-22T23:23:36.000Z,Discover the Fifth Wave: Metal  Additive Manufacturing http://,0,0,0,0
FFJournal,@FFJournalUpdate,2019-05-22T23:01:17.000Z,"In manufacturing, large part production has historically been costly and time-consuming, but the growth of metal  3D printing  is changing that paradigm  http:// @engineeringcom",0,0,0,0
Stefano,@stefanocortesi,2019-05-22T19:23:26.000Z,"The Prism Desktop  3D Printer http://  
A feature packed and easy to use UV Resin  3D Printer  for less than $300. - [currently $1,683 (3%) of $50,000 goal]",0,0,0,0
KindEarth.Tech,@altprotein,2019-05-23T02:32:18.000Z,"PARIS FOODTECH December 2019: Alternative Proteins + Alternative Dairy, featuring both bioengineered protein like Didier Toubia’s Aleph Farms  ( 3D printed  steaks!) or Shir Friedman & Ido Savir’s SuperMeat chicken nuggets; as well as plant-based superstars… https://",0,8,1,0
lil Jupiter,@lil_jupiter_,2019-05-22T19:53:23.000Z,"An Etsy store but it's just filled with  3D printed , florescent green models of my feet that cost way more than they should.",1,2,0,0
LavaHotDeals,@LavaHotDeals_US,2019-05-22T20:51:53.000Z,"3D Printing  Pens - Create Awesome Designs, Models, Arts and Crafts  https:// /3d-printing-pens-create-awesome-designs-models-arts-and-crafts/73022 …",0,0,0,0
THE 3D CONNECTORS,@3dConnectors,2019-05-23T01:30:06.000Z,"3D printed  molds help to insulate NASA supersize Space Launch System #Government3DPrinting #3DPrintGovernment #Millitary3D | #3Dprinting |3dcservices@the3dconnectors.com|

Click  below  to start your additive journey https://",0,0,0,0
MMNewzz™,@MMNewzz,2019-05-22T22:54:59.000Z,New  3D-printed #technology  lowers cost of common medical test  https:// ewsid=52857.php … #science #nanotechnology,0,0,0,0
たきた,@takita_ma,2019-05-22T22:08:41.000Z,"3D-Printed  Home Can Be Constructed For Under $4,000  https:// @YouTube さんから",0,0,0,0
Charles Russo,@Charles_M_Russo,2019-05-22T22:27:35.000Z,Impossible Objects and BASF partnership brings next-generation  3D Printer #3dprinting https:// ssible-objects-basf-partnership-brings-next-gen-3D-printer/ …,0,0,0,0
ganadineroamerica,@ganaeuroamerica,2019-05-22T21:14:17.000Z,"Renishaw and Identify3D protect metal <b> additive manufacturing </b> processes with upgraded software ... https:// ishaw-and-identify3d-protect-metal-additive-manufacturing-processes-with-upgraded-software/ …  
administración",0,0,0,0
Goodgame EduApps,@eduappsandmore,2019-05-22T23:49:01.000Z,3D Printer : Comgrow Creality Ender 3 Review  #edtech #edchat https://,0,0,0,0
Pierogisandwich Book,@Pierogibooks,2019-05-23T01:10:24.000Z,I'm friends with a  3D printer ?,0,0,0,0
cgilman,@cgilmanny,2019-05-22T19:58:07.000Z,Cool  3D printed  car wheels!  @GEAdditive @HRE_Wheels #HRE3Dcontest,0,0,0,0
bubbleistrouble,@bubbleistrouble,2019-05-23T00:32:47.000Z,"3D printed  trash can makes lots of, juicy bubbles",0,0,0,0
WUSA9,@wusa9,2019-05-22T22:59:03.000Z,'I want to help kids all around the world' | Virginia sixth grader starts business  3D printing  prosthetic limbs  https:// ocal/virginia/i-want-to-help-kids-all-around-the-world-virginia-sixth-grader-starts-business-3d-printing-prosthetic-limbs/65-e6e8d0b8-6773-485e-bd99-3c2b1772aab2 …,0,0,0,0
3d Print Days,@3dprintdays,2019-05-23T00:47:55.000Z,#8 NewスーパーマリオブラザーズU アンパンマン アニメ おもちゃ ☆kidsシアター☆ -  https:// ew%e3%82%b9%e3%83%bc%e3%83%91%e3%83%bc%e3%83%9e%e3%83%aa%e3%82%aa%e3%83%96%e3%83%a9%e3%82%b6%e3%83%bc%e3%82%bau-%e3%82%a2%e3%83%b3%e3%83%91%e3%83%b3%e3%83%9e%e3%83%b3-%e3%82%a2%e3%83%8b%e3%83%a1/ …,0,0,0,0
Not A Games Dev Ollie,@Reksaurian,2019-05-22T23:20:25.000Z,"nothing or could be something. And Ive seen this before. Its all about hiding what theyre thinking or feeling instead of being confident and honest. Kinda annoying TBH. So now, I simply dont know. Either she chills out and does something or not. Her choice. Cant make it for her.",0,0,0,0
@oisin@mastodon.ie,@oisin,2019-05-22T19:39:13.000Z,I am getting into this resin  3d printer  lark ,1,8,0,0
madison.com,@madisondotcom,2019-05-22T21:07:02.000Z,Project Lab: How to make a raised-letter sign with a  3D printer https://,0,0,0,0
3Dsteampen(3D스팀펜),@thesteampen,2019-05-23T03:01:26.000Z,Fun and exciting  3D printing  pen movie collection on youtube scrive!  #3Dprint #3Dpen #stencil https://,0,0,0,0
Jeff Lagant /Propmaker/,@StarJeff3D,2019-05-22T21:22:27.000Z,"That's why I'm happy that I found out about waterdecals:
Stencils can't make letters under 3-4mm.
Also, it requires to manually close open areas (like O or D) or use a stencil font which can be problematic.
That being said,  3d printed  stencil are still super usefull",0,5,0,0
David Erickson #BLM,@derickson,2019-05-23T02:00:13.000Z,NASA and Virgin Orbit have  3D-printed  a working rocket engine part  https:// and-virgin-orbit-have-3d-printed-a-working-rocket-engine-part/ …,0,0,0,0
LEO Lane,@LEOLane3D,2019-05-22T19:53:56.000Z,EOS is helping to develop a new runway mat for the United States Air Force using its  3D printing  technology.  http://,0,0,0,0
Quad-City Times,@qctimes,2019-05-22T20:15:10.000Z,Project Lab: How to make a raised-letter sign with a  3D printer https://,0,0,0,0
Rajat Shrimal,@rajat_shrimal,2019-05-23T01:35:05.000Z,A Kansas City company wants to  3D print  Notre Dame's new spire  #3dprinting #AI #technology #industry40 #ArtificialIntelligence  via  @rajat_shrimal  cc  @MikeQuindazzi @Paula_Piccard @SpirosMargaris @kashthefuturist @HaroldSinnott @chboursin @jblefevre60,1,68,56,0
Matt Everett,@EmJayEe,2019-05-22T23:13:14.000Z,If i designed and  3d printed @VoiceOfOBrien  a vax dagger... do we think he would paint it or want it painted?... or want it at all..,0,0,0,0
3D Printing Experts,@TriTech3D,2019-05-22T19:30:00.000Z,"Did you know we originally started out as a one man band, servicing 3D printers. Our founder Paul Webber was so passionate about  3D print , he began selling them too and the rest is history! What's more , we're now part of the Stanford Marsh Group!  #Staffordshirehour #3dprinting",0,0,0,0
bubbleistrouble,@bubbleistrouble,2019-05-22T22:52:37.000Z,"3D printed  trash can makes humongous, ephemeral bubbles",0,0,0,0
Lasertel,@LasertelInc,2019-05-22T20:06:04.000Z,Metal  additive manufacturing  moves toward automotive series production https://  |  #industriallasers #manufacturing #automotive,0,0,0,0
ClickPress,@ClickPressHQ,2019-05-22T23:23:36.000Z,Discover the Fifth Wave: Metal  Additive Manufacturing http://,0,0,0,0
Diamond Gift,@diamondgift_,2019-05-22T23:00:03.000Z,Sandvik creates first  3D printed  diamond composite [MiningCom]  http:// 51131/sandvik-creates-first-3d-printed-diamond-composite/ …,0,0,0,0
Kicklauncher !,@Kicklaunchr,2019-05-23T01:33:08.000Z,Cubibot: The new standard of modern consumer  3D printer http:// #3dprinter #3dprinting #kickstarter #crowdfunding #ayudos,0,0,0,0
3D printing supply CHAIN,@3DChain,2019-05-22T19:17:54.000Z,"Our new technology can reduce the cost and barriers in#Manufacturing,  #3DPrint ,  #additiveManufacturing , learn more at  http:// ,  #3DPrinting ,  #Industry40 #SupplyChain #IoT ,  #Manufacturing ,  #3DPrint ,  #additiveManufacturing",0,0,0,0
Joel Telling - 3D Printing Nerd,@joeltelling,2019-05-22T22:12:20.000Z,It’s  @luiserodriguez  at the  @Ultimaker  booth chatting about how they helped  @Heineken  ensure production continuity!  #3dprinting #RAPIDevent,2,24,2,0
Julio BaTaLLer,@bataller_julio,2019-05-22T21:05:09.000Z,"Sencillamente impresionante  #additivemanufacturing !  ⁦ @HRE_Wheels ⁩  #HRE3Dplus @GEAdditive ""Through its brand partnership with GE Additive, HRE gained access to two  unique  3D printing  manufacturing systems for the second generation of  the HRE3D+ concept"".",0,6,3,0
Pierre Tufenkjian,@jewelry3dstudio,2019-05-22T19:07:01.000Z,"An Ancient Lion's Ring With Patterns CAD Design Available In Silver 925 , Brass,  3D Printed  Resin, Mold Master Model Mold Silicon Rubber .
Its CAD design yet available for all fields jewelry shoppers ,jewelry…  https:// ?igshid=1rmmluo7l9frr …",0,0,0,0
waynestatechem,@waynestatechem,2019-05-22T22:51:07.000Z,A study led by Dr. Michal Brichacek on using  3D printing  to help young surgeons develop their skills. Michal received his B.S. in Chemistry (with honors) from  @waynestate  in 2009 and was a member of the Brock Lab.   https:// 3d-printing-being-used-to-train-young-surgeons-300854779.html …,1,4,1,0
Survival Pulse,@SurvivalPulse,2019-05-22T19:42:30.000Z,They’re BACK!  3D-Printed  Guns Are UNSTOPPABLE And Here to Stay (via  http:// )  http://,0,0,0,0
Asianwebshops,@asianwebshop,2019-05-23T03:14:05.000Z,#product #retweet  SoaringE E00303  3D Printer  Korte Afstand 0.5mm J-Head Nozzle voor Bowden Extruder (3mm filament)  http:// 655&a=258169&u=http%3A%2F%2Fwww.dx.com%2Fnl%2Fp%2Fsoaringe-e00303-3d-printer-short-distance-0-5mm-j-head-nozzle-for-bowden-extruder-3mm-filament-343214%3FTC%3DEUR%26utm_rid%3D43134375%26utm_source%3Dtradetrackernl … %,0,0,0,0
Kiki Kannon,@Kiki_Kannon,2019-05-23T00:24:29.000Z,I finally fix and reassembled my chain today over Twitch.  I went through the whole process of creating this while streaming.   3D printing  it probably would have been faster and nicer looking.  I went ahead and did it the old classic way with sculpting and molding.  #got #Daenarys,1,3,0,0
Nexus Automation,@NexusAutomation,2019-05-22T23:00:00.000Z,"See the modular Snapmaker 2.0. It can run as a  3D printer , a laser engraver/cutter, and even a 3- or 4-axis CNC machine!  #laser #3Dprint #CNCmachining #benchtop http://",0,0,0,0
Gary Weston,@GaryWeston11,2019-05-22T20:03:17.000Z,Renishaw and Identify3D protect metal  additive manufacturing  processes with upgraded software suite -  3D Printing  Industry  http://,0,0,0,0
Ryan (EmptyGryn) Klooster,@EmptyGryn,2019-05-22T19:39:03.000Z,Working with  3D printing  for my job is so great.  @wizards_magic,0,6,1,0
Christine McDermott,@tecpartnermcd,2019-05-23T02:27:27.000Z,The 3 Breakthroughs  Additive Manufacturing  Needs Most  https:// -iiot/3-breakthroughs-additive-manufacturing-needs-most …,0,0,0,0
Clermont County Public Library,@clermontlibrary,2019-05-22T19:24:15.000Z,Curious about  3D printing ? Visit our Miami Township Branch!  #AtClermontLibrary,0,0,0,0
RazzleTazzle,@RazzleTazzleMag,2019-05-22T21:42:53.000Z,"The  3D printing  materials market is projected to register a CAGR of 25%, in terms of value, between 2019 and 2024  http:// ow/the-3d-printing-materials-market-is-projected-to-register-a-cagr-of-25-in-terms-of-value-between-2019-and-2024/2019/05/22/ …",0,0,0,0
Bradley Jon Eaglefeather,@bjeaglefeather,2019-05-23T00:30:04.000Z,"3D Natives HP and SmileDirectClub partner up to offer  3D printed  braces: At Rapid +TCT in Detroit, HP announced a new partnership with SmileDirectClub, an American manufacturer of braces. The company will use 49 HP Multi Jet…  http:// #News  Via @3Dnatives_en",0,1,4,0
Tethon 3D,@Tethon3D,2019-05-23T00:56:45.000Z,This week’s top  3D printer  hardware releases  https:// 3d-printer-hardware-releases/ …  via @3dpbmPulse,0,2,0,0
Hudson ISD,@HudsonISD,2019-05-22T19:54:25.000Z,Hudson Middle School's  3D Printing  class worked collaboratively with Brookshire Brothers Distribution Center to solve a REAL WORLD need. Pictured on the table are some of the containers the students printed that Brookshire Brothers will be using.,0,9,0,0
Crowdfunding Center,@CrowdCBoost,2019-05-22T19:22:57.000Z,We added 'The Prism Desktop  3D Printer ' a new  #technology  campaign!  http:// #Calabasas,0,0,0,0
ganadineroamerica,@ganaeuroamerica,2019-05-22T21:15:58.000Z,Renishaw and Identify3D protect metal  additive manufacturing  processes with upgraded software …  https:// ishaw-and-identify3d-protect-metal-additive-manufacturing-processes-with-upgraded-software/ …,0,0,0,0
AM Hub,@AMHub_AMTIL,2019-05-23T01:00:52.000Z,An  Additive Manufacturing  Breakthrough in Commercial Aviation moving into the production arena. https://,0,0,0,0
Cokreeate,@cokreeate,2019-05-22T21:31:58.000Z,"These were  #3dmodel   and  #3dprinted  for a client.   3d printed  these on a full color sandstone  #3dprinter .  Modeling done in  #zbrush .
.
. #cokreeate #3dprinted #3dprinting #3dscanned #3dscanner #3dminime #3dfigurine …  https:// ?igshid=qjbtiz002xmu …",0,0,0,0
OrthoFeed,@OrthoFeed,2019-05-22T19:27:10.000Z,10 key developments in  3D printing  for orthopedics in 2019  https:// logy/item/45733-10-key-developments-in-3d-printing-for-spine-orthopedics-in-2019.html …  via  @BeckersSpine #3dprinting #medtech #orthopedics #orthopaedics,0,0,0,0
americaearnmoney,@americearnmoney,2019-05-22T21:15:54.000Z,Renishaw and Identify3D protect metal  additive manufacturing  processes with upgraded software …  https:// ishaw-and-identify3d-protect-metal-additive-manufacturing-processes-with-upgraded-software/ …,0,0,0,0
Tim Walsh,@ChooseTheWizard,2019-05-23T01:38:10.000Z,My boss gifted me  3D printed  night-light cover!  http://,0,0,0,0
Asianwebshops,@asianwebshop,2019-05-22T23:21:08.000Z,#hotdeal #deal  1set BLTouch : Auto Bed Leveling Touch Sensor BLTouch-Classic BLTouch-C with cables Spare parts for  3D Printer http:// 442&a=258169&u=https%3A%2F%2Fwww.aliexpress.com%2Fitem%2F1set-BLTouch-Auto-Bed-Leveling-Touch-Sensor-BLTouch-Classic-BLTouch-C-with-cables-Spare-parts-for%2F32787946802.html …,0,0,0,0
Stanford Cricket,@SF_Stanford,2019-05-23T04:11:15.000Z,sf_stanford  #3D  Printed  #Nexzen  quality extremely light weight batting gloves  #Cricket #Sports #TeamSF #SFCricket #SFStanford #Stanfordcricket,0,2,0,0
Mr. West,@Mr_West_JTHS,2019-05-22T21:09:12.000Z,Francisco is a member of our STEM club at Joliet Central. Today he finished his custom Nintendo Switch game case. The case was designed in  @ADSK_Inventor  and  3d printed  with our  @Ultimaker .  @NintendoAmerica @rNintendoSwitch @JTHS_204 #3dprint #NintendoSwitch #Nintendo #STEM,0,10,0,0
haaohaoo.bsky.social #fbpe #fbr,@haaohaoo,2019-05-22T20:44:33.000Z,Have we finally mastered  3D printing  with metal?  @Seeker,0,2,1,0
George Vangelov,@VangbergGallery,2019-05-22T20:38:10.000Z,‘Number 496 - Love’ -  3D Printing  sculpture https://,0,0,0,0
Suneel Kashyap,@sunkash147,2019-05-22T19:21:53.000Z,I'm taking  Additive Manufacturing  for Innovative Design and Production online with  @edxonline . Check it out!  https:// -v1:MITxPRO+AMx+1T2019/about?utm_campaign=social-sharing-db&utm_medium=social&utm_source=twitter …,0,0,0,0
Missoulian,@missoulian,2019-05-23T03:02:00.000Z,Project Lab: How to make a raised-letter sign with a  3D printer https://,0,0,0,0
3D Printing Tech,@MakerWatcher,2019-05-23T04:20:33.000Z,"Tyrannosaurus rex |  http:// https:// , see more  http://",0,0,0,0
Josué Acevedo,@neomatrixcode,2019-05-23T00:17:24.000Z,"NASA and Virgin Orbit  3D Print , Test Rocket Combustion Chamber | NASA   https:// ll/news/news/releases/2019/nasa-and-virgin-orbit-3d-print-test-rocket-combustion-chamber.html?utm_campaign=the_airlock.unpaid.engagement&utm_source=hs_email&utm_medium=email&utm_content=72939607&_hsenc=p2ANqtz--kLBvNc_-zuaiYwyDmPwCh7ySwlu-5OAEEZXMIEY_v0DWXQJhaz2cU151XbEHyEjDgSqzU8dsRTFZoE-CPy7dSPs7GjA&_hsmi=72939608 …",0,0,0,0
JZKitty Gaming,@JZKitty,2019-05-23T02:54:05.000Z,"We are live guys!

Come join me with some awesome videogames and let's have fun! #Mixer :  https:// #Twitch :  https:// #smallstreamer #SmallStreamerCommunity #SupportSmallStreams #SupportSmallerStreamers",0,5,3,0
LloydCreekStocks,@LloydCreekStock,2019-05-23T02:33:13.000Z,"HP, SmileDirectClub Deal Grows to Evolve in Dental  3D Printing http://",0,0,0,0
3D Systems,@3dsystems,2019-05-22T21:45:09.000Z,Colin delivers expertise to customers every day with 3D Systems On Demand manufacturing services. He’s at  @RAPID_Event  this week helping attendees understand the advantages of outsourced  3d printing  for product development. See Colin at Booth 1227.  http://,0,3,1,0
James Hunter,@KJamesMcfly,2019-05-23T02:29:01.000Z,When u try to  3D print  Thanos’ armor and it fails,0,0,0,0
Hawk FX - Greg Smith,@hawkfx,2019-05-22T21:53:01.000Z,Is this  3D-printed  building the future home for astronauts on Mars?  #Innovation #technology https:// /this-3d-printed-martian-home-is-truly-out-of-this-world?utm_source=Facebook%20Videos&utm_medium=Facebook%20Videos&utm_campaign=Facebook%20Video%20Blogs …,0,0,0,0
MattyMakes,@ohlookitsMatty,2019-05-22T19:38:25.000Z,"#whatsyour2022moment  Look at all these fancy models we have for our  #DnD  
Isn’t  3D printing  wonderful  https:// ?igshid=7sw4luh2lz1t …",0,0,0,0
arno,@Arno_3d_print,2019-05-22T22:33:53.000Z,Filament eryone gold de l’or  https:// ?igshid=1ocxngl9zz7ls …,0,0,0,0
Charles Russo,@Charles_M_Russo,2019-05-22T22:24:27.000Z,"Meet Marsha, Winner of NASA's  3D Printed  Mars Habitat Challenge  #3dprinting https:// ence/amaze-lab/meet-marsha-winner-of-nasas-3d-printed-mars-habitat-challenge/609-30921f6e-61d1-477b-b5aa-c7201f597e97 …",0,0,0,0
