Author Name,Author ID,Date,Post Text,Replies,Likes,Reshares,Views
BECT Computers & 3D Printing,@bectcomputing,2019-03-01T17:03:32.000Z,6 Ways Companies Are Using Data Analytics to Reduce Expenses - insideBIGDATA  https:// ays-companies-are-using-data-analytics-to-reduce-expenses/ …,0,0,0,0
LivingBeasts,@LivingBeasts,2019-03-01T20:15:49.000Z,"I bought a base at  #NordicFuzzCon  from  @SchneeCreations  
It’s going to be exciting to work with  3D printed  parts!",0,14,1,0
Velocity Electronics,@Velocity_Elec,2019-03-01T16:00:19.000Z,"Great development for the green  #electronics  industry - sensors that use a  3D printed , wood-derived cellulose material in place of the plastics and polymer materials currently used via @sfunews  https://",0,0,0,0
Gear Box,@Gear__Box,2019-03-01T18:04:12.000Z,"ad: FLSUN QQ-S 90% Pre-Assembled Delta  3D Printer  Lattice galss Platform Large Printing Size φ255X360mm, Auto Leveling,Titan Extruder,Touch Screen,WiFi Remote Control,Filament 1.75 mm PLA -  https://",0,0,0,0
Sutton High Careers,@Careers_SHS,2019-03-01T16:33:48.000Z,Probably Dr Bartalini’s favourite thing at the Faire - recycling plastic into wire for  3D printing . ⁦⁦ @SuttonHighEco ⁩ would love it too!,1,6,4,0
Steve Woodward,@WoodyNemo,2019-03-01T16:00:00.000Z,The Vatican’s Swiss Guards are now using  3D printed  helmets   https:// 8786/vatican-swiss-guards-3d-printed-helmets?utm_campaign=theverge&utm_content=entry&utm_medium=social&utm_source=twitter …  via  @Verge #3dprinting,0,0,0,0
Gretchen Moore,@gretchenbmoore,2019-03-01T17:31:09.000Z,"Find out what IoT, blockchain,  3D printing  and AI mean for your business.  #4IR https:// https://",0,0,0,0
John Robinson,@JohnGRobinson,2019-03-01T14:39:15.000Z,Hey Kodak  3D Printing  thanks for the follow!,0,0,0,0
Charles Russo,@Charles_M_Russo,2019-03-01T19:21:22.000Z,High-speed  3D printer  for high-performance plastics  #3dprinting https:// igh-speed-d-printer-high-performance-plastics.html …,0,0,0,0
3D Printing Professor,@3DPProfessor,2019-03-01T17:35:36.000Z,"""Close the door to continue"" BAH! Not when there's videos to record and clamps around. Ironic  #SafetyFirst",0,5,0,0
Un1v3rs0 Z3r0,@Un1v3rs0Z3r0,2019-03-01T16:44:17.000Z,A Modular Mounting System Via  3D Printing https://,0,0,0,0
Dr Shane Maxwell-Atkin,@GastroChap,2019-03-01T17:54:35.000Z,"Oh dear me. "" 3D printed  vegan steak"" anyone? There is no hope. ",0,0,0,0
"Byron Cole | Keller Williams, Frisco Stars",@byron_cole19,2019-03-01T17:31:32.000Z,"How ICON Is Building the $4,000  3D-Printed  Homes of the Future  http://",0,0,0,0
RocaGallery,@RocaGallery,2019-03-01T16:05:18.000Z,The  3D-Printed  walking stick Enea by Shiro Studio is one of the projects selected by  @debikaray  in her article about new design for the mobility challenged  #OntheMove #EyeOnDesign http://,0,0,0,0
Gary Weston,@GaryWeston11,2019-03-01T16:29:51.000Z,3D Systems Caps Off 2018 With Solid  3D Printer  Sales Growth - Motley Fool  https://,0,0,0,0
3D Printing Industry,@3dprintindustry,2019-03-01T16:00:26.000Z,"Roboze partners with Neofab, expands high-temperature  3D printing  in France -  http://  -  #3dprinting @Roboze3D @Neofab_3D",0,7,6,0
MaryAnneMohanraj,@mamohanraj,2019-03-01T15:18:47.000Z,"Our first  3D printing  workshop for Maram, with Kurt Hedlund!  My printer actually stopped printing partway through, but that just gave us an opportunity to demonstrate debugging the printer, so it's all part of...  https:// j/posts/10159219741989616 …",0,0,0,0
Joshua Murrah,@JoshMurrah,2019-03-01T16:05:29.000Z,Ordered 30 pounds of  3D printer  filament this week... the printers are getting a workout!,0,0,0,0
Makelab | 3D Printing Services,@makelab_3D,2019-03-01T17:20:06.000Z,Check out the detail on this part! We are absolutely in love with the new castable wax resin from  @formlabs ! This part is ready for investment casting  Project for @janetcadsawan @TrilogieNow,0,5,2,0
brandy jonathans,@brandy2091xx,2019-03-01T18:44:13.000Z,http:// Any ideas for a  3D printing  project? Share it!,0,0,0,0
Derek J,@ddj12121985,2019-03-01T17:34:46.000Z,I've entered the $5000 Ultimate Maker Giveaway for a chance to win a  3D Printer  and LIFETIME Supply of Filament from  @moretechco . Please click the link to help me win!  #madewithMORE http://,0,0,0,0
Ivan Miranda,@adnarimnavi,2019-03-01T19:05:08.000Z,I had so much fun with this  3D printed  air canon last year but what has been your favourite build on my channel so far?,12,61,8,0
JZ Murdock-Writer/Filmmaker,@jzmurdock,2019-03-01T17:12:08.000Z,3D-Printed  Paintings Let The Blind “See” Famous Art For The First Time  https:// nted-paintings-let-the-blind-see-famous-art-for-the-first-time/?fbclid=IwAR3JV8QVAZ8vGfSQGpHOoSysw-__ZmvCAmOxsdRKHpbCUvnY-I5B-746lV8 …,0,0,0,0
SME Media,@SMEMediaNews,2019-03-01T15:30:15.000Z,Additive Manufacturing  Labs And Spaces Continue To Grow Worldwide:  https://,0,3,2,0
Brendan Londos,@LondosHDSB,2019-03-01T14:36:36.000Z,3D printed  projects arrived today!   #3Dprinting #innovation #hdsblibrary #tinkercad,1,10,0,0
Gray,@grayheadedgamer,2019-03-01T17:47:19.000Z,It's happening my dudes!  3d printer  has been ordered.,4,30,1,0
"CADimensions, Inc.",@CADimensions,2019-03-01T18:04:03.000Z,The need for skilled labor with  3D printing  knowledge is critical.  http://,0,0,0,0
Andy Thomson,@Andy_ThomsonDT,2019-03-01T18:34:51.000Z,I think I might be teaching  3D printing  for every lesson from now on!  #3Dprinting #chocolate,0,6,0,0
Deb White,@Classichassis,2019-03-01T14:53:11.000Z,"Oh yes we are!!  #Repost @DarkFeatherEnt1  with get_repost
・・・
Did you know that  @DarkFeatherEnt1  is more than a  3D printing  company? We are also restoring a 1967 Chevy Impala aptly named…  https:// ?utm_source=ig_twitter_share&igshid=1rdb1irx77hbd …",0,2,2,0
BECT Computers & 3D Printing,@bectcomputing,2019-03-01T16:45:53.000Z,"Bitcoin steady, on track for back-to-back winning weeks - MarketWatch  #bitcoin https:// steady-on-track-for-back-to-back-winning-weeks-2019-03-01 …",0,0,0,0
IMAGINESS,@Imaginess_Art,2019-03-01T16:32:27.000Z,Just Pinned to  3D Printing :  3D printed  buttons - Studio Femke Roefs. Why not ? bringing age old forms to life with new technology.  https://,0,0,0,0
Micron Dental,@microndental,2019-03-01T18:10:16.000Z,"3ders: LLNL creates multibeam metal  3D printer  to understand laser-material interactions : Lawrence Livermore National Laboratory (LLNL) scientists and engineers are working alongside GE Global Research to create a research-grade,  http:// #print3d",0,0,0,0
Statistics Jobs,@Jobs_Statistics,2019-03-01T15:15:02.000Z,Seattle WA USA - Statistician - Design and deploy sound statistical process control systems for addi: Design and deploy sound statistical process control systems for  additive manufacturing  Analyze and document authoritativ  http://,0,0,0,0
Medieval-Shop,@Medieval_Shop,2019-03-01T15:00:34.000Z,NEW.-Plate with ball chain Air Force - £2.09: Identification plate of the air force. The plate comes with  3D printing  and the chain of balls.  http://,0,0,0,0
JZKitty Gaming,@JZKitty,2019-03-01T17:21:59.000Z,WHAT THE ......... #Pokemon,0,3,1,0
Mental Floss,@mental_floss,2019-03-01T18:23:01.000Z,The Pope's Swiss Guards Are Now Outfitted in  3D-Printed  Helmets— https://,0,9,0,0
maricam,@maricam58,2019-03-01T16:17:30.000Z,"I'm sorry. This sounds like just the kind of super-processed food I strictly avoid. It's made from ""natural"" ingredients, but what was done to them before they could be passed thru the  3D printer ? Blech!",0,0,0,0
BECT Computers & 3D Printing,@bectcomputing,2019-03-01T18:00:42.000Z,For when ‘Have you tried turning it off and on again?’ just isn’t cutting it anymore. The Intel Xeon Silver processor is built for the growing IT departments of the world. See how:  http://,0,0,0,0
Not A Games Dev Ollie,@Reksaurian,2019-03-01T19:41:50.000Z,Here's hoping that Scottish Trainer is gonna be Canon for Sword and Shield  https://,0,0,0,0
Gary Weston,@GaryWeston11,2019-03-01T16:19:37.000Z,Markforged launches  Additive Manufacturing  University to accelerate adoption of  3D printing  -  3D Printing  Industry  https://,0,0,0,0
borg..,@Borgology,2019-03-01T18:39:22.000Z,AHA  3D PRINTER  HAS ME WEAK AS HELL  https:// /Animayonsay/status/1101275834600501249 …,1,0,0,0
Scalda 3D,@ScaldaYT,2019-03-01T16:16:03.000Z,Liked on YouTube:  3D printing  Hangout  https://,0,0,0,0
Gregg Kinzer,@greggkinzerdds,2019-03-01T18:07:26.000Z,Not sure if it is time to purchase a  3D printer  for your practice? Read this article and learn more on 3D printers:  https://,0,0,0,0
Charles Russo,@Charles_M_Russo,2019-03-01T19:33:25.000Z,"Global Stereolithography  3D Printing  Market 2019- EnvisionTEC, Voxeljet AG, Proto labs, INC., Stratasys Ltd - Industry Daily Observer  https:// ithography-3d-printing-market-2019-envisiontec-voxeljet-ag-proto-labs-inc-stratasys-ltd/27092/ …",0,0,0,0
G2 Venture Partners,@G2VPLLC,2019-03-01T19:42:28.000Z,"3D printing  marketplace & service company  @shapeways  has partnered with portfolio company  @Carbon  to make 3 of Carbon’s 3D printable resins available to its customers, further democratizing product creation globally.  #manufacturing #AdditiveManufacturing https://",0,2,0,0
TIMENOUT,@TIMENOUT,2019-03-01T14:45:05.000Z,3D Printing  | Way of the Future  https://  via  @YouTube,0,0,0,0
OthielOPS,@OthielStrategic,2019-03-01T16:12:10.000Z,"Roboze partners with Neofab, expands high-temperature  3D printing  in France  https://",0,0,0,0
keepingitcreel,@Keepingitcreel,2019-03-01T17:50:31.000Z,"My son said ""Look! I'm a  3D printer !"" I told him to shut the toilet door when he poops.",0,0,0,0
Technology,@Technol53581657,2019-03-01T20:16:01.000Z,"A Modular Mounting System Via  3D Printing When working with cameras or other tools, it can often be useful to have some manner of stand or tripod to hold things in position, freeing up one’s hands for other tasks. Unfortunately, when it comes to smaller cameras and devices …",0,0,0,0
McGill Libraries,@McGillLib,2019-03-01T18:25:51.000Z,"3D printing  enthusiasts, take note! Our peer tutor hours will be modified next week for Reading Week:  http://",0,0,0,0
Dean Anthony Gratton,@grattonboy,2019-03-01T16:12:50.000Z,Digitalization and automation enhance successful lean methods to further increase factory competitiveness. Visit to the  @siemensindustry  Electronics Factory Erlagen and to  Additive  Manufacturing  Experience Center. #Industry40 #HM19,0,0,0,0
Atrapazon,@atrapazon,2019-03-01T18:51:57.000Z,"Easythreed Mini Home Education Children's  3D Printer  - 89.00€ Free Shipping|Gea  #gearbest Ahora: €89.00  Antes: €182.38 Cupón:   Oferta Flash Precio Final: €  Unidades: 50

Enlace:  http://",0,0,0,0
IVI 3D Printer,@ivi3dprinter,2019-03-01T17:30:00.000Z,Second part of the rock for  #Aquaman #3dprinted  with @ivi_3d printer,0,2,0,0
Trish,@HipHmschoolMoms,2019-03-01T17:27:22.000Z,This is the BEST use of a  3D printer  I've seen yet!! <3  https:// oms/posts/2516125018428636 …,0,0,0,0
Dwight Goodwin,@scout2i,2019-03-01T20:25:32.000Z,"RT TCEA ""RT rrodgers: Not to rush you or anything, but the deadline to register for the 2019  #TCEA  3d Design Contest is TODAY, so... No  3D printer  required, btw!   https:// ts/3d/ … #3DDesign #MakerEd #EdTech """,0,0,0,0
3D Printing @𝟑𝐃𝐚𝐛𝐥𝐞,@3Dable,2019-03-01T14:44:11.000Z,"3DPI > 3D Systems reports earnings for 2018, shifts focus to  3D printer  materials and software >  http:// #3DP #3Dprinting #3Dprinter #Prototyping #RapidPrototyping #AdditiveManufacturing",0,0,0,0
Oakland Public Library,@oaklibrary,2019-03-01T17:03:02.000Z,"Celebrate Teen Tech Month with OPL all month long! We'll be hosting  3D printing  workshops, VR demos, LED crafts, and more! https:// rograms/teen-tech-month … #ExploreConnectGrow #Oakland #librarylife #TTW #TeenTechWeek #TeenTechMonth",0,0,0,0
3d print,@Best3dprint,2019-03-01T18:55:15.000Z,|  #3dprint  | Selling 3D Printers Direct or Through Resellers?  https:// http://,0,0,0,0
Dangling Carrot Creative,@DanglingCarrot3,2019-03-01T18:01:07.000Z,3d printing  is just one of the MANY services we provide to our clients. She-Ra turned out fabulous and you can see exactly how tall she is!  http:// #DCC #3dprinting #3d #dreamworks #SheRa,0,0,0,0
InkSmith,@InkSmith3D,2019-03-01T16:53:35.000Z,Congrats to all of our  3D Printing  participants at the  @WCDSBNewswire  Elementary Skills Challenge Day! Here are a few of our platinum winners!  #21stcenturyskills #WCDSBinnovates,1,7,4,0
European XFEL,@EuropeanXFEL,2019-03-01T15:55:59.000Z,"This week  @EUCYS @BigBangFair  UK Young Engineer Josh Mitchell visited us. ""It's mind-blowing how precise & high-tech everything is here"" he says. Josh won  @BigBangFair  with a low-cost flatpack  3D printer , PlyBot. We hope you enjoyed your stay Josh!",0,5,2,0
Century21BayBenjamin,@C21BayBenjamin,2019-03-01T17:31:30.000Z,"How ICON Is Building the $4,000  3D-Printed  Homes of the Future  http://",0,0,0,0
Curso 3D Printing,@Curso3DPrinting,2019-03-01T14:37:13.000Z,Nexxt Spine to use MTS testing systems for  3D printed  spinal implants  https://,0,0,0,0
Eyes On Learning,@kidsvisionaz,2019-03-01T16:53:43.000Z,#3D  Printed Paintings Let the  #Blind  “See” Famous  #Art  For the First Time  http:// #blindness #visuallyimpaired #vision #lowvision #museum #3Dprinting,0,2,0,0
"Chuck Webster MD, MS AI, MS Systems Engineering",@wareFLO,2019-03-01T17:03:47.000Z,"Chuck! Attending  #HITsm  to browbeat... er, gently persuade everyone workflow,  3d printing  & social VR are the greatest things in the known universe! Check out my blog post and video tour beating the dead horse, I mean brilliantly demonstrating I'm right!",0,3,1,0
James Gingerich #B2B #Technology #Influencer,@jamesvgingerich,2019-03-01T20:05:00.000Z,"#3D  printing will 'transform' the oil industry, says BP.  (Telegraph)   #DigitalTransformation #OilAndGas40 http://",0,0,0,0
Women in 3D Printing,@Wi3DP,2019-03-01T15:30:34.000Z,"Join the Dublin chapter of  #Womenin3DPrinting  for our inaugural meetup on Friday March 8th, to celebrate International Women's Day and Engineers Week:  https://",0,0,0,0
Lady Spudgun 'M' la Croissant,@hellymoo,2019-03-01T18:15:58.000Z,Can somebody  3D print  me a sick bag? Ta.,0,5,0,0
Nano Dimension,@NanoDimensionX,2019-03-01T19:07:56.000Z,"Attend @3Dpcb product presentation at the SMTA Dallas Expo and Tech Forum - March 19 at 8:30 am. on ""You Design & You Manufacture, Complex Multilayer Circuits with  3D Printing ”. Click here to register for free:  http:// #3dprinting #additivemanufacturing",0,1,2,0
Deb Crawford,@Deb__Crawford,2019-03-01T17:26:39.000Z,JWHS AP Calculus BC students + @thaskiell  presented their 3D Mater project-designed from over 40 equations using Tinkercad to create/print cross sections w/ 3D printer -powered by coding Dash robot. “The math we do on paper came to life.” @sgross_jwhs  @L_Fout @fcpsk12 @DaveSovine,0,19,1,0
#VideoGames,@VideoGamesFeeds,2019-03-01T19:04:16.000Z,"ad: HATCHBOX 3D WOOD-1KG1.75-BRN  3D Printer  Filament, Dimensional Accuracy +/- 0.03mm, 1.75 mm, 1kg Spool, Wood Brown -  https://",0,0,0,0
"Libertarian, Homesteading, 3D Printing",@Liberty3DPrints,2019-03-01T15:39:05.000Z,The way this is filmed really scares me. It's filled in such a propaganda fashion. Those that say something I want to hear all the time I question the most. Just don't go blind.,0,0,0,0
3D Printing Fans,@3DPrintingFans,2019-03-01T15:19:00.000Z,UC Santa Barbara Researchers Explore Acoustophoresis in Regulating Electrical Composites for  #3DPrinting https:// ity-california-researchers-explore-acoustophoresis-in-regulating-electrical-composites-3d-printing/ … @ucsantabarbara,0,0,0,0
Gary Weston,@GaryWeston11,2019-03-01T15:34:13.000Z,"3D Printing  industry CrAMmed: KIT, University of Louisville, NTU, Manchester Metropolitan University -  3D Printing  Industry  https://",0,0,0,0
3dprintfeed,@3dprintfeed,2019-03-01T18:56:10.000Z,Warhammer  3d printing  files  https://,0,0,0,0
OthielOPS,@OthielStrategic,2019-03-01T17:48:14.000Z,LLNL creates multibeam metal  3D printer  to understand laser-material interactions  https://,0,0,0,0
Cheshire College Skills & Employment,@CCSWSkills,2019-03-01T15:01:01.000Z,Our 3D CAD &  3D Printing #FUSE  course is also being run at our Chester campus on the 28th! Don’t miss out on this opportunity for companies based in Warrington & Cheshire with less than 250 employees – FUSE courses are FREE! Book your space now on Eventbrite  #Business #Skills,0,0,0,0
Amy Peterson,@ThisAmyPeterson,2019-03-01T14:52:16.000Z,"Hi folks! I'm looking to recruit a PhD student to my group for Fall 2019/Winter 2020, working on extrusion-based  additive manufacturing  (experiments and/or modeling). If you're interested, DM/email me! RTs appreciated!",0,25,35,0
Ava Garden Wilder,@CherrificBird,2019-03-01T20:23:24.000Z,"Women are amazing. Women's bodies make humans! Like, somehow it knows how to  3D print  it perfectly! It makes all the guts and squishy stuff. And it puts it in the right order! I don't care what you say...that's badass.",0,0,0,0
Jonathan,@JMLarod,2019-03-01T16:12:44.000Z,"Roboze partners with Neofab, expands high-temperature  3D printing  in France  https:// https://",0,0,0,0
PressRelease.cc,@PressRelease_cc,2019-03-01T16:04:16.000Z,"Global  3D Printing  Lab Equipment Market 2019 Analysis, Growth, Share, Trends, Segmentation Forecast To 2024  https:// bal-3d-printing-lab-equipment-market-2019-analysis-growth-share-trends-segmentation-forecast-to-2024/ …",0,0,0,0
3Dstore.tn,@3Dstoretn,2019-03-01T19:03:34.000Z,Fortify and DSM Royal collaborate to develop industrial materials for  3D printing http://,0,0,0,0
3D Printing Fans,@3DPrintingFans,2019-03-01T14:46:00.000Z,Researchers Examine Potential for Synthetic Biomineralization in  #3DPrinting  Bone Grafts https:// hers-examine-potential-for-synthetic-biomineralization-3d-printing-bone-grafts/ …,0,2,1,0
3Ders.org 3D Printing News,@3dersorg,2019-03-01T20:07:26.000Z,Breakthrough - Mobile bedside 3D bioprinter can print skin to heal wounds http:// 301-breakthrough--mobile-bedside-3d-bioprinter-can-print-skin-to-heal-wounds.html … #3dprinting,0,7,6,0
Drug Delivery News,@DeliveryDrug,2019-03-01T19:15:03.000Z,PolyVinyl Alcohol  3D printed  tablets the effect of polymer particle size on drug loading and process efficiency.: Fused deposition modeling by 3Dprinting is a rapid technique for the production of personalized drug dosage forms. One of the most delicate…  http://,0,0,0,0
Official Ogemaw Heights High School,@OHHSFalcons,2019-03-01T19:02:44.000Z,"Physics students working with the crew from the Delta College STEM Explorer this morning. Over the next month we'll be partnering with them to design,  3D print  and test a crumple zone to absorb the force of an 8...  https:// 6/posts/309118703129480/ …",0,0,0,0
3d print,@Best3dprint,2019-03-01T17:23:38.000Z,|  #3dprint  | The Real Value of  3D Printing  Patents  https:// http://,0,0,0,0
Lena,@ucLena,2019-03-01T16:04:24.000Z,I've entered the $5000 Ultimate Maker Giveaway for a chance to win a  3D Printer  and LIFETIME Supply of Filament from  @moretechco . Please click the link to help me win!  #madewithMORE http://,0,0,0,0
Pottery Articles,@PotteryArticles,2019-03-01T20:34:55.000Z,Opinion on  3D printed  ceramic pieces  https://,0,0,0,0
Afelim,@Afelim_Assoc,2019-03-01T14:31:25.000Z," Agenda adhérents : @IDTechEx 15% Attendee Discount ends (8 March)  3D Printing  Europe 2019 | 10-11 April, Berlin, Germany
The next step for  Additive Manufacturing . Part of the  #IDTechExShow !
Register to attend:  http:// #3DPrinting  #AdditiveManufacturing",0,0,0,0
Dr. Cindy McGilvrey,@DrCindyMcG,2019-03-01T17:43:35.000Z,Made with  3D printer  in Brian Fry’s class!,0,0,0,0
3Ders.org 3D Printing News,@3dersorg,2019-03-01T18:34:12.000Z,LLNL creates multibeam metal  3D printer  to understand laser-material interactions http:// 301-llnl-creates-multibeam-metal-3d-printer-to-understand-laser-material-interactions.html … #3dprinting,0,1,3,0
夕凪㌠,@Yuunagi_DAMEYA,2019-03-01T16:50:43.000Z,1/144 scale model manufactured with  3D printer  is on sale. https:// #144scale #3dprinting,0,0,0,0
Dragonfly IoT,@DragonflyIot,2019-03-01T17:05:57.000Z,#IoT  A Modular Mounting System Via  3D Printing https:// odular-mounting-system-via-3d-printing/ … #RIoTS,0,0,0,0
LICHTWERKSTATT JENA,@LichtwerkstattJ,2019-03-01T17:01:30.000Z,"#brainfood  I  3D printing  is on everyone's lips and is now opening up a variety of applications, both in the commercial and private sector. But what about the legal requirements when using  3D printing ? Read more about it here:  http:// #lichtwerkstattjena #jena  # 3D",0,0,0,0
Wolfbird @ home,@Wolfbird_NLCC,2019-03-01T16:56:43.000Z,"Hi everyone, I'm excited to announce that I'm OPEN FOR NEW SLOTS on March 15th! Here are some recent examples of my work. I'll make any species, we have a  3D printer  so the sky is the limit :) #FursuitFriday #fursuit #fursuitcommissions",14,116,36,0
3D Druck Magazin,@3Ddruckmag_ch,2019-03-01T14:48:04.000Z,"3D Systems reports earnings for 2018, shifts focus to  3D printer  materials and software  https:// #3dprintindustry #3dprinting",0,0,0,0
Stoke Newington History,@HistoryOfStokey,2019-03-01T19:22:40.000Z,". @hancam14 , a self-confessed ' 3D printer  fanatic', surprised me with this amazing and unique set of coal-hole cover stamps she crafted after seeing my survey of Stoke Newington coal-hole covers ( https:// stoke-newington-historian-documents-the-fascinating-designs-of-victorian-coal-hole-covers-1-5606702?fbclid=IwAR20gptLhQjJV8FePKYR4wrid4Gk4BAqBtFuCjkYrSSudEizv1zJafg0ycc … ). Thanks Hannah!",3,9,3,0
Curso 3D Printing,@Curso3DPrinting,2019-03-01T18:03:45.000Z,LLNL creates multibeam metal  3D printer  to understand laser-material interactions  https://,0,0,0,0
BECT Computers & 3D Printing,@bectcomputing,2019-03-01T18:00:38.000Z,New year new PC. �� Leave old computer struggles in the past. Check out the latest Intel processor for faster speeds and more time doing what you want.  http://,0,0,0,0
City of Toronto Business,@BusinessTO,2019-03-01T15:00:41.000Z,Toronto Reference Library: Introduction to  3D Printing  - March 8 2019  https://,0,0,0,0
Not A Games Dev Ollie,@Reksaurian,2019-03-01T16:04:51.000Z,"The entire process can be repeated to entirely dig the floor out, that is, destroy every tile you see.

Once in, add in a protocol to extend tiles downwards to represent digging, then reverse the process to represent filling in.

Then add the other walls. Awesome stuff.",0,0,0,0
818Artists,@818Artists,2019-03-01T19:35:25.000Z,brynrichardsart here reusing old  3d print  design and laser cuts to be transferred through screen printing process  #lasercut #3dprint #Screenprinting https:// ?utm_source=ig_twitter_share&igshid=11r1m4qrosumi …,0,0,0,0
newportarthritis,@NPTarthritis,2019-03-01T14:57:00.000Z,Thank you to  @ValkyrieMedia  who has designed and  3D printed  a special trolley token that enables those with limited dexterity in their hands to be able to access trolleys that require a token much easier. We have been generously given some to try out. For more info speak to Jason,1,5,3,0
DNA&RNA Universe 𝕏,@DNA_RNA_Uni,2019-03-01T17:18:38.000Z,Nice webpage - submit your PDB structure and get model optimized for  3D printing https:// #3Dprinting #enjoy #DNA #quadruplex,0,12,6,0
Midland Library,@Midland_Library,2019-03-01T20:25:06.000Z,"Attend Intro to  3D Printing  this Saturday, March 2nd from 11am-12pm to learn more about  3D printing  and get certified to design and print your own projects. Visit, or call the main desk to register. Ages 12+. Can't make it Saturday? The next session is March 14th at 6:30pm.",0,0,2,0
3DPropsGB,@3DPropsGB,2019-03-01T16:29:50.000Z,Excited to share the latest addition to my  #etsy  shop: Fire Emblem Ragnell Sword -  3D Printed  Kit  https:// #supplies #3dprinting #ike #fireemblem #ragnellsword #ragnell #cosplay,0,0,0,0
Luke Spots VF,@luke_spots,2019-03-01T18:09:26.000Z,So this  3D printed  booper may be a thing on Luke ,0,3,0,0
Humtown,@HumtownProducts,2019-03-01T20:22:28.000Z,Congrats  @ash_totin  ! You have been an asset to our  additive manufacturing  community for many years - looking forward to continued success!,0,0,0,0
AdlerPlanet,@AdlerPlanet,2019-03-01T18:31:58.000Z,"How might we grow plants in space for longer missions? At the Kennedy Space Center, they’re testing new ways of doing just that, from  3D-printed  substrate to tubes that need no substrate at all.  #nasasocial",0,12,1,0
3D Printing @𝟑𝐃𝐚𝐛𝐥𝐞,@3Dable,2019-03-01T17:51:13.000Z,3ders > LLNL creates multibeam metal  3D printer  to understand laser-material interactions >  http:// #3DP #3Dprinting #3Dprinter #Prototyping #RapidPrototyping #AdditiveManufacturing,0,0,0,0
Tomthunkit™,@TomthunkitsMind,2019-03-01T14:42:20.000Z,This  3D-printed  bike tire will never go flat,0,2,2,0
shane foster,@shaney1602,2019-03-01T15:05:04.000Z,"UK-based  3D printing  curriculum developer PrintLab has launched two new unlimited-use licences for schools, non-profits, consultants and training programs. Each available on an annual basis, the Site License and Instructor License extend the  http:// 18 …",0,0,0,0
HCC Libraries,@HCCLibraries,2019-03-01T16:20:44.000Z,"Want to know the basics of  3D Printing ? Join us at our  3D printing  workshop on Wed, March 6 from 2 - 3:30 pm, at HCC Central Library, room # 400.9. Register here:  https:// hs=a …",0,0,0,0
eshop2018,@eshop2018,2019-03-01T17:16:16.000Z,Check out Premium  3D Printer  Filament 1kg/2.2lb 1.75mm 3mm PLA ABS PETG TPU Wood MakerBot   https://  via  @eBay,0,0,0,0
3D Printing Egg,@3DPrintingEgg,2019-03-01T16:17:35.000Z,Jurassic World inspired Velociraptor claw. 3D  #everythingelse @EtsyMktgTool https:// #jurassicworld #jurassicpark #dinosaur,0,2,0,0
