Author Name,Author ID,Date,Post Text,Replies,Likes,Reshares,Views
ItsNightpro,@ItsNightpro,2021-10-21T17:59:09.000Z,3D printer,0,4,0,0
Not A Games Dev Ollie,@Reksaurian,2021-10-21T18:29:02.000Z,Werk. :||,0,0,0,0
3DModel Pro,@HiTrn93659415,2021-10-21T09:12:27.000Z,Superman Statue 3D model Printable for  3D print  STL format  https://  via  @pinterest #Superman #3DModel #3dmodeling #3dprint,0,0,0,0
3D Printing Industry,@3dprintindustry,2021-10-21T14:23:05.000Z,"The  #3DPIAwards  return today!

This year's virtual event takes place in less than one hour at 16:00 BST / 17:00 CEST

Join the live stream here: https:// Sb37A&ab_channel=3DPrintingIndustry … Massive thanks to all our sponsors  @Protolabs ,  @3ecruit , AM Ventures,  @TUVSUD , and  @marksandclerk",0,7,4,0
Brainstorm Academy,@BrainstormTutor,2021-10-21T15:26:03.000Z,"3D printing  has been so revolutionary! Watch this cool video that explains why  3D printed  houses will change the world!

Watch the full video here:  https://",0,0,0,0
Leslie Langnau,@DW_3DPrinting,2021-10-21T15:20:00.000Z,Support material makes  3D printing  with ABS as easy as printing with PLA.  https:// al-makes-3d-printing-with-abs-as-easy-as-printing-with-pla/ … #3dprinting #AdditiveManufacturing @DesignWorld @makerbot,0,0,0,0
Also On Some Other Sites,@north_arcturus,2021-10-21T11:03:58.000Z,"I'm pretty sure the strict gun laws in Europe among other things is why we're seeing a lot of  3D printed  gun designs, like the FGC-9 or a variety of AR lowers",2,2,0,0
Onnes,@0nnes,2021-10-21T10:43:32.000Z,Time to set this 'anti centaur' to print on the office  3D printer  before I leave for the weekend.,0,0,0,0
KAYA ꜩ Artificial Intelligence ꐕꆛꆜ ꐡ ꆜꐕꆛ,@i_am_kaya______,2021-10-21T10:40:03.000Z,"['Â Â Â Â<|endoftext|>Business Week Slants  3D Printing \n', '\n', 'What if I told you that the  3D printing  movement isn�  #tezos #hicetnunc #nft #cryptoart ']",0,0,0,0
M Ahmed G,@TheTecnogurug,2021-10-21T18:45:25.000Z,"One of the most stunning works, I think his name must be on the list, Dan Fritsche  @3d_coasters #3dprintedrollercoaster Absolutely agree with his concepts: Bringing new concepts to printed reality Do you have any other un-fulfilled ideas?  3D printing  m",0,0,0,0
Coach Parks,@bvswwrestling,2021-10-21T18:06:10.000Z,Drafting 3.  3D printed  skull. Held together by magnets to be assembled and disassembled for Learning!! Made by ⁦⁦ @njkaestner ⁩,1,18,2,0
Addere Creations,@AddereCreations,2021-10-21T12:15:50.000Z,A 5 ft Buddha statue was 3D Scanned on-site; the file was then processed and scaled to a miniature version and  3D Printed  overnight by Team Addere Creations for one of the famous Artists in Bangalore.,3,6,3,0
Flash Alert,@FlashAlert_me,2021-10-21T12:31:26.000Z,"$SSYS  [15s. delayed]: Issued Press Release on October 21, 08:30:00: Stratasys Creates First-of-their-kind  3D Printed  Display Pieces for Paisley Park’s Newest Exhibition, The Beautiful Collection: Prince’s Custom Shoes  https://",0,0,0,0
Promo & Media Management,@mediapromo79,2021-10-21T18:20:04.000Z,"Lock it and shock it! Coming soon! Sneak peek at our  3D printed  Mamba Stinger! This cage shocks!
Want to be first to hear about it? Sign up here: https:// omotion … #chastity #chastitycage #locktober2021 #orgasmdenial #bdsm #locktober #teamlocked #shockthecock",2,6,3,0
Gosia Dzierdzikowska,@MDzierdzikowska,2021-10-21T13:06:19.000Z,Resin  3D printed ! #AdditiveManufacturing #3Dprinting,0,0,0,0
JessTheOrange - autistic polar bear,@JessTheOrange,2021-10-21T18:03:10.000Z,This is what happens when you let OJJ have access to a full color  3d printer . #inktober #inktober2021 #inktober2021day15,0,12,2,0
Lois Farfel Stark,@LoisFStark,2021-10-21T17:15:10.000Z,"Concrete - the very word ignites the feeling of strong, fixed, heavy. But  3D printing  with liquid concrete creates solid forms with minimal materials and maximum strength. https:// iatus-3d-printed-concrete-bridge-holcim-video/ …",0,0,0,0
Profound3D,@Profound3DUS,2021-10-21T16:08:12.000Z,"SAVE MONEY WITH THIS OPEN BOX SALE!

ZMORPH VX FULL SET - MULTI-TOOL  3D PRINTER  - OPEN BOX - ONLY $2499

FOR MORE DETAILS:  https://",0,0,0,0
3D Printing Industry,@3dprintindustry,2021-10-21T11:02:38.000Z,3D Printing  Industry Thursday 21 October 2021 -  http://,0,1,2,0
Gambody,@Gambody_com,2021-10-21T18:03:03.000Z,"The Empire Strikes Back and offers two extremely detailed and articulated  3D printing  models with a 23% discount!

Check out the new Bundle Jam duo on Gambody and start building your army:  https://",0,0,0,0
James Gingerich #B2B #Technology #Influencer,@jamesvgingerich,2021-10-21T14:55:00.000Z,"Scientists  3D print  ""biomimetic"" copy of human tongue. (Futurism)  #HealthTech #3DPrinting https://",0,0,0,0
Creative Feel,@CreativeFeel,2021-10-21T13:31:10.000Z,"We are constantly being reminded of the relationship between art & tech, so why not  #fashion ? 3D printing , scanning & more are being harnessed by artists & designers in their work & Kiara Gounder is one such designer.

Catch up with her in our Q&A  https://",0,0,0,0
ENGins Material,@ENGins_Material,2021-10-21T11:26:43.000Z,NASA Funds Antimicrobial  3D Printing  Materials for Space Applications. NASA has awarded $1.13 million to researchers from the University of Nebraska Omaha (UNO) and Chilean nanotechnology company Copper3D to develop and...  http:// #Materials #bioinspired #ENGins,0,0,0,0
KJD_3D_Printer (Real Life Bot),@Kjd3d,2021-10-21T12:55:02.000Z,KJD3D :   Printing is at 40%,0,0,0,0
Matthew_Graydon,@graydon_matthew,2021-10-21T15:22:44.000Z,My  3d printing  adventure begains! Pictured the Elegoo test print the rook.,0,0,0,0
Gary Buller,@GaryBuller7,2021-10-21T12:01:59.000Z,Tomorrow!  3D Print  for Repair Workshop. 10.00-13.00. DM me for an invite link  #sharepair  @SMehta_MMU  @MMUEngage,0,3,2,0
3DHEALS,@3dheals,2021-10-21T12:15:44.000Z,When Artificial Intelligence Meets  3D Printing https:// #ExpertCorner #medical3dprinting #bioprinting #3DTech,0,0,0,0
Karin Hilshire,@GhostKarin,2021-10-21T11:37:23.000Z,"""Any chance we can skip school? And connect your laptop to the  3D printer ?""  #SmartDollHaruka #SmartDoll",0,3,0,0
3D Printed Sports,@3DPrintedSports,2021-10-21T17:52:52.000Z,,0,4,1,0
joerg,@85jk71,2021-10-21T14:30:03.000Z,3D Printing  Shrinks Lab-on-a-Chip Devices Even Smaller  https://,0,0,0,0
ENGins Nanotech,@ENGins_Nanotech,2021-10-21T11:23:33.000Z,NASA Funds Antimicrobial  3D Printing  Materials for Space Applications. NASA has awarded $1.13 million to researchers from the University of Nebraska Omaha (UNO) and Chilean nanotechnology company Copper3D to develop and...  http:// #nanotech #ENGins #technology,0,0,0,0
bubbleistrouble,@bubbleistrouble,2021-10-21T12:40:48.000Z,"3D printed  cap makes many, fleeting bubbles",0,0,0,0
Tim@White Horse CAD,@WhiteHorseCAD,2021-10-21T14:15:01.000Z,Technical Thursday - here's our 'Benchy's' created on our  3D Printer . There's more to these little boats than meets the eye - this known test proves our software and printer can create the complex features of these models accurately. What can we print for you?,0,0,0,0
petz-r-us,@petz_r_us,2021-10-21T18:21:23.000Z,3d Printing  Cute Tshirt Children Casual Clothing 4-14T Baby Boys Girls Summer Animal T-shirt Kid Cartoon Dog Tops Tees T Shirt  #pets #doglover #doglovers https:// te-tshirt-children-casual-clothing-4-14t-baby-boys-girls-summer-animal-t-shirt-kid-cartoon-dog-tops-tees-t-shirt/ …,0,0,0,0
Universities Canada | Universités Canada,@univcan,2021-10-21T14:00:01.000Z,"One house, one printer at a time:

In partnership with Habitat for Humanity,  @UWindsor  is planning to provide the first  3D-printed  homes for residential use in  The goal is to help local families in need & to change the face of sustainable housing  https://",0,3,1,0
Carter Cheng,@CarterWCheng,2021-10-21T10:03:56.000Z,"When combined, with  3D printing , the question becomes, how to develop engine technologies tailored to this phenomena? Would it be viable?

The Long Tail: Why the Future of Business is Selling Less of More by Chris Anderson  https:// 566.The_Long_Tail …  via  @goodreads",0,0,0,0
Sumo,@SumoCrafts,2021-10-21T19:22:56.000Z,Time for a new model to be made!!! This time I plan to take on the North Star Seapost in  @SeaOfThieves  Got a nice plan for this in  3D printing  so lets get started!,0,2,0,0
3D Printing Science,@3DPScience,2021-10-21T10:16:29.000Z,Cool!,0,0,0,0
ᴊᴀʀᴋᴋᴏ ᴍᴏɪʟᴀɴᴇɴ (PhD),@Jarkko_Moilanen,2021-10-21T18:18:20.000Z,Brilliant use of  3D printing #fetus #pregnant #3Dprinting,3,17,5,0
ꨄ︎,@icysilk,2021-10-21T10:24:34.000Z,3D printed  nail art by Eichi Matsunaga for Iris van Herpen,0,149,21,0
BOCKS!,@bockscars,2021-10-21T15:55:37.000Z,Supports from a large  3D print  always look like the worst roller coaster disaster,1,16,2,0
GTMA - Manufacturing Resource Centre,@gtma1,2021-10-21T13:00:08.000Z,"Tri-Tech 3D
UK’s leading expert in  3D printing . Offer the complete range of Stratasys Polyjet & FDM  3D printing  technologies. https:// @TriTech3D #gtmamember",0,0,0,0
11thShadowDragon,@11thShadowDragn,2021-10-21T10:24:06.000Z,Not me realizing at 3:19 am that if I had a  3D printer  I could make a coffin with a lid to hold little paracord people for keyrings...,0,0,0,0
A Nether Dimension 3D,@ANDimension3D,2021-10-21T12:02:27.000Z,"My 3D scanner will be here on Saturday, so I am REALLY EXCITED! It can scan 0.3mm-0.5mm details. Has automatic turntable & mobile scanning. I can scan complex objects I'd have a hard time modeling from scratch. A 3D scanner is beneficial to both my gaming &  3D printing  careers!",0,2,0,0
Extruder Joe,@ExtruderJoe,2021-10-21T17:08:51.000Z,3D Printing : Roboze To Launch Recycling Program  https:// -launch-recycling-program …,0,0,0,0
"""Stable"" Gweny Bee",@GwenBFX,2021-10-21T13:11:04.000Z,". @Hor1zon_Project  will be the next project to moon for sure. Awesome design, active community and awesome roadmap ( 3D printing ). You should follow them RIGHT. NOW.",0,2,2,0
Erik Hamburger (he/him) #StandWithUkraine,@AmbidexterMan,2021-10-21T17:07:47.000Z,Accelerating the Discovery of Materials for  3D Printing https://,0,0,0,0
3D Printed Sports,@3DPrintedSports,2021-10-21T15:32:13.000Z,This is the way!  Helmet guys have skills but the cosplay crew knows what’s up when it comes to helmet finishes…can’t wait to see the progress on this lid with Alumaluster (the actual paint used for The Mandalorian show)!  #ThisIsTheWay @PhilHecken @UniWatch @bobafettfanclub,0,4,1,0
The Cycle Collective,@cyclecollective,2021-10-21T16:06:05.000Z,Found: Stellar Performance Pedal Sticks  3D printed  titanium crankset prototype  http://,0,0,0,0
Bikerumor,@bikerumor,2021-10-21T16:03:54.000Z,Found: Stellar Performance Pedal Sticks  3D printed  titanium crankset prototype  https:// nd-stellar-performance-pedal-sticks-3d-printed-titanium-crankset-prototype/ …,0,2,1,0
IP&E | Industrial Plant & Equipment,@IPEmagazine,2021-10-21T12:30:24.000Z,Sweden's Application Centre for  Additive Manufacturing  aims to accelerate new production techniques across the country's manufacturing sector. https:// acturing-centre-sweden … #manufacturing #additiveManufacturing #3Dprinting #Volvo #Siemens #Ericsson #SKF,0,2,0,0
Flashforge®,@ff3dprinters,2021-10-21T09:41:50.000Z,"How well does  #Flashforge #Creator4  print? Check out this video to find out! 3D Printer : Flashforge Creator4  
Material: pacf+hips
Application: design prototype and volume manufacturing.
For Creator 4 details and quotation:  https:// #3d #3dmodel #test #3Dプリント",2,6,0,0
James Gingerich #B2B #Technology #Influencer,@jamesvgingerich,2021-10-21T10:58:00.000Z,"This podcar is electric, autonomous and  #3D  printed.  Can it get anymore innovative than that?  (Mashable)  #EV #AutoIndustry #AutomobileIndustry",0,0,0,0
Motor Trade News,@UnicomInsurance,2021-10-21T16:41:03.000Z,Porsche starts offering  3D-printed  seats https:// #motortrade #motortradenews #insurance Follow us for MULTIPLE great pro-motor-trade posts like this EVERY DAY!,0,0,0,0
Trident Technical College Workforce Training,@TTC_CE,2021-10-21T15:17:39.000Z,Learn how to design and create useful objects and works of art with cutting-edge  3D printing  technology. Free two-session classes funded through a grant from the  @boschusa  Bosch Community Fund start Oct. 29 and 30 for youth ages 11-17. Learn more at  https:// .,0,0,0,0
3DHEALS,@3dheals,2021-10-21T15:02:20.000Z,"Powder bed fusion using Laser or Electron Beam as a heat source is the most used  3D printing  process for metal implants. Variations in handling, quality control, and safety limitations related to powder size and flowability.  https://",0,0,0,0
peggy sue,@UGetPegged,2021-10-21T14:27:57.000Z,"Calling mga anak ng senador dyan, pa  3D print  naman ng trophy para di sayang ",1,5,0,0
Emily Walco,@EmilyWalco,2021-10-21T18:28:45.000Z,I need to do a *bunch* of  3D printing  for an upcoming study. Anyone have suggestions of quick and affordable resources/places to order from?,1,2,2,0
bubbleistrouble,@bubbleistrouble,2021-10-21T10:10:49.000Z,"3D printed  cap makes fat, reflective bubbles",0,0,0,0
DyeMansion,@WeAreDyeMansion,2021-10-21T11:14:38.000Z,Showtime for our color wall   Our sales partner  @kreos3d  is attending the  3D PRINT  CONGRESS EXHIBITION in Paris. Looking for bright colors for your  #SLS / #MJF  parts? Come by!   Our partner platform:  https:// #print2product #3Dprinting #AdditiveManufacturing,0,2,0,0
Wevolver,@WevolverApp,2021-10-21T10:46:08.000Z,"Be among the first engineers in the world to prototype with a new high-temperature carbon fibre  3D printing  filament. Submit your entry to the High-Temperature Carbon-Fiber  3D Printing  Challenge today!

Read more about the challenge by  @MCAMconnect  here:  https:// emperature-carbon-fiber-3d-printing-challenge …",0,2,0,0
Charles Russo,@Charles_M_Russo,2021-10-21T15:57:53.000Z,Stratasys Creates  3D Printed  Display Pieces for Exhibition  #3dprinting https:// rticles/2021/october/stratasys-creates-3d-printed-display-pieces-for-exhibition/ …,0,0,0,0
PTEC-HAMA,@PTECHAMA_Chile,2021-10-21T14:50:10.000Z,"#CumbreManufacturaAvanzada2021 El turno de  @LEITAT_CHILE  presentado por Gabriel Urzúa, Senior  Additive Manufacturing  R&D Engineer, su trabajo en el CEM3D junto a empresas nacionales @Corfo @en_avanzada @udeconcepcion @ucscconcepcion @dinn_ucsc @INACAP_CONCE @INACAPINOS",1,3,2,0
Rabid 3d Printing,@Rabid3dprinting,2021-10-21T10:00:01.000Z,You'll likely hear a Kingfisher before you see them -- they have a rattling call! Tell me about the last time you saw a Belted Kingfisher. Shop now at  https:// cts/belted-kingfisher-set … .  #Rabid3dprinting #kingfisher #pendant,0,0,0,0
USD 216 Deerfield,@USD216,2021-10-21T13:56:55.000Z,It was great to get out last week in our Elementary & see all the great things going on. From CORE instruction to our STEAM classroom with our new  3D printer  & robots our kids have great opportunities because of our great staff.  #InTheArena #Spartans216,0,0,0,0
3DCulture,@3dculture_offl,2021-10-21T17:13:57.000Z,"Printer review - Mars Pro by SoonSer.

SLA  3D printer  family, The Mars Pro series is suitable for prototyping, manufacturing https:// #3dculture #3dprintingculture #3dprintingcommunity #3dprintingindia #3dcommunityindia #additivemanufacturing",0,0,0,0
Peter Zelinski,@AMPeterZelinski,2021-10-21T14:06:36.000Z,"One of my favorite  #coolparts  because of the hugeness of the promise behind it. What happens the economics of polymer  3D printing  get better? We are close to a time when plastic and rubber component production can be much more nimble, with much more of the work done domestically.",0,0,0,0
"AVS 3D Printing, Laser Cutting & Engraving",@AVS3DPrint,2021-10-21T16:45:05.000Z,"We are running a sale through Halloween! Any purchases over 20.00 before shipping and taxes automatically get 20% off when you check out. No coupon code needed. 

Thank you for shopping with us & have a spectacular spooky Halloween!  #ttrpg #dnd #pathfinder",0,5,4,0
makexyz,@makexyz,2021-10-21T17:08:53.000Z,"Holy growth!

Recent analysis finds that the global  3D printing  materials market is projected to reach $3.18 billion by 2027 from $1.33 billion in 2020 at a compound annual growth rate of 13.3%.  https:// emand-for-customization-drives-the-global-3d-printing-materials-market/article_d017fa76-3d57-5daa-84ba-41bcc86665d3.html … #3dprinting #3dtechnology #3dindustry",0,0,0,0
Community,@PROSTEP_INC,2021-10-21T14:00:07.000Z,"PROSTEP has entered into a strategic partnership with the Dutch technology company AMbrace, which is developing a service platform that makes it possible to  3D print  spare parts.  https:// #PROSTEP #AMbrace #3DPrinting",0,0,0,0
3D Printing Dad @3DPrintingDad@fosstodon.org,@MrCarefulGamer,2021-10-21T18:37:18.000Z,"I watched the  @smartereveryday  on privacy. Related to it is the 4Privacy Kickstarter, aimed at creating tech that will give more control over privacy of information to users. @DestinSandlin   - I don't know if you'll see this but one question: will there be an effort to seal",0,0,0,0
David Gray,@DavidRIchGray,2021-10-21T18:53:01.000Z,2021  3D Printing  Industry Awards – Vote Now  https://,0,0,0,0
Hybrid Services Ltd,@HybridServices,2021-10-21T13:05:03.000Z,"Available soon - the exciting new Mimaki 3DUJ-2207 compact, full colour  3D printer . Register your interest and be one of the first to see this impressive new model:  https://",0,0,0,0
Tshimologong Precinct,@TshimologongIT,2021-10-21T11:27:01.000Z,"#Fakugesi2021  presents: 
From Illustration To  3D Printing  (Workshop)

We have started with our  3D Printing  Workshop, taking place  @TshimologongIT , facilitated by Mpho Makhutu & assisted by Brandon Fisher. The team is being assisted to design a 3D Model using CAD Software...",1,7,4,0
Missouri River Relief,@mo_river_relief,2021-10-21T18:01:47.000Z,"Check out what's swimming around the Missouri River Relief office these days! We had four  3D-printed  replicas of the endangered Pallid Sturgeon created for our upcoming Traveling Trunk program. Until then, these prehistoric looking fish will be housed on our shelves.",0,2,0,0
Swanson Reed,@swansonreed,2021-10-21T18:16:50.000Z,"Delta P Design, Inc. has designed a rifle suppressor with gas chambers to enhance performance - all while being  3D printed .  #SROregon #SRManufacturing https:// of-the-month-october-2021 …",0,0,0,0
Fabbing,@fabbing,2021-10-21T14:08:05.000Z,The  3D printing  technology behind SIENA Garden’s “eternal spare part” offering  http://,0,0,0,0
Scott Felber,@ScottFelber,2021-10-21T11:40:09.000Z,Why is NX the go to solution when designing for  additive manufacturing ?  https:// #NXMakesItReal #CAD #Engineering #Additivemfg,0,0,0,0
bubbleistrouble,@bubbleistrouble,2021-10-21T18:20:48.000Z,"3D printed  trash can makes many, ephemeral bubbles",0,0,0,0
WineRides,@WineRides,2021-10-21T12:28:34.000Z,"just incase does anyone have google sketchup pro and the ablity to turn a sketchup file into an .stl file form me. 

its a very simple test i'm dong to see if I can get somethig  3D printed .",0,0,0,0
Jesse/Zen,@Zenumtin,2021-10-21T18:03:28.000Z,I'm finally starting Metroid Dread! (And doing some  3d printing  of course)  https://,0,5,1,0
SYS Systems,@SYS_Systems,2021-10-21T15:00:53.000Z,"The most reliable
The most productive
The most affordable
Industrial-grade 3D printers. 
Ever.

Take a closer look at the capabilities of the F Series from  @Stratasys  and find out more about  3D Printing  in Engineering:  https:// #3DPrinting #AdditiveManufacturing",0,0,0,0
UEA School of Engineering,@engineeringuea,2021-10-21T14:32:02.000Z,Make sure to check out our fun and creative  3D printing  opportunity as part of  @NorwichSciFest  2021!  http:// #RethinkEngineering #UEAScience,0,0,2,0
Fabbing,@fabbing,2021-10-21T16:18:33.000Z,Desktop Metal Qualifies Nickel Superalloy IN625 for Production System  3D Printing http://,0,0,0,0
Premier Radio Wrexham,@RadioWrexham,2021-10-21T14:42:33.000Z,Schoolgirl faces terror trial after 'being caught with bomb-making video and guide to  3D-print  gun'  http:// rl-16-to-face-terrorism-trial-after-being-caught-with-bomb-making-video-and-instructions-on-how-to-build-home-made-gun-12440227 …,0,0,0,0
MatterThings Inc.,@MatterThings,2021-10-21T16:19:36.000Z,"http://  and Reflow  3D print  luxurious portaloo from upcycled plastics: The 2021  3D Printing  Industry Awards are finally upon us. Interested in tuning in? The Youtube livestream link is now live, so viewers can subscribe and set reminders…  http://",0,0,0,0
Helping Hand Project @ NCSU,@helpinghandncsu,2021-10-21T14:17:34.000Z,"ABOUT US!: We are the Helping Hand Project, a student organization at North Carolina State University whose primary goal is to design and create, through the use of engineering and  3D printing , prosthetic hands and devices for children and adults with upper limb differences.",0,0,0,0
TechPats Reverse Engineering,@patent_analysis,2021-10-21T15:20:05.000Z,"""Isn’t it Good, Satellites Made of Wood?: The European Space Agency is backing a demonstration mission that will loft a wooden CubeSat equipped with  3D-printed  components. The post Isn’t it Good, Satellites Made of Wood? appeared first on…  https://  h/t EETimes",0,0,0,0
Karin Hilshire,@GhostKarin,2021-10-21T11:27:02.000Z,"""Come on kids, your big sisters need some help with moving the  3D printer  off the kitchen table."", ""Oh?"", "" 3D printer ?"", ""Hmm..."", ""Must be big!"", "" 3D printer  you say?""  #SmartDollValiant #SmartDollHaruka #SmartDoll",0,3,0,0
Denise Kaltofen,@NysaTranslation,2021-10-21T10:02:49.000Z,"https:// Protolabs: Digital manufacturing for the medical industry

""details the benefits of using  3D printing  technologies within the medical sector"" #medtech #xl8 #digitalhealth #innovation #3dprinting #medicaltech #printing",0,0,0,0
Bobby Cat,@Hipster_Bobcat,2021-10-21T13:34:28.000Z,Reason I need to get a  3D  printer  152737,1,3,0,0
Smith-KettlewellRERC,@SKERI_RERC,2021-10-21T19:12:33.000Z,"Want to learn more about  3D printing  for Geometry lessons?  @VIProgramSFSU  recorded a handy dandy tech-talk to get you started. Not too short, not too long- just RIGHT!  https:// d-perception-pedagogy-and-practice-3d-printing …",0,5,4,0
Håkan Fägnell,@HakanFagnell,2021-10-21T15:27:16.000Z,upcycled plastics are turned into luxurious Portaloo with  3D printing https:// ics-are-turned-into-luxurious-portaloo-with-3d-printing/ …,0,0,0,0
Yeah Genius,@YeahGenius_,2021-10-21T15:39:09.000Z,A Guide to  3D Printing  Support Structures in Cura  https:// ting/a-guide-to-3d-printing-support-structures-in-cura/ …,0,0,0,0
NICOLAS - IA,@NicolasIsntWild,2021-10-21T16:52:41.000Z,"i  3D printed  a pumpkin planter for halloween in class :D 
his name is jack, and he still needs to find his plant",2,5,0,0
fourmi,@fffourmi,2021-10-21T17:23:42.000Z,I love sovol  3d printer ！  https:// -sv01-direct-drive-extrusion-3d-printers?smile_ref=eyJzbWlsZV9zb3VyY2UiOiJzbWlsZV91aSIsInNtaWxlX21lZGl1bSI6InR3aXR0ZXIiLCJzbWlsZV9jYW1wYWlnbiI6InBvaW50c19wcm9ncmFtIiwic21pbGVfY3VzdG9tZXJfaWQiOjU0ODMzODYwMn0%3D …,0,0,0,0
Simon Portegies Zwart,@Simon_PZ,2021-10-21T17:43:08.000Z,"my neighbor's son, Twan (12 years: I was mostly picking my nose at that age) makes 3d projection photo's with his dad's  3d printer . A light behind the print reveals the foto! And he sells them via a self made website:  https:// here is an example of foto and print:",0,4,1,0
Grainger & Worrall,@GraingerWorrall,2021-10-21T10:25:00.000Z,"In our latest article, we cover the main aspects of  #EV #lightweighting , including material substitution and reduction, fuel economy targets, large  #prototyping , and  3D printing , along with the challenges involved.  https://",1,5,3,0
Count's Kustoms,@CountsKustoms,2021-10-21T10:00:01.000Z,Jaw Dropper is here! Horny Mike spent YEARS building this insane bagger! All  3D printed  and custom airbrushed! Did you catch last nights episode of Counting Cars?! Tell us what you think of Mike’s new ride! • #countskustoms #countingcars #lasvegas #history #hornymike,48,312,30,0
ENGins Astro & Space,@ENGins_Space,2021-10-21T11:28:28.000Z,NASA Funds Antimicrobial  3D Printing  Materials for Space Applications. NASA has awarded $1.13 million to researchers from the University of Nebraska Omaha (UNO) and Chilean nanotechnology company Copper3D to develop and test...  http:// #Astrophysic #ENGins #space,0,0,0,0
Plastics World,@PlasticsWorld,2021-10-21T13:45:02.000Z,"Fast parts specialist  @Protolabs  to expand   #3Dprint  capacity in US. Will start construction of a new 11,000m2 facility at Raleigh, NC, next month to meet ""strong growth"" in demand for  additive manufacturing  projects. Start-up forecast for late 2022  https://",0,2,1,0
bubbleistrouble,@bubbleistrouble,2021-10-21T16:20:49.000Z,"3D printed  trash can makes big, transparent bubbles",0,0,0,0
Bryit_,@Britt1166,2021-10-21T17:05:15.000Z,3D Printing  Industry Awards 2021 - Watch Live  https://  via  @YouTube,0,0,0,0
blakmac,@blakmaclives,2021-10-21T17:57:52.000Z,"WTF...  @SurreyPolice  just about anything could ""information that can aid terrorism"". 

This shit is freely and publicly available. 

Fuck you all. Bunch of scared thugs. 

Everybody over there should be  3D printing  non-stop and refusing to tolerate your bullshit.  https:// /PanvidyaMagnus/status/1451237143829942275 …",0,0,0,0
Childhood Memories,@nostalgiainsta,2021-10-21T17:21:06.000Z,A Doctor made a  3D print  from ultrasound result for a blind mother.,0,0,0,0
TJ Fiorenza,@CoHi_Titans,2021-10-21T13:16:53.000Z,Max Le is making a guitar with a  3D printer  in Mr. Craig’s class. Great stuff!  @Colony_High @DrBunn @Hibenator @CoHSDiscipline,1,5,0,0
