Author Name,Author ID,Date,Post Text,Replies,Likes,Reshares,Views
Mike Dailly™,@mdf200,2021-06-20T18:39:43.000Z,"Doin’ me some  3D printing …. Been a while, but got a new mini resin printer, so got my FlashForge going again….",1,9,1,0
anna,@a_he3d,2021-06-20T20:14:00.000Z,17.7US $ | 3D printer  accessories MK3 aluminum substrate hot bed 214*214*3.0MM reprap standard heatbed| 3D Print ...  https:// 82.html?channel=twinner …,0,0,0,0
Arab News,@arabnews,2021-06-20T10:14:56.000Z,Saudi developer  @DarAlArkan  is using  3D printing  technology to build homes in half the time  https://,0,8,2,0
Exposing the Communist Radical Left,@raikagestore,2021-06-21T02:47:41.000Z,#otakuworld #sao  Naruto Monster  3D Print  Short,0,0,0,0
Makelab | 3D Printing Services,@makelab_3D,2021-06-20T16:03:18.000Z,"These amazing smooth cups are printed in white PLA , standard quality 200 microns.",0,0,0,0
Gift-Feed,@gift_feed,2021-06-20T17:00:28.000Z,https://   $0.00 USD  NERA Fully  3D Printed  E-Motorcycle Retweet if you like!   Coolest things here  #viral #rides #mencave #lux #speed #carshow,0,0,0,0
Fisinformático,@Tach80,2021-06-20T15:33:42.000Z,"Hey @WarComTeam I uploaded these bases for  3D printing , for those old school models of Fantasy some of us still have lying around. Care to RT to reach people who might be interested?",0,0,0,0
Liam,@Cool_Dude_Liam,2021-06-20T19:48:14.000Z,"My mother : you need to be more fiscally responsible 
Me : *buys $200  3D printer  bc I want a hobby*
Mother: wtf* visual disappointment*",0,0,0,0
electrochemicat,@electrochemicat,2021-06-20T21:09:38.000Z,Tailoring Pore Structures of  3D Printed  Cellular High-Loading Cathodes for Advanced Rechargeable Zinc-Ion Batteries (relevance: 100%)  https:// ll.202100746?af=R … #battchat #batterytwitter,0,4,1,0
CHEK News,@CHEK_News,2021-06-21T00:57:13.000Z,UVic professors awarded provincial grant for brain tissue  3D print  modelling  https:// s-awarded-provincial-grant-for-3d-print-modelling-of-brain-tissue-822625/ …,0,5,0,0
STUDIO192.NL,@247robby,2021-06-20T15:48:25.000Z,"[605]  #zzp  3Dandprint  #3D #Printer #Adventurer  3 -  #FDM  Print  #technologie  -  #PLA ,  #ABS ,  #PETG .   http://  ( #TYTCB )",0,0,0,0
BennyTheBull,@BennyTh10118395,2021-06-21T02:47:11.000Z,3D printing  houses should be the norm,0,0,0,0
iVyasa,@ivyasaa,2021-06-20T15:53:13.000Z,"#Technology  -  #3dprinted  
  -- Volkswagen to use new  3D printing  process in future vehicle production  #iVyasa @ivyasaa #Volkswagen #Production #technews #tech #techno http:// RQ?ocid=st …",0,0,0,0
Not A Games Dev Ollie,@Reksaurian,2021-06-20T20:22:59.000Z,Food coma...setting in... =_=,1,0,0,0
François Lagunas,@madlag,2021-06-20T17:01:58.000Z,"DIY weekend: designed and  3D-printed  a case for a mini screen, for a Mac Mini server.  #prusa",0,8,0,0
The 3D printing belgian #FreeThe3DPGeneral,@3DPBelgian,2021-06-20T17:53:56.000Z,I would have to disagree on the whole professional aspect. Professional companies will rather use formlabs and strat. I recently saw a goodsmile factory visit. 0 prusa. All formlabs and weirdly a mega zero. I would say its more higher end consumer grade than professional.,3,2,0,0
Noel Skum,@skum_noel,2021-06-21T01:13:26.000Z,Idea for an invention: a  3D-printed  rocket that absorbs socks. If you don't like it you're a nugget.,0,0,0,0
,@gozda69,2021-06-20T21:57:00.000Z,3d print  por  @Jimmy_PR_17  y pintado por mi  #3Dprinting #Pokemon,1,3,1,0
Lewd Dude (Steely Phil eSports),@Lewd_Dude69,2021-06-20T19:48:09.000Z,3D Printed  and painted this Harvest Moon logo to go with my collection,0,5,0,0
ExOne,@ExOneCo,2021-06-20T17:24:36.000Z,Making History: Habitat for Humanity builds first  3D-printed  home in Tempe  https://,0,4,0,0
Amazing Store,@AmazingStore17,2021-06-20T14:06:16.000Z,customgogo Hip hop rap Hoodie Boys Girls Kids  3d Printed  Unisex Sweatshirts Long Sleeve.  https:// -hop-rap-hoodie-boys-girls-kids-3d-printed-unisex-sweatshirts-long-sleeve/ …,0,0,0,0
frank arko,@farkomd,2021-06-20T13:25:56.000Z,Hopefully  3D printing  will help guide therapy,0,6,1,0
Middle-East & Pakistan Times of News,@MiddleEastTon,2021-06-20T17:04:13.000Z,Saudi developer Dar Al Arkan builds  3D-printed  homes in half the time  https:// my/saudi-developer-dar-al-arkan-builds-3d-printed-homes-in-half-the-time.html …,0,0,0,0
がんにい,@pikaDAM,2021-06-20T13:09:29.000Z,YoichiroKoga にアカウントを移行しました．良かったらフォローしてください．最近は3D Printing Corporationという会社で最高技術責任者をやっています．ただ、つぶやく内容はほぼかわらないです．,0,0,0,0
yeddy,@payed09,2021-06-20T07:45:48.000Z,Gila kaya nak mampus ada  3D printer  :'),0,0,0,0
empirisch,@empirisch2,2021-06-20T18:16:57.000Z,3d printing  could be a reality sooner than you think.  #DIY #FindingDIY . Check  3d printing #DIYProjects  here  https:// search=3d+printing …,0,0,0,0
˙ʇᴉ ʇnoq,@GolfMamba,2021-06-20T16:44:32.000Z,"Don't share much of my pick ups, but had to share these. Quality is amazing, and for those that know me, know I love  3D printed  anything. More to my 4D collection.",2,5,0,0
3D Prints Mart,@3dsmartprinting,2021-06-21T02:37:48.000Z,Silver PLA  3D Printer  Filament  #3dprinterforyou #3dprintersmart https:// printer-filament/ …,0,0,0,0
Haych Storm©,@Museontheloose,2021-06-20T11:30:02.000Z,"Checkout and  #subscribe  to the top story  @mashable : 'This light e-bike was totally  3D printed  '  https:// s/1406483701073121282/video/1 … , see more  http:// ?s=tnp …",0,0,0,0
wirefall (AKA Pwn Spice),@DHAhole,2021-06-21T04:46:57.000Z,"Received the following email from Creality ( 3D printer  manufacturer) today at 7AM. Do they know how long it takes to create and print something? The dads wouldn't be getting anything today if I were acting on this ""reminder"" 

I went with the ""highly costly big ticket"" instead ",0,3,0,0
anna,@a_he3d,2021-06-20T15:45:00.000Z,85.0US $ |EI3 dual extruder upgrade kit for HE3D EI3 DIY  3D printer |dual extruder upgrade kit|dual extruder up...  https:// 70.html?channel=twinner …,0,0,0,0
꧁ᵂ.ᕱ d̶o̶m̶i̶n̶o̶ ᕱᵂ.꧂*҉,@pubcho_escargot,2021-06-20T10:23:49.000Z,"3d printed  7.62
ビームライフル風",0,2,0,0
Amy,@He3dU,2021-06-20T14:47:00.000Z,object scan 3d Modeling with software|3D Scanner...  https:// 9166.html?channel=twinnerUS …  $109.0 |3D scanner Z17OR for  3D printer  handheld body face,0,0,0,0
Open Neuroscience,@openneurosci,2021-06-20T20:52:16.000Z,"The open-source optical toolbox UC2 [YouSeeToo] simplifies the process of building optical setups, by combining  3D-printed  cubes, each holding a specific component (e.g. lens, mirror) on a...",1,12,0,0
UglyPlays.exe,@UglyPlays,2021-06-21T00:57:56.000Z,"So update. 

Apparently the the power thing the other night damaged the  3d printer . 

Getting warranty work done in the next 7 days. 

Well damn.",1,3,0,0
Dale,@NatoshaWei,2021-06-20T19:20:00.000Z,HE3D  3D printer  3in1out (owl)  https://  來自  @YouTube,0,0,0,0
☾༺ℓυa༻☽cazavampitos// ENCARGOS 3D OPEN,@Puchiluh,2021-06-20T14:54:11.000Z,Dilo más alto para asustar a la jojopolicía,2,18,2,0
Dr. Kelsi Rutledge,@fishandfreckles,2021-06-20T23:33:04.000Z,Just a normal Sunday gluing parts + inserting tubing in  3D printed  stingray heads…,1,40,1,0
PizZzaBear,@PizZzaBear,2021-06-20T12:23:02.000Z,"Doe anyone have any experience with  3D Printing ? Exploring the idea of creativity and hobbying with one, but where to start?  @3dprintingcom @3dprintingnerd https://",1,2,0,0
Dar Adal,@umfrumf,2021-06-20T19:45:26.000Z,So envision 30/50 years from now when  3D printing  will become very cheap and easily accessible.,0,0,0,0
Judy2k,@judy2k,2021-06-20T07:50:19.000Z,"This is why I love  3D printing  - for those quirky, personal, but useful projects ",0,0,0,0
Mistress Valentina,@Valentina_NSFW,2021-06-21T02:03:07.000Z,"cw: unaware hypno, slavery, 2nd person
You're at your desk, hard at work, reading emails from work, listening to the rhythmic whirr and whine of your  3D printer  in the corner of your office. It's almost...relaxing, almost musical.",3,68,12,0
"AVS 3D Printing, Laser Cutting & Engraving",@AVS3DPrint,2021-06-20T14:21:55.000Z,"Good morning  #ttrpgfamily . Its sun & flowers today. It's my no social media day so just popped in to wish you all a safe, calm, peaceful & happy day. I will check in tonight after the littles go to bed.  #ttrpg @LBSamuelsson  @SewingGeekiness @QueenofCrit  @JessGeekMom",3,9,3,0
So Tsuda,@soichirotsuda,2021-06-21T01:54:48.000Z,I'm gonna  3D print  this!,0,0,0,0
alishanmao,@alishanmao,2021-06-21T00:00:28.000Z,"https:// VpNdg … my  3D Printed  Catamaran RC Air boat.
electric Screw driver:  http://  
Support our work:  http://  
my 3D models:  http://  
my Social Media:  https://  
Electric Power Systems:  http:// https://",0,0,0,0
Mr Trick,@mr_trick,2021-06-20T11:49:38.000Z,"Really pleased with these  3D-printed  cases for my Pocket Operator KOs & Tonic. For €20 each they were a bargain, and the button action is superb.",0,6,0,0
Katzenfaust,@Katzenfaust,2021-06-20T15:42:57.000Z,3d printed  bage doge,0,97,12,0
Floyd Gomez,@fgomez90650,2021-06-20T21:58:14.000Z,Importing and Exporting - Tinkercad for  3d printing  2021  https://  via  @YouTube,0,0,0,0
Dale,@NatoshaWei,2021-06-20T14:32:00.000Z,HE3D Ei3 Full Metal TRIPLE Extruder  3D-Printer  (Kitty)  https://  來自  @YouTube,0,0,0,0
The Maker's Movement,@MAKERS_MOVEMENT,2021-06-20T12:23:43.000Z,"3D Printing  News Briefs, June 20, 2021  We’ve got a lot of research to share with you today, starting with a study on scattering-aware color  3D printing  and then a project with the goal of optimizing 3D... The post  3D Printing  News...

View the entire ar…  https://",0,0,0,0
Wayne Summers,@wayneingolden,2021-06-21T04:53:12.000Z,Stratasys introduces new PolyJet  3D printing  solutions for innovative design  http://,0,0,0,0
BIAS.de,@BIAS_Bremen,2021-06-20T15:30:00.000Z,"Do your  #3D -printed parts have to be tested after build-up to assure their  #quality ?  See Dieter Tyralla's presentation at  #LiM  on June 22, 2021 at 12 pm for an online monitoring approach to validate the part density already during production.  https:// #WLT",0,0,0,0
TTimes,@twt04,2021-06-21T01:19:07.000Z,"Top story:  @mashable : 'These self-sustaining  3D printed  houses generate their own electricity and water '  https:// s/1406775624773947392/video/1 … , see more  http:// tnp …",0,0,0,0
Ziggy,@ZachAttackFB,2021-06-20T15:53:39.000Z,3D printed  monster socket Cozzie. Will hold any standard size energy drink.,2,12,1,0
Einar Petersen,@TheEinarkist,2021-06-20T22:00:43.000Z,QHIliin designed by Carmelo Nazario for Reckoning  https://  my scifi comicbook project. Download and  3D print  models from the series yourself - Readable by the  #visuallyimpaired  - Immersive panels to zoom around in - This is the future!,0,0,0,0
CK's Technology News,@CKsTechNews,2021-06-20T10:47:30.000Z,"Volkswagen plans to use new  3D printing  process in vehicle production

Announce: https:// ses/volkswagen-plans-to-use-new-3d-printing-process-in-vehicle-production-in-the-years-ahead-7269 …",0,0,0,0
Dean Woodyatt,@Dean_Woodyatt,2021-06-20T20:56:08.000Z,Test fit of the  3D printed  Super LED Blinkenator 2000 ‘underside’ solderless PCB! Slight adjustments needed. Last ditch attempt for solderless so fingers crossed!,0,5,1,0
Geoff Wilbur,@geoffwilbur,2021-06-20T17:00:01.000Z,.@Festo_Global and Solukon Partner for Automated Depowdering of Metal  3D Printed  Parts  https:// nd-solukon-partner-for-automated-depowdering-of-metal-3d-printed-parts/ …  by  @MikeMolitchHou  via  @3DPrint_com,0,0,0,0
James Neophytou,@JamesNeophytou,2021-06-20T22:46:49.000Z,"This is the first  3D printed  residential building in Germany.  

Five weeks to go until completion. The result is already stunning. 

Foto by: HeidelbergCement  http://  

Concreteprinting:
PERI 3D Construction  #architecture #buildings #architektur #3dcp",0,2,2,0
RoccoZoom Game News,@roccozoom,2021-06-20T14:25:16.000Z,A  3D-Printed  Game Boy Prototype That Plays PC Games On The Go  https:// ame-boy-prototype-that-plays-pc-games-on-the-go/ …,0,0,0,0
Hannah,@hannahmakes,2021-06-20T17:18:55.000Z,"Here's a quick and nerdy birthday gift I  3D printed  for a friend recently.

Bonus points if you can tell what it is ",18,59,0,0
hbox ebooks,@hboxebooks,2021-06-20T23:51:16.000Z,When you lose to an artificial intelligence virtual reality CRISPR  3D printing  3D holograms electric self-driving cars nanotechnology solar roadways drones / quadcopters literally a fucking raw crab at me.,0,0,0,0
,@TECCK1NG,2021-06-20T20:46:18.000Z,"I really, really want a  3d printer  so I not only print  , but to print my own shoes, like those. Shit, I can print crocs, too.",0,0,0,0
local cryptid ~,@smo_mo_,2021-06-20T11:13:40.000Z,"the advert flashing across the giant surround screens as I descended into the underground this morning were for 'personalised  3d printed  vitamins' and idk what else could give off more dystopian future vibes, except to add that everyone was wearing masks to avoid The Disease",0,0,0,0
Charles Russo,@Charles_M_Russo,2021-06-20T10:44:35.000Z,Saudi developer Dar al Arkan builds  3D printed  homes in half the time  #3dprinting https:// usiness-economy …,0,0,0,0
AstonishTechLife,@astonishtechlfe,2021-06-20T07:40:34.000Z,This light e-bike was totally  3D printed,0,0,0,0
alun,@alun_dawn,2021-06-20T14:26:31.000Z,How to build a  3D Printed  Triple Axis Tourbillon | Assembly Guide  https:// @YouTube より,0,2,0,0
Analyst,@analystrsc,2021-06-20T07:29:00.000Z,"Take a look at 'Rapid, in situ detection of chemical warfare agent simulants and hydrolysis products in bulk soils by low-cost  3D-printed  cone spray ionization mass spectrometry' by Christopher Mulligan  @IllinoisStateU  & Patrick Fedick  @PatrickFedick http://",0,10,2,0
3D Printing,@3DPrinting18,2021-06-20T10:30:17.000Z,I just published Industrial  3D Printing  Dubai — Inoventive 3D,0,0,0,0
Applied Graphene Solutions,@GrapheneLeaders,2021-06-20T13:55:00.000Z,"3D Printing  News Briefs, June 20, 2021  http:// %2F%2F3dprint.com%2F282608%2F3d%2Dprinting%2Dnews%2Dbriefs%2D6%2D20%2D21%2F … #3dprinting",0,0,0,0
Focus Mobility,@FocusMobility,2021-06-20T07:41:23.000Z,"Top story: It took around 45 hours of  3D printing  to build this 1,076 square-foot house  https:// sive-3d-printed-home-built-in-milan-in-45-hours/?europe=true … , see more  http:// /all?s=tnp …",0,0,0,0
marsgizmo,@marsgizmo,2021-06-20T21:39:16.000Z,"How to Design and  3D Print  a Cable Hook for Tripod 

FREE design:  https:// on  @Thangs3D Check the video https:// #Sponsored   by  http://",0,7,0,0
3D Printed Sports,@3DPrintedSports,2021-06-20T13:28:33.000Z,"Fantasy Football stud RB, Josh Jacob’s Oakland Raiders  3D printed  Speedflex mini with his signature 2EG-SW-HD facemask and black out Oakley visor.  Just win, baby!  @UniWatch @PhilHecken  @HelmetAficinado  @HelmetStalker @HelmetAddict @HelmetArch @helmetnation @Elegoo_Official",3,9,1,0
Not A Games Dev Ollie,@Reksaurian,2021-06-20T23:02:31.000Z,"Me: Elements are Solid, Liquid, Gas, and Energy, with philosophical concepts like creation/destruction, or pleasure/pain, and they aren't binary so you can have semi-solids.  Other People: Petrol, Blood, Sound, RUBBER.  People ought listen ta me.",1,5,0,0
3D Printing Services,@delukart,2021-06-20T19:08:04.000Z,Making hang painted vape holder  #vapeholder #vapeholders #vape #plaster #vapingtricks #vaping  #430  https:// ?utm_medium=twitter …,0,0,0,0
Weldtool,@weldtool2,2021-06-20T18:26:20.000Z,How  additive manufacturing  improves the designs of racecars  https:// #weldnews #weldingnews #blog #weld,0,0,0,0
Christopher Boswell - Real Window Creative,@chris_boswell,2021-06-20T23:00:35.000Z,"New, Rainbow, Nude, Multi Color, Perfect, Female Form, Woman, Body  3D Print , Human, Form http:// #Nude #Woman #Form #Rainbow",0,0,0,0
Not A Games Dev Ollie,@Reksaurian,2021-06-21T01:25:45.000Z,"Being me is always an adventure.

For example, I went to brush before bed and just found that my idiotic housemates soaked - and by soaked I mean I've hung it up in the shower 10 minutes ago and it's still pouring a steady line of water - soaked the bathroom mat.",1,0,0,0
Not A Games Dev Ollie,@Reksaurian,2021-06-20T18:39:33.000Z,AWWW.,0,0,0,0
Joel Telling - 3D Printing Nerd,@joeltelling,2021-06-20T16:00:55.000Z,"How to fix YOUR  3d printer : Bed Wires. https:// My  @Prusa3D  mk3 had a short in the bed heater wires. Thanks to new wires from  @LDOMOTORSJASON , I take you step-by-step on how to install PLUS do a test print using  @PrintedSolid  Jessie PLA. WE EVEN GET TO SOLDER!",9,58,7,0
cairoqween,@cairoqween,2021-06-20T07:41:25.000Z,"Top story: Today in tech innovation... It took around 45 hours of  3D printing  to build this 1,076 square-foot house  https:// sive-3d-printed-home-built-in-milan-in-45-hours/?europe=true … , see more  http:// /all?s=tnp …",0,0,0,0
3d Printing and Painting 3DHP,@JERRY_3DHP,2021-06-20T21:07:13.000Z,"I have a Little over 2,474 Subs on YouTube. Once I hit  2,500 Subs. I will be doing a Giveaway Stream. Here are  my Sponsors.
Sergiu Malic ,Nikko, Tony Chambers, Chris Zindrick, 
ZYLtech ,Macewen3d ,Dennis Moore,Th3d Studio
3dWicked, COEX,EM3D,AutoDrop3d,Makers Hub,
Matt German",0,3,0,0
beepbot,@beep_bot1,2021-06-21T04:29:14.000Z,Lessons in image formation and  3D printing  technique for soft robotics for stroke rehabilitation.,0,0,0,0
David Steven Jacoby,@DavidStevenJ,2021-06-20T23:31:02.000Z,Prusa launches the SL1S Speed  3D printer  – technical specifications and pricing  http:// #ai #davidstevenjacoby #manufacturing,0,0,0,0
Not A Games Dev Ollie,@Reksaurian,2021-06-20T22:36:13.000Z,"Which came first; the chicken or the egg?

Answer; you can make a chicken, hen or cock, out of an egg made by a very near but not quite hen.",0,0,0,0
(Uncivilized),@Mokrewki,2021-06-20T10:48:36.000Z,3D-printed  sensors allow for simultaneous recording and imaging of tissues and organs during surgical procedures  https:// 021-06/danl-tsb061721.php …,0,0,0,0
Marissaemmaa,@MarissaEmma_,2021-06-20T17:18:22.000Z,Successfully mounted a new magnetic build plate on my  3D printer  today!,1,17,2,0
Tø©hukwü,@iamtokstesla,2021-06-20T07:41:26.000Z,"It took around 45 hours of  3D printing  to build this 1,076 square-foot house  https:// sive-3d-printed-home-built-in-milan-in-45-hours/?europe=true … , see more  http:// /all?s=tnp …",0,0,0,0
mary bot anderson,@whoismarybot,2021-06-20T23:22:00.000Z,Couldn't think I put in the image of all this dumbass simile Looking for a  3D print https://  Fun game: try,0,0,0,0
BigJake,@JacobAParks2,2021-06-20T20:59:57.000Z,"Should make a good paperweight. Finished my soul stone,  3D printed , drilled, and embedded an led paper lantern light. Inspired by  @odinmakes  Didn't even have to toss anyone off a cliff.  #infinitywar #mcu #loki https:// ?utm_medium=twitter …",0,0,0,0
Not A Games Dev Ollie,@Reksaurian,2021-06-20T19:37:56.000Z,"I may currently be a member of the walking dead but I'm nevertheless managing to make dinner, do laundry, and otherwise clean up after a shower. So bully for me I guess.",0,0,0,0
Not A Games Dev Ollie,@Reksaurian,2021-06-20T20:53:57.000Z,The peak of the entire of artistic history.  https:// /Rythayze/status/1406459125194711043 …,0,94,9,0
FactBuffet,@FactBuffet,2021-06-20T23:12:15.000Z,You can  3D print  pizza!,1,12,0,0
3D Printing Services,@delukart,2021-06-20T19:05:39.000Z,Making hang painted vape holder  #vapeholder #vapeholders #vape #plaster #vapingtricks #vaping  #430  https:// ?utm_medium=twitter …,0,0,0,0
3D PRINT TECH DESIGN,@AntonMnsson,2021-06-20T12:41:26.000Z,Looks like  @F1  TV reporters needs new masks... Keeps falling down every word spoken.,0,0,0,0
technospider,@technospiderssb,2021-06-20T18:15:02.000Z,"Neat mechanism I discovered and modeled based off some math I did for my work.

What it does doesn't really matter (Can't go into details cause it's confidential technology), but it sure does look cool. 

Currently trying to get it  3d printed  cause why not!",0,2,0,0
Research Watcher,@ResearchWatcher,2021-06-20T17:31:44.000Z,"The Global Rise of  3D Printing  During the COVID-19 Pandemic - SiliconExpert  https:// l-rise-of-3d-printing-during-the-covid-19-pandemic/ … , see more  http://",0,0,0,0
moosekababs.bsky.social / moosekababs.tumblr.com,@moosekababs,2021-06-20T14:18:25.000Z,someone with a  3D printer  please print me a teto kasane figure i will pay you money for it but i can't afford the pvc ones that got released officially,0,4,0,0
https://mastodon.social/@vitaut,@vzverovich,2021-06-21T01:41:17.000Z,3D-printed  pyramid or bust!,0,4,0,0
CryptoClocky,@CryptoClocky,2021-06-20T16:00:00.000Z,"FATHER TIME SET OUT NOW!  Only 8 available @ 0.06 ETH Ξ

Each Clocky includes redeemable  3D printed  Father Time Clocky!  https:// ptoclocky … #nftdrop #nft #NFTCommunity #nftart #nftutility #3dprinted",2,5,2,0
Phil #ForNate,@Gidsentinel,2021-06-21T01:16:37.000Z,"I don’t need a  3D printer , I do not need a  3D printer #PrimeDay",0,2,0,0
Komeri | Aspiring Vtuber | EW SPOILERS,@HK_Twitch,2021-06-21T03:18:16.000Z,"I’m thinking about if there won’t be anymore aerith and tifa figurines, ill save up for a  3D printer  and demand that people make different 3D models

ill contact the tifa zine, the aerith zine, the cloud zine, ill have all the 3D models from the greatest artists",0,6,0,0
Duchofilla 3d filament. Vijay,@sangani_vijay,2021-06-20T21:21:07.000Z," 
Material: D-Glass 
First ISO 9001-2015 certified  3d printer  filament manufacturer company   India  #3dprinting #3dprints #3duchofilla #duchofilla #startupindiastandupindia #makers #makeinindiacampaign #makeinindia #madeinusa #startupinvestments",0,0,0,0
Ada,@ragwafire,2021-06-20T17:57:18.000Z,"I should post pictures of my new  3D printer , and resultant prints",1,7,1,0
Craig Scarborough,@ScarbsTech,2021-06-20T08:37:10.000Z,"Rapid and accurate front wing adjustment during sub 2s pitstops is done by this power tool.
The number of turns is preset into the gun. The  3D printed  guide, directs the tool accurately onto the wing adjuster. One push of the button and the adjustment is made.",9,416,52,0
Julie is A REAL BIRD,@jmatwood,2021-06-21T03:23:12.000Z,"I regret throwing away my only bra without underwire. In my defense, it was awful. But now I have zero wireless bras (not even Bluetooth!) and have had to get more creative than I'd prefer. It involved  3D printing , pliers and wrestling with armored underwire channels. ",3,26,1,0
Green Cat's Trinkets and 3D Prints,@GCTrinkets,2021-06-20T15:31:49.000Z,"A Blackmage keychain!  3D printed  in Dark Silk Purple! 
Catching up on some really old pics I took from past orders & this is one! #FinalFantasyXIV #FinalFantasy #FinalFantasy14 #FFXIV #ffxivart #FF14 #ファイナルファンタジーxiv #ffxivblackmage #ffxivblm #blackmage #ffxivendwalker",0,0,0,0
Thijs,@thijs_boom,2021-06-20T15:05:48.000Z,Why is  3D printing  sooooo slow?,0,2,0,0
☾༺ℓυa༻☽cazavampitos// ENCARGOS 3D OPEN,@Puchiluh,2021-06-20T10:49:11.000Z,Amigas para recrear esto dónde?!?!?!?!???!??,4,23,4,0
Brockhouse Institute for Materials Research (BIMR),@BIMR_McMaster,2021-06-20T16:14:14.000Z,"Materials for  Additive Manufacturing  are rapidly evolving. This topic is the focus of a session at the Future Directions of Soft Materials workshop this Tuesday, with talks by Ravi Selvaganapathy, Axel Guenther, Kalai Saravanamuttu, and Tim Long. Don't miss this great session!",0,5,3,0
Constructech,@ConstructechMag,2021-06-20T17:00:52.000Z,The COBOD BOD2  3D printer  used by  @PERIgroup  is certified to allow workers to remain in the print area during the printing process  https:// r-habitat/ … #construction #IoT #sustainability #AI #5G #cloud #edge #futureofwork #infrastructure #COVID19,0,4,2,0
https://mas.corq.co/@rogue_corq,@rogue_corq,2021-06-20T19:48:03.000Z,"Spanish inventor crafts  3D-printed , prosthetic arms  https:// lCtrg&utm_source=dlvr.it&utm_medium=twitter&utm_campaign=rogue_corq … #reuters",0,0,0,0
GayCarBoys,@GayCarBoys,2021-06-21T02:56:54.000Z,VW Now Using  3D Printing  in Parts Manufacture  https:// d-printing-in-parts-manufacture/gay-car-news/vw-news/ …,1,0,0,0
The Additive Report,@AdditiveReport,2021-06-20T17:09:01.000Z,"The Orlando Health Winnie Palmer Hospital for Women & Babies uses MRI, ultrasound imaging, and  3D printing  technology to create a first-of-its-kind, detailed model of a fetus that allows surgeons to plan in-utero surgical procedures.  https:// /article/additive/orlando-hospital-uses-3d-printed-models-of-fetuses-to-prep-for-in-utero-surgery?utm_campaign=FMAC_feed&utm_content=1624208941&utm_medium=social&utm_source=twitter …",0,0,0,0
Amy,@He3dU,2021-06-20T14:56:00.000Z,US $107.9 |Z17OR 3D scanner  3D printer  handheld body face object scan 3d Modeling with software free shipping...  https:// 4333.html?channel=twinner …,0,0,0,0
3D Print Works,@3DPrintWorks,2021-06-20T11:00:04.000Z,"Happy Father's Day to all dads, dads-to-be, dads at heart, and those that dream to be fathers one day!  May your day be wonderful!

From all of us at  3D Print  Works  #FathersDay #Dad",0,0,0,0
Fabricación 4.0,@Fabricacion40,2021-06-20T11:05:45.000Z,"3dprintindustry ""Dentafab's PowerResins cleared for  3D printing  crowns and dentures in EU -  https:// -powerresins-cleared-for-3d-printing-crowns-and-dentures-in-eu-191773/?utm_source=Twitter …  -  #3dprinting """,0,0,0,0
Geoff Wilbur,@geoffwilbur,2021-06-20T14:00:00.000Z,3D Printed  Assistive Tech:  @wearePrintlab  &  @Autodesk  Announce make:able Challenge Winners  https:// ted-assistive-tech-printlab-autodesk-announce-makeable-challenge-winners/ …  via  @3DPrint_com,0,0,0,0
