Author Name,Author ID,Date,Post Text,Replies,Likes,Reshares,Views
anna,@a_he3d,2021-04-25T20:26:00.000Z,30.0US $ | 3D printer  ABS consumables 1.75mm filament 1kg  3D printing  filament FDM| 3D Printing  Materials|   - A...  https:// 09.html?channel=twinner …,0,0,0,0
iDESIGN Solutions,@iDESIGNsol,2021-04-26T13:20:40.000Z,These are amazing  We love how you integrated your  3D Printing  into celebrating Earth Day. I love it!,0,0,0,0
3D Printing Industry,@3dprintindustry,2021-04-26T11:03:17.000Z,3D Printing  Industry Monday 26 April 2021 -  http://,0,1,2,0
jazrelle,@mybraveacolyte,2021-04-26T01:57:20.000Z,if i had a nickel for every white gamer nerd i know that owns a  3D printer  i'd have 2 nickels,3,9,0,0
TheWordPlay,@theword_play,2021-04-25T21:01:15.000Z,Entering the mysterious world of  3D printing . Wish me luck,0,0,0,0
3D Adept Media,@3DAdept,2021-04-26T06:53:50.000Z,"New  Additive Manufacturing  Filament from  @natureworks  provides significant reduction in warping, minimizes print failures -  #materials #additivemanufacturing https:// anufacturing-filament-from-natureworks-provides-significant-reduction-in-warping-minimizes-print-failures/ …",0,5,0,0
Glytch,@GlytchTech,2021-04-26T03:50:57.000Z,same but a  3d printer  in a van  https:// /Foone/status/1386399521467297792 …,1,14,1,0
PuppyLovn,@PuppyLovn,2021-04-26T05:26:58.000Z,#puppylove #lovn #love #doggo #bestfriend #doglover #puppies #toys #treats #goodies #care #lifestyle #dogs  Personality Pillow  3D Printed  Cartoon Dog Cushions,0,0,0,0
Shehzad Younis شہزاد یونس,@shehzadyounis,2021-04-25T21:06:02.000Z,These self-sustaining  3D printed  houses generate their own electricity and water,0,0,0,0
3D Printing Industry,@3dprintindustry,2021-04-26T10:47:03.000Z,PRIMES launches the ScanFieldMonitor  3D printing  laser characterization device -  https:// unches-the-scanfieldmonitor-3d-printing-laser-characterization-device-188606/?utm_source=Twitter …  -  #3dprinting,0,0,0,0
shark (BOOTH items sell),@greatofshark,2021-04-26T08:43:19.000Z,"3D printed  city
3D pdinted brick test again

All the road、house and traffic sign is printing by FDM type machine.

Now, I will check parts can be build the image of my idea.  #3Dprinting #ダイアクロン #BUIDL",1,30,9,0
Lax,@0xlax,2021-04-26T03:32:16.000Z,3D-printing  is a tech art,0,0,0,0
Amy,@He3dU,2021-04-26T14:00:02.000Z,"US $159.0 |HE3D C270 camera laser 3d scanner DIY kit, Reprap 3d Open source Portable for  3d printer |reprap 3d|...  https:// 53.html?channel=twinner …",0,0,0,0
SMART FACTORY MAGAZINE,@SMART_FACTORY_M,2021-04-26T11:41:01.000Z,"El mini páncreas bioimpreso en  #3D  para luchar contra la  #diabetes . Científicos utilizan un proyecto europeo a gran escala para desarrollar un modelo vivo del páncreas en 30 segundos, para probar nuevos  #fármacos . MÁS EN  http:// mini-pancreas-bioimpreso-en-3d-que-puede-ayudar-en-la-lucha-contra-la-diabetes … #bioimpresion #bioprinting",0,3,0,0
Soumya,@Soumyazen,2021-04-25T21:55:29.000Z,Looking at  Additive Manufacturing  sector and pondering on a future allocation to one or two stocks in that space for Long Term investment . Currently looking at Velo3D (  $SPFR  ) and a few others including  $DM  . Ideas and inputs welcome .,21,42,3,0
Casper,@reverse_swing3,2021-04-26T03:02:00.000Z,"How to build a  3D printer  yourself, it's such an amazing project  #engineering",0,0,0,0
Andrew Morawski,@amorawski,2021-04-26T13:41:01.000Z,"This startup uses  #blockchain  to secure supply chains and protect intellectual property for  additive manufacturing , and they've gained the attention of several major customers. Read their story via  @OracleStartup .  https://",1,3,2,0
Jeff Gilmour,@CaptainManiac,2021-04-25T23:09:09.000Z,"PrintABlok Kangaroo I  3D printed . Part of a set of 6 or more other Beasts that have been designed by  @3DPProfessor  to "" 3D print  and build your favorites, or mix and match parts with other sets to  your own awesome creations."" If you loved Legos help fund:  https:// ofessor/printablok-beasts-3d-printed-building-blocks …",0,0,0,0
Safran,@SAFRAN,2021-04-26T13:22:00.000Z,[ #SustainableAviation #DYK ]  #AdditiveManufacturing  — also known as  3D printing  — enables us to design lighter and more geometrically complex parts than traditional manufacturing processes  #additivemanufacturing,0,11,2,0
DNA.am,@DNAamUK,2021-04-26T09:00:01.000Z,"We love to hear that  #AdditiveManufacturing  is making strides on the racetrack!  
Coverage by  @ZenootUK Williams Racing has announced a new partnership with @Nexa_3D, bringing the fastest polymer  3D printing  to the world of Formula One.  https:// am  #formula1",0,4,0,0
Zeak6464,@Zeak6464,2021-04-26T02:21:11.000Z,#GurrenLagann  is ready to  3D print  !  https:// me/gurren-lagann …,0,0,0,0
MIT Sloan Management Review,@mitsmr,2021-04-26T02:02:01.000Z,"7 Technologies Remaking the World  http:// 1. Pervasive computing
2. Wireless mesh networks 
3.  #Biotechnology 4.  3D Printing 5.  #MachineLearning 6. Nanotechnology
7.  #Robotics",0,46,25,0
Teurastaja,@teurajarvi,2021-04-25T21:03:46.000Z,Unboxing  3D-printed  markkeri ja vino pino kiekkoja [FIN ]  https://,0,0,0,0
Blick Winkel(H. Anthony Israel),@blockwonkel,2021-04-26T00:42:37.000Z,"Time to assemble this tank of a  3d printer , I guess",4,38,0,0
3D Printing Canada,@3dprintingcan,2021-04-25T23:46:39.000Z,"Modix part 7! This series continues! It’s been a long journey and it’s going to end soon. 

Check it out here at... https://  @  3D Printing  Canada  https:// ?igshid=xqsrvafyrql0 …",0,0,0,0
SMART FACTORY MAGAZINE,@SMART_FACTORY_M,2021-04-26T07:47:22.000Z,"Engranajes  #3D : definición, tipos y ejemplos impresos. Qué son, los tipos que existen y algunos ejemplos de  #impresión3D  de engranajes. MÁS EN  http:// ranajes-3d-definicion-tipos-y-ejemplos-impresos …",0,2,0,0
World Defense Show معرض الدفاع العالمي,@WDS_KSA,2021-04-26T12:02:43.000Z,"Tech developments that facilitated the Fourth Industrial Revolution have enabled innovations such as robotics, AI automation,  3D printing  and much more. Check out our latest blog on  #4IR  here:  https:// #WDS2022",0,1,2,0
Sanna Valapuro,@MissDeliana,2021-04-26T13:46:30.000Z,Hmm. I just realized that I could probably  3D print  my own presser feet for my sewing machine.,1,3,0,0
Flsun 3d printer,@flsun3dprinter,2021-04-25T23:21:14.000Z,"The moon castle lamp,  printed for my sister,She likes it very much,  stl   https:// 38632319 …",0,0,0,0
Yumenoshima Eden/占拠マンSKT豆腐屋,@Yumenoshima1,2021-04-25T21:00:26.000Z,ARK: SURVIVAL EVOLVED  3D PRINTED  FIGURES/TOYS  https://  via  @YouTube,0,0,0,0
MedScan3D,@MedScan3D,2021-04-26T10:00:41.000Z,Our sister company  @3DTechnologyLtd  continues to deliver cutting edge  3D printing  solutions to companies and sectors across Ireland   Learn how  3D printing  can revolutionise your business by speaking with a member of the 3D Technology team today  https://,0,0,0,0
Peter Johnson #InnovativeArts,@puzzshiftcreate,2021-04-25T23:15:59.000Z,Student Project: How I made a  3D printed  inline 4 engine -  https:// t-project-how-i-made-a-3d-printed-inline-4-engine/ …,0,0,0,0
Kdrew,@Mr_Kdrew,2021-04-26T07:34:21.000Z,My first ever  3D print !  #3Dprinting,2,7,0,0
Scott Pigman,@scottpigman,2021-04-25T22:16:54.000Z,"Some people I know spend their weekends doing cool stuff like  3D printing , programming Arduinos, hacking Raspberry Pi's, or restoring old synthesizers. 

Me, I get to spend the day rebuilding the foundation of a chicken coop.",1,6,2,0
F1 in Schools UK,@f1inschoolsUK,2021-04-26T08:00:37.000Z,"Have you purchased your manufacturing starter kit yet? If not, make sure you purchase yours ready to build your competition car. Remember, all DEV / PRO teams must use the official F1 model block. Entry Class, you must too, unless you choose to  3D print  your car!  #f1inschoolsuk",0,2,1,0
Deals & Promotions,@ItShouldBeYour,2021-04-26T06:00:45.000Z,Artillery® Sidewinder X1  3D Printer  Kit with 300*300*400mm Large Print Size Support Resume Printing&  https:// #gifts #giftideas #dog #cat #puppy #pets #blackfriday #thanksgiving #cybermonday #banggood @banggood #primeday,0,0,0,0
Michael Version 2.023,@Michael_WI,2021-04-26T01:08:30.000Z,"Like those 'bingo cards' all the rage these days, I get 4 out of 5, but I don't yet have a  3D printer .",0,0,0,0
Edmonton 3D Print's,@edmonton3dprint,2021-04-26T04:19:15.000Z,Got a small project on the go for my brother from another mother.  #3dprinter #3dprinting #3dprinted #3dprint #maker #making #tech #bigdata #yeg #yeg3dprinter #edm #edmonton #alberta #AB #yogurt,0,4,1,0
Joel Telling - 3D Printing Nerd,@joeltelling,2021-04-26T05:08:27.000Z,Great job!,1,27,1,0
Not A Games Dev Ollie,@Reksaurian,2021-04-25T20:51:07.000Z,"So...el doughnut rides his bike to the store, buys the stuff, packs it, now has to unpack it into a box he forgot to empty of spare thermal clothes. xD",1,1,0,0
anna,@a_he3d,2021-04-25T20:27:00.000Z,"39.9US $ | 3D printer  consumables, carbon fiber materials, strength and toughness, carbon fiber filament, frost...  https:// 20.html?channel=twinner …",0,0,0,0
Nick Smith - TheMidnightSmith,@midnightsmith,2021-04-26T05:28:02.000Z,"I got my assessment results back, and hung these up today. That's right! Ya boy is officially certified as an  additive Manufacturing  technician and manufacturing Engineer!  #additivemanufacturing #3dprinting #engineering #engineer",5,47,4,0
erika hugged jin last june 13,@shiny_syndrome,2021-04-26T03:05:40.000Z,"After weeks, fixed the loose key on my laptop -  with a  3D printer  pen..",0,0,0,0
Thomas,@picsthomasgg,2021-04-25T19:46:00.000Z,Treated myself to a GoPro Hero 8 and just finished  3d printing  a mount to put it on top of my camera,1,4,0,0
Miguel A. Fuentes Peniza,@AngelPeniza,2021-04-26T06:23:11.000Z,"Additive manufacturing . An emerging threat. 
EL PAÍS https:// 1-04-26/el-primer-taller-clandestino-de-espana-constata-las-armas-3d-como-una-gran-amenaza-europea.html …",0,2,2,0
Paschaline Agughala | Coding & Robotics Instructor,@Pct_unplugged,2021-04-26T13:53:21.000Z,"Applicants must have basic coding skills.  3D Printing  , and Electronics Programming will be an added advantage.  #Jobs #Coding #100DaysofCoding #kids #Monday",0,0,0,0
PrintLab,@weareprintlab,2021-04-26T12:31:54.000Z,"Check out this teacher’s guide to using PrintLab! A big thank you to  @MatterHackers  and  @mrjonesteaches  for creating this content. For our community in the USA, you should definitely give Matterhackers a shout for all your  3D printing  needs!  https://",0,8,6,0
古賀洋一郎 / Dr. Eng. Yoichiro Koga,@YoichiroKoga,2021-04-26T03:54:58.000Z,私がCTOを務める3D Printing Corporation(3DPrintingCorp)のバーチャルツアー動画を撮りました！3Dプリンタを使う会社や最先端技術を活用する会社に興味ある方はぜひご覧ください！ https://,0,0,0,0
Not A Games Dev Ollie,@Reksaurian,2021-04-25T21:50:58.000Z,1ft 6. TINY-OLLIE. :O  https://,0,0,0,0
Tyllah | Email Marketer,@MarketingBully_,2021-04-26T06:21:11.000Z,I can’t wait till I can buy this industrial XL $30K  3D printer  in cash. I can finally make custom office decor and furniture on a large scale then ,2,21,0,0
Matthew Griffin,@311Institute,2021-04-25T20:30:06.000Z,Scientists show off the world's first  3D printed  mini human heart  #FutureNow #Futures #Futurism #FutureTrends #Entrepreneurship #Innovation #Leadership #Technologies http://,0,0,0,0
SuperNfty,@SuperNfty,2021-04-26T12:56:29.000Z,"DAY 2 of the frontpage auctions! One more day!

Super excited to see new bids and secondary sales.   Thank you everyone for the support New people don't forget to join the Discord!

Here's some HD pics of #100's included  3D print ! 
Get your bids in!  https:// er-nfty-floating-heads …",2,9,0,0
PETER BREHM GmbH,@PETERBREHM_GmbH,2021-04-26T11:59:15.000Z,We are proud to announce that our MRS-TITAN family for  #hip  revision is expanding. The new revision cup system MRS-TITAN Standard and Maximum with the innovative trabecular surface structure is manufactured in  3D printing . More information?  https:// e/mrs-titan-standard-und-maximum/ … #PETERBREHM,0,3,2,0
Invest in Plymouth,@InvestPlymouth,2021-04-26T10:01:04.000Z,"How can you transform the world through  #3Dprinting ? Join the Smart Citizens' Sustainable Design Talk on 29 April to hear how  @3dwasp , specialists in  3D printing , are leading the  #sustainable  housing revolution.

Register:  https:// @fablabplymouth",0,5,3,0
hackaday,@hackaday,2021-04-26T08:02:11.000Z,3D-Printed  Laser Scanning Confocal Microscope Measures Microns,0,42,13,0
AstonishTechLife,@astonishtechlfe,2021-04-26T08:40:18.000Z,We totally need this chocolate-molding  3D printer,0,0,0,0
Matt Clarke - @akamatchstic@mastodon.online,@akamatchstic,2021-04-25T20:16:17.000Z,"First ever  3D printer ! Grab a drink, then watch me unbox, assemble and test the Original Prusa Mini+",2,11,0,0
Nikki E,@NikkiEgeberg,2021-04-26T12:10:52.000Z,Watch robots build houses at incredible speed.  3D printing  meets AI.  https://  via  @YouTube,0,0,0,0
Not A Games Dev Ollie,@Reksaurian,2021-04-25T21:58:26.000Z,,0,0,0,0
オバホル OVERHAUL,@CrowRebuild,2021-04-26T13:17:00.000Z,"A Infinite  3D Printer  on legs wishes to a Alliance with a Criminal? This almost sounds like a honeytrap set up for a Villain. 

But I could definitely use a Quirk of this Caliber..",0,0,0,0
Sreejith Nambiar,@SreejithNambiar,2021-04-26T03:44:02.000Z,SPEE3D Features Fusion 360 in Metal  Additive Manufacturing  Simulator  #AutodeskEmployee https://,0,0,0,0
MB Prints,@MasterBlud,2021-04-26T01:45:15.000Z,Buying an enclosure for my  3D printer  has made my prints more efficient. Amazing.,0,3,0,0
Fabricación 4.0,@Fabricacion40,2021-04-26T11:06:53.000Z,"3dprintindustry "" 3D Printing  Industry Monday 26 April 2021 -  http:// """,0,0,0,0
"3Dプリンター用精密ノズル""kaika""",@kaika_tecdia,2021-04-26T09:43:32.000Z,,0,2,0,0
Glen Hannah,@Glenworking,2021-04-26T05:47:53.000Z,"May I introduce Professor McDuckley, my very first attempt at a  3D printed  object. I'll buff out the rough edges and paint him.
Produced in our new library makerspace.
  #3dprinting #makerspace https:// ?igshid=2ccau1sn7og5 …",1,3,0,0
Jacky's B2B,@JackysBiz,2021-04-26T09:35:01.000Z,"Have you registered yet for the Massivit 3D launch of its new Massivit 5000 large-volume  3D printer  at a live Webinar on April 28th? 

For more details and to register for the webinar, click here:  http://",0,0,0,0
Nebula Racing,@nebula_aus,2021-04-26T14:03:59.000Z,Global 3D are providing us with advanced  3D printing  solutions for the World finals! Very excited to watch their parts go down the track in a month's time...,0,0,0,0
Amy,@He3dU,2021-04-25T19:31:00.000Z,object scan 3d Modeling with software|3D Scanner...  https:// 9166.html?channel=twinnerUS …  $109.0 |3D scanner Z17OR for  3D printer  handheld body face,0,0,0,0
Artify Vibes,@artifyvibes,2021-04-26T13:15:30.000Z,Geeetech® A10M Mix-color Prusa I3  3D Printer  220*220*260mm Printing Size  https:// mix-color-prusa-i3-3d-printer-220220260mm-printing-size/ …,0,0,0,0
Worcon,@info_worcon,2021-04-26T14:01:04.000Z,The Global  #Additive  Manufacturing and Materials Market was valued at USD 16.6 million in 2020 and expected to reach USD 70.92 million by 2026 and grow at a CAGR of 27.5% over the forecast period (2021 – 2026).  Read more  https:// acturing-market-forecasted-to-reach-usd-70-92-m-by-2026/?lang=en …,0,0,0,0
ID Exchange,@idexsusanne,2021-04-26T12:55:03.000Z,"Wow!!  #Inspired  

""TECLA is the world’s first  3D-printed  house made from raw earth"" https:// ecla-worlds-first-3d-printed-house-raw-earth-mario-cucinella-wasp …",0,0,0,0
Rodrigo Senra,@rodrigofsenra,2021-04-25T23:41:09.000Z,"From  3D Printing  to Apps, 4 Ways Students Are Fighting Coronavirus #MakeAnything #AutodeskAmbassador #AmbassadorHub #Autodesk #AutodeskEDU https:// avirus-3d-printing/?mkt_tok=eyJpIjoiTkRWaE9XVTVOamsyTXpObSIsInQiOiJYMlQxVU9nOVhCbWhLQlhuZDV0clZLTXNkZEFxcmhlMGo0TFVESjJpZFpCSys0R0ZlVTZSeCtvSVdOM0c3amtYd1ozUWs1ZmJFRTRkRHdCTGxjWGk0MksxZ3RmSG4rUE1GUUZMak81YjZnNndlTG83Z24weHJnUVV6d2o1cmZRVFRzZThDVTVLb1AyR0hldlJ4Q3F6bmc9PSJ9 …",0,0,0,0
jslNET,@jsl_net_,2021-04-26T00:30:04.000Z,3D Printed  Pancakes for dinner anyone?!  #LETSGODODGERS #dodgerblue #dodgers @dodgers @SportsNetLA @PancakeBot  @Justin_Levy04  @jslnet_,1,3,2,0
Hamanshiron Publishing is working on their shit,@hamanshiron,2021-04-25T22:51:37.000Z,"No I didn't see really cool  3d print  minis on a patreon and I didn't become a patreon to get them, even though I won't have a  3d printer  til Christmas, if I save really hard. No, I definitely didn't. Anyway Archvillain Games stuff looks fuckin beautiful",0,0,0,0
Aibuild,@ai_build,2021-04-26T09:37:36.000Z,Want to know more about how large scale  additive manufacturing  is applied in Aerospace using AiSync? Follow the link bellow to download our new Brochure. https://,0,0,0,0
Not A Games Dev Ollie,@Reksaurian,2021-04-26T12:46:31.000Z,ಠ_ಠ,1,2,0,0
Cedland : 3DprintFR,@Cedland,2021-04-25T20:28:05.000Z,"3d print  for cosplay prop of The famous ""Tinker Tom special"".
Wood painting effect tuto by @Off__Earth
-
- #3Dprinting #3dprinter #3d #dagoma #instafun #handmade #cosplay #cosplayer #prop #cosplaygirl #sexycosplay #game #gamergirl #gamer #steampunk #fallout4 #fallout76 #fallout",1,8,1,0
Laurentiu Todie,@LaurentiuTodie,2021-04-26T13:40:47.000Z,Did I mention that I can  3D print  this sculpture of mine and make the wooden stairs for it?,0,0,0,0
Print N Play - James,@jcprintnplay,2021-04-25T23:41:43.000Z,"Go watch this Nerd do some  3D Printing ... Hey, that gives me an idea for a YouTube channel name! Hope no ones taken it yet!",0,14,2,0
TransOutlaw,@TransOutlaw,2021-04-25T20:41:31.000Z,When you have a  3D printer  are a nerd and need a holder for your covid passport you make a multipass from fifth element  #multipass #covidvacccine #fifthelement #3dprinter #nerd #favoritemovie https:// ?igshid=1ca93py34zrae …,0,0,0,0
Alec Muffett,@AlecMuffett,2021-04-26T11:14:55.000Z,Today I am  3D printing  my first  #OpenSCAD  design for a  #Coffee  Redistributor  https://,1,6,1,0
Raven St. Johns,@RavenStJohns,2021-04-26T14:12:28.000Z,"The handle exploded on me and spaghetti-fied on me. If you are familiar with  3D printing , then you'll know what that means. So back to the beginning of the handle. Which is hollow so I can stick the battery pack into.",0,0,0,0
Matthew Rackley,@marack,2021-04-25T23:01:53.000Z,Event of the Week! Let's print and play! -  3D printing  - Fun - Chatting - Chilling - Animals,0,0,0,0
Gun Carot,@CarotGun,2021-04-26T03:59:18.000Z,"Today's progress:  @Akwikone  and another friend came over, we all had character projects to finish up along with testing out  3d printing . All-in-all, a very busy day. I'll show more of Primaris Dante in another post.",0,2,1,0
Duchofilla 3d filament. Vijay,@sangani_vijay,2021-04-26T13:26:38.000Z," 
First ISO 9001-2015 certified  3d printer  filament manufacturer company   India  #3dart #3D #3dmodeling #3dprint #3dprinted #3dsculpting #3dartwork #3darchitecture #additivemanufacturing #startupbusiness #StartUpEp16 #startupindia #startupin #India",0,1,2,0
Fast Company,@FastCompany,2021-04-26T00:35:17.000Z,This wild-looking house is made out of dirt by a giant  3D printer http://,0,23,2,0
3DMedNet,@3DMedNet_FSG,2021-04-26T10:08:44.000Z,"How can we  3D print  drugs? Find out in this editorial published in our sister journal, the Journal of  3D Printing  in Medicine: https://",0,0,0,0
Not A Games Dev Ollie,@Reksaurian,2021-04-26T13:45:57.000Z,"You can double-click on an object in Unity to zoom in the editor.

But if you double-click on a object with other objects under it then the camera zooms ALL the way out.

So I'm going in, out, in, out, in, out, in, out, over and over because I keep clicking the wrong thing. xD",0,0,0,0
Tvasta,@Tvasta3D,2021-04-26T12:44:17.000Z,"Tvasta is thrilled to announce the Inauguration and Unveiling of ‘India’s FIRST  3D Printed  House’ by Smt.  @nsitharaman , Minister of Finance and Corporate Affairs, on the 27th of April, 2021. 

Please register here to virtually be a part of this event - https:// ration …",2,19,5,0
Michael Petch,@MichaellPetch,2021-04-26T10:47:42.000Z,PRIMES launches the ScanFieldMonitor  3D printing  laser characterization device  #3DPrinting https:// unches-the-scanfieldmonitor-3d-printing-laser-characterization-device-188606/?feed_id=1376&_unique_id=60869a4d51b50 …,0,0,0,0
Maverick™,@spooney35,2021-04-25T20:34:16.000Z,An Entire Community Of  3D-Printed  Houses Is Springing Up In California  https:// nity-california/ …,0,0,0,0
Anj Bryant,@anjbryant,2021-04-25T21:27:16.000Z,"Longer Orange 10  3D Printer  Review: Cheap Price, Poor Performance  https:// -orange-10-3d-printer-review … @AndrewASink",0,0,0,0
3DHEALS,@3dheals,2021-04-25T22:47:05.000Z,"#repost  @timandersondds The efficiency and and simplicity of  3D printing  have made it a cornerstone in my digital workflow.  From the software to hardware, there has never been a better time to integrate this technology to better serve your patients.  #lovewhatyoudo #dental3d …",0,2,0,0
Nicholas Bering,@nickbering,2021-04-26T00:25:09.000Z,"I got a larger second monitor for my stream machine to replace the USB display I’d been using. That made things crowded with the spring-loaded arm I was using for my webcam. So, I just whipped-up mount on my  3D printer  to attach it to my desk lamp.",1,1,0,0
𝕃𝕚𝕩𝕚𝕖 𝕃𝕒𝕓𝕤 / Connor Nishijima,@lixielabs,2021-04-26T03:47:23.000Z,Calibrating for a beautiful new copper filament using  @TeachingTechAU 3D printing  calibration tool! #lixielabs #3Dprinting #lixie @Creality3dprint https://,0,6,3,0
Cyprus Shipping News,@CyShippingNews,2021-04-26T03:20:49.000Z,Wilhelmsen and thyssenkrupp showcase the capabilities of their unique  Additive Manufacturing  (AM) service during the Maritime Drone Estate Launch in Singapore https:// helmsen-and-thyssenkrupp-showcase-the-capabilities-of-their-unique-additi … ...,0,0,0,0
Mashable,@mashable,2021-04-26T08:27:00.000Z,We totally need this chocolate-molding  3D printer,2,53,21,0
TU München,@TU_Muenchen,2021-04-26T09:20:50.000Z,A research team has succeeded in using  #neutrons  from our research neutron source  #reactor  to improve the production process of energy-saving gas  #turbines  from the  #3D  printer:  http://,0,9,4,0
YonghuaSupply,@yonghuasupply,2021-04-26T07:02:57.000Z,Additive Manufacturing  in the Factory of the Future: Global Opportunities and Markets Report 2021 -  http://  - Business Wire  https://,0,0,0,0
Joel Telling - 3D Printing Nerd,@joeltelling,2021-04-25T23:53:43.000Z,,0,10,1,0
Mitchell and Son Additive Manufacturing LTD,@MitchellandSon1,2021-04-26T13:05:34.000Z,#ClassicCarEvents #ConcoursofElegance #ConcoursOfElegance  Concours of Elegance Embraces Next Generation Of Classic Enthusiasts  http:// http://,0,0,0,0
Kamilla Sultanova,@KamillaUbuntu,2021-04-26T04:56:26.000Z,"Exciting! This could be future homes, printed in 200 hours, check out new low-carbon housing prototype from Bologna-based architects! 

Tecla house  3D-printed  from locally sourced clay  https:// io-cucinella-architects-wasp-3d-printed-housing/ …  via  @dezeen",0,5,2,0
Impact Hub Berlin,@ImpactHubBLN,2021-04-26T07:15:02.000Z," What does a  #BetterTogether  team look like? The founders of rrreefs have designed a  3D-printed  coral reef, a  #CircularEconomy  product aiming to restore ocean ecosystems. We're helping them to reach the next level. Apply to the next programme by 9th May:  http:// berlin …",0,2,2,0
George Silbermann,@ACCUSmayor,2021-04-26T02:18:14.000Z,Things that didn’t exist in 2000: Smartphones; streaming; Wikipedia; Facebook; Uber; iPads; Twitter & Instagram; XBox; YouTube; Bluetooth; Bitcoin;  Airbnb; podcasts; WhatsApp; iRobot vacuum; wireless earbuds; bag check fees; GPS-enabled devices; text messaging;  3D printing ...,0,0,0,0
ELEGOO,@Elegoo_Official,2021-04-26T10:31:51.000Z,"The rook is very meaningful to us  3D printing  guys. Here Husky preserves his decayed rook in a unique manner. Check his page :  https:// .
.
. #3dprinted #3dprinter #ELEGOO #ELEGOOMars #print #art #warhammer #artwork #3dprinting #warhammer40k",0,8,0,0
𝟽 𝙳𝚊𝚢𝚜 𝙰 𝚆𝚎𝚎𝚔,@7_DAYSaWEEK,2021-04-26T13:13:55.000Z,"$SGLB  Great info on the Sigma Labs deal..
Lockheed Martin Selects PrintRite3D for Aerospace  3D Printing ! 3D Printi...  https://",0,0,0,0
Shurdle3D,@Shurdle3D,2021-04-26T00:36:15.000Z,"And here it is!  3D printed , assembled, and looking gooooooood.  #Shurdle3D",3,27,3,0
Jason Starkey,@JasonStarkey19,2021-04-26T13:37:03.000Z,"just got my first  3D printer  set up! 
it's a creality ender 3 v2

so far everything has been a breeze, although one of the rubber footpads was a tad short  definitely a fun and hopefully useful investment!",0,0,0,0
John Jason Fallows,@JohnJasonFallow,2021-04-26T07:02:09.000Z,"Good Prusa  3d printer  shops in Singapore? -  https://  -April 25, 2021 at 07:45PM",0,0,0,0
Joel Telling - 3D Printing Nerd,@joeltelling,2021-04-26T05:07:47.000Z,OMG.,1,46,2,0
Cody Church,@AlwaysTellTall,2021-04-26T01:00:50.000Z,"My  3D Printer  arrived today! I got myself an Elegoo Mars Pro 2, and I'm going to have a nice time printing myself some  #dnd  miniatures!",0,0,0,0
Hello Tomorrow,@hellotmrc,2021-04-26T09:08:07.000Z,"Congratulations to the team at  @MX3D_AM , one of our Deep Tech Pioneers developing a robotic metal  3D printing  technology, for raising €2.25M!
Next step....commercial launch  Read more here!  https:// l-launch-m1-robotic-metal-3d-printer/ …",0,2,0,0
Kathy U Patrick,@KathyUPatrick,2021-04-25T19:38:49.000Z,https:// ted-house-2/ … #3d  printed buildings,0,0,0,0
