Author Name,Author ID,Date,Post Text,Replies,Likes,Reshares,Views
Leo,@fightraccoon,2021-07-26T08:59:43.000Z,Now the shortage of everything includes parts of a train for kids' rides in a nearby farm. Can  3D print  fix it? Or this is why more hot money is now injected for these companies?,0,0,0,0
bubbleistrouble,@bubbleistrouble,2021-07-26T02:40:42.000Z,"3D printed  trash can makes ridiculously, slimy bubbles",0,0,0,0
Awesome Burger King Facts 𝕏,@AwesomeBKFacts,2021-07-26T02:30:35.000Z,"I bought a  3d printer , what should I print?",19,19,0,0
Markus Wolf,@3DMetalPrintin1,2021-07-26T12:37:04.000Z,Prince’s Shoe Collection Gets  3D Printed  Tribute at Paisley Park  https://,0,0,0,0
The Spirit of Creative Technologies,@TheSpiritofCre1,2021-07-26T07:25:52.000Z,PROPOSED PROJECT: a video game that explores the plight of native birds utilizing projected images with  3D printing  to reach first home buyers.,0,0,0,0
fascinathings,@fascinathings,2021-07-26T11:15:30.000Z,Face shields are still mandatory in my country and I got fed up with the standard ones scratching my lenses and squeezing the life out of my temples. So I designed and  3d printed  these that clip onto my glasses' frames.  #fascinathings,0,0,0,0
ShinChaos,@ChaoticTimelord,2021-07-26T03:12:56.000Z,Fucked around and finished my  #KamenRider  panel for Megacon. Image related  Do I knock out the  3D Printing  one while I’m on a fucking roll?,1,1,0,0
Lashes4today,@Lashes4today,2021-07-26T13:49:31.000Z,"Customized Crystal Acrylic Lash Case With  3D Printing  Logo   100 pcs Acrylic Cases  + Tray ( Lashes Holder )

Buy it now:  https:// stom-packaging …",0,0,0,0
Mean Gummy Lizard,@MeanGummy,2021-07-26T02:40:01.000Z,3D Models for Games and  3D Printing  [EN/GER]  Daily Show - Day #266,0,0,0,0
Tuan TRANPHAM,@ttranpham,2021-07-26T13:02:23.000Z,Revolutionizing the Orthopedic Sector Thanks to  3D Printing  •  https://  •  #3Dprinting  • tuan@tranpham.com •  #additivemanufacturing https://,0,0,0,0
Lig long ans posper,@antigarashir,2021-07-26T06:17:38.000Z,"axie just asked me if i wanted to see his ""fidget collection"" and it was  3d printed  reddit gold next to a vibrator",0,3,1,0
bubbleistrouble,@bubbleistrouble,2021-07-26T02:00:48.000Z,"3D printed  cap makes gargantuan, reflective bubbles",0,0,0,0
Dr Lorenzo Garcia - Now @lorenzogarcia.bsky.social,@Lorenz0Garcia,2021-07-26T00:18:55.000Z,Avoiding bone amputation in trauma accidents with the use of a  3D printing  titanium scaffolding to allow bone to grow in patients who suffer breaks. https:// ginals/duke-university-engineers-developing-special-3d-printer-for-bone-reconstruction/ …,1,1,0,0
"vagina, the original 3D printer",@thybreaux,2021-07-25T23:02:30.000Z,i wish i could just forget shes dating elon musk,0,0,0,0
Triditive,@TRIDITIVE,2021-07-26T12:59:36.000Z,"3D Printing  Metal parts is a revolution, if you need to produce precise and complex metal parts, get an instant quote:  http:// #Triditive #additivemanufacturing #EVAM",0,2,0,0
Nicolas Jambin,@Nicolas_Jambin,2021-07-26T12:06:43.000Z,A  3D-printed  concrete tiny home is now on Airbnb — see what it's like to stay inside the $130 per-night stay  #3Dprinting #AirBnB #RealEstate https:// ted-concrete-tiny-home-summer-vacation-2021-7 …,0,0,0,0
jjrobots,@jjrobots,2021-07-26T11:53:10.000Z,"We are almost there! The new KIT is arriving. The Laser pointer robot!: Wi-Fi controllable,  3D printed  and extremely fast and accurate.   Drove by 2 regular NEMA17 motors  #Arduino #STEM #Robotics #Laser",1,8,2,0
The Maker's Movement,@MAKERS_MOVEMENT,2021-07-26T13:09:57.000Z,"Shine On: Trumpf Sales Stay Level at €3.5 Billion for 2020  Laser, machine tools and  3D printing  company Trumpf reported that sales stayed level at €3.5 billion. The company’s largest markets were Germany (€580 million), China (€525 million), US …  https://",0,0,0,0
James Tan MBA Broker/ REALTOR -Bethany Real Estate,@jkdanu,2021-07-26T06:06:33.000Z,Recycling A Profit: El Dorado Hills Students Turn  3D Printing  Passion Into Small Business  http://,0,0,0,0
3D Printing Industry,@3dprintindustry,2021-07-26T08:01:18.000Z,"Dyndrite launches new software APIs for support-free  3D printing , anisotropic compensation and more -  https:// launches-new-software-apis-for-support-free-3d-printing-anisotropic-compensation-and-more-193317/?utm_source=Twitter …  -  #3dprinting @Dyndrite",0,2,1,0
Tiyeni,@TiyeniFarming,2021-07-26T12:14:23.000Z,""" 3D printing  will help to unlock the potential for affordable housing and schools in Africa"", with local skills transfer  #education #Africa Via  @NationOnlineMw @mcbrams",0,0,0,0
3D Printy,@3dprinty,2021-07-26T09:52:44.000Z,The cutaway model of the  3D printed  Barrel Cooper's Puzzle Box is now available! Find out more in this week's video. #Puzzles #3Dprinting https://,0,0,0,0
GrabCAD,@GrabCAD,2021-07-26T14:00:19.000Z,"Who is enjoying the  #OlympicGames ?! Well, we rounded up the countries that use  3D printing  the most! See which countries are on the podium:  https:// #Olympics #3Dprinting",0,0,0,0
3YOURMIND,@3yourmind,2021-07-26T11:39:00.000Z,"Military  Additive Manufacturing  Summit starts tomorrow! Meet our defense industry expert William Cuervo! 

MORE INFO:  https://  
WHERE: Hilton Tampa Downtown Hotel, Tampa, Florida #defenseindustry #defense #workflowsoftware #additivemanufacturing #3dprinting",0,0,0,0
Fabricación 4.0,@Fabricacion40,2021-07-26T11:57:25.000Z,"3dprintindustry "" 3D Printing  Industry Monday 26 July 2021 -  http:// """,0,0,0,0
bubbleistrouble,@bubbleistrouble,2021-07-26T04:10:41.000Z,"3D printed  cap makes gargantuan, juicy bubbles",0,0,0,0
Spiraldown,@blue_greene,2021-07-26T10:11:30.000Z,3D-printing  Technology Gives Animals a Second Chance!  https://  via  @YouTube,0,0,0,0
ZDNET,@ZDNET,2021-07-25T23:30:06.000Z,Creality Sermoon D1 review: An industrial-level  3D printer  for under $700   https:// ty-sermoon-d1-review-3d-printer-under-700/?ftag=COS-05-10aaa0g&taid=60fdf3fecb4037000146c62c&utm_campaign=trueAnthem%3A+Trending+Content&utm_medium=trueAnthem&utm_source=twitter …,0,0,0,0
Maths Scholarships,@Beamathsteacher,2021-07-26T08:20:02.000Z,"Happy  #MathsArtMonday !  To aid his students' learning, mathematician Henry Segerman began  3D-printing  geometric models of mathematical objects!

Check out this video from Segerman explaining the design of his model of an Archimedean Spire:  http://",0,0,0,0
Doot Defense,@DootDefense,2021-07-26T09:17:09.000Z,"Both of you are against natural rights. One of my favorite rights that you hate is the right to keep and bear arms. 
I  3d print  integrally suppressed pistols. 
You. Can't. Stop. Me. 
You. Can't. Stop. Us.",2,6,1,0
bubbleistrouble,@bubbleistrouble,2021-07-26T09:10:40.000Z,"3D printed  cap makes lots of, juicy bubbles",0,0,0,0
Sharebot3D,@Sharebot3D,2021-07-26T08:00:08.000Z,"Join us on LinkedIn to get exclusive content Photos, Videos, Reports and Whitepapers published in collaboration with  #universities  and  #research  centers. An opportunity to share the knowledge of this new metal  3D printing  system.

Join the CLUB: https://",0,0,0,0
ExOne,@ExOneCo,2021-07-26T13:50:10.000Z,What are the advantages of using  #metalbinderjet 3D printing  for  #tooling ? Lightweight geometries that increase strength through material choice & topology optimization. Check out this  #EOAT  application produced at a quarter of the cost of laser powder bed  https://,0,5,2,0
Songhu,@3Dsonghu,2021-07-26T01:09:59.000Z,"10% off, whether you buy 1 piece or 10 pieces, the factory price and then 10% off, hurry to private chat with me  #Black 3d print  filament  #PLA  filament 1.75mm",0,0,0,0
catboy simp,@smutkitsune,2021-07-26T01:32:32.000Z,I did a bad thing and bought myself a new  3d printer .,0,0,0,0
Peter Graystock,@PeterGraystock,2021-07-26T12:35:00.000Z,"3D printing  the last of the bumblebee pollen traps, designed by  @rufocinctus  and colleagues. Looking forward to exploring the work rates and foraging preferences of our bumblebees!",4,33,1,0
WebDesigner.it,@WebDesigner_it,2021-07-26T04:44:17.000Z,5 Ways To Improve  3D Print  Quality  https://,0,0,0,0
B2B Printing,@B2B_Printing,2021-07-26T03:41:34.000Z,"3D Printing  Webinar and Event Roundup: July 25th, 2021 -  http:// http://",0,0,0,0
bubbleistrouble,@bubbleistrouble,2021-07-26T04:30:45.000Z,"3D printed  cap makes many, beautiful bubbles",0,0,0,0
bubbleistrouble,@bubbleistrouble,2021-07-26T05:40:42.000Z,"3D printed  trash can makes ridiculously, transparent bubbles",0,0,0,0
Blake Teipel,@brteipel,2021-07-26T14:02:06.000Z,"Thermoplastic Polyurethane streamlines  #additivemanufacturing  processes, saving companies time & money. At  @Essentium3D , we’re combining the advantages of TPU & the power of our HSE  3D Printing  Platforms to help manufacturers create the most durable parts.  https://",0,0,0,0
Diogo,@dgalexandre1,2021-07-26T10:22:39.000Z,"Lost a bet and had to bake for my girlfriend.. aka had her help me bake cause I am terrible in the kitchen. 

Took advantage and used the cookie cutter she made and  3D-printed  yesterday night ",0,4,0,0
«Lucess»,@SoaringLuceXX,2021-07-26T04:04:12.000Z,buy  3D printer print  3d printer return  3d printer profit,1,4,0,0
Cody,@ajobforacody,2021-07-26T04:38:13.000Z,"“Char”

Charmander printed using  @ISanmate 3D Printing  Carbon Fiber filament on a  @voxelab  Aquila  3D Printer",2,7,1,0
Daniel Hensley,@L33Tdpunk,2021-07-26T02:37:56.000Z,"Wild. “In Amsterdam, You Can Now Stroll Across a  3D-Printed  Bridge”  https:// /amsterdam-3d-printed-bridge …",0,0,0,0
Civil + Structural Engineer Media,@csENGINEERmag,2021-07-26T13:00:11.000Z,"3D Printing  Composites Will be a $2 billion Industry Within the Next Decade, Says IDTechEx  https:// mposites-will-be-a-2-billion-industry-within-the-next-decade-says-idtechex/ …",0,2,0,0
Better Human Adaptability Solutions,@BHASolutions,2021-07-26T11:06:57.000Z,A revolutionary technology improves the future of face restoration.. Scientists succeed in designing ears and noses using  3D printing  technology - via  @ArrajolM https://,0,0,0,0
Construction Review,@ConstrucReview,2021-07-26T14:01:53.000Z,7 Advantages of using a  3D printer  in construction projects  https://,0,0,0,0
"vagina, the original 3D printer",@thybreaux,2021-07-26T03:20:01.000Z,prayed for sé go-eun interaction and here we are  https://,0,2,0,0
bubbleistrouble,@bubbleistrouble,2021-07-26T05:50:40.000Z,"3D printed  trash can makes fat, slimy bubbles",0,0,0,0
The Official HCCSW,@HCC_Southwest,2021-07-26T00:00:12.000Z,"Did you know that  3D Printing  is one of the fastest-growing fields in manufacturing? Jobs abound in the high-tech field, such as machine operator, robotic assembly technician, manufacturing assistant,  3D printing  engineer, and more.  https:// aying/ …",0,0,0,0
Gabe,@StationGuyGabe,2021-07-25T23:09:23.000Z,Painting  3D printer  screwlink couplings is the worst experience I wouldn’t wish it upon my worst enemy.,1,1,0,0
bubbleistrouble,@bubbleistrouble,2021-07-26T01:10:44.000Z,"3D printed  cap makes fat, juicy bubbles",0,0,0,0
Gadgetify,@Gdgtify,2021-07-26T11:31:29.000Z,"R QIDI X-PLUS Large Nylon, Carbon Fiber  3D Printer  -  https://",0,0,0,0
Car Club,@CarClubViva,2021-07-25T23:00:33.000Z,"Bugatti Bolide to feature  3D printing  technology helping achieve its 1472bhp/tonne – The Bugatti Bolide concept takes the W16 hypercar to the extreme, increasing power and shedding weight with high-tech, lightweight components  https://",0,0,0,0
"vagina, the original 3D printer",@thybreaux,2021-07-26T03:11:19.000Z,mygod rosé is so gay,0,0,0,0
Markus Wolf,@3DMetalPrintin1,2021-07-26T13:33:05.000Z,Castor Beans Making Sustainable  3D Printed  Eyewear Possible  https://,0,0,0,0
OficineRobotica,@OficineRobotica,2021-07-26T08:01:29.000Z,"Weekend project using  @FreeCADNews #LinkStage3 . Filament cooler assembly for a  3d printer  extruder. 

Used a lot of the new PartDesign enhancements   https:// t=52221 … If you like what you see support  @RealThunder12  at  https://",0,30,5,0
IQ Dental Supply,@iqdentalsupply,2021-07-26T13:01:09.000Z,"LOCAL PICKUP SALE- SprinRay- MoonRay  3D Printer . Heavily discounted at $2,100 Retail $4,200! (while supplies last)  #dental #dentist #dentistry #dentalassistant #dentalhygiene #dentistryworld #3dprinter #njdentist #nydentist #dentalsupplies #dentaldeals #localpickup #sale",0,0,0,0
"Matthew A. Mishak, Attorney and Counselor at Law",@mishaklaw,2021-07-26T08:43:41.000Z,3D-Printed  Guns: What You Need to Know  https:// source=ReviveOldPost&utm_medium=social&utm_campaign=ReviveOldPost … #3dguns #gunlaws #legalnews #nra,0,0,0,0
Emeraldous,@vore49105300,2021-07-26T02:37:35.000Z,I should buy a  3D printer,0,0,0,0
Jon NOTHING,@8bitmaster,2021-07-26T00:36:19.000Z,"cool cool, had to take apart my  3d printer  to pull melted filament out of the bowden tube, and the bottom most part of it looks burnt. Took a good 30 minutes to fix it. This is not a hobby for the impatient.",1,0,0,0
Joe 𝕏!,@JoeX92,2021-07-26T07:28:40.000Z,Check this  #youtube #video  out! https:// d5h9s … 3D Printing  it longer? My 2020 debate..,0,0,0,0
The 3D Print General,@3DPrintGeneral,2021-07-26T13:18:53.000Z,"Sorry guys, range may need to be rescheduled due to this towing mess.",3,20,4,0
⁷⁷⁷,@kervcristo,2021-07-26T04:53:28.000Z,This  3D-printed  bridge is made of 4.5 tons of stainless steel,0,0,0,0
Burger 凶,@burger_ggs,2021-07-26T01:45:57.000Z,Wish I had a  3D printer  I would totally paint doge vandire,0,0,0,0
3D Strikers,@3dStrikers,2021-07-26T12:09:21.000Z,"Best  3D Printer  under 40,000/-  @Creality3dprint   CR-10S
The CR-10S comes with a convenient monitor that will detect when the printer has run out of filament, automatically pausing the print, and will alert the user to restock the Filament before continuing.",0,0,0,0
EIN Presswire: Waste Newswire,@EINWasteNews,2021-07-26T08:00:42.000Z,Recycling A Profit: El Dorado Hills Students Turn  3D Printing  Passion Into Small Business  http://,0,0,0,0
Mildly Interesting,@interest_mild,2021-07-26T11:15:47.000Z,Face shields are still mandatory in my country and I got fed up with the standard ones scratching my lenses and squeezing the life out of my temples. So I designed and  3d printed  these that clip onto my glasses' frames.,0,14,0,0
zad,@zadmakaveli,2021-07-26T01:05:50.000Z,3D printed  houses is now a reality.,0,0,0,0
Stewart Watkiss,@stewartwatkiss,2021-07-26T12:01:30.000Z,Keep cool with this  3D printed  fan extension arm. https:// Step by step instructions for creating it using  #FreeCAD  with the part and part design workbenches. #3Dprinting #CAD #HotSummer,0,0,0,0
jay,@tomnooksbigtits,2021-07-26T08:36:26.000Z,"etsy: "" 3D PRINTED  thing that you want! for 80 dollars! by the way you dont have any money!!!""

me: hmm... *adds to cart*

our 3d priter: ...lazy bitch",0,0,0,0
Tuan TRANPHAM,@ttranpham,2021-07-26T13:00:10.000Z,"DYNDRITE LAUNCHES NEW SOFTWARE APIS FOR SUPPORT-FREE  3D PRINTING , ANISOTROPIC COMPENSATION AND MORE •  https://  •  #3Dprinting  • tuan@tranpham.com •  #additivemanufacturing  via Dyndrite  https://",0,0,0,0
bubbleistrouble,@bubbleistrouble,2021-07-26T08:50:40.000Z,3D printed  trash can makes abundent fleeting bubbles,0,0,0,0
がんにい,@pikaDAM,2021-07-26T09:10:05.000Z,YoichiroKoga にアカウントを移行しました．良かったらフォローしてください．最近は3D Printing Corporationという会社で最高技術責任者をやっています．ただ、つぶやく内容はほぼかわらないです．,0,0,0,0
The Maker's Movement,@MAKERS_MOVEMENT,2021-07-26T12:38:22.000Z,"Prince’s Shoe Collection Gets  3D Printed  Tribute at Paisley Park  Prince passed onto the next dimension five years ago, but, to his biggest fans, it still feels like yesterday that they lost one of the greatest U.S. musicians in modern... The post Prince…  https://",0,0,0,0
Neel Achary,@neel5,2021-07-26T10:47:17.000Z,New post: Doctors at Fortis Gurgaon implanted the largest (in India)  3D printed http:// -at-fortis-gurgaon-implanted-the-largest-in-india-3d-printed-customized-hip-implant-in-60-year-old-tanzanian-patient-with-damaged-pelvic-bone/ … #businessnews #businessnewsthisweek,0,0,0,0
꧁♱❃ℑ❃♱꧂,@J33822248,2021-07-26T10:13:26.000Z,3D printing  is the future,0,0,0,0
bubbleistrouble,@bubbleistrouble,2021-07-26T09:40:51.000Z,3D printed  cap makes abundent slimy bubbles,0,0,0,0
Tuan TRANPHAM,@ttranpham,2021-07-26T13:13:43.000Z,AM VENTURES BACKS ROLL-OUT OF METSHAPE’S LMM METAL  3D PRINTING  TECHNOLOGY •  https://  •  #3Dprinting  • tuan@tranpham.com •  #additivemanufacturing https://,0,0,0,0
3D Printing Industry,@3dprintindustry,2021-07-26T10:52:05.000Z,PostProcess Technologies delivers its first VAD depowdering system to European customer -  https:// ss-technologies-delivers-its-first-vad-depowdering-system-to-european-customer-193105/?utm_source=Twitter …  -  #3dprinting @postprotech,0,5,1,0
SlappyTheNinja,@SlappytheNinja,2021-07-26T10:36:47.000Z,"I think of fun projects or things to print on a regular enough basis that getting my own  3d printer  isn't a bad idea, I just really don't want to get into the nitty gritty of calibration and programming your bios and shit",1,1,0,0
JZKitty Gaming,@JZKitty,2021-07-25T21:24:30.000Z,"I can finally wake up to finished  #3dprints  without any issues, the road has been long, but totally worth it! I love my  #3dprinter ! Btw, this gecko grew up a lot during the night #3dprinted #3Dprint #3dprinting",1,4,2,0
Guided Solutions,@GuidedSolutions,2021-07-26T10:15:05.000Z,"NuVasive launches Modulus ALIF  3D-printed  porous titanium implant for anterior spinal surgery
Subscribe for our newsletter:  https:// https:// NuVasive  @NuVasiveInc #medtech #medicaldevices #medicaldevice #titan #implant #spinal #spine #surgery",0,0,0,0
3D Systems Japan,@3DSYSTEMSJAPAN,2021-07-26T06:35:43.000Z,ロストワックス鋳造の原型を3Dプリンタ―で作成する流れ。ここで紹介しているのは ProJet MJP 2500W。ワックス原型をダイレクトに造形するプリンタ―です。 3D Printed  Wax Casting Patterns -  @3DSystems https:// @YouTube より,0,0,0,0
Asianwebshops,@asianwebshop,2021-07-26T04:42:09.000Z,#bestprice #followus  1.7 Meter 6mm Width GT2 Timing Belt For  3D printer  Rostock Mendel REPRAP Black  http:// 442&a=258169&u=https%3A%2F%2Fwww.aliexpress.com%2Fitem%2FFor-Plastic-1-7m-Synchronous-Timing-Belt-2GT-6mm-For-RepRap-3D-Printer-Pulley-New%2F32769877475.html …,0,0,0,0
B2B Design,@B2B_Design,2021-07-26T02:25:04.000Z,These  3D printed  needle covers were designed to put children at ease during vaccinations!  http://,0,0,0,0
SuperbCrew.com,@SuperbCrew_com,2021-07-26T14:00:00.000Z,Industrial  3D Printing  Company Precision Additive Helps OEM’s Improve Their Efficiency And Lower Production Costs  https:// printing-company-precision-additive-helps-oems-improve-their-efficiency-and-lower-production-costs/ …,0,8,7,0
LTT Markov,@LTTMarkov,2021-07-26T08:03:57.000Z,"$5,000  3D Printer  with a $1000 CPU vulnerabilities, Meltdown, Spectre x360",0,0,0,0
India Womens World,@IndiaWomens,2021-07-26T13:32:58.000Z,Fortis hospital conducts largest  3D printed  hip implant in India  http:// tis-hospital-conducts-largest-3d-printed-hip-implant-in-india/ …,0,0,0,0
Fabbing,@fabbing,2021-07-26T13:45:04.000Z,Continuous Composites raises $17M to commercialize Continuous Fiber  3D Printing http://,0,0,0,0
Barl0we,@Barl0we,2021-07-26T06:52:35.000Z,I  3D printed  a Witcher medallion towel hook because the old towel hook kept falling off the wall ,2,7,0,0
Design Watcher,@design_watcher,2021-07-25T21:33:14.000Z,"These  3D printed  needle covers were designed to put children at ease during vaccinations! | Yanko Design  https:// se-3d-printed-needle-covers-were-designed-to-put-children-at-ease-during-vaccinations/ … , see more  http://",0,0,0,0
Meg Ross,@Meg_Ross_PhD,2021-07-26T08:16:36.000Z,This is amazingly innovative! A compostable lamp made from  3D-printed  orange peels...it even maintains its citrusy scent post-printing!,0,0,0,0
China Tech,@ChinaTechFR,2021-07-25T21:24:52.000Z,Creality Sermoon D1  3D Printer  ...  #BonPlan #Coupon #CrealitySermoonD13D #Deal #Discount #Promo #Promotion https:// roduits-chinois/tomtop/creality-sermoon-d1-3d-printer-machine-free-shipping-539.html …,0,0,0,0
Heidelberg Materials,@hd_materials,2021-07-26T09:58:30.000Z,"Ready to move in: Today we celebrate the official opening of Germany’s first  3D-printed  residential building in Beckum, Germany, built with HeidelbergCement's “ http:// ® 3D”.  #architecture #constructionprinting #3dconcreteprinting #firstprintedhouse",5,45,16,0
Harrison Cito,@FreedumStoopid,2021-07-26T13:05:33.000Z,"They tried to stifle the printing press. Use of the written word was control and the elites deemed to be too dangerous for the average man. Fast forward to today, the  3D printer  is today’s printing press and is leveling the playing field against tyrants!  #BuildBackBetter",0,0,0,0
Focused3D,@focused3dllc,2021-07-26T13:59:47.000Z,"After doing some work programing g-code for the new CNC. I have a new respect for machinist.  3D printing  slicer software is so much easier, and streamlined.",0,0,0,0
Dutchy,@pdankqueen207,2021-07-26T00:18:26.000Z,"Best  3d printer  for a beginner? Just gonna make little gadgets to make life easier, and prob try to make some Harry Potter stuff!",0,0,0,0
Lifeboat Foundation,@LifeboatHQ,2021-07-26T02:50:54.000Z,World’s first  3D-printed  steel bridge debuts in Amsterdam’s Red Light District  https:// orlds-first-3d-printed-steel-bridge-debuts-in-amsterdams-red-light-district …,1,41,12,0
All3DP,@All3DP,2021-07-26T10:56:57.000Z,Ex-Olympian's  3D printing  business helps fellow paralympic athletes compete at a higher level.  #additivemanufacturing @markforged https:// thlete-3d-prints-adaptive-sports-equipment/ …,0,0,0,0
Wayne Kankovsky,@waynekankovsky,2021-07-26T12:16:54.000Z,"In Amsterdam, You Can Now Stroll Across a  3D-Printed  Bridge | Mental Floss  https:// /amsterdam-3d-printed-bridge …",0,0,0,0
Gabriel Hussy,@gabriel_hussy,2021-07-26T07:44:51.000Z,"It took around 45 hours of  3D printing  to build this 1,076 square-foot house",0,0,0,0
Nick Stefan,@nickstefan,2021-07-26T06:29:54.000Z,World’s first unreinforced  3D-printed  concrete bridge displayed in Venice  https://,0,0,0,0
Sulubeyn New App Alert,@SulubeynAppz,2021-07-26T08:04:15.000Z,Creality Cloud -  3D Printing  - CREALITY 3D (HK) TECHNOLOGY LIMITED (Social Networking)  https:// 28 …,0,0,0,0
bubbleistrouble,@bubbleistrouble,2021-07-25T22:00:42.000Z,"3D printed  trash can makes big, beautiful bubbles",0,0,0,0
Arctech14,@arctech14,2021-07-26T06:13:14.000Z,"So, I'm finally getting to it. My Anet A8, my first  3D printer , died a few years ago when something on the control board blew. It's far past time I finally repair and upgrade my machine.",1,1,0,0
Andrew Sefton,@OPCATrusted,2021-07-26T12:40:37.000Z,Two  3D-Printed  Concrete Projects Bring the Concept Home to the US https:// le/21521268/3d-printed-concrete-home-breaks-ground-in-virginia …,0,0,0,0
Dr. Roy Schestowitz (罗伊),@schestowitz,2021-07-25T21:53:48.000Z,"Second CECIMO survey results predict strong  3D printed  product, parts and materials growth -  3D Printing  Industry  https:// cimo-survey-results-predict-strong-3d-printed-product-parts-and-materials-growth-193169/ …  ䷉  #3dprintingindustry  | more in  http:// test …",0,0,0,0
Graphic Display World,@GDWtweets,2021-07-26T08:17:38.000Z,"#3D #printing #composites  will be a $2 billion industry within the next decade, says  @IDTechEx https:// #3Dprinting #3Dprinters #print",0,3,1,0
i4isp,@i4isp,2021-07-26T13:19:14.000Z,"Top story: Prince’s Shoe Collection Gets  3D Printed  Tribute at Paisley Park -  http://  | The Voice of  3D Printing  /  Additive Manufacturing https:// -shoe-collection-gets-3d-printed-tribute-at-paisley-park/ … , see more  http://",0,0,0,0
3DPrinting World,@3DPrinting_W,2021-07-26T13:47:43.000Z,"Top story: Prince’s Shoe Collection Gets  3D Printed  Tribute at Paisley Park -  http://  | The Voice of  3D Printing  /  Additive Manufacturing https:// -shoe-collection-gets-3d-printed-tribute-at-paisley-park/ … , see more  http:// =tnp …",0,0,0,0
de Bibliotheek HW,@BibliotheekHW,2021-07-26T07:28:20.000Z,"3 augustus om 10.00 in Oud-Beijerland is de workshop: 3D ontwerpen van een fantasiedier.
Doe inspiratie op aan de hand van boeken over fantasiedieren en maak je eigen dier in 3D. Jouw ontwerp wordt uitgeprint met onze eigen  3D printer !
Aanmelden kan via:  https:// /3d-ontwerp-van-een-fantasiedier.html?fbclid=IwAR2dNypqfpvrvvpEHa7hr9aFmVjSbBbXwBsnyvlYhoonO7aHtB5WqHPLQg0 …",0,2,1,0
AltaNautical,@AltaNautical,2021-07-25T21:29:54.000Z,If  #BillGates  gets his way we'll all be eating  3D printed  Synthetic Foods. #SyntheticFood #3DPrintedPizza #SyntheticBeef #ImpossibleBurger #SoylentGreen #SoylentGreenMovie https://,0,0,0,0
Joel Telling - 3D Printing Nerd,@joeltelling,2021-07-25T21:33:58.000Z,KERMIT FLAIL DOT GIF,1,36,0,0
Matt Kokoski,@pittsburghcad,2021-07-26T00:55:34.000Z,John found a cool video on recycling old plastic bait.  So we spent some time in xShape and xMold designing our own minnow bait.  We then  3D printed  a mold that we will try!   #3dexperience #xdesign #fishing #design #3dprinting #xshape,0,5,0,0
MechaniCalc,@MechaniCalcEng,2021-07-25T22:00:30.000Z,A  3D-printed  concrete tiny home is now on Airbnb — see what it's like to stay inside the $130 per-night stay  https://,0,0,0,0
❂april❂ HUSH Darah Muda,@SMilloow,2021-07-26T08:13:22.000Z,"kaga ada hubungannya ndeeer, ga usah dipikirin

malah di sekitar gw, setelah diamati, rata2 yg ga suka pedes, orangnya ga suka marah2",0,0,0,0
