Author Name,Author ID,Date,Post Text,Replies,Likes,Reshares,Views
3D Printing Deals,@3dpdeals,2021-10-21T13:16:43.000Z,"Lightning Deal on CREALITY Ender models that all come with 3kg free filament

$160.65 Ender 3
$237.15 Ender 3 V2
$297 Ender 3 MAX

afflinks
Printers:  https:// Black PLA:  https://",2,3,0,0
David Hagemann,@TocoGamescom,2021-10-21T12:47:30.000Z,Thinking about getting this mask of Inscryption ready for  3d printing . Maybe someone likes to be a maniac card playing prospector this Halloween,0,4,0,0
Asianwebshops,@asianwebshop,2021-10-21T17:00:04.000Z,#bestseller #deal  T8 Lead screw 500 mm 8mm + brass copper nut + Mounted ball bearing Bracket +Flexible Coupling for  3D printer &C  http:// 442&a=258169&u=https%3A%2F%2Fwww.aliexpress.com%2Fitem%2FT8-Lead-screw-500-mm-8mm-brass-copper-nut-Mounted-ball-bearing-Bracket-Flexible-Coupling-for%2F32773347180.html …,0,0,0,0
ZoomStocks Markets,@ZSMarkets,2021-10-21T11:10:58.000Z,"#France : Stocks on the move (Français Bourse) Electrical  $LR  -3.3%. Glass  $SGO  -1.6%. E-vehicle  $NAVYA  -2%

▲ Retail  $CA  +2%.  3D Printing $PWG  +3.7%. Tunnel  $SMTPC  +2%  #StockMarket  
@euronext_fr",0,0,0,0
tidbitch no justice the evil of humanity just won,@Tealyona1fun,2021-10-21T19:09:54.000Z,Oh lovely away from nuks on to rocket drone blasters Its a video game New stuff to spend money on to keep up with the war Jones's. Yippie what fun off to mars we go! Disposable planet of the rich. All going to live in  3d printer  houses on Mars. Rocket chess from mars direct to ,0,0,0,0
Ziknes | Robotic 3D Printing,@ziknes_,2021-10-21T19:02:00.000Z,Este fin de semana estaremos en la Plaza del Ayuntamiento de València en #VLCStartupMarket  .   Un punto de encuentro con todos los que quieran saber más sobre Ziknes y acercarse a la innovación y tecnología que se está desarrollando en  #Valencia https://,0,3,2,0
Michael Mifsud,@xzyfer,2021-10-21T10:18:13.000Z,If you were buying a user-friendly low fuss  3D printer  what would you buy?,0,0,0,0
Vanmyrthe,@ivyd0103,2021-10-21T09:04:17.000Z,"Loving my airdropped bears!  @InverseBearNFT  
Can't wait to get my hands on a  3d printer  since apart from the png and glb interactive 3d file, we'd also get the stl files for  3d printing ! How awesome is that?  @TitanXBT @0x_fxnction @hotsolsummer @SOLBigBrain @CamTuff_ @ksicrypto",0,9,2,0
WSU Science & Math,@wsu_cosm,2021-10-21T13:36:00.000Z,"There is still time! Join us this Saturday for the STEMM Experience. It’s a golden opportunity to explore the anatomy of the brain, delivery drones, lasers and  3D printing . 8 of the 10 fastest-growing industries in Ohio are looking for STEMM professionals. https://",0,0,0,0
Cyrus Weinberger,@SHPK8,2021-10-21T14:36:41.000Z,"7th grade students explore the Maker Space with center activities including: Electronic Lily Pads, Lego Wedo, Cubelets, Spheros,  3D printing , VR , and Design Center  #StVrainStorm",0,5,3,0
Fabbing,@fabbing,2021-10-21T11:08:04.000Z,http://  and Reflow  3D print  luxurious portaloo from upcycled plastics  http://,0,0,0,0
Latest News from Business Wire,@NewsFromBW,2021-10-21T12:37:45.000Z,"Stratasys Creates First-of-their-kind  3D Printed  Display Pieces for Paisley Park’s Newest Exhibition, The Beautiful Collection: Prince’s Custom Shoes  http://",0,0,0,0
Michal Vaner,@MichalVaner,2021-10-21T16:28:58.000Z,"Crap! With several iterations, tests, and experiments I've finally made the  3d-printed  locking mechanism work… and then printed a full batch of the previous version that didn't work :-(",0,0,0,0
SmallCapsDaily,@SmallCapsDaily,2021-10-21T17:10:48.000Z,"$SSYS  Stratasys Creates First-of-their-kind  3D Printed  Display Pieces for Paisley Parks Newest Exhibition, The Beautiful Collection: Princes Custom Shoes Business Wire  https:// -creates-first-kind-3d-123000794.html … #smallcapsdaily #smallcaps #microcap #stocks #trading #profits",0,0,0,0
サメQCU,@sameQCU,2021-10-21T15:41:55.000Z,"quickly expiring catalogues of fashion items is a kind of deletionism.
taking the option of wearing badly-contrasting fits away from consumers is a kind of positive social good and a service of curation.
uniqlo would still exist w/ basic fits even if  3d printer  clothing was free",0,0,0,0
Len Rosen,@21stcentechblog,2021-10-21T15:06:33.000Z,Why Medicine is Turning to  3D Printing https:// l-companies-3d-printing/ …  via @21stCenturyTechBlog,0,0,0,0
Tony Owen,@TonyOwe73242661,2021-10-21T18:49:59.000Z,Schoolgirl faces terror trial after 'being caught with bomb-making video and guide to  3D-print  gun'  http:// fE?ocid=st …,1,0,0,0
MORENA MOSHOESHOE PARODY ACCOUNT,@MORENA_BARENA,2021-10-21T13:08:24.000Z,"DID YOU KNOW:

South African born Professor Mashudu Tshifularo, who is also a pastor, is the first surgeon on Earth (  the entire planet for those at the back ) to successfully cure deafness by performing the world's first  3D-printed  Middle-Ear Transplant.",3,194,90,0
Krystal Muñoz,@ms_munozJLJ,2021-10-21T17:31:34.000Z,Just a few of the awesome creations my  3D printing  pros created last week!  #STEAMyClusters,0,3,0,0
KJD_3D_Printer (Real Life Bot),@Kjd3d,2021-10-21T12:57:24.000Z,KJD3D :   Printing is at 80%,0,0,0,0
bubbleistrouble,@bubbleistrouble,2021-10-21T18:10:50.000Z,"3D printed  cap makes fat, fleeting bubbles",0,0,0,0
Mrs. Sinclair,@MrsKSinclair,2021-10-21T13:06:48.000Z,Lifelong Learner here!  Testing out Launchpad software to find an easier way for students make use of our  3D Printer  in the @DLMS_Library Makerspace!   @InkSmith3D @DLMS_MS #PeelEML,0,11,2,0
bubbleistrouble,@bubbleistrouble,2021-10-21T12:30:50.000Z,"3D printed  cap makes lots of, slimy bubbles",0,0,0,0
Conard Corporation,@Conardcorp,2021-10-21T16:06:31.000Z,3D-printed  microneedle patches offer greater immunity than single needles  https://  by  @additivereport,0,0,0,0
bubbleistrouble,@bubbleistrouble,2021-10-21T10:40:50.000Z,"3D printed  cap makes lots of, juicy bubbles",0,0,0,0
Mini-invasive Surgery,@MiniSurgery,2021-10-21T11:09:26.000Z,"3D printing  applications for percutaneous structural interventions in congenital heart disease
Article from Dr. Hannah Tredway's team  @tredway_hannah https:// 752 … PDF: … https://oa 43b6-ba77-c523bcde9f24/3752.pdf …",0,3,1,0
karl fenton,@KarlFenton3D,2021-10-21T11:11:25.000Z,My 8 year old son sliced and printed these. He’s doing a show and tell about using a  3D printer  to his class tomorrow and he is super excited about it.  3D printing  is making amazing memories with my kids,3,42,5,0
3d4printers,@3d4printers,2021-10-21T16:19:34.000Z,The  3D printing  technology behind SIENA Garden’s “eternal spare part” offering  http://,0,0,0,0
Hypervalent Iodine,@HyperIodine,2021-10-21T16:30:23.000Z,Naphthyl-Naphthalimides as High-Performance Visible Light Photoinitiators for  3D Printing  and Photocomposites Synthesis.  https://,0,0,0,0
"AVS 3D Printing, Laser Cutting & Engraving",@AVS3DPrint,2021-10-21T16:02:26.000Z,"Good morning  #ttrpgfamily . Today's map artist is  @emma_collis . She has a new pack inspired by castles! 

Wishing you all a safe, calm, happy & peaceful day.  @LBSamuelsson  @SewingGeekiness  @JessGeekMom  @MountainGothMom @QueenofCrit @WorldofCordeDnD  @ShinyFluffdnd #ttrpg",4,5,0,0
arg/machine,@arg_machine,2021-10-21T15:31:02.000Z,UPDATED LINKS:  3D Print  This at  https:// 096/3d-swan-vase …,0,0,0,0
NTU Singapore,@NTUsg,2021-10-21T09:34:06.000Z,#NTUsg  scientists successfully  3D-printed  a bathroom unit in less than a day using an in-house robot back in 2018. It was a major breakthrough for the  #construction  industry as it drastically cut cost and production time while also reducing carbon  #emissions .  #NTUsg30 #MadeinSG,1,2,2,0
Josef Prusa,@josefprusa,2021-10-21T16:32:17.000Z,"WOW,  @prusa3d  won a  Company of the year and MK3S+ won a  3D Printer  of the year!   Big thank you to our wonderful community!   And thank you  @3dprintindustry  and  @MichaellPetch  for a great event ",32,436,37,0
SHALALA~,@ebonicplague_,2021-10-21T17:52:01.000Z,if only i had a  3d printer  i'd just make it myself. also surprised that there are no green or red shell cases either. does no one like mario kart any more?,0,0,0,0
schmuckbot,@schmuckbot,2021-10-21T12:36:26.000Z,"a tiny studded thingy, that looks recycled, made out of  3d printed  bioplastic",0,0,0,0
CAD & BIM Services,@CADBIMServices,2021-10-21T13:33:00.000Z,The Most Impressive  3D Printed  Structures in the World https:// ndustry/the-most-impressive-3d-printed-structures-in-the-world …,0,2,0,0
Newcastle College,@NSCGNewcastle,2021-10-21T11:05:04.000Z,"How amazing is this creation from Level 2 Engineering student, Daniel Hine.  Working many hours and coming in on his day off, Daniel has designed and  3D printed  this intricate piece to celebrate the  @AoC_info #LoveOurColleges  campaign. #ShareTheLoveOurColleges @irwinmitchell",0,0,0,0
"AVS 3D Printing, Laser Cutting & Engraving",@AVS3DPrint,2021-10-21T18:00:00.000Z,The September release from Artisan Guild is listed. The Turtle Dragon is awesome! There is also an extra weapons pack to let you change weapons and hands out. Please remember that Artisan Guild's standard size is 32mm but we can do other sizes for you.  #ttrpg #dnd #pathfinder,0,0,0,0
Additive Manufacturing Media,@AddMfgMedia,2021-10-21T16:45:03.000Z,Did you miss all the  #CoolParts  on the floor at the @LearnAdditive Conference + Expo?  @AM_StephanieH  and  @Z_Axis_MMS  reveal the WINNERS of The Cool Parts Showcase:  https:// Congrats to our winners and a big thank you to all who participated!  #thecoolpartsshow,0,3,2,0
夕凪㌠,@Yuunagi_DAMEYA,2021-10-21T16:50:43.000Z,1/144 scale model manufactured with  3D printer  is on sale. https:// #144scale #3dprinting,0,0,0,0
Natural Born Yapper,@DataShill,2021-10-21T18:08:29.000Z,"I got a  3D printer . This is my first print.  #WSB ! October 21, 2021 at 01:18PM",0,0,0,0
3DHEALS,@3dheals,2021-10-21T16:35:41.000Z,"#repost @omid .afarinan  𝐍𝐞𝐰𝐬

An integrated and heterogeneous soft-hard construct was successfully assembled as a lock-key structure by 3D cell printing. This  3D printed  soft-hard construct has the potential to be a customized plug in alveolar ridge preservation.
اخیرا …",0,0,0,0
Chris Evans,@evnsio,2021-10-21T17:49:31.000Z,"Thats cool, someone's  3D printed  a save icon.  https:// /corg_e/status/1450672130895622145 …",1,6,0,0
❂april❂ HUSH Darah Muda,@SMilloow,2021-10-21T15:00:18.000Z,Han sohee di My Name gila bgt ya ,0,0,0,0
The Concrete Centre,@concretecentre,2021-10-21T12:26:29.000Z,"INNOVATION -  @ZHA_News  has built a bridge from 53  3D-printed  blocks, with no reinforcement and nothing holding them together. It’s lightweight, low carbon, and might be the future of concrete structures.  #CQAutumn http://",0,0,0,0
KJD_3D_Printer (Real Life Bot),@Kjd3d,2021-10-21T12:56:13.000Z,KJD3D :   Printing is at 60%,0,0,0,0
e4i,@e4i_vakfi,2021-10-21T11:09:46.000Z,Son zamanlarda  3D printer  nedir sorusu fazlası ile sorulmaya başlandı. Özellikle girişimciler için 3D yazıcılar artık hiç olmadığı kadar önemli bir konu olma yolunda. https:// ir-ve-ne-ise-yarar/ …,0,0,0,0
reichelt INT,@reichelt_int,2021-10-21T17:14:02.000Z,The Voltera V-ONE  3D printer  will print the appropriate desired PCB according to your individual requirements.  More information here:  https://,0,2,0,0
朽木雕也,@kutsuki_choya,2021-10-21T15:13:54.000Z,"望むだけ支払う方式（３ドル～）のローマの邸宅の３Dデータ。

3D Printable Wealthy Roman Villas - Pay What you Want - STL by  3D Printing  Samurai を @Kickstarter_JP で要チェック！  https:// ntingsamurai/3d-printable-wealthy-roman-villas-pay-what-you-want-stl?ref=project_tweet …",1,1,0,0
Kevin Fosters,@KF_advice,2021-10-21T17:54:28.000Z,"NASAAmes: Time flies when you’re building a Moon rover! 
 
Using  3D-printed  and metal pieces, we’ve assembled a full-scale model of VIPER, our  #Artemis  Moon rover. Check out our practice run, and stay tuned for the final build in 2022: …",0,0,0,0
Gambody,@Gambody_com,2021-10-21T16:09:03.000Z,"Meet our exclusive   Anycubic & Gambody Bundles   featuring new and well-beloved  3D printing  models by Gambody contributing 3D artists and the Vyper Auto-Levelling FDM  3D Printer . 

Read more about the offer and order YOUR perfect bundle now:  https://",0,6,4,0
Bud Hammerton,@BudHammerton,2021-10-21T10:15:47.000Z,Check out the  3D printed  Tarmac SL/Pave Bontrager Flare Post Mount  http://  via  @shapeways  Single bolt clean / secure design,0,0,0,0
cheese lover,@wumboknives,2021-10-21T18:49:38.000Z,i think i want a  3d printer,0,0,0,0
Cristiane Kalinke,@criskalinke,2021-10-21T14:25:14.000Z,The best SEM image you will see today!  3D printed  electrode surface after activation. #ScienceIsLove #3DPrinting #3DPrintedSensors #WomenInSTEM,1,27,3,0
zeusJuice.Ξth,@ElectrikTwo,2021-10-21T19:08:36.000Z,"Thinking of getting this baby. An SLA  3D printer  instead of filament. Much better detail, less beat, faster, and less headaches..",0,0,0,0
enkinaru,@enkinaru,2021-10-21T15:25:49.000Z,"I felt somewhat sceptical about  3D printed  miniatures earlier but heck, this is awesome.

Test base, still need to cover the base with some grass. Pretty hapoy with colors tho",0,5,0,0
bubbleistrouble,@bubbleistrouble,2021-10-21T17:10:50.000Z,"3D printed  cap makes gargantuan, fleeting bubbles",0,0,0,0
Nonye85,@thenonye85,2021-10-21T18:24:25.000Z,"More on the  3d Printer  today while I organize my tools... Everyone needs a small dumpster for their desk, HOPEFULLY  #3dprinting #cleandesk #organizetools #adulting",0,0,0,0
Smart Industry,@SmartIndustryUS,2021-10-21T14:35:33.000Z,RISE center will accelerate industrial use of  additive manufacturing . Read the release here:  https://,0,0,0,0
Investor News,@newsfilterio,2021-10-21T12:30:50.000Z,"Stratasys Creates First-of-their-kind  3D Printed  Display Pieces for Paisley Park's Newest Exhibition, The Beautiful Collection: Prince's Custom Shoes  $SSYS https:// asys-creates-first-of-their-kind-3d-printed-display-pieces-for-paisley-parks-newest-exhibition--0f7f085fd8cf19fc6140c4d64ecc8663 …",0,0,0,0
EileanSiar Libraries,@WILibraries,2021-10-21T12:38:17.000Z,"LCC UHI at the Library!
Gaelic conversation, cyanotype printing, game design &  3d printing  and fashion design - a fantastic series of classes taking place at Stornoway Library.

To book your free place, email - lemarketing@uhi.ac.uk 
@lccuhi  #discovernewskills",0,0,0,0
brodie / knox,@brodiecantskate,2021-10-21T09:12:46.000Z,"3D printing  TikTok annoys me so much cause they’re like “look at this really cool think we’re about to make! Watch part 2 to see how it comes out”

No, motherfucker. Just film the start, leave it in your drafts and then film the result after! IT’S SO SIMPLE",0,4,0,0
Mirco Vanini,@MircoVanini,2021-10-21T10:09:58.000Z,Monitoring  3D Print  Quality using Azure Percept DK - Microsoft Tech Community  https:// -things/monitoring-3d-print-quality-using-azure-percept-dk/ba-p/2812741 … #IoT #AzurePercept,0,0,0,0
Make Parts Fast,@MakePartsFast,2021-10-21T15:54:50.000Z,3D printing  keeps off road vehicles moving  https://,0,0,0,0
EIN Presswire: Press Releases,@EINPresswirePR,2021-10-21T12:15:28.000Z,"3D Printing  Healthcare Market Trend, Growth, Size, Forecast, Key Players and Competitive Landscape Research Report  http://",0,0,0,0
SherbourneFields,@Sherbournetweet,2021-10-21T14:39:29.000Z,"Today we received an exciting delivery of a  3D printer  courtesy of @ArupGroup. The school is part of the Enthuse Partnership  @STEMLearningUK  with  @PKS_Coventry  and we have been invited to take part, designing and producing Robot Wars competition robots against other schools",0,6,2,0
Chreem,@Chreem1,2021-10-21T12:30:25.000Z,"OKAY GUYS so we had another dnd session yesterday yeah? and the dm  3d printed  some minifigs inclukding some squids and an octopus for a fight we had. some kid walked by saying ""oh yo you dming squid game??""",0,0,0,0
MatterThings Inc.,@MatterThings,2021-10-21T16:19:39.000Z,"The  3D printing  technology behind SIENA Garden’s “eternal spare part” offering: The 2021  3D Printing  Industry Awards are finally upon us. Interested in tuning in? The Youtube livestream link is now live, so viewers can subscribe and set reminders to…  http://",0,0,0,0
Geoff Wilbur,@geoffwilbur,2021-10-21T19:00:02.000Z,Nickel alloy IN625 now qualified for  3D printing  on  @DesktopMetal  Production System  https:// acturing-3d-printing-news/metal-additive-manufacturing-news/nickel-ally-in625-3d-printing-desktop-metal-production/ …  by  @Leanaura  via  @TheTCTMagazine,0,0,0,0
Andrew Brown,@andb143,2021-10-21T10:01:33.000Z,3D Printing  for Healthcare Market  http:// ing-for-healthcare-market-2021-research-sales-supply-and-demand-analysis-2026-2021-10-20 …,0,0,0,0
"George Robert Martin III aka: ""Nemesis Rising TV""",@Player1Rising,2021-10-21T13:33:57.000Z,Check out the  3D printed  SAHASRARA CROWN CHAKRA BARTER & TRADE COIN  http://  via  @shapeways,0,0,0,0
Megapop,@MegapopGames,2021-10-21T09:26:34.000Z,"We finally got around to actually paint our Big Bad Viking  3D print . Fits in nicely with the handpainted Stormtropper helme. Not all done yet, but getting there. Office decor ftw  #gamedev #indiedev #TrollsvsVikings2 #indiegame #towerdefense #ios #android #videogames",0,3,0,0
Thrill Science עם ישראל חי,@ThrillScience,2021-10-21T18:43:37.000Z,"My very first 'scope cam photo using an Amscope microscope and a Raspberry Pi ""High Quality"" camera with a  3D printed  adapter",1,1,1,0
8BitofFun-On Vacation,@8BitoffunX,2021-10-21T17:18:46.000Z,The look on  @RandyOrton  face when that   came out,0,0,0,0
Choice Store,@choicestore,2021-10-21T11:30:40.000Z,"Add to your off-duty wardrobe with the Box Contour Hoodie from  @mallet_london , featuring the  3D printed  Mallet 'M' ",0,0,0,0
trashpanda,@trashpandacos,2021-10-21T13:57:38.000Z,"I’m thinking of selling this  3d print  of  @dangerousladies  levin sword, I’m struggling to figure out how to light it up and I sort of just want to just get it out of my sight now. 

It’s printed with no infill so it’ll be hollow and transparent filament to diffuse light",2,11,1,0
3D Printing Tech,@printingtech3d,2021-10-21T16:45:05.000Z,"Even without any formal  #fashion  training or experience, you can be your own designer and create truly unique pieces using  #additivemanufacturing . All you need is a concept and a  #3Dprinting  pro who knows how to bring your vision to life. #fashionlovers http://",0,0,0,0
GeekBuying,@GeekBuying,2021-10-21T14:08:55.000Z,"With an under $400 price, the Anycubic Vyper  3D Printer  made no compromises on its build quality or performance. It comes with ease of use, superb printing quality, and most importantly, the cost-friendly price!  #FlashDeals  12% off now! More>>  https://",0,0,0,0
Brixham Belle,@JanetMcwee,2021-10-21T15:29:26.000Z,Schoolgirl faces terror trial after 'being caught with bomb-making video and guide to  3D-print  gun'  http:// fE?ocid=st …,0,0,0,0
Gambody,@Gambody_com,2021-10-21T17:03:06.000Z,"Get the Halloween Squid Game Mask for  3D Printing  for free on Gambody before the 1st of November:  https://   

The cruel Squid Game and its facilitators are perfect for your Halloween cosplay   Hurry up to get and  3D print  the mask of the notorious Front Man ",0,0,0,0
AllVisuals4U & 3DParts4U,@AllVisuals4U,2021-10-21T16:53:34.000Z,3D printed  algorithmic skyscraper!  https:// #AllVisuals4U #3DParts4U #Shorts #3DPrinting #3DPrint #3DPrints #PLA #Skyscraper #Building #Tower,0,0,0,0
Phrozen 3D Printer,@Phrozen3D,2021-10-21T12:57:00.000Z,"Ecstasy Demon  

This demon is attached firmly to the Sonic Mini 8K's frosted laser-cut building plate, which drastically improves your printing success rate! 

Special thanks to Alexei Konev for creating this fantastic print!",0,9,2,0
True Earper,@meltrue7,2021-10-21T18:38:06.000Z,Insta live of baby grogu  3d print #babyyoda #Grogu https:// 82701923410918?utm_medium=share_sheet …,1,2,0,0
"AVS 3D Printing, Laser Cutting & Engraving",@AVS3DPrint,2021-10-21T14:00:00.000Z,"We carry a very large selection of can mugs & each one has a matching dice box! Check them out on our store. These pics are actual print photos.. Not renders. 

Click below to visit our shop!  #ttrpg #dnd #pathfinder",0,1,4,0
Shikoru,@GaleWarrior,2021-10-21T11:19:25.000Z,#DragonFable  healing pad redesign/concept for next  3d print .,1,25,3,0
Trapper,@Ahnassis,2021-10-21T17:10:09.000Z,Impossible. You can't make guns at home without a  3D printer .  https://,0,0,0,0
TheUndefinedMystic,@pennycheck,2021-10-21T18:22:11.000Z,only a matter of time before the  3D printing  stocks start to move $VLD $DM $MKFG $SHPW https://,0,2,1,0
AatishSharma1995,@AtishSharma1995,2021-10-21T12:52:20.000Z,This  3D Printed  Tableware Collection is Made out of Waste Food  https:// leware-made-from-waste-food/161271/#.YXFiec91OyE.twitter …,0,0,0,0
Grey G.,@gr3yg00,2021-10-21T11:54:00.000Z,Yay - new  3D printer  arrived \o/ @KatharinadieKl2  jetzt koennen wir nochmal ueber die Drone reden ;),1,2,0,0
NBC Nightly News with Lester Holt,@NBCNightlyNews,2021-10-21T19:30:00.000Z,"On today's episode of  #NightlyKids :

> Learn what the supply chain is and how it will impact how holiday gifts.

> A behind-the-scenes look at a company that's  3D printing  rockets heading to space.

And more! Stay tuned and catch up on past episodes here:  https://",1,8,5,0
Boudoir Numérique,@BoudoirNUM,2021-10-21T13:05:39.000Z,#Halloween  will be  #fashiontech  thanks to  #SquidGame 3d-printed  masks :  https:// lloween-will-be-fashion-tech-thanks-to-squid-game-59504 …  -  #3Dprinting #halloweenmask #DIY #cults3d #thingiverse,0,0,0,0
Asian Amerigun,@LordNoodles,2021-10-21T14:06:03.000Z,Should really make a  3D print  of these shells (harhar) with a CMMG bolt inside.  Seburo is peak cyberpunk.,0,0,0,0
Daniel Eichhorn,@squix78,2021-10-21T12:58:22.000Z,Ender 3 V2: 8 Reasons to Get Started With  3D Printing  Now!  https:// #3Dprinting @Creality3dP #ender3v2,0,0,0,0
3D Printing @𝟑𝐃𝐚𝐛𝐥𝐞,@3Dable,2021-10-21T15:51:10.000Z,FA »Zortrax Hitches a Ride on WoodSat«  https:// #3Dable #3DP #3Dprinting #3Dprinter #Prototyping,0,0,0,0
3D Strikers,@3dStrikers,2021-10-21T13:58:19.000Z,"3D Printer #Installation  

Sold by:  @phrozen3d Printer:  Sonic Mighty 4K
Installed by:  @roshanrk_47 Location: @thegreatamritsar

  #3dprinting #3d #3dprinter #3dprinted #3dprint #design #3dmodel #maker #engineering #art #prototype #3ddesign #technology #diy #cosplay #makersgonna",1,2,0,0
Christina Birkel,@BirkelChristina,2021-10-21T17:11:04.000Z,"3D printed  running shoes and dentures? Digital Manufacturing of Polymer Products in this week's  #MateriAlZ  Seminar by Dr. Joseph DeSimone  @Joseph_DeSimone @Stanford  hosted by  @asu @ASU_SMS @uarizona @azengineering . Oct 22nd, 11 am Phoenix time, pw: 756959 https://",0,6,4,0
Leslie Langnau,@DW_3DPrinting,2021-10-21T12:25:00.000Z,Materialise and Proponent plan to raise the profile of  3D printing  in aerospace aftermarket supply chains.  https:// d-proponent-plan-to-raise-the-profile-of-3d-printing-in-aerospace-aftermarket-supply-chains/ … #3dprinting #AdditiveManufacturing @DesignWorld @MaterialiseNV,0,2,0,0
Fabbing,@fabbing,2021-10-21T13:19:06.000Z,De-Hyper: Can  3D Printing  Alone Solve the Climate Crisis? Probably Not.  http://,0,0,0,0
jeddab abderrahim,@a_jeddab,2021-10-21T16:52:36.000Z,Nanoscale Glass  3D Printing  Method Developed « Fabbaloo  #Prototyping  via  http:// https:// -glass-3d-printing-method-developed …,0,0,0,0
Additive Manufacturing Center of Excellence,@ASTMAMCOE,2021-10-21T16:24:53.000Z,"[ #ICAM2021  PANEL DISCUSSION ANNOUNCED] 

Nov 4: AM in the Vehicle Industry: Current Perspective and Preparing for the Future @ASTMIntl  Conference on  #AdditiveManufacturing @eatoncorp @GM @Divergent3D @GKNAero https://",0,0,0,0
arg/machine,@arg_machine,2021-10-21T14:33:37.000Z,UPDATED LINKS:  3D Print  this!  https:// 136/3dprint …,0,0,0,0
Natsuro Wolf @TFF,@Natsuro_Wolf,2021-10-21T15:30:41.000Z,My  3D printer  is coming in tomorrow!!!!! So excited!!! Still don't have a damn clue on how to use it.  Gonna do some more research tonight,0,10,0,0
Fabbaloo,@fabbaloo,2021-10-21T18:00:10.000Z,Nanoscale Glass  3D Printing  Method Developed  https:// #3DPrinting #AdditiveManufacturing,0,2,1,0
Nick Ballz,@NickBalazs,2021-10-21T11:32:31.000Z,"Gooood morning  #dogecoin  fam   Busy day ahead! I'm driving out to meet my jeweler to go pickup the gfs 3 year anniversary   It's been 2 months in the making. Diamonds imported from Hong Kong, custom  3D printed  parts! I'm excite   Pics in 6 days when she gets it!",3,25,6,0
3D Printing Deals,@3dpdeals,2021-10-21T12:17:45.000Z,"Price dropped some on this, now $9.99 for Grey/White/Black using the same promo code in original tweet.",0,2,0,0
E.,@erikaagissella,2021-10-21T18:14:00.000Z,Love/hate relationship with this  3D printer .,0,0,0,0
Simon Angelo,@SimonJAngelo,2021-10-21T09:57:48.000Z,3D printing  may represent a quantum leap forward in manufacturing. Here’s how you can take advantage of this next-generation opportunity. https:// 991/the-next-industrial-revolution-1200-growth-by-2030/ …,0,0,0,0
Université de Labé,@universitelabe,2021-10-21T18:44:21.000Z,"Dans le cadre d’une mission de travail avec ses partenaires académiques, des cadres de l’université de Labé ont participé ce mercredi 20 octobre 2021 au Salon International  3D Print  Congress & Exhibition  à Paris. https:// 9/posts/4756506374432929/ … @Mesrs_Gn #UL2021",1,16,5,0
3D Print Mars,@3dprintmars,2021-10-21T17:41:13.000Z,Epic,0,0,0,0
Idk 19/15 coms2/5,@IdkofficiaI,2021-10-21T14:53:15.000Z,Ok if I get a  3D printer  what should I do with it? Make custom avatars in the shape of a bloxy award and sell them? or something else.,1,2,0,0
