Author Name,Author ID,Date,Post Text,Replies,Likes,Reshares,Views
Michael Molitch-Hou,@MikeMolitchHou,2021-02-23T17:05:42.000Z,". @Inkbit3D  has finally revealed its Vista  3D printer , featuring machine vision and closed-loop control.  https:// launches-inkbit-vista-closed-loop-automated-3d-printer/ …",0,0,0,0
Curtis Mann,@CurtisM34080386,2021-02-23T16:02:43.000Z,"I  3D printed  a Glock in California!!!  https://  via  @YouTube  

This is what Californians have to go through.",0,0,0,0
3DPrint,@3DPrint_com,2021-02-23T15:02:02.000Z,Single-Piece  3D Printed  Rocket Engine Passes Fire Test in India  http:// #3DPrinting #AdditiveManufacturing,0,3,7,0
mikebit 3d printing,@Mikebit3d,2021-02-23T11:10:35.000Z,#3dpq @kraegar @chimpusmaximus @MCHRISP1 @themitch22 @Mobile_Dom @MidknightGiant @GreyBeard_3D @idig3d @ChrisViolaNerd @nerys  @Sahil_no5 @SallyRepRap  @nachete2016  @esun3dfilament @Afro3dP @alienslacker @dragonbaneOZ @wilkovehreke @jbonasera @can3_d @technosworld @DanielNoree,17,21,0,0
msg,@pledism,2021-02-23T10:29:27.000Z,"I want to build my very own custom made super sentai series mechas using metal alloys, ceramics n good composite plastic
I just need a good  3d printer  for this

Getting frustrated looking at those bandai cheap looking inconsistent plastic toys lol

Its gonna b expensive n....",1,0,0,0
anna,@a_he3d,2021-02-23T18:44:00.000Z,US $4.7 | 3D printer  accessories 2020 aluminum profile X type connection plate 2020 corner bracket connection s...  https:// 2098.html?channel=twinner …,0,0,0,0
Zorro - Star Haven’s Hero,@StarHavensHero,2021-02-23T16:23:37.000Z,Exor  3d Print  - Blade Segments,0,0,0,0
3d scanner,@reprap_sara,2021-02-23T14:24:00.000Z,US $326.6 54% OFF|HE3D the Newest EI3 triple large print size 3 in 1 out extruder  3D printer  kit with 2rolls f...  https:// 06.html?channel=twinner …,0,0,0,0
Michael Martinez,@Obsy,2021-02-23T16:06:38.000Z,"Regardless of how you feel about  3D printing , this is a great example of how someone who thinks they know the CA gun laws can still be unknowingly non-compliant with CA firearms laws, especially those that panic purchased in 2020  https://",0,0,0,0
KJD_3D_Printer (Real Life Bot),@Kjd3d,2021-02-23T14:35:50.000Z,KJD3D :   Printing is at 20%,0,0,0,0
Kremser Mariana,@KremserMariana1,2021-02-23T16:36:40.000Z,"3D-Printed  Home Can Be Constructed For Under $4,000  https://  via  @YouTube 3D-Printed  Home Can Be Constructed For Under $4,000",0,0,0,0
MWW,@MattWWriter,2021-02-23T17:12:03.000Z,Turns out you can't  3D print  a personality :(,0,5,0,0
Wevolver,@WevolverApp,2021-02-23T13:15:02.000Z,"Researchers have produced a gel from cellulose fibres and biodegradable  #nanoparticles  that liquifies when pressed through the nozzle of a  #3D  printer, but then quickly returns to its original shape. https:// iversal.carrier.ink.for.3d.printing … Image/video credits:  @ETH_en #engineering #tech",0,0,0,0
3D Printed Crack Pipe,@TronMeggy,2021-02-23T18:16:01.000Z,Back at it again,2,3,0,0
Mashable,@mashable,2021-02-23T20:07:00.000Z,This office is the largest  3D-printed  building to date,1,30,20,0
Sushi is taking commissions,@SushiboySimon,2021-02-23T11:10:47.000Z,I well it’s done live now on twitch YOLO  http://  painting a model I  3D printed  of Tom nook from animal crossing,0,1,2,0
Everyone Is Charaphobic,@ECharaphobic,2021-02-23T15:38:31.000Z,3D Printed  naily is charaphobic,0,0,0,0
Smart Manufacturing Experience,@SmartMfgExp,2021-02-23T13:39:00.000Z,Did you know there are 8 disruptive technologies that are transforming manufacturing?  Additive manufacturing  and  3D printing  are at the top.,0,0,0,0
Sandesh Khobragade,@Sandeshk358,2021-02-23T10:14:47.000Z,The Biqu B1 is an affordable and superb  3D printer . And it comes in pink. Enter to win one in this week's  http://  competition!  https://,0,0,0,0
Kenzos_customs,@Kenzos_customs,2021-02-23T17:57:34.000Z,"The 12"" Nikola Jokic Project is Complete..  With the Arm extended, and the stand, it sits at a little over 20""...  3D printed  head on top of a Mcfarlane Yao Ming base pose.  #CustomMcfarlane #nuggets @nuggets #mcfarlaneNBA #TheJoker @ChrisMarlowe @ScottHastings @katywinge",4,31,0,0
Not A Games Dev Ollie,@Reksaurian,2021-02-23T11:58:12.000Z,BRECKFAST. :O,0,0,0,0
川向薫@東京ゲームダンジョン7(日) B-11,@bydriv,2021-02-23T11:10:33.000Z,3d printer  もな,0,0,0,0
𝐍𝐢𝐤𝐨,@lavrys,2021-02-23T19:49:07.000Z,Or  3D printing  ...,0,0,0,0
Mitchell and Son Additive Manufacturing LTD,@MitchellandSon1,2021-02-23T11:17:03.000Z,#MedicalDental #3DSystems #CollPlant #Formlabs #McMasterUniversity  Scientists  3D print  dope new open-source cannabis-smoking ‘lung simulator’  http:// http://,0,0,0,0
Ali khan,@Alikhan99203722,2021-02-23T10:46:57.000Z,#Jacob #Cook #Kid 's/Youth  #Hoodies  Leg-end Zelda  #Children 's  #3D #Printing #Unisex #Pullover  Hooded  #Sweatshirts  for  #Boys / #Girls  S(7-8) Black by JETEZ   https://  via  @amazon,0,0,0,0
Hawk Ridge Systems,@Hawk_Ridge_Sys,2021-02-23T17:52:41.000Z,"We're just over an hour away from our  #HP  live stream event!

There's still time to join us  Learn everything you need to know about the HP  3D Printing  solutions.

We go live at 11 AM PT/1 PM CT!

We'll see you soon  https://",0,0,0,0
al hogg,@AlastairCHogg,2021-02-23T15:57:57.000Z,I really want a  3d printer,0,0,0,0
"AVS 3D Printing, Laser Cutting & Engraving",@AVS3DPrint,2021-02-23T14:42:19.000Z,Ragdath Grimforge - DND-Pathfinder-Minature-RPG-CastNPlay-Swamp  https://  via  @EtsySocial  Scifi Rpg  #RPG #DND,0,0,0,0
Fabbing,@fabbing,2021-02-23T14:11:03.000Z,Inkbit Launches A New  Additive Manufacturing  System  http://,0,0,0,0
Kremser Mariana,@KremserMariana1,2021-02-23T16:40:09.000Z,This company can build move-in ready houses using a  3D printer  | Your Mo...  https://  via  @YouTube,0,0,0,0
Med-Tech Innovation,@medtechonline,2021-02-23T12:00:00.000Z,Titanium and  3D Printing : the future of medical implants? https:// @SandvikGroup #medtech #3dprinting #medicalimplants #titanium,0,0,0,0
InShaniac on the dance floor,@Psypresschill,2021-02-23T14:02:44.000Z,"One of the driving forces behind me learning to 3d model and  3d print  is a desire to recreate a sculpture a friend once designed. I want to be able to hang the small pendant of ashes I have of them, and I want others who miss him to have this sculpt eventually as well.",0,0,0,0
TH3D™ Studio,@TH3DStudio,2021-02-23T14:51:48.000Z,New live stream today! Ask Tim -  3D Printer  Q&A Help Stream | Livestream | 2/23/21 Link:  http://,0,0,0,0
Tuan TRANPHAM,@ttranpham,2021-02-23T13:36:35.000Z,"Inkbit Launches Inkbit Vista, a New  Additive Manufacturing  System that Revolutionizes  3D Printing  •  https://  •  #3Dprinting  • tuan@arevo.com •  #additivemanufacturing  via  @fireflybio  & Jakob René",0,2,1,0
Supercharg3d,@Supercharg3d,2021-02-23T12:32:47.000Z,AMFG considers five trends shaping the future of  Additive Manufacturing  | Supercharg3d  http:// #supplychain #logistics @AMFG_ai,0,0,0,0
3DHEALS,@3dheals,2021-02-23T12:46:05.000Z,"Ohio State’s new M4 Lab utilizes#3Dprinting to meet needs in clinical medicine⠀ https:// @cdmeosu @OhioStateIMR  A newly formed, interdisciplinary team of researchers at The Ohio State University’s Nanotech West Laboratory is utilizing  3D printing  to find inno…",0,2,0,0
Orthofix Medical,@OrthofixMedical,2021-02-23T14:34:17.000Z,The First  3D Printed  SI Screw with Nano Surface Technology. Learn more about the FIREBIRD™ SI Fusion System at  https:// iew/orthofix-is-on-the-move/5 … .  #OrthofixSpine,0,0,0,0
Alberto P. Lorandi M,@alorandi,2021-02-23T16:32:14.000Z,Guau:  3D Printing  Bones Directly into the Human Body - Industry Tap  https:// nes-directly-into-the-human-body/56148 …  a través de  @IndustryTap,0,0,0,0
Not A Games Dev Ollie,@Reksaurian,2021-02-23T13:59:30.000Z,My entire goal and occupation in life is to wake up RN.,0,0,0,0
Pro Painted Podcast,@ProPainted,2021-02-23T17:32:25.000Z,Had a rethink of how to tackle the Sashimonos. Rather than  3D printing  I decided to try scratch building them. I felt it important the bone design elements are present. Also used my 90’s modelling knowledge to make foil banners! What do you think?,3,52,4,0
½Man½Rusk,@HalfManHalfRusk,2021-02-23T15:55:20.000Z,* orders  3D printer * https:// spensed:2 …,0,0,0,0
Kremser Mariana,@KremserMariana1,2021-02-23T16:09:56.000Z,Why This  3D-Printed  House Will Change The World  https://  via  @YouTube,0,0,0,0
Capturing Reality,@RealityCapture_,2021-02-23T14:19:36.000Z,"Famous Porta Nigra in Trier 3D scanned and  3D printed  by  http://  (Philipp Matschoss) 

The Porta Nigra was recreated as a 3D model with  #RealityCapture ,  3D printed  and then hand-painted into a realistic copy of this large Roman city gate built in 170AD. #3Dprint",2,17,1,0
Leslie Langnau,@DW_3DPrinting,2021-02-23T13:35:47.000Z,"Inkbit launches Inkbit Vista, an automated  additive manufacturing  ecosystem  https:// s-inkbit-vista-an-automated-additive-manufacturing-ecosystem/ … #3dprinting #additivemanufacturing @DesignWorld @Inkbit3D",0,2,1,0
3DFils,@3DFils,2021-02-23T16:09:18.000Z,Today we are very happy to present our new filament esFil PETG MAX.  This premium quality PETG based filament is perfect for  3D printing  functional objects.  PETG stands out for its great resistance and toughness.,0,3,1,0
夕凪㌠,@Yuunagi_DAMEYA,2021-02-23T16:50:42.000Z,1/144 scale model manufactured with  3D printer  is on sale. https:// #144scale #3dprinting,0,2,0,0
Techosmo,@techosmo,2021-02-23T19:57:54.000Z,"CEL Automaker released under open source license -  https:// -automaker-released-under-open-source-license/ … Seven years ago, CEL-UK broke new ground when it released the Robox  3D printer . It was a commercial product that anyone could use, and it didn't require a self build, unlike many other machines at ...",0,0,0,0
eSUN 3D Printing,@esun3dfilament,2021-02-23T14:30:12.000Z,"ePA-GF is an amazing nylon filament with reinforced glass fiber, which is much improved in rigidity, with better creep resistance, fatigue and heat resistance comparing to pure nylon, making it an ideal filament for engineering-grade application. https://",0,2,1,0
Kelsey Means,@MrsKelseyMeans,2021-02-23T19:39:30.000Z,We've been enjoying our new  @ff3dprinters  Creator Pro thanks to  @DonorsChoose  and  @TysonFoods ! Just found out that my second grant was paid for by  @TysonFoods  and we are getting another  3D printer !  @GardenSpotMS @GardenSpotHS,1,8,1,0
Jiří Kašpar,@JiKapar8,2021-02-23T10:08:13.000Z,"3D PRINT  BING
NAVIGATION
SECURE.
ASHY
IM
I http://",0,0,0,0
❂april❂ HUSH Darah Muda,@SMilloow,2021-02-23T17:24:16.000Z,"This is what i thought days ago when sungyun appeared in volley jersey. He will fit prince of tennis outfit   
but as who? tezuka?  https:// /hellosunggyoon/status/1364059323924574213 …",0,0,0,0
3D Metal Printing Magazine,@3DMetalPrintMag,2021-02-23T15:29:03.000Z,"Railroad OEM Wabtec calls  additive manufacturing  a ""technology pillar"" as it plans use AM in the production of more than 25,000 parts by 2025. This spring the firm will open a new AM facility in Pittsburgh.  https:// le/?/2021/2/4/Wabtec_On_Track_to_Reap_Performance_Gains_from_Metal_AM …",0,0,0,0
Mighty Jabba,@mightyjabba,2021-02-23T12:16:59.000Z,"Got the Saturn resin  3D printer  from  @Elegoo_Official  in for review and was surprised to find it personalized for my channel! Pretty cool, not gonna lie!  #3dprinting #elegoo #elegoosaturn",3,11,1,0
Books To Believe In,@books2believein,2021-02-23T16:15:59.000Z,#Python  is quickly becoming the world's most popular programming language for many things - including 3D-modeling - when used in conjunction with the  #openSource  language  #OpenSCAD .  https:// #3D -printing  #amazon #DownloadablePythonCode,0,0,2,0
Carpenter Additive,@CarpenterTechAM,2021-02-23T18:35:10.000Z,Cool Parts from INSIDE a  3D Printer . Check it out at  https:// .  @AddMfgMedia #CoolParts,0,2,1,0
Tuan TRANPHAM,@ttranpham,2021-02-23T13:59:12.000Z,"Meet Korodur, the company behind CyBe’s  3D printing  MORTAR •  https://  •  #3Dprinting  • tuan@arevo.com •  #additivemanufacturing https://",0,0,0,0
KJD_3D_Printer (Real Life Bot),@Kjd3d,2021-02-23T17:14:11.000Z,KJD3D :   Printing is at 80%,0,0,0,0
3ECRUIT,@3ecruit,2021-02-23T10:20:02.000Z,"As we all wake up to more positive news about the pandemic, it's great to see  3D printing  playing such a part   

Take a look at how  3D printing  could actually help to reduce Covid-19 spreading. http:// #jobsin3Dprint #3dprintingjobs",0,0,0,0
CIC Makerspace,@CIC_Makerspace,2021-02-23T17:11:29.000Z,"Spot the speaker sitting beautifully on a  3D printed  speaker stand 3D printing  is a remarkable technology with endless possibilities stretching into a vast array of industries and uses
We can do a lot with  3D printing  technology
Check-in for your  3D printing  services #CLINTONEL",0,3,1,0
Salt,@SaltUnknown_,2021-02-23T15:01:22.000Z,So for chistmas my friend made me a  3d printed  figure and painted it as  @sapnap  /  @sapnapalt  and I wanted to show yall. :) #sapnapart #sapnap #mcyt #mcytfanart #mcyttwt,1,4,0,0
D,@dmartyn76,2021-02-23T14:25:44.000Z,1st  3D printed  ribeye!  Call the girls! http://,0,0,0,0
Designz by JJS,@DesignzbyJJS,2021-02-23T16:42:50.000Z,Lithophane  3d Print  Waterfall Time Lapse  #shorts #lithophane #3dprint https://  via  @YouTube,0,0,0,0
Amy,@He3dU,2021-02-23T19:17:00.000Z,object scan 3d Modeling with software|3D Scanner...  https:// 9166.html?channel=twinnerUS …  $109.0 |3D scanner Z17OR for  3D printer  handheld body face,0,0,0,0
Cheryl Rainfield they/them,@CherylRainfield,2021-02-23T15:52:27.000Z,This seems hopeful-> 3D-printed  homes build hope for U.S. affordable housing.  http:// 42828-zv3th/ …  via  @goodgoodgood,0,0,0,0
Fabbaloo,@fabbaloo,2021-02-23T19:01:05.000Z,Inkbit Launches A New  Additive Manufacturing  System  https:// #3DPrinting #AdditiveManufacturing,0,0,0,0
Zilla Tech News,@ZillaTechNews1,2021-02-23T11:41:39.000Z,3D Print  a PCB the Hard Way  https:// -the-hard-way/ …,0,0,0,0
Prima Power North America,@PrimaPowerNA,2021-02-23T17:01:23.000Z,"A hi-tech sculpture celebrates our belief in a sustainable restart. Watch the making of this amazing sculpture just using our technologies: laser cutting and marking,  additive manufacturing , bending, and punching. This work of art is our way to celebrate a new and sustainabl…",0,0,0,0
Oxford Centre For Innovation,@OCFI_OI,2021-02-23T12:35:06.000Z,"Are you looking for a technical workshop to rent that's perfect for light prototyping,  3D printing  and high-tech assembly work? Visit our website to find out more:  https:// space/ … #ocfi #office #oxford #flexible #workshops",0,4,2,0
A(￣ω￣)Zy~~~7☆,@az7stars,2021-02-23T14:35:10.000Z,A(ಠωಠ)Zy~~~7☆Is this  3D printer  used meat? Stop war don't make weapons for save nature. No rocket.,0,0,0,0
KJD_3D_Printer (Real Life Bot),@Kjd3d,2021-02-23T15:42:26.000Z,KJD3D :   Printing is done! Took about 1:24:10,0,0,0,0
3d scanner,@reprap_sara,2021-02-23T19:32:00.000Z,He3D K200 single head delta DIY  3d printer  kit autolevel with heat bed- suppo...  https:// ref=cm_sw_r_tw_dp_x_KKktFb96TC5TV …  来自  @amazon,0,0,0,0
NSF NCAR Computational and Information Systems Lab,@NCAR_CISL,2021-02-23T17:11:41.000Z,#NCARExplorerSeries  happening today. Online resources to build and maintain  3D-printed  components for a DIY weather station   and how to use the  #WRF  model with a Raspberry Pi  #IoTwx #NSFstories  Register for free at  http:// @NCAR_Science,0,3,1,0
Kremser Mariana,@KremserMariana1,2021-02-23T16:54:29.000Z,"The First Legally Permitted  3D Printed  House in the USA with SQ4D  https://  via  @YouTube  
The First Legally Permitted  3D Printed  House in the USA",0,0,0,0
Copiah-LincolnCC,@CopiahLincolnCC,2021-02-23T17:57:27.000Z,"Thanks to support from  @GeorgiaPacific , our Engineering Lab currently includes 2 filament-based 3D printers, 1 resin-based  3D printer , a material testing system & computers for computer-aided design & numeric computations/plotting. We'll share more photos when it is complete!",0,5,1,0
Jemima Willcox,@JemimaWillcox,2021-02-23T16:58:41.000Z,"Our  3D printer  at work.
Watching it can be rather mesmerising... #3Dprinting #Cambridge",0,2,1,0
Not A Games Dev Ollie,@Reksaurian,2021-02-23T11:26:36.000Z,Unknown Post Content,1,1,0,0
jules @ hulkenberg call me pls,@severeluna,2021-02-23T18:27:43.000Z,kinda wanna fuck around and save for a  3d printer  in the future,1,11,0,0
Tuan TRANPHAM,@ttranpham,2021-02-23T13:59:56.000Z,HOW  3D PRINTING  MANUFACTURING HUBS CAN OPTIMIZE CITY LOGISTICS •  https://  •  #3Dprinting  • tuan@arevo.com •  #additivemanufacturing https://,0,0,0,0
Shapeways,@shapeways,2021-02-23T19:18:02.000Z,"Shapeways and BeeHero partnered to  3D print  hardware for smart beehive sensors, encouraging successful pollination—and growth of crops for common food sources.  https:// #3DPrinting #Bees #BeeHero",0,1,2,0
Vivek Wadhwa,@wadhwa,2021-02-23T18:32:52.000Z,"These are debates I am really looking forward to, when we can inexpensively  3D print  the meat we eat and don't have to slaughter animals. 

Very likely in this decade.",2,8,2,0
Kevin Pitts,@kpitts33,2021-02-23T20:00:20.000Z,"I have a pretty cool PEZ collection at school in my office, but now I have a little bit of myself in the collection. Thank you Ms. Wynne and PLTW for the  3D printer  masterpiece!! Totally cool and totally surprised!  #spoofhoundpride #evenhadcandyinit",1,48,0,0
Scarlett's Grandpa,@KASDad,2021-02-23T18:40:48.000Z,This could make me give up beef if this was my only choice. A startup is  3D printing  plant-based steaks to recreate the taste and texture of the real thing — see how they do it  https:// 3d-printed-plant-based-faux-steaks-in-photos-2020-9?utmSource=twitter&utmContent=referral&utmTerm=topbar&referrer=twitter …  via  @businessinsider,0,0,0,0
3d scanner,@reprap_sara,2021-02-23T14:15:00.000Z,"HE3D K280 Large Size Auto- leveling Single extruder Delta  3D printer  DIY kit with heatbed 280&600mm Sale, Price & Reviews | Gearbest  https:// d-printer-kits/pp_3008243559583407.html#.X0yswvoNAn4.twitter …",0,0,0,0
Vala Afshar,@ValaAfshar,2021-02-23T13:11:16.000Z,"15 BIG DISRUPTIVE IDEAS 2021:

1 Deep Learning (AI/ML)
2 Virtual Worlds (Gaming and AR/VR)
3 Digital Wallets
4 Bitcoin Fundamentals
5 Electric Vehicles (EVs)
6 Automation
7 Autonomous Ride-Hailing
8 Delivery Drones
9 Orbital Aerospace
10 ",4,179,76,0
anna,@a_he3d,2021-02-23T15:30:00.000Z,US $3.6 |5pcs  3D printer  accessories T8 screw lock ring lock block isolation column| 3D Printer  Parts & Accesso...  https:// 68.html?channel=twinner …,0,0,0,0
The 3D printing belgian #FreeThe3DPGeneral,@3DPBelgian,2021-02-23T19:11:33.000Z,It is a shame that its so unappreciated. Lovely color. I will. Got the sickness from kiddo and tori. Doctor wants me to do a rona test if my fever isnt down tomorrow but i am 99% sure its just a headcold,0,4,1,0
Richard Martin,@ScinaryActual,2021-02-23T12:26:02.000Z,3D Print  a PCB the Hard Way  http://,0,0,0,0
anna,@a_he3d,2021-02-23T18:42:00.000Z,US $4.67 | 3D printing  accessories aluminum alloy coupling motor coupling metal model DIY printer 5pcs| 3D Print ...  https:// 97.html?channel=twinner …,0,0,0,0
Deshpande Center @ MIT,@MITDeshpandeCtr,2021-02-23T18:16:13.000Z,"MIT Deshpande spinout  @Inkbit3D  launches Inkbit Vista, a new  additive manufacturing  system that revolutionizes  3D printing .  http:// #3Dprinting #startup",0,0,0,0
USSROVER,@USSROVER,2021-02-23T10:28:29.000Z,Help me win The Biqu B1  3D printer .  https://  Thank you.,0,0,0,0
Nano Dimension,@3Dpcb,2021-02-23T12:47:22.000Z,Today we will kick off the first virtual seminar of the AME Academy at 10 am (Eastern Time) with industry leaders in  additive manufacturing  of electronics! If you have not registered you can reserve your seat at  https:// #innovation #3dprinting #ame #technology,5,106,30,0
Kremser Mariana,@KremserMariana1,2021-02-23T16:07:54.000Z,LUXURY Houses made ENTIRELY from  3D PRINTER ! | WATCH NOW  https://  via  @YouTube,0,0,0,0
iLima Digital Foundary,@iLimaFoundary,2021-02-23T11:12:36.000Z,"Faster than traditional building approaches,  3D printing  is just one of the many alternative product based construction techniques available today. #3Dprinting #modular #prefab #construction #industrializedconstruction #affordablehousing Are  3D-printed  homes the future for  ...",0,0,3,0
KJD_3D_Printer (Real Life Bot),@Kjd3d,2021-02-23T14:18:15.000Z,KJD3D :   I've started printing **rose.gco**,0,0,0,0
anna,@a_he3d,2021-02-23T18:38:00.000Z,US $4.2 | 3D printer  accessories 7025 cooling fan 70*25 12V super quiet fan| 3D Printer  Parts & Accessories|   -...  https:// 11.html?channel=twinner …,0,0,0,0
3D Innovations,@3D_Innovations,2021-02-23T18:15:05.000Z,"3D Printing  In The Jewelry Industry  https:// ng-in-the-jewelry-industry …  via  @fabbaloo #3Dprinting  has found its place in the  #jewelry  design industry. Most commonly, a special castable wax resin is being used in 3D printers in order to create amazing pieces of jewelry.  #design #innovation",0,0,0,0
Crackedconsole,@crackedconsole,2021-02-23T13:32:49.000Z,3D printing  functional car parts with ApolloX  https:// printing-functional-car-parts-with-apollox/?utm_source=ReviveOldPost&utm_medium=social&utm_campaign=ReviveOldPost … #3dprinting #externalnews #technology,0,0,0,0
Charles Russo,@Charles_M_Russo,2021-02-23T14:03:36.000Z,Siemens Digital releases latest Simcenter Testlab software -  3D Printing  Media Network - The Pulse of the AM Industry  https:// l-releases-latest-simcenter-testlab-software/ …,0,0,0,0
littleblokes,@littleblokes,2021-02-23T17:49:46.000Z,"Imhotep Builder of Egypt Standard Ships  3d Printer  Digital Download | STL Print, Egyptian Reed Ship, Custom Games, KOSMOS Games  http:// #GeekGear #Etsy #lbStudiosOnEtsy #EtsySeller #EtsyStore #NerdWear #3dPrinting",0,0,0,0
⟭⟬Jeanette⁷⟬⟭˙८ ˙,@GnetArmyMom,2021-02-23T18:38:05.000Z,Check out my ARMY friend’s new light stick holder now for sale in her Etsy shop . Her daughter is super talented with the  3D printer  and has super cute ornaments too. Here’s the one she made for me.  http://,0,6,1,0
A.Amag,@ame_feb4,2021-02-23T11:53:28.000Z,non planar  3d printing  というやつですかね。これとか。 https:// U0TRw …,0,6,3,0
ASME Journals,@ASMEJournals,2021-02-23T11:00:01.000Z,Ready-to-Go Multi-Material  3D-Printed  Parts https:// es/content/ready-to-go-robot-emerging-from-3d-printer … #3dprinting #materials,0,0,0,0
rheia smith,@RheiaSmith_,2021-02-23T12:13:50.000Z,"Funny, because I’m sure I remember writing SO MANY articles on communities sewing masks, making  3D printed  face shields in dining rooms, and dropping them off at hospitals and care homes in the THOUSANDS.",0,2,0,0
Englander / Chris,@CPH76Hawk,2021-02-23T20:21:20.000Z,3D Printing  technology is worth jack shit until one can print a perfect edible pizza.,1,2,0,0
DCU Engineering,@DCUEngineering,2021-02-23T12:35:19.000Z,"Robots,  3D printing  &  #sustainability  are just some of the themes of the events that  @DCU  is hosting as part of  #STEPSEngineersWeek  2021. These free virtual, interactive events have been specifically designed for secondary school students https:// #DCUEngineering",1,14,9,0
Sciaky Inc.,@Sciaky_inc,2021-02-23T15:49:07.000Z,HOW  3D PRINTING  MANUFACTURING HUBS CAN OPTIMIZE CITY LOGISTICS http://,0,0,0,0
Metal AM,@MetalAMMag,2021-02-23T19:01:33.000Z,"The Institute of Production Engineering and Machine Tools (IFW) and the Fraunhofer Institute for  Additive Manufacturing  Technologies (IAPT) have collaborated on a new AM research project, AddSpin. http:// #AdditiveManufacturing #3DPrinting #research",0,0,0,0
❂april❂ HUSH Darah Muda,@SMilloow,2021-02-23T17:18:27.000Z,,0,0,0,0
Kremser Mariana,@KremserMariana1,2021-02-23T16:47:16.000Z,3D Printing : The Home of Tomorrow  https://  via  @YouTube,0,0,0,0
Camberley Rubber,@CamRubber,2021-02-23T15:06:02.000Z,Large-scale  3D printing  used for latest Airbus satellites... http:// #LatestNews #UKMfg #GBMfg #Aerospace,0,0,0,0
The Tech Journal,@TheTechJournal,2021-02-23T12:30:57.000Z,Previously in our blog: The Micro The First Truly Consumer  3D Printer https:// o-consumer-3d-printer.xhtml …,0,0,0,0
Dominic,@CodebyDominic,2021-02-23T17:26:23.000Z,3D printed  arc star. One of my first prints but getting better everytime  #apexlegends,0,0,0,0
Holy Cross CHS,@holycrosschorl,2021-02-23T15:40:13.000Z,"Manufacturing has developed rapidly in the last two decades. Who'd have thought we'd be able to  3D print  body parts.

""We're using 3D printers to create human body parts"" -  https:// q=making+prosthetic+body+parts&&view=detail&mid=F1D58B964ED5E3ED6990F1D58B964ED5E3ED6990&&FORM=VRDGAR&ru=%2Fvideos%2Fsearch%3Fq%3Dmaking%2Bprosthetic%2Bbody%2Bparts%26FORM%3DHDRSC4 …",0,0,0,0
PrintLab,@weareprintlab,2021-02-23T11:50:42.000Z,"3D printing  tip! Here’s what happens when you  3D print  PLA with high nozzle temperatures. For a good finish, experiment with the lowest nozzle temperature that doesn’t cause underextrusion :D",0,5,4,0
Lars Christensen,@Lars_cadcam,2021-02-23T14:22:53.000Z,30 BEST  3D Printer  Software in 2021  #AutodeskEmployee https://,0,0,0,0
Industry Today,@IndustryToday,2021-02-23T12:16:27.000Z,"3D Printing  Powder Market Competitive Landscape, Trends, Opportunities by 2027 with Top Manufacturers like Sandvik , Arcam , Erasteel, Arkema, GKN http://",0,0,0,0
Gadgeticus Store,@gadgeticusstore,2021-02-23T13:31:49.000Z,#hashtag3 3D Printer  ABS Filament Sets,0,0,0,0
Beazus,@Beazus,2021-02-23T13:35:16.000Z,Pretty cool use of  3D printing ...,0,0,0,0
