Author Name,Author ID,Date,Post Text,Replies,Likes,Reshares,Views
Faraiya Art,@DragonWings83,2021-03-18T06:28:50.000Z,"WIP Geralt meditating,  3D print  file by spartak #modelkit #garagekit #resin #modellbau #scalemodel #figurecollector #ガレージキット #modelpainting #miniaturepainting #gkpainting #figurine #TheWitcher #3Dprint",0,4,0,0
Wevolver,@WevolverApp,2021-03-17T18:40:03.000Z,"Takumi Yamamoto was six when it happened, and the moment charted the course of his professional career — a career that includes a famous race car and a soon-to-be-revealed tribute car to David Bowie, created with the help of a large  3D printer https:// rst-ever-3d-printed-concept-car-to-honor-david-bowie-s-legacy … @Massivit3d",0,3,1,0
3D Print .com,@3DPrintBoard,2021-03-17T18:12:56.000Z,"Visit the EOS Zone on the  http://  website to access the latest  #3Dprinting  news from @EOSNorthAmerica, in addition to on-demand webinars, whitepapers, case studies, customer success videos, and more. https://",0,0,0,0
3DMeltdown - 3D Printing discord,@3DMeltdown,2021-03-18T07:00:06.000Z,"Shared by robin_cosplay_life  #3dprint  on our discord:
Join us:  http:// This is a Datsun 240z with Jack stands

Interested in  #3Dprinting #3DPrinter ? join us on our discord server.",0,2,0,0
Make: Projects,@MakeProjects_,2021-03-18T00:13:01.000Z,"Never too early to start working on Halloween projects. Jesse from AlphaGeek created a touchless candy dispenser w/ a jump scare mechanism thanks to a Raspberry Pi,  3D printing , & an air compressor.

Enter your own Rasp Pi project to our contest by 3/21. https://",0,3,1,0
AshMRichter,@AshMRichter,2021-03-18T05:36:17.000Z,"""The task of rebuilding it equivalent to solving a battered 3D puzzle that has most of its pieces missing."" 

My kind of puzzle  Made a melty 3D model of it from a casual museum pass, hope they will opensource their pieces for  3D printing  fun.  https:// ar/12/scientists-move-closer-to-solving-mystery-of-antikythera-mechanism …",0,0,0,0
Sarah Jones,@i_heart_science,2021-03-18T03:44:34.000Z,Year 7 STEAM students designing and  3D printing  Mars Habitats  #Mars #3Dprinting #STEAM #Science #Technology #Engineering #Art #Maths #Innovation #Design #Creativity #Ideas #Planning #Constructing #Building #Evaluate #Refinement #Teamwork #ProblemSolving,0,3,2,0
Leo Di Camillo,@leoneldicamillo,2021-03-18T01:08:00.000Z,Jello  3D Printer https://,0,0,0,0
3d scanner,@reprap_sara,2021-03-17T21:03:00.000Z,"HE3D K280 Delta DIY  3D Printer  kit with Auto-level,Large Printing Size 280X60...  https:// ref=cm_sw_r_tw_dp_x_5EktFbT32SDS8 …  来自  @amazon",0,0,0,0
苺千（いちか）,@ichika_sen,2021-03-18T01:03:55.000Z,おめでとうございます フレッシュ フレッシュ 3D PRINT  CONTEST 06に向かって準備しなくちゃ https://,0,0,0,0
夕凪㌠,@Yuunagi_DAMEYA,2021-03-18T06:00:55.000Z,1/144 scale model manufactured with  3D printer  is on sale. https:// #144scale #3dprinting,0,4,1,0
y!!@warframe and downloading videos 4ever,@Shrimpy_shift11,2021-03-17T18:37:23.000Z,"Like if you aren't sure what everyone's talking about when they bring up things like ""model minority"" or any other terms during these next couple of days, let me know. It's there. I've felt it. I can explain it explicitly to you. My entire life has been affected by it.",0,2,0,0
"AVS 3D Printing, Laser Cutting & Engraving",@AVS3DPrint,2021-03-18T01:05:15.000Z,Epic Miniatures Pirate Striker  https://  via  @EtsySocial  TTRPG Rpg  #RPG #DND,0,0,0,0
3d Printing and Painting 3DHP,@JERRY_3DHP,2021-03-18T01:05:28.000Z,"Test Printing Spawn for   Dennis Xawery Moore on my Phrozen Mighty 4k at 100% scale.These parts r hollowed other than Hands.More pics to come as I get them done. Awesome Work here. http:// 3D Printing  Models STL
Checkout his Patreon here  https:// ...",0,2,0,0
Lisa,@LindaSe57093199,2021-03-17T20:59:00.000Z,19.0US $ |57 step motor /57BYGH56/3A 1.26N large torque / step drive / engraving machine/ 3D printer  accessory|...  https:// 27.html?channel=twinner …,0,0,0,0
Go Travel Blogger,@ltravel395,2021-03-18T07:43:41.000Z,AAHIL Compatible for Redmi Note 7 Pro Pink Pattern Mobile Phone Back Cover Case Stylish Designer  3D Printed  Hard Plastic Latest Accessory Multicolor Gift for Girls & Boys  https:// le-for-redmi-note-7-pro-pink-pattern-mobile-phone-back-cover-case-stylish-designer-3d-printed-hard-plastic-latest-accessory-multicolor-gift-for-girls-boys/ …,0,0,0,0
3D Printing News,@3DPrintGirl,2021-03-17T18:12:38.000Z,"Visit the EOS Zone on the  http://  website to access the latest  #3Dprinting  news from @EOSNorthAmerica, in addition to on-demand webinars, whitepapers, case studies, customer success videos, and more. https://",0,0,0,0
James Bricknell,@keridel,2021-03-17T18:08:42.000Z,"Beautiful snake from  @loubie_3D  printed on the  @Elegoo_Official  Neptune 2 with  @MatterHackers  build PLA

He's a real beauty",6,26,4,0
Donal Romano,@Lord_D_Romano,2021-03-17T20:03:47.000Z,Liked on YouTube: What  3D printing  material to use for object inside a car? Temperature test  https:// YbsjI …,0,0,0,0
President Crime,@SalvadorViescaV,2021-03-18T04:32:51.000Z,"Yo-Kai Watch/Testing  3D-printed  *NEW* 3DS XL stand, and try out a couple of ebay finds.",0,0,0,0
felipenobrega,@nobrega2019,2021-03-17T22:56:59.000Z,Brand Fest | ANYCUBIC - Save up to 65% off a  3D printer  -  https:// 2bfa81643e1c048c/172275/263726/subaccount …,0,0,0,0
PeteNicholls_,@petenicholls_,2021-03-18T01:26:00.000Z,"I am  3D printing  my own  #Doritos ! OK, not really. Can you guess what I am  3D printing ? This one is a toughie!  #iam3dprinting ... but WHAT?  #3DPrinting #Ender3Pro #Ender3",0,2,0,0
Julie Allen,@Julisbiztech,2021-03-17T19:04:33.000Z,This kid-friendly  3D printer  is the toy you wished you had growing up  http://,0,0,0,0
JZKitty Gaming,@JZKitty,2021-03-18T07:00:14.000Z,"The Outbreak in Call of Duty: Warzone is headed to the hospital next https:// Don't forget to visit, like and share for the best  #GamingNews  and  #TechnologyNews !",0,0,0,0
Hacker News 50,@betterhn50,2021-03-18T01:26:54.000Z,Jello  3D Printer https:// inter …  ( https:// 65 … ),0,0,0,0
Optimised 3D Engineering,@Optimised3D,2021-03-17T22:46:41.000Z,"We now have a large build volume, dual extrusion  3D printer  with a wide range of materials, ideal for rapid prototyping, large models, designs that require geometrical freedom, creating on-demand parts, and manufacturing tools. #optimised3d #additivemanufacturing #3dprinting",0,0,0,0
Internet of Things,@TheIoT,2021-03-17T22:03:30.000Z,"ExOne, Ford Look to Advance  3D Printing  for Automotive  https:// #IoT",0,0,0,0
Q-pwr88 (Mick),@Pwr88Q,2021-03-18T05:15:07.000Z,Playing around with the  3D printer .. sadly my wife didn't get the reference :-(  @HamillHimself  #StarWars,0,0,0,0
B Skill D,@magikmake3D,2021-03-18T01:30:50.000Z,Celebrate this  #StPatricksDay  with a cool  3D print  lesson #irish #ireland #stpattysday #green #luckoftheirish #shamrock #stpaddysday #kissmeimirish #stpatrick #saintpatricksday #lucky #stpatricksdayoutfit,0,0,0,0
irma vape,@bophadesnauts,2021-03-17T23:32:09.000Z,has non-petroleum-based  3d printing  feedstock been figured out yet,1,1,0,0
Dale,@NatoshaWei,2021-03-17T20:04:00.000Z,11.8US $ | 3D printer  parts B3 Radiator Remote&Short range Mini Heat Sink All Metal Stainless steel 1.75mm Fila...  https:// 34.html?channel=twinner …,0,0,0,0
Dale,@NatoshaWei,2021-03-17T21:04:00.000Z,25.0US $ | 3D printer  accessories 2040 aluminum profile y synchronous belt motor base motor bracket tronxy v sl...  https:// 9200.html?channel=twinner …,0,0,0,0
wendy hutton,@wghutton,2021-03-17T19:02:03.000Z,A Great  3D Printing  Website with a great  #giveaway  Check it out don't miss the how-to sections! //3dprinterchat.com/win-a- 3d-printer /,0,0,0,0
あも,@defamo,2021-03-18T04:23:45.000Z,3D PRINT  CONTEST 05 のタテが届きました,0,6,0,0
Neil Howard (Mastodon - @neilhoward@mas.to ),@NeilAlderney,2021-03-17T20:37:12.000Z,A Pinhole shot looking across the Common towards the historic houses at Braye on Alderney. Taken with my  3d printed  camera with no lens on Kodak ColorPlus200 film and processed at home. #alderney #pinhole #film #lovefilm #3dprinted #braye #history #landscape,0,9,3,0
Michael Petch,@MichaellPetch,2021-03-17T19:13:34.000Z,ROBOZE deploys  3D printing  to bolster cosmic storm-monitoring CubeSat  #3DPrinting https:// ploys-3d-printing-to-bolster-cosmic-storm-monitoring-cubesat-186507/?feed_id=817&_unique_id=605254dd9d40f …,0,0,0,0
creatorbots,@creatorbots,2021-03-18T02:01:19.000Z,Unlimited opportunities to create with our  3D Printed  parts for your robot. Get yours and start creating now at  http:// #STEM #STEMcareers #edtech #edtechteachers #STEAM #teaching #TEACHers #3Dprinting #3D #code #WomensHistoryMonth #WomenInSTEM #womenintech,0,4,1,0
"AVS 3D Printing, Laser Cutting & Engraving",@AVS3DPrint,2021-03-17T21:50:15.000Z,2ND Dynasty Scout Ship  https://  via  @EtsySocial  TTRPG Rpg  #RPG #DND,0,0,0,0
Kingston Frontenac Public Library,@KFPL,2021-03-17T22:00:59.000Z,"Inspire your creative side! Discover resources to support hobbies, passions and new skills–from  3D printing  to the culinary arts. Subscribe to our Create newsletter - sent out quarterly!  http:// #MakersGonnaMake #creativity #ygk #ygklove #inFrontenac",0,0,0,0
JEWAX 3D PRINTING,@jewax3d,2021-03-18T04:31:03.000Z,"When I decided to get a great manicure!
Когда решила сделать отличный маникюр! #3dпечатьназаказ #3дпечать #3dпечать #3дпринтер #макеты #макетирование #моделизм #конструирование #миниатюры #3дпечатьназаказ #ямоделист #сборныемодели #моделист #миниатюра #фигурка #диорама #миниарт",0,0,0,0
Nitin Patil,@nittinpatil,2021-03-18T09:14:35.000Z,"Audi Leverages EOS M 400 System for  3D Printing http:// -eos-m-400-system-for-3d-printing/#.YFMZmqxXqgI.twitter …  

@EOSGmbH @EOSNorthAmerica  #EOSM400 @AudiOfficial #Metal3DPrinting #AdditiveManufacturing #CAM",0,0,0,0
❂april❂ HUSH Darah Muda,@SMilloow,2021-03-18T06:35:51.000Z,Golcha's contents let my anger away. They heal me,0,0,0,0
3D Printing Fans,@3DPrintingFans,2021-03-17T18:07:09.000Z,"Additive Manufacturing  Strategies, the  #3Dprinting  Industry Intelligence Summit powered by  http://  and @SmarTechPublish, is returning in February of 2022! Subscribe to our newsletter to get all of the latest event updates! https://",0,0,0,0
Zoophilist TV,@ZoophilistTv,2021-03-17T18:19:55.000Z,"""Look at spiders. They use about eight different properties of silk for different functions. The spider is like a multi-material  3D printer ."" -Neri Oxman

Subscribe to Zoophilist TV!!! https:// TATivqXf5ru9wcslUw … #ZoophilistTV #Tarantulas #Respect",0,5,2,0
Macky/BLADERUNNER researche,@macky_2019,2021-03-18T05:52:53.000Z,"これは使える。

Resin  3D Printer  Trick - FEP Cleaning  #shorts https:// @YouTube より",0,0,0,0
poopington,@vonpeepster,2021-03-18T00:28:29.000Z,I really want to buy a  3d printer  but 1. I have no room 2. I'd print so much star wars stuff that I don't have room for and 3. I'm currently researching 3d printers anyway,7,22,0,0
SME Media,@SMEMediaNews,2021-03-17T18:52:02.000Z,"ExOne, Ford look to advance  3D printing  for automotive  https:// #mfg #autos #3D  printing",0,0,0,0
Franc Coenen,@madeineuropenu,2021-03-18T07:34:45.000Z,Dit keer in de e-mail nieuwsbrief: Demcon wil verdubbelen | De Valk  3D print  precisie chuck | Nieuwe Doosan machine voor matrijzenindustrie | En Industrie 4.0 vraagt andere stijl van leidinggeven -  https:// /bereik-de-hightech-cnc-en-am-industrie-met-made-in-europe-2683152 …,0,0,0,0
Joel Telling - 3D Printing Nerd,@joeltelling,2021-03-18T01:42:38.000Z,Hey  @TeamYouTube  why am I unable to schedule a stream?,7,28,0,0
Stratasys,@Stratasys,2021-03-17T19:58:30.000Z,"Join  @makerbot  March 31st for the Shape the Future,  3D Printing  in Education Virtual Summit! This one day event features educators and  #3Dprinting  experts sharing their experience utilizing  3D printing  to translate STEM  #education  into real world results.  http://",0,3,0,0
#3dprinthelp,@devmobnow,2021-03-18T02:35:25.000Z,"This might be my last  @adskFusion360  model. Love the program but it's just a matter of time before it's to expensive for the  3d Printer  Maker. Unless of course, you sell a product. I don't these are all just prints for me. Here I come  @onshapecad .",0,2,0,0
Berlin Additive Manufacturing Symposium,@BAMsymposium,2021-03-18T09:16:51.000Z,"We're excited to announce the 1st edition of the  #BAMsymposium , hosted by  @srhberlin  - the conference will shine a light on the latest developments in  #AdditiveManufacturing  

Find out more info and register for the event here:  https:// #3Dprinting #Berlin",0,2,0,0
"Simon, the Hunter - Give out the good vibes!",@EAllwatcher,2021-03-17T22:05:37.000Z,"Greetings everyone on this fine day!

The  3d printer  has been slowly printing stuff over the past week or two, so time to put them together in a mock battle between 3 PC's and 5 Skeletons!

Let the battle commence! #ttrpg #3dprinted #rpgminiatures #dnd #TTRPGSolidarity",1,1,0,0
Rumbl3b33,@rumbl3b33,2021-03-18T01:10:20.000Z,Whelp... I just myself bought a  3D printer !,0,0,0,0
Engineering Daily,@EngineersDay,2021-03-18T07:21:59.000Z,"[Job] Sr Material Testing Engineer,  Additive Manufacturing  | Company: LEGO | Location: Billund D83  Denmark |  #Billund #Chemical #Engineering #Jobs  | More info at   https://",0,0,0,0
Leo Silva,@LeoGamOficial,2021-03-18T07:07:31.000Z,Green Day  Anycubic® photon mono 2k high speed resin  3d printer  130x80x165mm with 2k lcd screen /   Loja:  #banggood  Preço: R$ 1759.65  (Já Incluso o Frete!)  Parcele em até 12x  Link:  https:// Lojas parceiras:  https://,0,0,0,0
U.S. Army,@USArmy,2021-03-17T22:02:51.000Z,"The  #USArmy  supply chain of the future will incorporate  additive manufacturing  to increase readiness. 

Using this technology at the point of need will reduce costs and increase unit mission capability.

Learn more  https:// #Adapt2Win",11,212,46,0
Enderz,@Enderzworld,2021-03-18T00:19:10.000Z,Time to give out some  3D Printed  Marbles! Come win a Grand Prix and win a marble (shipped worldwide)!  https:// #marblesonstream #MSLA #3Dprinting #grandprix #LetsGo #GetInvolved,0,10,0,0
B⃣ i⃣ g⃣ L⃣ e⃣ o⃣,@Leyoncee_bae,2021-03-18T04:56:03.000Z,Stop posting your keys before somebody  3d print  them shits and rob you ,0,0,3,0
eSUN 3D Printing,@esun3dfilament,2021-03-18T09:07:16.000Z,Can you tell it's Real Wood or  #3DPrinted ? ,0,4,1,0
Reno SRA,@reno_sra,2021-03-17T19:10:29.000Z,"Nevada has proposed legislation that would make  3d printed  firearms or other unserialized, DIY firearms a felony. This would severely hamper the ability of poor and previously underrepresented groups to learn about gunsmithing. We ask your support in opposing this bill",2,11,5,0
Design World,@DesignWorld,2021-03-17T21:39:01.000Z,"3D printing  technologies have evolved significantly over recent years, with much of the research effort placed in the materials science field.  Read about how advanced manufacturing processes are being explored:",0,0,0,0
James Gingerich #B2B #Technology #Influencer,@jamesvgingerich,2021-03-17T18:35:00.000Z,Agile certainty: How Additive  #Manufacturing  helps navigate an unpredictable world. (The Manufacturer)   https://,0,0,0,0
@CommieGIR@infosec.exchange,@CommieGIR,2021-03-17T22:41:10.000Z,"I love living in the age where I can quickly draft up a component and then just print it on a  3D printer .

Its like magic.",1,3,0,0
Fane,@Catfolk_Cleric,2021-03-17T20:01:17.000Z,"I just wanted to share some awesome work that @EstebanBarrioz is doing.

He is taking commissions for 3D bust models for $80

And I will  3D print , paint and ship said models for an additional  $80

Work in Progress made for  @FollowTheCharms  

Retweets are appreciated",0,0,0,0
PrintParts,@PrintParts,2021-03-17T19:45:19.000Z,"Who remembers the first time they saw a  3D Printer  in action and had no idea what was going on? Sameer Pandya shares how he got hooked on  3D printing  and joined the Print Parts Inc. Team. 

Learn more about PrintParts:  https://",0,0,0,0
Tuan TRANPHAM,@ttranpham,2021-03-17T20:25:00.000Z,Renishaw Receive Funding For Large Scale  Additive Manufacturing  •  https://  •  #3Dprinting  • tuan@tranpham.com •  #additivemanufacturing https://,0,0,0,0
Adams & Adams,@AdamsAdamslaw,2021-03-18T08:31:00.000Z,"3D printing  technology has been in existence for several decades, but its recent rapid growth makes it clear that this technology presents a challenge to Intellectual Property laws and rights holders, and to traditional manufacturing practices. Read here:  https://",0,0,0,0
❂april❂ HUSH Darah Muda,@SMilloow,2021-03-18T00:05:24.000Z,"I thought i misheard when PD said 20/10, so i clicked on autosub, and really said 20/10 ",0,0,0,0
OJ,@ojenabosi,2021-03-18T01:29:01.000Z,Can you make a gun with a  3D printer ?,1,0,0,0
Not A Games Dev Ollie,@Reksaurian,2021-03-18T03:25:49.000Z,Unknown Post Content,0,0,0,0
Dave Gaylord,@DGaylord3D,2021-03-18T06:15:35.000Z,"I'm Launching a Podcast!

On episode #1 I talk shop about PLA with the expert behind ALL the  3D printing  PLA magic - @DSoyboy70  of  @natureworks  Did you know NatureWorks makes almost all the PLA in the world?

I can't wait for you to listen
Please subscribe https://",6,48,15,0
Evan Kirstel #B2B #TechFluencer,@EvanKirstel,2021-03-17T21:20:02.000Z,New Method for Making  3D Printed  Organs Is 50 Times Faster  https://,2,7,4,0
Mitchell and Son Additive Manufacturing LTD,@MitchellandSon1,2021-03-17T19:16:33.000Z,#ClassicElectricVehicles #ElectricClassic #Ev #Porsche356  Watts Electric Coupe Takes Inspiration From Porsche’s 356  http:// http://,0,0,0,0
Peter Toth,@compulog,2021-03-18T02:55:59.000Z,I still can't get over how amazing this is!  3D printing  in space should become much easier.,0,0,0,0
8BitofFun-On Vacation,@8BitoffunX,2021-03-17T19:29:21.000Z,Karin get the beans,1,3,0,0
marsgizmo,@marsgizmo,2021-03-17T23:43:44.000Z,"3D Printed  Among Us

get the FREE STL files from here:  https:// Hosted on  @Thangs3D #Sponsored",0,6,0,0
Westmont Public Library Teens,@WPLteen,2021-03-17T20:00:18.000Z,"TONIGHT! There is still space to register for our WPL Teen:  3D Printing  Cookie Cutter program. Register with an email in our event calendar to receive a Zoom link. 

Sign up here:  http://",0,0,0,0
KJD_3D_Printer (Real Life Bot),@Kjd3d,2021-03-17T18:56:47.000Z,KJD3D :   Printing is at 80%,0,0,0,0
回遊魚,@protoenthu,2021-03-18T05:42:39.000Z,MMU2Sで曲がってほしいところだけTPU、その他は硬いPETGとかでプリントすれば面白そう。スパイラル単層でうまくTPUとPETGが接合するかはわかりませんが……,0,0,0,0
The 3D printing belgian #FreeThe3DPGeneral,@3DPBelgian,2021-03-17T22:49:58.000Z,One day il own a  @Raise3D  printer. I swear on it,0,0,0,0
CJ,@CJSNOWY1,2021-03-18T00:10:00.000Z,"So my past streams have been very flat lately and I like to try out new things that i enjoy and hopefully my viewers enjoy. So I would love your feedback. Would you guys like to watch me do more craft builds. ie metal sheet models,  3d printing  models and D&D terrain builds?",1,1,0,0
Unicun,@UnicunShop,2021-03-17T20:39:50.000Z,3D Printed  Rocket Lamp https:// nted-rocket-lamp/ … #UnicunShop,0,0,0,0
Vega Deftwing,@Vega_DW,2021-03-17T23:23:09.000Z,"3D printer  is up and running, this was just the test print on the provided SD card using the provided filament. Looks like it might need a bit of tuning, but overall looks good",2,3,0,0
The Center for Career & Professional Success,@HUCCPS1867,2021-03-18T06:11:09.000Z,HCC Employment: Postdoctoral Appointee -  Additive Manufacturing  for Microelectronic Systems at Sandia National Laboratories  https:// hare_preview …,0,0,0,0
Anthony,@Lurfleman,2021-03-17T23:13:04.000Z,"Back on my bullshit

after dusting off my  3D printer  I wanted to mess around with making a model I could print, paint, etc. So here we are.",6,19,2,0
MisterMaker,@MisterMakerNL_,2021-03-17T23:11:24.000Z,When you get a  3D printer .,0,4,0,0
President Crime,@SalvadorViescaV,2021-03-18T02:09:45.000Z,excited to try out this  3D Printed  *New* 3DS XL stand designed by  @The_Craft_Dude  on thingiverse ( https:// ). Then I'll be running a second test of a macguyver'd 3DS Stream of a couple new games I just got from Ebay. Streaming System Shock Tonight after it gets dark,1,1,0,0
Vampire Step-Dad,@VampireStepDad,2021-03-17T20:02:21.000Z,"I made a sculpture! In truth, I recreated one I'd seen before. When I first saw the photo, I fell in love, but I couldn't find ANY info on it. So I decided to try my hand at modeling it and  3D printing  it. It was quite an adventure! I'm actually pretty impressed how close I got.",4,30,4,0
CustomWeddingDecorations.com,@Positiv3Prints,2021-03-18T07:00:22.000Z,Kanye and Bill Belichick are killing the game right now. Haters gonna hate,0,0,0,0
3d4printers,@3d4printers,2021-03-17T23:29:02.000Z,ROBOZE deploys  3D printing  to bolster cosmic storm-monitoring CubeSat  http://,0,0,0,0
3D Printing Canada,@3dprintingcan,2021-03-17T19:00:54.000Z,Additive Industries aerospace client to expand installed base of MetalFAB1  additive manufacturing  systems  https://,0,0,0,0
Banggood Affiliate Official,@banggoodaff,2021-03-18T02:34:16.000Z,Higher Commission Categories For you Recommendation:  https:// Smartphones  https:// Earphones  https:// 3D Printer https:// Multi-Rotor Parts  https:// Keyboards & Mouse  https:// https://,0,0,0,0
Leslie Langnau,@DW_3DPrinting,2021-03-17T19:49:00.000Z,New software improves accuracy of factories' mass-produced  3D-printed  parts.  https:// 021-03/uoig-nsi031621.php … #3dprinting #AdditiveManufacturing,0,0,0,0
Artillery 3D,@3DArtillery,2021-03-18T03:08:22.000Z,"Artillery3D HORNET & Peet's Coffee - FIRST PRINTS & PRIZES!
Live stream by   3D Printing  Nerd. https:// 72ULU … #artilleryhornet #Artillery3D #3dprinting #3dprinter",0,0,0,0
Farhad Noorzay,@farhadnoorzay,2021-03-17T18:35:21.000Z,If your kids are interested in learning about  3D printing  check out this class by @heydeepaks which includes assembling your own  3D printer ! Two separate age groups from 6-16yrs  https://,0,3,2,0
Dragoslav Neskovic,@dneskovic,2021-03-18T02:30:00.000Z,"Congratulations Magellan Aerospace Limited team, this is an excellent example of the company taking the lead and investing in the new technologies. I am proud of being apart of the team implementing ExOne  3D printing , robotics and the digital radiography.… https://",0,0,0,0
re-how.net,@rehownet2,2021-03-18T03:12:02.000Z,3D Printer  SK Honpo Pre-orders will start soon! Information on SK Honpo’s first crowdfunding project  https://,0,0,0,0
Not A Games Dev Ollie,@Reksaurian,2021-03-17T21:54:01.000Z,"Note to self: general stats, specific stats, skills granted based on actions taken.",0,0,0,0
Psych0h3ad-P3D,@YuTR0N,2021-03-18T03:55:01.000Z,Professional  3D printer  3DPmac  3D printing  Robot Arm  3d PRINTER  Can use any platform  https:// ity-3d-printer-cr-10-high-printing-precision …,0,0,0,0
Apes apeslion.bsky.social,@apeslion,2021-03-18T00:13:56.000Z,I wish my  3D printer  was working. Would make a jungle gum for my danger noodles,2,16,0,0
Peter Keates,@peterkeates,2021-03-18T03:44:57.000Z,Continuum:  3D-Printing  the Future of Fashion  #Fashion #3D https:// urce=ReviveOldPost&utm_medium=social&utm_campaign=ReviveOldPost …,0,0,0,0
Rajesh Uppal,@idstch,2021-03-18T03:39:05.000Z,3D Printing  or  additive manufacturing  revolutionising aerospace propulsion by  production of motors & Rockets  to  scramjet engines -  https:// 3d-printing-revolutionising-aerospace-propulsion-prototyping-production-motors-complete-rocket-engines/ …,0,0,0,0
3D Printing Deals,@3dpdeals,2021-03-18T00:46:23.000Z,"there is also an Ender and CR series upgrade kit that just went on lightning deal as well, 5.5hrs left

$18, includes  @captubes  bowden tubing, bed springs, aluminum bed-leveling knobs, and tubing couplers at afflink:  https://",0,2,1,0
ForceBiomedical,@forcebiomedical,2021-03-18T08:06:54.000Z,"3D GRAPHY WORKSHOP 2021 SERIES  https:// 3D Printing  Solutions for Orthotics & Prosthetics

A Knowledge, networking & Business forum on  3D printing  which is benefiting the Medical field of Orthotics & Prosthetics. The event is Organised b… https://",0,0,0,0
anna,@a_he3d,2021-03-17T21:47:00.000Z,9.9US $ | 3D printer  accessories MK8 extruder parts for  3d printer  not including the motor| 3D Printer  Parts & A...  https:// 5685562.html?channel=twinner …,0,0,0,0
Will Walker,@walkerwill,2021-03-17T20:16:35.000Z,British PM examines  3D printed  recreation of the 14 pounds he lost by quitting late night cheese snacking.  https://,0,2,0,0
Mᴀᴛᴛʜɪᴀs Rᴏᴢᴇɴsᴢᴛᴏᴋ,@SpootSuitRiot,2021-03-18T01:31:24.000Z,Buy a  3D printer  and several parts kits with my tax money.,0,0,0,0
anna,@a_he3d,2021-03-17T20:42:00.000Z,101.12US $ 21% OFF|3D scanner Z17OR handheld body face object scan for  3d printer  with software free shipping|...  https:// 1639.html?channel=twinner …,0,0,0,0
John J. Rainone (He/Him),@mgccprez,2021-03-18T01:04:06.000Z,Higher ed ramps up to fill gaps in  3D printing  industry  https:// her-ed-ramps-up-to-fill-gaps-in-3d-printing-industry/ … #comm_college,0,0,0,0
Singularity,@singularityu,2021-03-17T22:00:21.000Z,"Austin, Texas is stepping into the future with  3D printed  homes on the market ",0,16,7,0
