Author Name,Author ID,Date,Post Text,Replies,Likes,Reshares,Views
nohandlebars,@jerome_araullo,2013-05-05T05:50:49.000Z,This Is The World's First Entirely  3D-Printed  Gun http:// nberg/2013/05/03/this-is-the-worlds-first-entirely-3d-printed-gun-photos …,0,0,0,0
Jean-loup Karst,@JeanloupKarst,2013-05-05T11:32:07.000Z,Will a Napster for  3D printing  emerge?  #Techcrunch http:// printing-piracy-physibles/?utm_source=feedburner&utm_medium=email&utm_campaign=Feed%3A+francaistechcrunch+%28TechCrunch+en+Francais%29 …,0,0,0,0
Christian Fictoor,@chrisfictoor,2013-05-05T07:44:07.000Z,#3DPRINTING #NAPSTER  -- Napster For  #Pirated 3D Printing #Templates ?  http:// printing-piracy-physibles/ …  via  @TechCrunch,0,0,0,0
Rory Harper,@harper_rory,2013-05-05T07:27:58.000Z,This Is The World's First Entirely  3D-Printed  Gun (Photos) - Forbes  http://,0,0,0,0
INSShawnee,@INSShawnee,2013-05-04T23:15:53.000Z,"3D Printed  Firearm: Despite Technical Breakthrough, Isn't Really a Liberator but ... - Design & Trend: Design ...  http://",0,0,0,0
Blockmine3rz,@bmine3rz,2013-05-04T23:50:30.000Z,#creative  Printing a spool holder for more  3D printing . Designed in sketchup.  #3dprinte ...  http:// http://,0,0,0,0
Douglas Muth (Giza) MFF (Find me on,@dmuth,2013-05-05T12:02:04.000Z,The World's First Entirely  3D-Printed  Gun:  http://,1,1,1,0
sóempresas,@soempresass,2013-05-04T23:51:31.000Z,"Meet Steve Israel, The Congressman Who Wants To Ban  3D-Printed  Guns (Q&A): Few would have predicted, six month...  http://",0,0,0,0
Forbes Tech,@ForbesTech,2013-05-04T23:09:05.000Z,This is the world's first entirely  3D-printed  gun:  http://,4,6,15,0
Austin Kastelic,@AustinKastelic,2013-05-04T23:16:05.000Z,"If they could clone a human heart using a  3d printer , would you eat one?",0,0,0,0
UK politics & nature,@Roehamster,2013-05-05T08:00:50.000Z,"Looks like a cheap toy, but this Is The World's First Entirely  3D-Printed  Gun (Photos):  http://",0,0,0,0
Fabrizio Costa,@xfcosta,2013-05-05T10:53:16.000Z,Stranger Visions: DNA Collected from Found Objects Synthesized to Create  3D Printed  Portraits  http://,0,0,0,0
Victor García Studio,@Visnar8,2013-05-05T08:12:10.000Z,"""Scientists  3D-print  bionic ear that hears beyond human range"" good read  http:// entists-3d-print-bionic-ear-hears-beyond-human-range/ …",0,0,0,0
Ron Milford,@ron_milford,2013-05-04T23:47:43.000Z,Defense Distributed reveals the world's first fully  3D-printed  gun: ... Liberator” (Photo credit: Forbes). Thi...  http://,0,0,0,0
3DPrintPlan,@3DPrintPlan,2013-05-05T10:47:49.000Z,"Say Hello to the Liberator, Supposedly the Word’s First Entirely  3D-Printed  Gun:  3D printing  has come a long w...  http://",0,0,0,0
Andreas Olofsson,@zeroasic,2013-05-05T11:41:42.000Z,"Took the kids to ""Einstein's workshop"". Great place! When will  3D printing  be offered at most public schools?  http://",1,1,1,0
steffenmeier,@steffenmeier,2013-05-05T09:13:05.000Z,RT @holgervolland: building up:  3D printing  in china on the rise. first maker fairs established.  http:// nd-technology/21576626-additive-manufacturing-growing-apace-china-new-brick-great-wall?frsc=dg%7Ca&fsrc=scn/tw_app_ipad …,0,0,0,0
vassdim,@vassdim,2013-05-04T23:37:48.000Z,Stranger Visions: DNA Collected from Found Objects Synthesized to Create  3D Printed  Portraits,0,0,0,0
Jaroslav Kalvoda,@JaroslavKalvoda,2013-05-05T06:49:30.000Z,"Staples started selling Cube  3D Printer  from 3D Systems in its stores for $1,299. Will you buy?  http://",0,0,0,0
cavalleto,@cavalleto,2013-05-05T11:03:06.000Z,Defense Distributed claims to have created the world's first fully  3D-printed  gun /by  @carlfranzen http://,0,0,0,0
j.s.lamb,@ObjectsOnDemand,2013-05-05T11:34:40.000Z,NEWS & VIEWS: See what the Twitterverse is saying about  3D Printing  @  http:// d/1355758180 …   or visit our ARCHIVE @  https:// d/ …,0,0,0,0
al,@shuraport,2013-05-04T23:51:04.000Z,"Meet Steve Israel, The Congressman Who Wants To Ban  3D-Printed  Guns (Q&A): Few would have predicted, six month...  http://",0,0,0,0
Kazuo Kadota,@robotakun,2013-05-05T10:28:22.000Z,Meet the Most Affordable  3D Printer  Yet: The $200 MakiBox  http:// affordable-3d-printer-yet-the-makibox/ … @hackthingsblog さんから,0,0,0,0
Ruud Alaerds,@Ruud_Alaerds,2013-05-05T07:28:33.000Z,"We zijn begonnen aan de ""mens van 6 miljoen"" ;-) Onderzoekers maken bionisch oor met  3d-printer http:// #tweakers #classic",0,0,0,0
Marta Purdy,@marta_nelson,2013-05-05T12:38:05.000Z,Many of us don't yet grasp the impact of  3D printing : The World's First Entirely  3D-Printed  Gun (Photos) - Forbes  http://,0,0,0,0
Author Elf,@AuthorElf,2013-05-05T06:45:25.000Z,Library Raising Funds for Hulk Statue &  3D Printer  -  http://,0,0,0,0
Jon Yoffie,@JYoffie,2013-05-04T23:42:14.000Z,$1300 for a  3D printer  from  #Staples !  http://  The world is changing fast!!  http://,0,0,0,0
Samuel Carver,@TheAccidentMan9,2013-05-05T07:28:53.000Z,But  3d printing  is expensive. Wait a moment.,0,0,0,0
Jah-Red,@iScoopHard,2013-05-04T22:23:54.000Z,“ @YourAnonNews : The World's First Entirely  3D Printed  Gun:  http:// ” This is kinda scary to think about,0,0,0,0
Ben moge777@bsky.social,@moge777,2013-05-05T08:25:30.000Z,Het wachten is nu op een  3D print  van La Paay uit 1975. Jet Bussemaker verstrekt de subsidie.   #jinek #wnl,0,0,0,0
3DPrint_news,@3dprint_news,2013-05-05T05:49:53.000Z,RT  @faidhan 3D printing  kakaaa... Takjub sendiri sama teknologi.... [pic] —  http://,0,0,0,0
THE LABRATZ,@LABRATZBEATS,2013-05-05T08:12:30.000Z,#Forbes  World's first  3D-printed  handgun is here; Congressman fights to extend ban on ...: Forbes r...  http:// #WORLDWIDE,0,0,0,0
Worldwide Partners,@wwpartners,2013-05-05T12:39:21.000Z,What will happen to the Chinese economy &transportation when every household has a  3d printer  and can print it all at home?  #wpiwm13,0,0,0,0
financial world,@financialworld,2013-05-04T23:51:02.000Z,"Meet Steve Israel, The Congressman Who Wants To Ban  3D-Printed  Guns (Q&A): Few would have predicted, six month...  http://",0,0,0,0
DIMENSIO NEXT,@3DPjournalist,2013-05-04T23:19:51.000Z,WORLD’S FIRST FULL-COLOUR HOME  3D PRINTER !  http:// #3dprinting,0,0,0,0
ICT 4 Life Sciences,@ICT4LS4UM,2013-05-05T10:13:53.000Z,Princeton scientists use  3D printing  to create bionic ear.  http://,0,0,0,0
Tweets Broker,@TweetsBroker,2013-05-05T10:11:22.000Z,Napster For Pirated  3D Printing  Templates? - eu.techcrunch   http:// printing-piracy-physibles/ …,0,0,0,0
Lauren Jooste,@lsjooste,2013-05-05T11:24:53.000Z,Article: Stranger Visions: DNA Collected from Found Objects Synthesized to Create  3D Printed  Portraits ...  http://,0,0,0,0
Future Of Everything,@FOEnews,2013-05-05T07:25:11.000Z,"World&#39;s First 3D Printed Handgun Liberator Is Fully Functional And Lethal, Gun ...  http://",0,0,0,0
nyN,@icoxnyn,2013-05-05T05:46:48.000Z,Stranger Visions: DNA Collected from Found Objects Synthesized to Create  3D Printed  Portraits   http://,0,0,0,0
Jonathan Brotto,@JonathanBrotto,2013-05-05T11:32:42.000Z,"Cube  3D Printer  goes retail at Staples for $1,299 | ZDNet  http://",0,0,0,0
Adam Coutts,@adcoutts,2013-05-05T06:10:09.000Z,The scary side of  3D printing  ... The World's First Entirely  3D Printed  Gun  http://,0,0,0,0
Kaitlin Alvarez,@workinghg,2013-05-04T22:50:35.000Z,First completely  3D-printed  gun shown  http:// st-completely-3d-printed-gun-shown/ …,0,0,0,0
Applied Technotopia,@AppliedTechnoto,2013-05-05T09:34:37.000Z,A  3d printed  gun - let great debate begin!futuramb:This Is...  http://,0,0,0,0
Schalk Burger,@schalkburger,2013-05-05T08:48:36.000Z,Theoretically you can  3D print  the 3D sonar scans of your baby.,0,0,0,0
3D Printing Fresh,@Print_3_D,2013-05-05T11:12:35.000Z,"May, a month full of Revit &amp; BIM events!: It’s a busy time for Revit related events. Just a reminder of th...  http://",0,0,0,0
(((Dan Graur))) ダン דן גראור,@DanGraur,2013-05-04T23:42:15.000Z,Scary! This Is The World's First Entirely  3D-Printed  Gun (Photos) - Forbes  http://,1,0,0,0
KyleG,@42wavelength,2013-05-04T23:34:50.000Z,Updates on the Kinect/Unity3D/ 3D Printer  collaborative design project  https://  Virtual World's to design/print with friends!,0,0,0,0
kerry ritz,@kerryritz,2013-05-05T09:49:27.000Z,This is brilliant.  3D printing  at its best  http:// ord.html …  via  @jobsworth,0,0,0,0
DigitalFabrication,@dfab_info,2013-05-05T10:41:54.000Z,A Look at the 'Inside  3D Printing ' Conference in New York [PICS]  http://  via  @mashable,0,0,0,0
Sterling Heights,@SterlingHeight3,2013-05-05T05:38:42.000Z,BotObjects announces first full color  3D printer — ProDesk3D  http:// otobjects-full-3d-printer-prodesk3d.html …  [=,0,0,0,0
Bradley White,@rotomangler,2013-05-05T06:46:33.000Z,This Is The World's First Entirely  3D-Printed  Gun  http://,0,0,0,0
resultsindianexam,@resultsindian,2013-05-05T11:40:41.000Z,"Link About It: This Week's Picks - Cool Hunting: Skateboarding India, poems on Mars,  3D-printed  ears and more ...  http://",0,0,0,0
Nysse Nyström,@NysseNystrom,2013-05-04T22:55:15.000Z,World's first entirely  3D-printed  gun:  http:// nberg/2013/05/03/this-is-the-worlds-first-entirely-3d-printed-gun-photos/ …,0,0,0,0
3D Printing Fresh,@Print_3_D,2013-05-05T11:51:52.000Z,"3D printed  guitar now available with 76 pickup tones: AweSome Musical Instruments, the manufacturer of high pe...  http://",0,0,0,0
Amazon Industrial,@amzn_industrial,2013-05-05T08:25:55.000Z,#4: Taulman 3D 618 Natural Nylon Filament for  3D Printer  1.75mm 2 1lb Spool Bundle MADE IN USA  http://,0,0,0,0
US & World News,@Criticalanglez,2013-05-04T22:52:25.000Z,"Gun made from  3D-printed  parts draws congressional ire
Shut this shit down!  http://  via  @Circa",0,0,0,0
SCOOLZ - C. Veltman,@scoolz,2013-05-05T09:40:33.000Z,Make  3D Printing  Easy Enough for Kids (Doodle3D)  http:// ng-easy-enough-for-kids-doodle3d/ …,0,0,0,0
Yolla,@elyollas,2013-05-05T08:33:56.000Z,The World's First Entirely  3D-Printed  Gun  http://,0,0,0,0
Merry Christmas 2009,@smarteric,2013-05-04T23:51:04.000Z,"Meet Steve Israel, The Congressman Who Wants To Ban  3D-Printed  Guns (Q&A): Few would have predicted, six month...  http://",0,0,0,0
Brian Schoenbaechler,@bschoenbaechler,2013-05-05T11:06:04.000Z,World's first  3D-printed  gun makes its debut  http://  {private sector will always move faster than Govt can legislate},0,0,0,0
jps,@jps_black,2013-05-05T05:47:48.000Z,世界初！？デスクトップ型フルカラー3Dプリンター『ProDesk3D』をNY拠点のbotObjectsが開発中  http:// @3d_printer_std さんから　いやフルカラーじゃなくてもいいのだけども。価格次第。,0,0,0,0
TheBfeeds Tech News,@TheBfeeds,2013-05-05T08:10:29.000Z,Napster For Pirated  3D Printing  Templates?  http:// #Tech #Geek #Gadget,0,0,0,0
Fremiot Gerónimo,@pcsoft,2013-05-05T07:06:44.000Z,This Is The World's First Entirely  3D-Printed  Gun (Photos) -->>   http:// nberg/2013/05/03/this-is-the-worlds-first-entirely-3d-printed-gun-photos/?utm_campaign=techtwittersf&utm_source=twitter&utm_medium=social …,0,0,0,0
𓂆 ටʍąɾ,@OmarQaraman,2013-05-04T23:42:32.000Z,"Top story: Napster For Pirated  3D Printing  Templates?  |  TechCrunch  http:// printing-piracy-physibles … , see more  http:// ch/all …",0,0,0,0
Blockmine3rz,@bmine3rz,2013-05-05T05:47:32.000Z,#3dprinting 3D Printed  Series I Land Rover  http:// http://,0,0,0,0
HSC,@hkshco,2013-05-04T23:50:52.000Z,"Meet Steve Israel, The Congressman Who Wants To Ban  3D-Printed  Guns (Q&A)  http:// #HSC",0,0,0,0
Occupyingtheillusion,@heavydemon2012,2013-05-05T05:50:37.000Z,The World’s First Entirely  3D Printed  Gun...  http://,0,0,0,0
popshared,@popshared,2013-05-05T09:57:53.000Z,Napster For Pirated  3D Printing  Templates? (Techcrunch - 556 retweets)  http://,0,0,0,0
"Vault (Harlem, NYC)",@VaultHarlem,2013-05-04T23:39:31.000Z,VAULT CERTIFIED | Vice “ 3D Printed  Guns” Documentary  http://,0,0,0,0
Addie Pratama,@adiey_pratama,2013-05-04T23:41:16.000Z,"Meet Steve Israel, The Congressman Who Wants To Ban  3D-Printed  Guns (Q&A)  http://",0,0,0,0
Marc Goodman,@FutureCrimes,2013-05-04T23:17:25.000Z,The World's First Entirely  3D-Printed  Gun is complete. Soon the plans will go online so that anybody can print one.  http:// nberg/2013/05/03/this-is-the-worlds-first-entirely-3d-printed-gun-photos/ …,0,1,10,0
gadget centre,@gadgetspot1,2013-05-05T09:23:20.000Z,The World's First Entirely  3D Printed  Gun  http://,0,0,0,0
Casandra,@portugrad,2013-05-05T08:04:12.000Z,The World's First  3D-Printed  Gun  http://,0,0,0,0
iPad iPhone news,@iPad_iPhone_n,2013-05-05T08:41:13.000Z,The World's First Entirely  3D Printed  Gun  http://,0,0,0,0
Digital Dialect,@digitaldialect,2013-05-04T22:35:30.000Z,"3D Printed  Firearm: Despite Technical Breakthrough, Isn't Really a Liberator but ... - Design & Trend: Design ...  http://",0,0,0,0
Fortune RD,@Fortune_RD,2013-05-05T12:36:29.000Z,3D printing  breakthrough: Print your own working gun  http:// /~3/GlEt6AB4baM/story01.htm …,0,0,0,0
Jagged,@GideonJagged,2013-05-05T12:31:59.000Z,Photo: high-tech-low-fashion: adove:  3D printed  cum fashion art ~cum fashi0n~  http://,0,0,0,0
Bovacap,@Bova_cap,2013-05-04T23:51:27.000Z,"Meet Steve Israel, The Congressman Who Wants To Ban  3D-Printed  Guns (Q&A): Few would have predicted, six month...  http://",0,0,0,0
Tania Sheko /tʌnjə/,@taniatorikova,2013-05-04T23:39:52.000Z,3D printing  : 11 examples  http:// -fascinating-frightening-ways-3d-bioprinting-next-big-thing-medicine-science-photos … #vicpln,0,0,0,0
ixto,@ixtoMusic,2013-05-05T06:22:43.000Z,Probably if you own a  3D Printer #WouldntThatBeSomething  RT @RageTeddyRage: Can I download clothes off the Internet yet ? ,0,0,0,0
Dj Mondo Ent,@Djmondoent,2013-05-05T08:12:26.000Z,#Forbes  World's first  3D-printed  handgun is here; Congressman fights to extend ban on ...: Forbes r...  http:// #WORLDWIDE,0,0,0,0
Rosenberg Associates,@RosenbergCo,2013-05-05T10:51:49.000Z,"Ah, the potential of technology unbridled by social consideration... Student creates the first  3D-printed  handgun:  http://",0,0,0,0
infosproducts,@infosproducts,2013-05-04T23:21:34.000Z,#1970s #1980s  #2009 #8: Afinia  3D Printer  Bundle #2  http://,0,0,0,0
iPhone Dev House,@iPhoneDevHouse,2013-05-05T06:11:11.000Z,This Is The World's First Entirely  3D-Printed  Gun  http://,0,0,0,0
Cooldotz,@cooldotz,2013-05-05T05:43:32.000Z,"3D Printed  Firearm: Despite Technical Breakthrough, Isn&#039;t Really a Liberator but ... - Design & Trend  http://",0,0,0,0
SmarterHipHop.com,@SmarterHipHop,2013-05-05T08:12:27.000Z,#Forbes  World's first  3D-printed  handgun is here; Congressman fights to extend ban on ...: Forbes r...  http:// #WORLDWIDE,0,0,0,0
Ravi Andersahare,@RaviAndersahare,2013-05-04T23:25:10.000Z,"http:// 3D Printed  Firearm: Despite Technical Breakthrough, Isn't Really a Liberator but ... - D...  http://",0,0,0,0
Jack Dodgson,@jackyD123,2013-05-04T23:51:19.000Z,3d printed  pandana vase..,0,0,0,0
Bruno Hour-Sezille,@lanationjournal,2013-05-05T10:31:39.000Z,Staples First U.S. Retailer To Sell  3D Printer  (But Please Don't Print 3D Handgun)  http:// 20130504/staples-first-us-retailer-sell-3d-printer-please-dont-print-3d-handgun.htm …,0,0,0,0
caimand,@8LAK3y,2013-05-05T06:40:38.000Z,"anyone with a  3d printer  could dl the file, print a 3d handgun in any country, and sell it anonymously within that country",0,0,0,0
Social News tweets,@social_ttweets,2013-05-05T09:42:51.000Z,The World's First Entirely  3D Printed  Gun  http://,0,0,0,0
yoruichi,@_geekymelanin,2013-05-05T07:59:50.000Z,I want a  3D printer .,0,0,0,0
Tweets for Kaijzer,@TweetingKaijzer,2013-05-04T22:44:13.000Z,"#Science 3D Printed  Firearm: Despite Technical Breakthrough, Isn't Really a Liberator but ... - D...  http:// #FF  @Kaijzer",0,0,0,0
Wim Mussche,@notiontechcom,2013-05-05T09:03:04.000Z,3d-printer  daily is out!  http:// 1336906857 …,0,0,0,0
Spencer Campbell,@SCampbellSBN,2013-05-04T22:35:14.000Z,""" @YourAnonNews : The World's First Entirely  3D Printed  Gun:  http:// "" watched the vice video on this....crazy.",0,0,0,0
IT News America,@AmericaIT,2013-05-04T22:29:22.000Z,"#IT #News 3D Printed  Firearm: Despite Technical Breakthrough, Isn't Really a Liberator but ... - Design & Trend  http:// #USA",0,0,0,0
Tech News Today,@9technews,2013-05-04T22:31:25.000Z,"3D Printed  Firearm: Despite Technical Breakthrough, Isn't Really a Liberator but ... - Design & Tr...  http:// #Tech #News",0,0,0,0
xxuriel,@xzuriel,2013-05-04T23:51:34.000Z,"RT  @Forbes  Meet Steve Israel, The Congressman Who Wants To Ban  3D-Printed  Guns (Q&A): Few would h...  http:// #Philippines",0,0,0,0
newspyre,@newspyre,2013-05-04T22:27:17.000Z,This Is The World's First Entirely  3D-Printed  Gun  http://,0,0,0,0
Sedona SoL | tD,@SedonaSol,2013-05-05T07:28:57.000Z,"The path to  3D printed  Cyborgs has been started with which part of the body?   Ok, Ill tell  -  http:// atus/19819 …",0,0,0,0
Heardable,@heardable,2013-05-05T10:05:57.000Z,"Thanks, OuttaTheBox Marketing, for this interesting link.   3D Printing  is going to be H-U-G-E.  Technology #11...  http://",0,0,0,0
ProtoExchange,@ProtoExchange,2013-05-05T07:24:16.000Z,Napster For Pirated  3D Printing  Templates? - eu.techcrunch - Napster For Pirated  3D Printing  Templates?eu.techcrun...  http://,0,0,0,0
Sophie Bennett,@ShelearX,2013-05-05T06:36:28.000Z,Gigabot  3D Printer  Allows Insane 24-Cubic Inch Objects To Be Printed -  http:// abot-3d-printer-startup/ …  via  @bitrebels,0,0,0,0
Carter Tokelau,@hiramfayhutc,2013-05-04T22:44:14.000Z,"hiramfayhutc:  3D Printed  Firearm: Despite Technical Breakthrough, Isn't Really a Liberator but ... - Design & Trend",0,0,0,0
Viringo Threads,@dantalancha,2013-05-05T07:20:48.000Z,"This is a  3D printed , bionic ear!

Over the last few months 3D printers being used to ""print"" biological cells...  http://",0,0,0,0
iPavel,@ipavel,2013-05-05T08:54:08.000Z,Stranger Visions: DNA Collected from Found Objects Synthesized to Create  3D Printed  Portraits http:// er-visions-dna-collected-from-found-objects-synthesized-to-create-3d-printed-portraits/ …,0,0,0,0
Catarina Tully,@CatTullyFOH,2013-05-05T10:36:33.000Z,Govt must start thinking abt banning/regulating Int Property - Plans for fully  3D-printed  gun go online next week  http:// ly_3d_printed_gun/ …,0,0,0,0
A.Vledder,@AVledder,2013-05-05T09:25:14.000Z,Gevaar van  3d printing : 'Student maakt volledig functionerend wapen met  3d-printer '  http://,0,0,0,0
Highheeledlady,@Highheeledlady,2013-05-05T09:18:16.000Z,""" @SUKITEA :  3D printing  food....  http:// hnology/3D_food_printer/index.htm … "" the future??",0,0,0,0
舞櫻,@maisakura39,2013-05-05T08:54:05.000Z,"Princeton crafts a  3D printed  bionic ear with super hearing, creepy looks  http://  via  @engadget",0,0,0,0
Jack Hotchkiss,@fedup_azjack,2013-05-05T09:31:01.000Z,"VIRTUAL FIREARMS: First  3D-Printed  Handgun Ready to Hit the Web
00  

This is an update to Defense Distributed’s...  http://",0,0,0,0
Mark Kim,@thedokoeppe,2013-05-04T22:44:13.000Z,"thedokoeppe:  3D Printed  Firearm: Despite Technical Breakthrough, Isn't Really a Liberator but ... - Design & Trend",0,0,0,0
Adrian Shaughnessy,@AJWShaughnessy,2013-05-05T09:15:50.000Z,"Print Shift, new print-on-demand magazine about  3D printing http://",1,5,3,0
B4INSci-Tech,@B4INSciTech,2013-05-04T22:28:18.000Z,Meet “The Liberator”: The World’s First Fully  3D-Printed  Firearm  http://,0,0,0,0
freshnews.org,@freshnewsorg,2013-05-04T23:43:51.000Z,Defense Distributed Has  3D-Printed  an Entire Gun (slashdot)  http://,0,0,0,0
Davide Consoli,@Davide_Consoli,2013-05-05T08:02:51.000Z,Fast-growing  #3D  printing in  #China : preparing for a new generation of entrepreneurs? RT  @ThEconomist http:// nd-technology/21576626-additive-manufacturing-growing-apace-china-new-brick-great-wall …,0,0,0,0
DoNotFollowMe,@8hollow8,2013-05-05T08:19:59.000Z,The World's First Entirely  3D Printed  Gun  http://,0,0,0,0
Amit Kumar,@bestcopydotnet,2013-05-04T23:51:21.000Z,"Meet Steve Israel, The Congressman Who Wants To Ban  3D-Printed  Guns (Q&A): Few would have predicted, six month...  http://",0,0,0,0
Starkey UK,@Starkey_UK,2013-05-05T10:16:57.000Z,3D printing  is used  @Starkey_UK  to print shells and Earmoulds. This takes the  3D printing  world to a whole new level   http:// nic-ear/27361/ …,0,0,0,0
Petteri Günther,@petterigunther,2013-05-05T09:15:47.000Z,This Is The World's First Entirely  3D-Printed  Gun (Photos) - Forbes  http://,0,0,0,0
Eclipse Vape,@EclipseVape1,2013-05-04T23:05:20.000Z,Revealing Dita Von Teese in a Fully Articulated  3D Printed  Gown  http://,0,0,0,0
Allison Vanore,@alliecine,2013-05-05T06:02:32.000Z,Wow RT This Is The World's First Entirely  3D-Printed  Gun http:// nberg/2013/05/03/this-is-the-worlds-first-entirely-3d-printed-gun-photos/ …,0,0,0,0
Leon Hurley,@LeonHurley,2013-05-05T09:37:49.000Z,This Is The World's First Entirely  3D-Printed  Gun  http://,1,0,1,0
CCHS,@HackMelbourne,2013-05-05T08:15:16.000Z,Next Meeting: Mon May 06 6:00pm  3D Printing  session. See  http://  for details.,0,0,0,0
Martin Bergmann,@Martin_Bergmann,2013-05-05T05:43:15.000Z,TP-DIY Fashion Juicy Couture Design  3D Print  Hard Back Case Cover for Samsung Galaxy S3 I9300 Ligh Pink Color TP-DIY-03380…,0,0,0,0
Kaitlin Alvarez,@workinghg,2013-05-05T08:53:05.000Z,"Say Hello to the Liberator, Supposedly the Word's First Entirely  3D-Printed  Gun  http://",0,0,0,0
Bob Cummer,@BobbyCee70,2013-05-05T10:03:04.000Z,Gun made from  3D-printed  parts draws congressional ire  http://  via  @Circa,0,0,0,0
Patrick Schlafer,@pschlafer,2013-05-05T06:01:23.000Z,"I've always thought the biggest stunt to 3D printers would be handling this: 
World's First Entirely  3D-Printed  Gun  http:// nberg/2013/05/03/this-is-the-worlds-first-entirely-3d-printed-gun-photos …",0,0,0,0
Typicall.de,@Typicall_de,2013-05-05T06:07:05.000Z,New post: learning foreign creative practices fingernail machine  3D printer  and successful business model  http://,0,0,0,0
Social News tweets,@social_ttweets,2013-05-05T12:44:26.000Z,Napster For Pirated  3D Printing  Templates?  http://,0,0,0,0
martynday,@martynday,2013-05-05T09:59:04.000Z,The World’s First Entirely  3D Printed  Gun  http:// rlds-first-entirely-3d-printed-gun/ …,1,0,0,0
Sir Jutter,@SirJutter,2013-05-05T06:59:21.000Z,Student maakt volledig functionerend wapen met  3d-printer  - Computer - Nieuws - Tweakers  http:// tudent-maakt-volledig-functionerend-wapen-met-3d-printer.html …  via  @tweakers .,0,0,0,0
Mortemer,@Mort3mer,2013-05-04T23:05:38.000Z,Why not buy a  3D printer - and print more 3D printers? You could make a gazillion dollars. just sayin',1,4,9,0
EvA,@evabdulina,2013-05-05T10:33:52.000Z,Is that even legal? DNA Collected from Found Objects Synthesized to Create  3D Printed  Portraits  http://,0,0,0,0
Auke Huistra,@Houslive,2013-05-05T09:15:23.000Z,Amazing and scary at the same time: This Is The World's First Entirely  3D-Printed  Gun  http://,0,0,0,0
willnoon,@willnoon,2013-05-05T06:25:47.000Z,Fuck. RT  @YourAnonNews : The World's First Entirely  3D Printed  Gun:  http://,2,4,0,0
Giancarlo Perlas,@giancarloperlas,2013-05-05T08:02:36.000Z,3D-Printed  Handgun By Defense Distributed Now Complete http:// dgun-by-defense-distributed-now-complete/ …,0,0,0,0
Jeff Greenspan,@JeffGreenspan,2013-05-04T23:38:20.000Z,Lego: The original  3D printing .,0,2,1,0
Alison Miller,@ali_sonic,2013-05-05T10:41:26.000Z,Certainly not. No No No. This Is The World's First Entirely  3D-Printed  Gun  http://,0,0,0,0
Tweakers Aanbod,@TweakersVA,2013-05-05T10:19:30.000Z,"A: Printrbot LC incl Panelolu ( 3D Printer ) - € 400,-  http:// #aanbod #printersenscanners",0,0,0,0
business,@business_news33,2013-05-04T23:51:03.000Z,"Meet Steve Israel, The Congressman Who Wants To Ban  3D-Printed  Guns (Q&A): Few would have predicted, six month...  http://",0,0,0,0
Tobias Pret,@TobiasPret,2013-05-05T08:32:45.000Z,"A downside of  3D Printing : ""...Gun regulations will do little good if criminals can print plastic firearms at...  http://",0,0,0,0
Joan Peterson.,@commongunsense,2013-05-05T11:48:04.000Z,This Is The World's First Entirely  3D-Printed  Gun (Photos) - Forbes  http://,0,0,0,0
Vijay Paul,@DOTSAN,2013-05-05T07:36:35.000Z,Check out the  3D printed  Elephant  http://  via  @shapeways,0,0,0,0
anlalog,@anlalog,2013-05-05T05:42:35.000Z,Stranger Visions: DNA Collected from Found Objects Synthesized to Create  3D Printed  Portraits  http://,0,0,0,0
AUDILOGIA,@audilogia,2013-05-05T09:40:45.000Z,Printed Ear: Can you hear me now? Princeton University researchers have used off-the-shelf  3D printing  tools t...  http://,0,0,0,0
Scorypto,@Scorypto,2013-05-05T06:15:50.000Z,"Top story: This Is The World's First Entirely  3D-Printed  Gun (Photos) - Forbes  http:// nberg/2013/05/03/this-is-the-worlds-first-entirely-3d-printed-gun-photos … , see more  http://",0,0,0,0
N,@maybenomfundo,2013-05-05T10:59:56.000Z,"#Staples  -- that place where you can get a couple of pens, plastic folders, a desk chair, gum and a  3D printer http://",0,0,0,0
Adriaan Pelzer,@adriaan_pelzer,2013-05-05T06:30:16.000Z,Here it is: the first fully  3D printed  gun  http://,0,0,0,0
KyleG,@42wavelength,2013-05-04T23:41:46.000Z,The UpMini  3D printer  we're using for Kinect/Unity3D collaborative design and engineering project.,0,0,0,0
AllGraph Online,@allGraphOnline,2013-05-05T08:16:51.000Z,#4: Taulman 3D 618 Natural Nylon Filament for  3D Printer  1.75mm 2 1lb Spool Bundle MADE IN USA: Taulman 3D 618...  http://,0,0,0,0
Cooldotz,@cooldotz,2013-05-04T23:35:19.000Z,World&#039;s First Fully 3D-Printed Handgun Is Here - Gamenguide  http://,0,0,0,0
