Author Name,Author ID,Date,Post Text,Replies,Likes,Reshares,Views
HT,@DisBritNicole,2017-11-12T23:23:50.000Z,Just entered to win a STANLEY® Model 1  3D Printer  courtesy of  @dudeshopping !  http://,0,0,0,0
VoxelMatters,@VoxelMatters,2017-11-12T18:17:01.000Z,US based  @Ultimate3_D  expands capacity with  @Prodways  Promaker P4000 X SLS  3D Printer https://  via @3DPBizDirect,0,0,0,0
FFJournal,@FFJournalUpdate,2017-11-12T20:30:30.000Z,"U.S. military deploys superalloys, fabrication training and  3D printing  to keep soldiers and citizens safe.  http://",0,0,0,0
Sold Right Away Team,@soldrightaway,2017-11-12T22:16:29.000Z,Love our new  3D Printed  Sign by  @Westdale3D !!,0,3,1,0
Ian Palmer,@dripster,2017-11-12T17:15:20.000Z,World’s first  3D printed  concrete bridge  https:// orlds-first-3d-printed-concrete-bridge/ …,0,0,0,0
Kênh Tự Chế Tạo,@KenhTuCheTao,2017-11-13T00:12:08.000Z,3D Printing  T-Shirt Designs  http://,0,0,0,0
eSmartMe,@esmartme,2017-11-12T18:25:20.000Z,Make: Power Bank Under $10 ! | DIY |  3D Printed http://,0,0,0,0
Robert Boissy,@cloudseq,2017-11-12T17:47:44.000Z,Metal  3D printing  at 100 times the speed and a twentieth of the cost  https:// al_3d_printing_at_desktop_metal/ …  via  @theregister,0,0,0,0
Deeps | Commissions closed,@dishindeeps,2017-11-12T17:23:18.000Z,Omg first  3D print  ever! So cool!! I literally sat there to watch it print the whole thing. It took exactly 27 minutes haha,1,0,0,0
Vote3D.COM,@Vote3D,2017-11-12T19:10:42.000Z,The  3D Printing  Cloud By Polar 3D https:// oud/ … #polar3D #3dprint #3dprints #3dprinter #3dprinters #3dprinting #cloud #CloudComputing #technology #tech #electronics #blueprints #blueprint #educate #education #educational #learn #learning #school #teach #teaching #3dp,0,0,2,0
3D Printing,@Just_Print_It,2017-11-12T21:44:27.000Z,3D Printable Flexi Wallets by Felipe aguirre  https://,0,0,0,0
TheWineDiva,@KittyKatz32,2017-11-12T17:40:53.000Z,"I entered a giveaway to win ""SainSmart x Anet A8 Prusa i3  3D Printer ..."" by  #SainSmart !  #GiveToEmpower https:// 7993/?ref_=tsm_4_tw_p_tw … #giveaway",0,0,0,0
JD Engineering Ltd.,@3DJDEngineering,2017-11-12T17:47:55.000Z,"Head over to our Facebook page tomorrow at 8.15 and get involved in our  3D printer  raffle! 

Win a MakerBot Replicator +!!  http:// td … #JDRaffle #WinAPrinter",0,0,0,0
Donna Evans,@DonnaEvans8,2017-11-12T22:00:16.000Z,Just entered to win a STANLEY® Model 1  3D Printer  courtesy of  @dudeshopping !  http://,0,0,0,0
ʂᴱɔᵤЯітץ,@SecurityFeed,2017-11-12T21:03:13.000Z,The iPhone X’s Face ID can be broken with a  3D printer  and a whole lot of time  http:// #infosec #security,0,0,0,0
Mandi Williams,@mandib21,2017-11-12T17:56:23.000Z,"I entered a giveaway to win ""SainSmart x Anet A8 Prusa i3  3D Printer ..."" by  #SainSmart !  #GiveToEmpower https:// 7993/?ref_=tsm_4_tw_p_tw … #giveaway",0,0,0,0
#VideoGames,@VideoGamesFeeds,2017-11-12T20:40:16.000Z,"ad: HATCHBOX 3D PETG-1KG1.75-ORN PETG  3D Printer  Filament, Dimensional Accuracy +/- 0.05 mm, 1 kg Spool, 1.75 mm, Orange -  http:// #3DPrinting",0,0,0,0
#HelcoAerial™,@HelcoAerial,2017-11-12T19:00:58.000Z,30 Degree Xiaomi Yi Sports Camera Mount Holder For FPV QAV250 QAV210 LS210 lantian210  3D Printed http:// mi-Yi-Sports-Camera-Mount-Holder-For-FPV-QAV250-QAV210-LS210-lantian210-3D-Printed-p-1058151.html?p=J2030417240562015060 …,0,0,0,0
محمد محمود نصار,@Nassar_opnion,2017-11-12T17:41:57.000Z,أعجبني فيديو  @YouTube  على  http://  Arduino  3D Printer  | Homemade - Part 1,0,0,0,0
Sedo-Amazom.com Shop,@sedoamazomshop,2017-11-12T20:39:26.000Z,New post (Buy Antenna Mount Holder for Frsky X8R X6R L9R Receiver  3D Printed #Goodbuy ) has been published on  http://   -  https:// nd-hobbiesrc-toys-hobbiesradios-receiver-2/ …,0,0,0,0
cnanowork,@cnanowork,2017-11-12T23:33:05.000Z,"HP Keeps Focus On Industrial  3D Printing  with Introduction of Jet Fusion 3D 4210 and Expansion of Materials Portfolio, Partnerships  http://",0,0,0,0
Blockmine3rz,@bmine3rz,2017-11-12T20:33:00.000Z,"Weaver desktop  3D printer  offers hi-res SLA printing with F-theta lens, 50-micron laser spot...  http://",0,0,0,0
Margaret OConnor,@IRISHOPFL,2017-11-12T20:01:18.000Z,Just entered to win a STANLEY® Model 1  3D Printer  courtesy of  @dudeshopping !  http://,0,2,0,0
Blockmine3rz,@bmine3rz,2017-11-12T18:31:22.000Z,"3D Printing  News Roundup: Graphene 3D Lab, PyroGenesis, Rolls Royce,  3D printed  headphones...  http://",0,0,0,0
JohnHauer,@maverickonline,2017-11-12T23:43:05.000Z,"How  3D Printing , Lego, and Custom Sleeves Are Helping Hospitals  http:// #Go3D",0,0,0,0
CH Tutu Turtles 9003,@FRC9003,2017-11-12T20:15:52.000Z,Another activity we have been able to add since we have more time in Robotics is learning about  #SOLIDWORKS  and  3D printing ! Robotics is a winter sport  @ChathamHall !,0,0,0,0
Autodesk HSM,@AutodeskHSM,2017-11-12T20:42:03.000Z,Will there be  3D Printer  farms for the future of manufacturing?  https:// 2017/11/08/3d-printer-farms-and-robotics-start-pointing-to-future-of-manufacturing/#4b1596a9a429 …,0,0,0,0
Telhunter,@Telhunter,2017-11-12T20:32:55.000Z,Please  #Retweet  ! Join this  #giveaway  for a NEW CR-10  3D Printer ! <3  https:// #contest #sweepstake #win #freebie #3dpchat,0,0,3,0
Thrifty 4nsic Gal,@Thrifty4nsicgal,2017-11-12T17:34:45.000Z,"$19.99  3D Printing  Pen & 3D Doodler Professional Printing 3D Pen, Charger and Filaments  http://",0,0,0,0
Curso 3D Printing,@Curso3DPrinting,2017-11-12T17:38:09.000Z,"4 Fun DIY  3D Printing  Projects - portable rail-gun, duplicate keys, aquatic car tires, customized doors  http://",0,0,0,0
Red5Apps,@Red5Apps,2017-11-12T19:31:45.000Z,The iPhone X’s Face ID can be broken with a  3D printer  and a whole lot of time -  http:// face-id-can-be-broken-with-a-3d-printer-and-a-whole-lot-of-time/ …,0,0,0,0
HudsonHardwear,@HudsonHardwear,2017-11-12T21:00:52.000Z,. @Instructables  Power Bank Under $10 ! | DIY |  3D Printed  - Today’s smartphone industry is producing way too po...  http://,0,0,0,0
"Prof. Emre Huri, MD, PhD, FEBU",@EmreHuri_MD,2017-11-12T17:07:20.000Z,#urologyeverywhere  in  @MedTRainModsim  project 1st LTT activity with  3D printed  unique models and  #VR  models  @iTrusturology @robymiano @aurusdm @selcukurolog @drmecityavuz @urology52 @ilkerselcukmd  JOIN US!,0,5,2,0
Nexus Governance,@NexusGov,2017-11-12T23:44:53.000Z,New Matter  #Mod -t  #3D  printer Test Prints  #VR #VRGames #Drone #Gaming http://  | Datacracy Marketplace -  https:// -t-3d-printer-test-prints/ … https:// oads/2017/11/new-matter-mod-t-3d-printer-test-prints.jpg … #3dPrinter #3dPrinting #DroneVideos  ...,0,0,0,0
Saphire Pudding (Shadow Wing),@milleraustin321,2017-11-12T19:20:04.000Z,I liked a  @YouTube  video  http://  Experimenting with  3D Printed  Fabric,0,0,0,0
Penny Coville,@PennyCoville,2017-11-12T22:02:51.000Z,Just entered to win a STANLEY® Model 1  3D Printer  courtesy of  @dudeshopping !  http://,0,0,0,0
SME Media,@SMEMediaNews,2017-11-12T23:00:06.000Z,"HP Boosts  3D Printing  Effort, Adds New Industrial Printer, New Materials  http:// #mfg #3dprinting",0,0,0,0
Ms. Career Chick,@_susanwho,2017-11-12T20:29:19.000Z,https://  is coming soon with the game changing  3D printed  backpacks that are sooo cute!!! Check out the link ,0,0,0,0
Sabina,@SabinaKamys,2017-11-12T22:09:23.000Z,3DWithUs - SelfCAD – Design Software for  3D Printing  Review  https:// withus-selfcad-design-software-for-3d-printing-printed-software-best …,0,0,0,0
DelilahMartin,@DelilahMartin,2017-11-12T22:08:46.000Z,Just entered to win a STANLEY® Model 1  3D Printer  courtesy of  @dudeshopping !  http://,0,0,0,0
3D Printing Society,@Hud3DPS,2017-11-12T22:04:09.000Z,"New materials, new possibilities! Meet PLA, TPU (flexible material), and wood filament!  #3dprinting #createeducation",0,0,0,0
Mary Anaya,@MaryAnaya9,2017-11-12T19:02:48.000Z,Just entered to win a STANLEY® Model 1  3D Printer  courtesy of  @dudeshopping !  http://,0,0,0,0
We Heart Fam Friends,@WeHeartFamily,2017-11-12T17:34:45.000Z,"$19.99  3D Printing  Pen & 3D Doodler Professional Printing 3D Pen, Charger and Filaments  http://",0,0,0,0
Premier Orthopedics,@PremierOrthopdx,2017-11-12T20:02:44.000Z,"3D Printing  Medical Devices Market by Component, Technology, Application, and End User – Global Industry Analysis...  https:// x/1501444940?read=https%3A%2F%2Fwww.econotimes.com%2F3D%2DPrinting%2DMedical%2DDevices%2DMarket%2Dby%2DComponent%2DTechnology%2DApplication%2Dand%2DEnd%2DUser%2D%2DGlobal%2DIndustry%2DAnalysis%2Dand%2DForecast%2Dto%2D2025%2D1001801 …",0,0,0,0
Iain Todd FREng,@ProfIainTodd,2017-11-12T17:15:12.000Z,3D Printer  Farms And Robotics Start Pointing To Future Of Manufacturing  https:// 2017/11/08/3d-printer-farms-and-robotics-start-pointing-to-future-of-manufacturing/#2d487aa5a429 …,0,4,1,0
Joe Workman,@joeworkman,2017-11-12T17:19:14.000Z,The  @DagomaUs  NEVA  3D printer  is pretty amazing! There software could use some work though. I cannot get anything to print flat on the base. ,1,1,1,0
Not A Games Dev Ollie,@Reksaurian,2017-11-12T19:36:03.000Z,Sunday 12th of November: The Night of Double Orders. :] About 20 shy of weekly and its only 1935. Neat.,0,0,0,0
Bibi Tech,@IamBibiTech,2017-11-12T19:57:54.000Z,This  3D-Printing  Lab Is Iowa’s Entry Into A $140 Billion Industry  https:// #goodreads,0,0,0,0
iEd,@savushkinedu,2017-11-12T17:45:33.000Z,3d printer  done  http://,0,0,0,0
Hungry Gizmo!,@hungrygizmo,2017-11-12T20:01:18.000Z,Fixing the Wilfa BL-1200 blade holder/cap using a  3D printer :  http://  via  @YouTube,0,0,0,0
Hume-Fogg Library,@hfalibrary,2017-11-12T21:59:27.000Z,We’ve got TWO great lunch and learns this week. On Tuesday you can learn to  3D Print  with students Matthew and Andrew!,0,2,0,0
Instant Time Deals,@InstantTimeDeal,2017-11-12T21:04:57.000Z,ad: 9671 - Ultimaker 3  3D Printer  -  http:// #3Dprinting,0,0,0,0
Scott White,@scottdwhite1991,2017-11-12T19:42:26.000Z,Singapore's Offshore and Marine Sector Boosts Global Edge with  3D Printing https:// re-offshore-and-marine/ …,0,0,0,0
TheDutyPaid,@TheDutyPaid,2017-11-12T20:29:17.000Z,I added a video to a  @YouTube  playlist  http://  TEVO Tarantula  3D printer  - HOW TO improve your printer - Part 14,0,0,0,0
nicole pfannenstiel (aka Dr. P),@npfannen,2017-11-12T19:19:13.000Z,since we discussed  3D printing  :)  #engl671mu https:// ting-helps-students-develop-critical-thinking-skills/amp/ …,0,0,0,0
Peter3d ℗,@Peter_Lemmens,2017-11-12T19:02:29.000Z,Check out the  3D printed  Owl pendant   http://  via  @shapeways #owl #owlpendant #owljewelry #owlgadget #owly #gift #owlgift,0,0,0,0
Lori Byrd,@sunshinehdfan,2017-11-12T19:00:37.000Z,"I entered a giveaway to win ""SainSmart x Anet A8 Prusa i3  3D Printer ..."" by  #SainSmart !  #GiveToEmpower https:// 7993/?ref_=tsm_4_tw_p_tw … #giveaway",0,0,0,0
Joel Telling - 3D Printing Nerd,@joeltelling,2017-11-13T00:20:40.000Z,"My first  @josefprusa  MMU print. Setup was easy, live Z adjustments we're quick, this is first print, just click print and go. I'm very much impressed.",15,85,1,0
frijoles,@frijoles001,2017-11-12T22:46:42.000Z,Affordable Out-of-box  3d printer  for every maker.  https://,0,0,0,0
Online Food Deals (including EBT),@EBTeligibledeal,2017-11-13T00:16:16.000Z,Just saw this on Amazon: youvimi Unisex  3d Printed  Drawstring Pocket... by youvimi for $19.99  http://  via  @amazon,0,0,0,0
Andy Greenberg (@agreenberg at the other places),@a_greenberg,2017-11-12T23:56:30.000Z,"Vietnamese researchers claim they've spoofed Face ID with a composite mask of  3D-printed  plastic, silicone, makeup, and 2D-printed eyes  https:// say-broke-face-id-security/ …  (Still some unanswered questions, but pretty surprising if this actually works without eye movement)",6,82,79,0
Dee~Moda,@deemoda83,2017-11-12T23:47:04.000Z,MakerBot Releases Educator’s Guidebook for  3D Printing  | Make:  https://,0,0,0,0
3D Printing,@Just_Print_It,2017-11-12T17:15:05.000Z,Roary McRoarface [small]  https://,0,0,0,0
3D printings Dronten,@3DprntDr,2017-11-12T22:11:11.000Z,Maak je sint-kado of gedicht helemaal af met een persoonlijk label of letter uit de  3D printer !  #Sinterklaas,0,0,0,0
Daily Deals,@DailyDealFeeds,2017-11-12T20:38:49.000Z,"MatterHackers White PLA Filament – 3.00mm

1 Kg of 3mm PLA, (aka Polylactic Acid), spooled for  3D Printing  usePLA is a bioplastic which transitions quickly from liquid to solidThis makes it an ideal printing material, one of the most commonly used i  http:// kers-white-pla-filament-3-00mm/ …",0,0,0,0
philcotton,@learnbylayers3D,2017-11-12T20:32:58.000Z,Win a CR-10  3D Printer  / 5 YouTube Channels You Should Be Watching [11.11] via  @joeltelling #3dprinting https:// Yq7rA&feature=share …,0,7,3,0
Надежда России,@nadegda_sol,2017-11-12T20:34:26.000Z,Самодельный 3д принтер. Качай STL файлы деталей. Big  3d printer https://  с помощью  @YouTube,0,0,0,0
Scott Cole,@HIDSG,2017-11-12T19:45:13.000Z,Just entered to win a STANLEY® Model 1  3D Printer  courtesy of  @dudeshopping !  http://,0,0,0,0
Oz Robotics,@OzRoboticsUSA,2017-11-12T20:58:13.000Z,"All-In-One  3D Printing  with Laser Engraving, Vinyl Cutting and Drawing  http:// #vinyl #sculpture #Sculptures #CuttingEdge #Cutepress #CutOutFest #drawing #drawings #LaserKiwi #lasers #laseronline #painting #paintings #art #artist #ARTPOP #3dprinted #Productivity",0,0,0,0
Diane Potts,@ldian,2017-11-12T22:45:11.000Z,Just entered to win a STANLEY® Model 1  3D Printer  courtesy of  @dudeshopping !  http://,0,0,0,0
ATLANTA TECH BLOGS,@ATLTechBlogs,2017-11-12T21:32:17.000Z,This Company Wants to Revolutionize  3D Printing  By Making It 10X Faster and 5...  #techblogs #community http:// irect …,0,0,0,0
i was here,@ohisthatall,2017-11-12T17:32:10.000Z,3D-Prinred Drugs!  3D-Printed  Drug Ushers in Era of Downloadable Medicine.  #xMed http://,0,0,0,0
Rajesh,@bporajesh,2017-11-12T20:32:25.000Z,Need English technical writer –  3D printing  / medical – Upwork  http:// echnical-writer-3d-printing-medical-upwork/ …,0,0,0,0
Agustin Arroyo,@flowalistik,2017-11-12T19:01:21.000Z,Add this to the list of reasons why you need a resin  3D printer,2,13,0,0
Not A Games Dev Ollie,@Reksaurian,2017-11-12T23:58:42.000Z,"Found a 24 hours, even on a weekend, Tescos and got some bits I had run out of to make food. Eat, shower, sleep, and cleaning house tomorrow then back to mon boulder and le hill.",0,0,0,0
Carol Delk,@luckycricket7,2017-11-12T23:30:56.000Z,Just entered to win a STANLEY® Model 1  3D Printer  courtesy of  @dudeshopping !  http://,0,0,0,0
PropesterH,@PropesterH,2017-11-12T22:24:26.000Z,The iPhone X’s Face ID can be broken with a  3D printer  and a whole lot of time  http:// e-id-security-how-to-hack-picture-mask/ …,0,0,0,0
John Morahan,@MordogJ,2017-11-12T18:57:18.000Z,"I entered a giveaway to win ""SainSmart x Anet A8 Prusa i3  3D Printer ..."" by  #SainSmart !  #GiveToEmpower https:// 7993/?ref_=tsm_4_tw_p_tw … #giveaway",0,0,0,0
3dprintfeed,@3dprintfeed,2017-11-12T19:05:22.000Z,Power Bank Under $10 ! | DIY |  3D Printed http://,0,0,0,0
The Motor Show,@TheMotorShows,2017-11-12T23:57:28.000Z,Divergent 3D premieres its first  3D printed  superbike at Los Angeles Auto Show  https:// remieres-its-first-3d-printed-superbike-at-los-angeles-auto-show/ …,0,0,0,0
3D Printing Tech,@MakerWatcher,2017-11-12T21:57:51.000Z,"Giveaway!  https:// 6cd346d15/ … ?, see more  http://",0,0,0,0
Luanne Lawler,@cmcdol1,2017-11-12T19:40:42.000Z,Want to win STANLEY® Model 1  3D Printer ? I just entered to win and you can too.  http://,0,0,0,0
Blitz,@Darkspiral_94,2017-11-12T23:53:23.000Z,iPhone X Face ID beaten with  3D-printed  mask - SlashGear  http://,0,0,0,0
Jim Arsineau,@pontiac1955,2017-11-12T23:18:47.000Z,"I entered a giveaway to win ""SainSmart x Anet A8 Prusa i3  3D Printer ..."" by  #SainSmart !  #GiveToEmpower https:// 7993/?ref_=tsm_4_tw_p_tw … #giveaway",0,0,0,0
☾༺ℓυa༻☽cazavampitos// ENCARGOS 3D OPEN,@Puchiluh,2017-11-12T22:59:44.000Z,Mi vida por el kabedon.,0,0,0,0
James Ronald,@Jovan_cvijic88,2017-11-12T17:12:02.000Z,"3DWithUs - SelfCAD – Design Software for  3D Printing  Review
  https:// fCAD-%E2%80%93-Design-Software-for-3D-Printing-Review/c193z/59ff03354a59e967f0597f54 …",0,0,0,0
3Ders.org 3D Printing News,@3dersorg,2017-11-12T17:36:50.000Z,"4 Fun DIY  3D Printing  Projects - portable rail-gun, duplicate keys, aquatic car tires, customized doors http:// 112-4-fun-diy-3d-printing-projects--3d-printed-portable-rail-gun-duplicate-keys-aquatic-car-tires-customized-doors.html … #3dprinting #3dprinted",0,10,5,0
Anirudh C,@ani_619c,2017-11-12T17:19:57.000Z,"Marketing News: Content Cocktails, Old School Emails,  3D Printing http://",0,2,1,0
3dprintfeed,@3dprintfeed,2017-11-12T18:20:32.000Z,"4 Fun DIY  3D Printing  Projects -  3D printed  portable rail-gun, duplicate keys, aquatic car tires ...  http://",0,0,0,0
Youth Made Malaysia,@YouthMadeMY,2017-11-12T21:40:49.000Z,"Saturday 25th November sees the start of the first Make Faire in Klang! Hosted by Jaya One there are a range of activities and vendors, ranging from IOT and  3D printing  to Islamic Calligraphy and jewelry! You may even see  @CSboxMY  there!  https://",0,0,3,0
Petar Petrovic,@starr00891,2017-11-12T20:51:44.000Z,"3DWithUs - SelfCAD – Design Software for  3D Printing  Review
  https:// fCAD-%E2%80%93-Design-Software-for-3D-Printing-Review/c193z/59ff03354a59e967f0597f54 …",0,0,0,0
Netmon Inc.,@NetmonTeam,2017-11-12T22:15:10.000Z,Whats for dinner tonight? One day soon we may be looking at  3D printed  food?  https:// how-3d-food-printers-are-changing-the-way-we-cook/ …,0,0,0,0
Lisa Sudo,@MistressofMoney,2017-11-12T19:03:49.000Z,Wow!  3D printed  house.  http://,0,0,0,0
Bonney Milan,@galxedustr,2017-11-12T23:33:24.000Z,"I entered a giveaway to win ""SainSmart x Anet A8 Prusa i3  3D Printer ..."" by  #SainSmart !  #GiveToEmpower https:// 7993/?ref_=tsm_4_tw_p_tw … #giveaway",0,0,0,0
Matrix PNG,@MatrixPNG,2017-11-12T20:24:04.000Z,The iPhone X's Face ID can be broken with a  3D printer  and a whole lot of time - BGR  http://,0,0,0,0
Ihrtgiv,@Ihrtgiv,2017-11-12T19:00:37.000Z,"I entered a giveaway to win ""SainSmart x Anet A8 Prusa i3  3D Printer ..."" by  #SainSmart !  #GiveToEmpower https:// 7993/?ref_=tsm_4_tw_p_tw … #giveaway",0,0,0,0
NASA Hack Space,@nasahackspace,2017-11-12T22:14:59.000Z,NASA Opens $2 Million Third Phase of  3D-Printed  Habitat Competition  http:// ml?pid=51845 …,0,0,0,0
3D Innovations,@3D_Innovations,2017-11-12T18:45:01.000Z,RT  @fabbaloo  Popular: How To Make Any  3D Printed  Part Much Stronger  #3DPrinting http://,0,0,0,0
A H Shumaker,@AHShumaker,2017-11-12T21:16:43.000Z,Just entered to win a STANLEY® Model 1  3D Printer  courtesy of  @dudeshopping !  http://,0,0,0,0
Mauricio Araujo,@mauricio_araujo,2017-11-12T18:32:18.000Z,Gostei de um vídeo  @YouTube http:// WESOME … 3D Printed  Rick Sanchez - Creality CR-10 Print!,0,0,0,0
SecurityNews,@SecurityNews,2017-11-12T19:14:49.000Z,http://  :  The iPhone Xs Face ID can be broken with a  3D printer  and a lot of time BGR  http://,0,0,0,0
Power Jedi,@PowerJediStore,2017-11-12T19:59:45.000Z,#darthvader #theforceawakens 3D Printed  BB8 T-Shirt  https:// -t-shirt/ …,0,0,0,0
3dprintfeed,@3dprintfeed,2017-11-12T20:25:06.000Z,Singapore's Offshore and Marine Sector Boosts Global Edge with  3D Printing http://,0,0,0,0
newsguy2010,@newsguy2010,2017-11-12T21:40:47.000Z,The iPhone X’s Face ID can be broken with a  3D printer  and a whole lot of time  http:// e-id-security-how-to-hack-picture-mask/ …,0,0,0,0
Architecture Week,@architecturewee,2017-11-12T17:38:33.000Z,"Please RT if you like!!  #architecture #design #architects #interiordesign  Swarovski crystal gets  3D-printed , upcycled and turned into gadgets by emerging designers  http://",0,0,0,0
Magick at Scale,@ourmagickfuture,2017-11-12T17:14:04.000Z,Demon Horde Cuts  3D Printing  Time in Half,0,0,0,0
marc woronoff,@marc1231965,2017-11-12T19:04:43.000Z,Just entered to win a STANLEY® Model 1  3D Printer  courtesy of  @dudeshopping !  http://,0,0,0,0
Shigekazu Ishihara,@shigekzishihara,2017-11-12T23:39:28.000Z,Concept and Design of a  3D Printed  Support to Assist Hand Scanning for the Realization of Customized Orthosis  https:// 017/8171520/ …,0,0,0,0
Vote3D.COM,@Vote3D,2017-11-12T20:11:16.000Z,Helping War Veterans With  3D Printed  Prosthetics  https:// terans-3d-printed-prosthetics/ … #3d #3dprint #3dprinter #3dprinting #3dprinted #prosthetic #prosthetics #war #warveteran #VeteransDay #veteran #ampute #biotechnology #bio #biotech #help #support #care #army #military #infantry #tech #tc,0,2,1,0
Clotheshorse,@dopehorse,2017-11-12T21:35:18.000Z,3D Printer  RTS Hot End Now Available Via Kickstarter  http://,0,0,0,0
Cozy Balls,@CozyBalls,2017-11-12T18:37:28.000Z,"I entered a giveaway to win ""SainSmart x Anet A8 Prusa i3  3D Printer ..."" by  #SainSmart !  #GiveToEmpower https:// 7993/?ref_=tsm_4_tw_p_tw … #giveaway",0,0,0,0
Josh Pigford,@Shpigford,2017-11-12T18:19:57.000Z,"It’s been ages since I’ve done any sort of virtualization on Mac. Who’s got best USB-device support?  @VMware , @ParallelsMac, someone else?

Specifically have a  3D printer  that's got terrible Mac software, so wondering if I'll have better luck via Windows.",3,2,0,0
Blended Learning Tasmania,@BlendedLearnTas,2017-11-12T22:58:36.000Z,"FREE PL opportunity for Tasmanian DoE teachers!
Session 1 - Tuesday 13th November – Packaging (laser cutting)
Session 2 - Wednesday 29th November - Robotic Arm ( 3D printing )
Session 3 - Tuesday 12th December - Smart Growing (microcontrollers) https:// chool-Teachers/Pages/Technologies-Twilight-Series.aspx …",1,1,1,0
3D Printing,@Just_Print_It,2017-11-12T21:18:39.000Z,The  3D-Printed  Solid Gold Spica Virginis Fountain Pen  https:// -printed-solid-gold-spica-virginis-fountain-pen/ …,0,6,3,0
Telien Emberheart,@theelfiestelf,2017-11-12T20:35:12.000Z,"Reminds me I still need to talk to the Fighter about the local  3d printing  cafe.

Still have that replica Destiny hand cannon to print. (Sun Shot)",0,0,0,0
Initial State,@initialstate,2017-11-12T18:05:16.000Z,"3D printing  is no longer reserved for sci-fi - it's permeating every industry, from automotive to pharma  #3DPrinting http://",0,0,0,0
New York University,@nyuniversity,2017-11-12T21:11:02.000Z,3D-printed  marvels + more of your tweet and instas that we  ed this week:  http://,0,5,2,0
Nursery Décor,@Nursery_Decor,2017-11-12T17:17:36.000Z,#10: KUNGKEN Rechargeable  3D Printing  Moon Lamp Touch Switch Luna Night Light Color And…  https:// #FREE http://,0,0,0,0
Alex,@just_alex_ok,2017-11-12T19:26:59.000Z,I liked a  @YouTube  video  http://  Google Translate  3D Printer,0,0,0,0
Design Milk,@designmilk,2017-11-12T18:00:40.000Z,Bearing  3D Printed  Jewelry by Giulio Iacchetti for Maison 203  http://,0,14,0,0
PS,@palaminodee2,2017-11-12T19:08:34.000Z,Just entered to win a STANLEY® Model 1  3D Printer  courtesy of  @dudeshopping !  http://,0,0,0,0
DIY 3Dprinted com,@DIY3dprinted,2017-11-12T17:53:31.000Z,M3D CEO gives more details about the new M3D Promega  3D printer  -  https://,0,0,0,0
RowdyGirl78,@smokefannascar,2017-11-12T19:15:42.000Z,Just entered to win a STANLEY® Model 1  3D Printer  courtesy of  @dudeshopping !  http://,0,0,0,0
Aytaç,@aytacseyfioglu,2017-11-12T19:33:20.000Z,3D Printing  Microbe Biofilms to Reduce Methane  https:// 0/3d-printing-microbe-biofilms-reduce-methane#.Wgih-x1I-xc.twitter …,0,0,0,0
Chris Garrett / Maker Hacks,@makerhacks,2017-11-12T18:05:03.000Z,"Sign up now - free Arduino, Raspberry Pi,  3D printing , CAD tutorials, webinars + FREE Robot Building & Coding Course https:// _source=edgar&utm_medium=twitter&utm_campaign=opt-in …",0,0,0,0
Gabriel Krieshok,@gabrielkrieshok,2017-11-12T22:14:59.000Z,My side hustle --  3d printing  for awesome little life tools.  #proprthings https:// atus/929809921159426050 …,1,5,1,0
Andy Warwick,@creednmd,2017-11-12T19:43:40.000Z,Just had some great UK switch covers for Philips Hue Wireless Dimmers ( @tweethue )  3D printed  by  @3DPRINTUK  from files from  @thingiverse https://  Super impressive quality.  #meethue #thingiverse #3dprint https://,0,4,1,0
3d Digital Printing,@3dDigitalPrint1,2017-11-12T18:24:53.000Z,"Creality  CR-10  DIY desktop  3D printer  

Tag a friend who would love this! 

FREE Shipping Worldwide 

Get ...  https:// ty-cr-10-diy-desktop-3d-printer/ …",0,0,0,0
Alisha Faye,@HelaFaye,2017-11-12T22:46:58.000Z,Got my slicer settings for general purpose working on my new  3D printer . Here's a preview of my…  https://,0,0,0,0
FOX Business,@FoxBusiness,2017-11-12T21:30:02.000Z,Teenager invents  3D-printed  hand for $300    http://,2,17,4,0
New Media Manitoba,@NewMediaMB,2017-11-12T18:28:03.000Z,"Take a tour this Tuesday at 6pm of only public fabrication lab  @northforgemb  & learn how  3D printing , laser cutting, computer-controlled routing, plasma cutting, & vacuum forming can transform your idea into a real product/business. Save your spot here -   https://",0,0,0,0
Jabil,@Jabil,2017-11-12T21:48:00.000Z,3D Printer  Farms And  #Robotics  Start Pointing To Future Of  #Manufacturing :  https://  by  @Forbes,0,1,8,0
Rick,@Kuperrl,2017-11-12T20:42:08.000Z,"I entered a giveaway to win ""SainSmart x Anet A8 Prusa i3  3D Printer ..."" by  #SainSmart !  #GiveToEmpower https:// 7993/?ref_=tsm_4_tw_p_tw … #giveaway",0,0,0,0
Aashik KC,@KcAashik,2017-11-12T20:31:03.000Z,http://  The iPhone X's Face ID can be broken with a  3D printer  and a whole lot of time - BGR  http:// #sharethis #KcAashik,0,0,0,0
Deanne Miller,@DeanneMiller16,2017-11-12T19:06:28.000Z,Just entered to win a STANLEY® Model 1  3D Printer  courtesy of  @dudeshopping !  http://,0,0,0,0
