Author Name,Author ID,Date,Post Text,Replies,Likes,Reshares,Views
Charles Russo,@Charles_M_Russo,2017-06-27T15:27:32.000Z,DIY kit appears for  3D printed  quadcopter -  http:// #3dprinting http:// cetera/diy-kit-appears-for-3d-printed-quadcopter-20121123/ …,0,5,4,0
3D Printing Industry,@3dprintindustry,2017-06-27T16:33:07.000Z,"Imperial College London introduces multimaterial  3D printer  for alloys, elastomers and resin -  http://  -  #3dprinting",0,8,14,0
Hirotter,@Hirotter22,2017-06-27T17:13:21.000Z,"TU Delft wind tunnel to gain aero advantage with  3D printed  mannequin of...
流れの計測手法が僕の研究テーマに関連してます  https:// xJud8&feature=share …",0,0,0,0
Shawna Bradshaw,@ShawnaMarie1974,2017-06-27T16:49:12.000Z,Turn up the heat. Enter now and you can win a game console or  3D printer  and 1 of 100s of smokin hot instant prizes  https://,0,0,0,0
#3DPrintingZone,@3DPrintingZone,2017-06-27T15:55:22.000Z,#3D  Printing Helps UCL and Microsoft Research Gamify Cystic Fibrosis Breathing Tr...  http:// #3DPrinter #3DScanners #3DTech,0,0,0,0
Sharon Harms,@Sharm6407,2017-06-27T15:46:00.000Z,New Scribbler DUO: The World’s First Dual-Nozzle  3D Printing  Pen Pre-Order Now:  http:// https:// 0ecf/?ref_=tsm_4_tw_p_tw … #giveaway,0,0,0,0
3D Printer Reviews,@3DPrintReviewer,2017-06-27T15:27:33.000Z,I Made  3D Printed  Shoes  http:// zKNEs&t=5s&index=1&list=PLPCx-1KKqYKx_J4fV6alU-LKt6IkWpdzs … </p>  http:// ted-shoes/ …,0,0,0,0
Fabbing,@fabbing,2017-06-27T17:02:12.000Z,"3D Printing  News Sliced Lockheed Martin, Porsche, Formlabs, MakerBot, SLM Solutions  http://",0,0,0,0
Theresa king,@Theresa53459366,2017-06-27T14:56:41.000Z,New Scribbler DUO: The World’s First Dual-Nozzle  3D Printing  Pen Pre-Order Now:  http:// https:// 0ecf/?ref_=tsm_4_tw_p_tw … #giveaway,0,0,0,0
Stockboard Media Inc,@stockboardinc,2017-06-27T15:06:16.000Z,"$SSYS  Announcing the MakerBot Educators Guidebook, the Definitive How-to on  3D Printing  in the Classroom... -  http://",0,0,0,0
Win a Supercar,@supercarcomp,2017-06-27T15:11:12.000Z,#Supercar  News: Divergent Blade  3D-printed  supercar visits Jay Leno's Garage - Motor Authority  http:// #WinASupercar,0,0,0,0
The Maker's Movement,@MAKERS_MOVEMENT,2017-06-27T17:11:43.000Z,3D printing  the next five years by Sander Adam CEO Leapfrog...  http://,0,0,0,0
Adam J. Penna,@AdamJPenna,2017-06-27T16:16:32.000Z,EOS has the most scaled to production metal  3D printing  installations. Another certified example of EOS organic grow… https://,0,0,0,0
carl.manz,@3Dfacts,2017-06-27T16:47:53.000Z,3D Printed  Aspie  http:// ie …,0,0,0,0
Vanessa Dalton,@krlvnsa,2017-06-27T16:01:41.000Z,New Scribbler DUO: The World’s First Dual-Nozzle  3D Printing  Pen Pre-Order Now:  http:// https:// 0ecf/?ref_=tsm_4_tw_p_tw … #giveaway,0,0,0,0
IMAGERS Atlanta,@IMAGERS,2017-06-27T15:50:20.000Z,Check out these environmental  #graphics  we created for last year's  @modatl 's  3D Printing  exhibit!  http:// #3dprinting #3d,0,2,2,0
#3DPrintingZone,@3DPrintingZone,2017-06-27T15:01:59.000Z,Renishaw embarks on Spanish Futuralve project for development of  #3D  printed aero...  http:// #4DPrinter #4DPrinters #3DTech,0,0,0,0
houstonfc,@houstonfc,2017-06-27T17:20:45.000Z,Here's how  3D printing  could save the lives of astronauts in space  http://,0,0,0,0
The Maker's Movement,@MAKERS_MOVEMENT,2017-06-27T17:11:48.000Z,Nano Dimension to  3D print  space electronics with Harris...  http://,0,0,0,0
Iyas AlQasem,@BeyondQuarter,2017-06-27T17:06:09.000Z,Reflow turns plastic waste into  3D print  filament to lift waste pickers out of poverty -  http:// urns-plastic-waste-into-3d-print-filament-to-lift-waste-pickers-out-of-poverty/ …,0,0,0,0
crazyarchitect.13,@crazyarchitect,2017-06-27T16:38:00.000Z,"Imperial College London introduces multimaterial  3D printer  for alloys, elastomers and resin …",0,0,0,0
$Stocknewsalerts,@Allstocknews,2017-06-27T15:04:23.000Z,"$SSYS  Announcing the MakerBot Educators Guidebook, the Definitive How-to on  3D Printing  in the Classroom
From our Stock News Alerts App",0,0,0,0
TURBOCAM International,@TurbocamIntl,2017-06-27T15:02:51.000Z,Our poster for  Additive Manufacturing  Day  @IGTI  Turbo Expo is up!  Come visit us at Booth #612.,0,2,0,0
3Druck,@Druck3D,2017-06-27T17:33:38.000Z,"http://  -  3D Printing  News Sliced Lockheed Martin, Porsche, Formlabs, MakerBot, SL...  http:// ndustry/~3/G9y9vsqyPEs/ …",0,0,0,0
Fabbing,@fabbing,2017-06-27T16:59:17.000Z,"3D Printing  Spotlight On: Erica Fung, Advanced Materials and Applications Material Scientist and Engineer, HP 3D…  http://",0,1,2,0
NIHL 3D Printing,@NIHL3D,2017-06-27T15:56:59.000Z,An implantable two axis micromanipulator made with a  3D printer  for recording neural activity in free-swimming fish. https://,0,0,0,0
doreen jeffries,@djeff1968,2017-06-27T15:49:05.000Z,New Scribbler DUO: The World’s First Dual-Nozzle  3D Printing  Pen Pre-Order Now:  http:// https:// 0ecf/?ref_=tsm_4_tw_p_tw … #giveaway,0,0,0,0
Rya Dwyer,@rya_dwyer,2017-06-27T15:31:58.000Z,"I entered a giveaway for a chance to win "" 3D Printer  Filaments - White 1.75 mm PLA Filam..."" by Worksteel.  https:// e9b0/?ref_=tsm_4_tw_p_tw … #giveaway",0,0,0,0
Business Wire-Edu,@BW_Education,2017-06-27T15:06:07.000Z,"Announcing the MakerBot Educators Guidebook, the Definitive How-to on  3D Printing  in the Classroom  http://",0,0,0,0
Tea & Crafting,@teaandcrafting,2017-06-27T16:45:12.000Z,Make beautiful and original  3D printed  jewellery? Join Grace 5 July to learn how and make some stunning jewellery  http://,0,0,0,0
NIHL 3D Printing,@NIHL3D,2017-06-27T15:56:10.000Z,Patient specific  3D printed  neurovascular phantoms to evaluate the clinical utility of a high resolution x-ray image  https://,0,2,1,0
Mara schiff,@lilyandkalani,2017-06-27T15:33:54.000Z,New Scribbler DUO: The World’s First Dual-Nozzle  3D Printing  Pen Pre-Order Now:  http:// https:// 0ecf/?ref_=tsm_4_tw_p_tw … #giveaway,0,0,0,0
Prof. Prokar Dasgupta OBE,@prokarurol,2017-06-27T16:26:30.000Z,"#BAUS17  Come and touch a  3D printed  prostate tomorrow at the eposter session on  #ProstateCancer  
Might reduce margins",0,0,0,0
Market Cheetah,@marketcheetah,2017-06-27T17:40:05.000Z,Optomec Showcases Aerosol Jet Systems for  3D Printed  Electronics at Sensors Expo  http:// omec-showcases-aerosol-jet-systems-for-3d-printed-electronics-at-sensors-expo/ …,0,0,0,0
Beth,@prospectorbeth,2017-06-27T15:54:57.000Z,Lily gave me a  3D Printer . This'll be really useful!,0,0,0,0
Additive Manufacturing Media,@AddMfgMedia,2017-06-27T17:20:22.000Z,Field-stretchable assembly reduces operating costs for  @EnvisionTEC #3Dprinters :  http://,0,0,0,0
Fabbaloo,@fabbaloo,2017-06-27T15:03:10.000Z,Earlier: Mosaic Manufacturing Announces the Palette+  3D Print  Multimaterial Accessory  http:// #3DPrinting,0,0,0,0
Roberto Alonso González Lezcano,@robertoglezcano,2017-06-27T15:51:32.000Z,"This house was  3D-printed  in under 24 hours and costs just $10,000",1,20,19,0
Deborah Wetzel,@DeborahWetzel1,2017-06-27T17:27:00.000Z,Virtual reality +  3D printing  = a new way to study the anatomy of the human heart  #engineering,0,0,0,0
Steve Howard,@landshoward,2017-06-27T17:27:45.000Z,Turn up the heat. Enter now and you can win a game console or  3D printer  and 1 of 100s of smokin hot instant prizes  https://,0,0,0,0
POP ATL,@POP_ATL_,2017-06-27T17:06:09.000Z,Just over here doing a little  3D Printing . The homie  @funkthaworld_   is gonna love this. Bring…  https://,0,0,0,0
3D Druck Magazin,@3Ddruckmag_ch,2017-06-27T16:56:04.000Z,"3D Printing  News Sliced Lockheed Martin, Porsche, Formlabs, MakerBot, SLM Solutions  http:// #3dprintindustry #3dprinting",0,0,0,0
PRV Engineering,@PRVEngineering,2017-06-27T14:57:38.000Z,Scribbler crafts world's first dual nozzle  #3D  printing pen  http://,0,0,0,0
amy,@Amcdaniels79,2017-06-27T16:06:20.000Z,"I entered a giveaway for a chance to win "" 3D Printer  Filaments - White 1.75 mm PLA Filam..."" by Worksteel.  https:// e9b0/?ref_=tsm_4_tw_p_tw … #giveaway",0,0,0,0
Shapeways,@shapeways,2017-06-27T14:47:39.000Z,"Could  3D-printing  change the way bridges are built, and help cut down on CO2 emissions in the process?  https:// printed-concerete-bridge-netherlands/ …",0,6,4,0
Brandon,@BrandonAught2,2017-06-27T16:03:34.000Z,New Scribbler DUO: The World’s First Dual-Nozzle  3D Printing  Pen Pre-Order Now:  http:// https:// 0ecf/?ref_=tsm_4_tw_p_tw … #giveaway,0,0,0,0
Fabbing,@fabbing,2017-06-27T17:02:36.000Z,"Imperial College London introduces multimaterial  3D printer  for alloys, elastomers and resin  http://",0,0,0,0
Manda Marshall,@insttechrocks,2017-06-27T15:23:48.000Z,"Mind blown!!  3D print  of a head that doctors practice surgery on when printed with materials that mimic real human hearts, brains, etc.",0,2,0,0
3d print,@Best3dprint,2017-06-27T16:48:54.000Z,"|  #3dprint  | ETH Zurich team creates all-concrete SkelETHon canoe built on slender ""bones""  http:// http:// …",0,0,0,0
Fillamentum.com,@Fillamentum,2017-06-27T16:01:30.000Z,Simple and elegant  3D printed  design of lightning by Mimokolektiv. Read more here  http://,0,6,1,0
Arciplex,@arciplex,2017-06-27T17:18:04.000Z,What is an “Accelerator” for  3D Print  Companies?  http:// #innovation #3Dprint #3Dprinting #engineering #startup #manufacture,0,0,0,0
Jim Kremer,@Kremerjim,2017-06-27T15:59:33.000Z,Automata cams  3d printed . @iTeachPLTW teaching the tools of the trade.  @PLTWorg #PLTWCT17,0,2,4,0
SPI News,@NewsFromSPI,2017-06-27T15:05:06.000Z,"Announcing the MakerBot Educators Guidebook, the Definitive How-to on  3D Printing  in the Classroom  http://",0,0,0,0
causality.io,@causalitydotio,2017-06-27T15:09:02.000Z,Jay Leno takes Divergent Microfactories  3D printed  Blade supercar for a spin |  #makerspace #stem http:// leno-takes-divergent-microfactories-3d-printed-blade-supercar-for-a-spin/ … Television ...,0,0,0,0
Hope on Future,@itshopeonfuture,2017-06-27T15:33:16.000Z,Cool hand-cranked laser show made from  3D printed  parts / Boing Boing  http:// ked-laser-show-made-from-3d-printed-parts-boing-boing/?utm_source=ReviveOldPost&utm_medium=social&utm_campaign=ReviveOldPost …,0,0,0,0
#3DPrintingZone,@3DPrintingZone,2017-06-27T16:55:22.000Z,"#3D  Printing Spotlight On: Erica Fung, Advanced Materials and Applications Material...  http:// #3DScanning #3DScan #3DPrint",0,0,0,0
Kohei Kurihara - Privacy for all together,@kuriharan,2017-06-27T17:30:00.000Z,"Learn. Airless,  3D-printed  concept tires can't go flat, never need replacement  https:// rinted-tire-michelin-concept/ …  via  @DigitalTrends #marketing",0,0,0,0
Sangeetha,@sangkhus,2017-06-27T16:01:31.000Z,3D printing  the next five years by Sander Adam CEO Leapfrog  https://,0,0,0,0
Anurag Saxena,@AnuragFun,2017-06-27T15:04:55.000Z,Sculpteo online  3D printing  service.45 materials available + free tools – fast delivery and worldwide shipping....  http://,0,0,0,0
Hattons Model Railways,@HattonsModels,2017-06-27T16:00:18.000Z,Last week was hot but we're already preparing for snow! Check out the  3D printed  sample of our Beilhack ZZA:  https://,2,6,2,0
Baby Kay,@BabyKay0501,2017-06-27T16:45:27.000Z,New Scribbler DUO: The World’s First Dual-Nozzle  3D Printing  Pen Pre-Order Now:  http:// https:// 0ecf/?ref_=tsm_4_tw_p_tw … #giveaway,0,0,0,0
InCo Projects,@incoprojects,2017-06-27T14:48:22.000Z,An interesting piece on the use of  3D printing  in construction in  @TheEconomist http:// nd-technology/21722820-think-spiderweb-floors-denser-skyscrapers-and-ultra-thin-bridges-3d-printing-and?fsrc=scn/tw/te/bl/ed/hightechconstruction3dprintingandclevercomputerscouldrevolutioniseconstruction …,0,0,0,0
Feralpaw,@Feralpaw,2017-06-27T17:16:23.000Z,"I entered a giveaway for a chance to win "" 3D Printer  Filaments - White 1.75 mm PLA Filam..."" by Worksteel.  https:// e9b0/?ref_=tsm_4_tw_p_tw … #giveaway",0,0,0,0
3DPRobo,@3dprinterRobo,2017-06-27T16:54:34.000Z,"Imperial College London introduces multimaterial  3D printer  for alloys, elastomers and resin  http://",0,0,0,0
Printing News,@commercial_ptng,2017-06-27T16:38:14.000Z,"#Prodways  Introduces New  3D Printed  Footwear Materials and Solutions, Collaborates with Nike. Read more:  http://",0,0,0,0
Scarlet O'Hara,@Scowt23,2017-06-27T15:31:35.000Z,New Scribbler DUO: The World’s First Dual-Nozzle  3D Printing  Pen Pre-Order Now:  http:// https:// 0ecf/?ref_=tsm_4_tw_p_tw … #giveaway,0,0,0,0
݁,@chungf,2017-06-27T15:43:34.000Z,Where can I  3D print  myself a copy of this Herschel polyhedron?  http:// eahedron-for-herschel/ …,0,0,0,0
freethesquirls,@freethesquirls,2017-06-27T15:03:15.000Z,"I liked a  @YouTube  video  http://  XRobots - How to Build an Iron Man Helmet & Suit, Moulding, Casting,  3D Printing ,",0,0,0,0
GreyLocke/Mark,@txfellowship,2017-06-27T14:53:41.000Z,3D Printing  Lawsuits - Just3DPrint(It) vs Stratasys TechCrunch and others  https://,0,0,0,0
Eric Hilary Smith I,@dabyronicred,2017-06-27T17:19:52.000Z,"I've just posted on my Blog about: Airless,  3D-printed  concept tires can’t go flat, never need replacement •...  http://",0,0,0,0
Arndt,@Disruptive42,2017-06-27T17:02:45.000Z,"Using an available  3D printer , college student Amos Dudley was able to fix his teeth and craft his own retainer. http:// t-straightens-teeth-3d-printed-retainers-made/ …",0,0,0,0
Creed Bratton,@creeedbratton,2017-06-27T15:46:36.000Z,rss test 2 Food Ink – The World’s First  3D Printing  Restaurant  http://,0,0,0,0
Acondel,@Acondel_,2017-06-27T14:57:42.000Z,Renishaw embarks on Spanish Futuralve project for development of  3D printed  aerospace turbines -  http:// ks-on-spanish-futuralve-project-for-development-of-3d-printed-aerospace-turbines/ …  - -  #3DPrinting,0,0,0,0
crazyarchitect.13,@crazyarchitect,2017-06-27T17:22:45.000Z,British metal  3D printer  manufacturer Renishaw to create high-speed aerospace turbines  http://,0,0,0,0
HMH,@TheTeacherRoom,2017-06-27T15:30:03.000Z,Congratulations to our 1st winner of a  3D Printer ! Visit us today for another chance to win! Booth 1518  #ISTE17,0,0,0,0
小河流水,@hezhishang,2017-06-27T17:19:58.000Z,"New post: Imperial School London introduces multimaterial  3D printer  for alloys, elastomers and resin -  3D Printing  Trade -",0,0,0,0
Charles Russo,@Charles_M_Russo,2017-06-27T16:42:30.000Z,"Imperial College London introduces multimaterial  3D printer  for alloys, elastomers and resin  https:// college-london-introduces-multimaterial-3d-printer-alloys-elastomers-resin-117068/ …",0,0,0,0
Silvio De Santiago,@DriveAssisst,2017-06-27T15:55:05.000Z,3D printing  the next five years by Sander Adam CEO Leapfrog  http:// #3Dprinting,0,0,2,0
3D Open Hardware,@3DOpenHardware,2017-06-27T17:30:54.000Z,"Professional CNC-Controller for mill, turn,  3D print , cut...  http://",0,0,0,0
Melissa Allen,@Missy82783,2017-06-27T15:49:35.000Z,Turn up the heat. Enter now and you can win a game console or  3D printer  and 1 of 100s of smokin hot instant prizes  https://,0,0,0,0
ManufacturingProduct,@__Manufacturing,2017-06-27T17:03:30.000Z,#5: EAONE 14PCS M6  3D Printer  0.2mm 0.3mm 0.4mm 0.5mm 0.6mm 0.8mm 1.0mm Extruder Brass Nozzle…  https:// #Additive #Products,0,0,0,0
The Maker's Movement,@MAKERS_MOVEMENT,2017-06-27T15:08:58.000Z,ViscoTec launches two-component printhead for  3D printing  in...  http://,0,0,0,0
ISU Library @ISUnet,@library_isu,2017-06-27T15:55:54.000Z,Enterprise In Space Program Announces Winners for Its Print The Future Competition to  3D Print  on ISS  http://,0,0,0,0
3Ders.org 3D Printing News,@3dersorg,2017-06-27T14:48:40.000Z,Renishaw embarks on Spanish Futuralve project for development of  3D printed #aerospace  turbines  http:// 627-renishaw-embarks-on-spanish-futuralve-project-for-development-of-3d-printed-aerospace-turbines.html … #3Dprinting,0,6,5,0
Gregory Branch,@gregbranch,2017-06-27T17:23:02.000Z,5 things  #Africans  need to know about  3D printing .  It is revolutionizing manufacturing -  https:// https://,0,0,0,0
3D Druck Magazin,@3Ddruckmag_ch,2017-06-27T17:26:16.000Z,British metal  3D printer  manufacturer Renishaw to create high-speed aerospace turbines  http:// #3dprintindustry #3dprinting,0,0,0,0
Anil Monga,@anilmonga55,2017-06-27T16:20:33.000Z,"Melca 1.75  3D Printer  Filament PLA 1kg +/- 0.03mm, Black  http:// printer-filament-pla-1kg-0-03mm-black/ …",0,0,0,0
PaduWaras Networks,@PaduWarasID,2017-06-27T15:06:04.000Z,#PaduWaras  blue painters tape  3d printing https://,0,0,0,0
3D Open Hardware,@3DOpenHardware,2017-06-27T14:41:20.000Z,3D Print  2 small items  http://,0,0,0,0
3D Printing News,@My3DPrinting,2017-06-27T15:10:01.000Z,. @ViscoTec  Introduces Two-Component Print Head for  #3DPrinting  Viscous Materials https:// c-viscous-3d-printing/ …,0,2,0,0
Judy Banks,@judyabanks1,2017-06-27T16:43:17.000Z,Turn up the heat. Enter now and you can win a game console or  3D printer  and 1 of 100s of smokin hot instant prizes  https://,0,0,0,0
Moulds & Plastics,@MouldsPlastics,2017-06-27T16:58:47.000Z,"3D Printing  Spotlight On: Erica Fung, Advanced Materials and Applications Material Scientist and Engineer, HP 3D P…  http://",0,0,0,0
ThePartyElements,@_Party_Elements,2017-06-27T15:54:02.000Z,Fun with the  3D printer ! Kings for our chess promo,0,0,0,0
Fabbing,@fabbing,2017-06-27T17:25:08.000Z,British metal  3D printer  manufacturer  #Renishaw  to create high-speed  #aerospace  turbines  http:// #3DPrinting,0,0,0,0
Blitz,@Darkspiral_94,2017-06-27T15:55:42.000Z,French  3D printing  firm unveils additive forging for aerospace - The Engineer  http://,0,0,0,0
3DPRobo,@3dprinterRobo,2017-06-27T17:24:42.000Z,British metal  3D printer  manufacturer Renishaw to create high-speed aerospace turbines  http://,0,0,0,0
Stephanie Williams,@sdwilliams08,2017-06-27T17:25:03.000Z,3D printing . Let's go!,0,2,0,0
BAF,@BFriedle,2017-06-27T17:01:47.000Z,"futurism: Using an available  3D printer , college student Amos Dudley was able to fix his teeth and craft his own r…  http:// t-straightens-teeth-3d-printed-retainers-made/ …",0,0,0,0
Random Tweet Machine,@554BOT,2017-06-27T16:43:05.000Z,3D print  12ft long,0,0,0,0
Whip Mix,@WhipMixCorp,2017-06-27T14:45:00.000Z,The introduction of  3d printing  brings new challenges when printing parts for burnout.  http://,0,0,0,0
Extruder Joe,@ExtruderJoe,2017-06-27T17:28:25.000Z,"3D Printing : The Protonium High-Speed, High Resolution Delta  3D Printer http:// fabbaloo/default~The-Protonium-HighSpeed-High-Resolution-Delta-D-Printer …",0,0,0,0
TechKnowledgeIt.com,@TechKnowledgeIt,2017-06-27T17:02:17.000Z,A Crash Course in Thingiverse Customizer: OpenSCAD is a great way to create objects for  3D printing  (or other...  http://,0,0,0,0
Zakk ザック,@YuriyZakk,2017-06-27T15:07:59.000Z,3D printed  fidget spinner -_-,0,3,0,0
heather,@heatherysp,2017-06-27T16:48:22.000Z,New Scribbler DUO: The World’s First Dual-Nozzle  3D Printing  Pen Pre-Order Now:  http:// https:// 0ecf/?ref_=tsm_4_tw_p_tw … #giveaway,0,0,0,0
Go Vols!,@RickJaneway,2017-06-27T15:31:15.000Z,New Scribbler DUO: The World’s First Dual-Nozzle  3D Printing  Pen Pre-Order Now:  http:// https:// 0ecf/?ref_=tsm_4_tw_p_tw … #giveaway,0,0,0,0
Ziko,@Ziko_3D,2017-06-27T17:10:00.000Z,Siemens joins  #Adidas  SPEEDFACTORIES project for custom  3D printed #Sportswear http:// #3DPrinting,0,0,0,0
thomas quinn,@ttpjquinn,2017-06-27T16:40:48.000Z,Turn up the heat. Enter now and you can win a game console or  3D printer  and 1 of 100s of smokin hot instant prizes  https://,0,0,0,0
Charles Russo,@Charles_M_Russo,2017-06-27T16:21:32.000Z,3D Printing  Helps UCL and Microsoft Research Gamify Cystic Fibrosis Breathing Treatment  https:// ce-computer-game/ …,0,0,0,0
Alex Ignatius,@aleksignatius,2017-06-27T17:15:52.000Z,US Navy to shore up  3D printing  security with blockchain - The U.S. Navy's innovation arm says it plans to use ...  http://,0,0,0,0
Luis,@luis_avalos87,2017-06-27T14:53:27.000Z,New Scribbler DUO: The World’s First Dual-Nozzle  3D Printing  Pen Pre-Order Now:  http:// https:// 0ecf/?ref_=tsm_4_tw_p_tw … #giveaway,0,0,0,0
Bonnie Tran,@MsTranClass,2017-06-27T17:03:21.000Z,Our S's parent is here with her  3D printer  to print our keychains. The class is buzzing with excitement! @RJLANGTDSB  @TDSB_STEM,0,12,1,0
Market Cheetah,@marketcheetah,2017-06-27T15:10:09.000Z,"Announcing the MakerBot Educators Guidebook, the Definitive How-to on  3D Printing  in the Classroom  http:// ouncing-the-makerbot-educators-guidebook-the-definitive-how-to-on-3d-printing-in-the-classroom/ …",0,0,0,0
3Druck,@Druck3D,2017-06-27T17:33:35.000Z,http://  - British metal  3D printer  manufacturer Renishaw to create high-speed aero...  http:// ndustry/~3/1ychheNy2Aw/ …,0,0,0,0
Not A Games Dev Ollie,@Reksaurian,2017-06-27T14:52:47.000Z,Apparently I Missed The Day...  https://,0,0,0,0
trishia drury,@trishiardrury29,2017-06-27T16:43:59.000Z,New Scribbler DUO: The World’s First Dual-Nozzle  3D Printing  Pen Pre-Order Now:  http:// https:// 0ecf/?ref_=tsm_4_tw_p_tw … #giveaway,0,0,0,0
Tanya Fell,@TanyaFell1,2017-06-27T16:03:16.000Z,New Scribbler DUO: The World’s First Dual-Nozzle  3D Printing  Pen Pre-Order Now:  http:// https:// 0ecf/?ref_=tsm_4_tw_p_tw … #giveaway,0,0,0,0
Extruder Joe,@ExtruderJoe,2017-06-27T16:24:57.000Z,3D Printing : US Navy to shore up  3D printing  security with blockchain  http:// 627-us-navy-to-shore-up-3d-printing-security-with-blockchain.html …,0,0,0,0
Not A Games Dev Ollie,@Reksaurian,2017-06-27T15:17:05.000Z,Flood warnings as Britain set to be hammered by heavy rain http:// 7/flood-warnings-britain-set-hammered-heavy-rain/amp/ … - GUD. I need to get paid FFS.,0,0,0,0
Eric Hilary Smith I,@dabyronicred,2017-06-27T17:19:48.000Z,"I've just posted on my Blog about: Airless,  3D-printed  concept tires can’t go flat, never need replacement • r/tec…  http://",0,0,0,0
ZBRELLA,@ZBRELLA,2017-06-27T15:50:20.000Z,"Put Your Feet Up & Listen to zbrella Hosts Talk  #Drones ,  #Robots ,  3D Printing  & More in  #Construction .  http://",0,0,0,0
Sangeetha,@sangkhus,2017-06-27T16:01:18.000Z,3D printing  the next five years by Sander Adam CEO Leapfrog  https://,0,0,0,0
Alt on Innovation,@Alt_ivate,2017-06-27T16:10:35.000Z,3D Printing  the 1952 Porsche 356 Engine  http:// 465422?read=https%3A%2F%2F3dprint.com%2F178403%2F3d%2Dprinting%2Dporsche%2Dengine%2F … #3dprinting,0,0,0,0
Debbie van Steenpaal,@steenpaal,2017-06-27T16:36:23.000Z,"Waarom managers meer bezig zouden moeten zijn met social media (i.p.v. AI,  3D-printing  & IoT) | Elja   Daae   https:// anagers-meer-bezig-zouden-moeten-zijn-met-social-elja-daae …",0,0,0,0
Franz Dill,@franzd,2017-06-27T17:05:02.000Z,3D Printing  and Retail  http:// nting-and-retail.html … #3DPrinting #Retail #Markets,0,0,0,0
Eric Hilary Smith I,@dabyronicred,2017-06-27T17:20:06.000Z,"I've just posted on my Blog about: Airless,  3D-printed  concept tires can’t go flat, never need replacement • r/tec…  http://",0,0,0,0
Lock Fun,@satoyumiko11,2017-06-27T15:17:09.000Z,Summer Beach Gym Tights Elastic Quick-drying Superman  3D Printed  T-shirts Short Sleeve Running Training Suit  http:// 8179b045c136 …,0,0,0,0
Nikhil Jain,@nikhilchhajar,2017-06-27T17:01:35.000Z,"#researchpreneur #Twitter #Futurism  Using an available  3D printer , college student Amos Dudley was able to fix his teeth and craft his own …",0,0,0,0
Aubrey Daniels,@AubreyDaniels12,2017-06-27T16:48:56.000Z,New Scribbler DUO: The World’s First Dual-Nozzle  3D Printing  Pen Pre-Order Now:  http:// https:// 0ecf/?ref_=tsm_4_tw_p_tw … #giveaway,0,0,0,0
Ella collins,@Ellacol93312478,2017-06-27T16:29:45.000Z,New Scribbler DUO: The World’s First Dual-Nozzle  3D Printing  Pen Pre-Order Now:  http:// https:// 0ecf/?ref_=tsm_4_tw_p_tw … #giveaway,0,0,0,0
hugh garry,@huey,2017-06-27T15:30:36.000Z,If you get a moment please vote for Sasha's  3D Printed  LifeCycle bespoke saddle design  #MLGyournova http:// 5_LrFoMw.twitter …,0,0,0,0
Steve Scor,@3DPrinterDepot1,2017-06-27T16:23:10.000Z,US Navy to shore up  3D printing  security with blockchain,0,0,0,0
telecomsnews.gr,@telecomsnewsgr,2017-06-27T16:20:35.000Z,3D Printing  εφαρμογή της χρονιάς τα πτερύγια αεριοστροβίλων της Siemens  http://,0,0,0,0
BGDG of Utah,@bgdgofutah,2017-06-27T15:34:48.000Z,"One of our guild members, Joseph Larson has launched another Kickstarter dealing with a  3D printing  of the...  http://",0,2,1,0
Lawrence G. Miller (Larry Miller),@lawrencegmiller,2017-06-27T15:45:15.000Z,MakerBot Debuts  3D Print  Manager for Schools |  http:// #3Dprinting #edtech @Campus_Tech @makerbot @isteconnects,0,0,0,0
#3DPrintingZone,@3DPrintingZone,2017-06-27T15:01:51.000Z,3D-printing  catalytic applications  http:// #3DScans #3DPrinting #3DScanner,0,0,0,0
Curso 3D Printing,@Curso3DPrinting,2017-06-27T17:23:39.000Z,British metal  3D printer  manufacturer Renishaw to create high-speed aerospace turbines  http://,0,0,0,0
Frank C. Lindner,@Tech2Mark,2017-06-27T15:46:22.000Z,"3D printing  plays a major role in today’s printing industry. Mostly  3D-printed  objects come in a ribbed, sharp...  http://",0,0,0,0
Verbatim EMEA,@VerbatimEurope,2017-06-27T17:08:05.000Z,Want to test out our filaments for  3D Printing ?  You can now order 10m samples directly from the website -  http://,0,0,0,0
#3DPrintingZone,@3DPrintingZone,2017-06-27T16:01:30.000Z,Ultimaker Expands Materials and Enhancements for Enterprise Desktop  #3D  Print...  http:// #3DScanning #3DModeling #3DPrinted,0,2,1,0
LanaBetty,@LanaBetty,2017-06-27T16:17:08.000Z,"In case you missed it, here you go   Three Hexagon Earrings //  3d printed  steel brass silver drop earrings //... http://",0,2,0,0
