Author Name,Author ID,Date,Post Text,Replies,Likes,Reshares,Views
Ozan UCAR,@ucarozan,2017-11-12T17:42:41.000Z,How Face ID bypassed by  3D printer  ? http:// iew_content/content/103968/face-id-beaten-by-mask-not-an-effective-security-measure …,0,7,3,0
TMG official account,@tmgco,2017-11-12T22:51:05.000Z,Look here for the latest news on  3D printing  of body parts:  http://,0,0,0,0
"Department of Industry, Science and Resources",@IndustryGovAu,2017-11-12T23:56:02.000Z,#InnovationWk  case study: Vic firm Anatomics collaboration w  @CSIRONews  creates world’s first  3D-printed  body parts:  http://,0,8,11,0
Justin D. Long,@justindlong,2017-11-12T21:02:03.000Z,Metal  3D printing  at 100 times the speed and a twentieth of the cost  https://,0,0,0,0
KC DAO,@KansasCityDAO,2017-11-12T18:56:30.000Z,http://  Men's Adidas 4D Futurecraft Runner  3D Printed  Size 11 - New Authentic!,0,0,0,0
Catherine,@catranw,2017-11-12T19:54:23.000Z,Just entered to win a STANLEY® Model 1  3D Printer  courtesy of  @dudeshopping !  http://,0,2,0,0
Rebecca Davison,@peachesnsuch,2017-11-12T17:27:41.000Z,"I entered a giveaway to win ""SainSmart x Anet A8 Prusa i3  3D Printer ..."" by  #SainSmart !  #GiveToEmpower https:// 7993/?ref_=tsm_4_tw_p_tw … #giveaway",0,0,0,0
David Skerrett,@skegz,2017-11-12T21:34:35.000Z,The iPhone X's Face ID can be broken with a  3D printer  and a whole lot of time - BGR  https:// VbYHODwGQ …,0,0,0,0
Luanne Lawler,@cmcdol1,2017-11-12T19:32:49.000Z,Just entered to win a STANLEY® Model 1  3D Printer  courtesy of  @dudeshopping !  http://,0,0,0,0
Modern Metals,@ModernMetalsMag,2017-11-13T00:00:51.000Z,Why  3D printing  aircraft is now possible.  http://  @edgylabsdotcom,0,2,0,0
Tonetta Coleman,@pepusc,2017-11-12T22:23:49.000Z,Just entered to win a STANLEY® Model 1  3D Printer  courtesy of  @dudeshopping !  http://,0,0,0,0
3D Printing,@Just_Print_It,2017-11-12T17:09:48.000Z,"http://  -  #3dprinting  News Roundup: Updates to Materialise software, SLM partners with Authentise, more  http:// 109-3d-printing-news-roundup-carbons-biocompatible-sil-30-resin-nuvasive-materialise-slm-authentise.html …",0,1,2,0
Joel Telling - 3D Printing Nerd,@joeltelling,2017-11-12T23:26:28.000Z,The  @josefprusa  machines are printing PLA and ABS for one of my kid's science fair projects!,3,26,1,0
Madame Curie,@Mariek2525,2017-11-12T22:18:49.000Z,Just entered to win a STANLEY® Model 1  3D Printer  courtesy of  @dudeshopping !  http://,0,0,0,0
prismperfect,@prismperfect,2017-11-12T19:20:51.000Z,Want to win STANLEY® Model 1  3D Printer ? I just entered to win and you can too.  http://,0,0,0,0
vixentael,@vixentael,2017-11-12T22:50:27.000Z,FaceID vs  3d printed  mask. Mask won.  http:// iew_content/content/103968/face-id-beaten-by-mask-not-an-effective-security-measure …,1,11,8,0
3D Printing,@Just_Print_It,2017-11-12T18:48:11.000Z,Materialise to show 'next innovation in metal  #3dprinting ' software at formnext  https:// mnext-powered-by-tct/materialise-show-next-innovation-metal-3d-printing/ …,0,3,2,0
Mark Toney,@bonzomark,2017-11-12T20:55:27.000Z,Just entered to win a STANLEY® Model 1  3D Printer  courtesy of  @dudeshopping !  http://,0,2,0,0
News Assistant,@NewsAssistant,2017-11-12T21:00:55.000Z,The  #iPhone #X #Face #ID  can be  #broken  with a  #3D #printer #and  a  #whole #lot  of  #time #technology #news #NewsAssistant http:// e-id-security-how-to-hack-picture-mask/ …,0,0,0,0
Jason Hysell,@JHysell68,2017-11-13T00:13:03.000Z,"I entered a giveaway to win ""SainSmart x Anet A8 Prusa i3  3D Printer ..."" by  #SainSmart !  #GiveToEmpower https:// 7993/?ref_=tsm_4_tw_p_tw … #giveaway",0,0,0,0
D1g1t@l©0d3®,@edeiller,2017-11-12T18:12:03.000Z,"Singapore’s Offshore and Marine Sector Boosts Global Edge with  3D Printing  | 3D…  https:// re-offshore-and-marine/ … , see more  http://",0,0,0,0
Salisu Bako,@freshsalis,2017-11-12T20:27:09.000Z,ggtechmy: The iPhone X's Face ID can be broken with a  3D printer  and a whole lot of time - BGR  http://,0,0,0,0
MatterHackers,@MatterHackers,2017-11-12T18:00:26.000Z,"We know that issues can sometimes happen with your  #3Dprints , so that's why we created an in-depth article on how to help! Of course, you can always contact our awesome  3D printer  pros at support@matterhackers.com. Check out the guide here:  https://",1,18,4,0
Rodolfo Luiz,@RLuiz_BR,2017-11-12T23:09:23.000Z,Gostei de um vídeo  @YouTube http:// WESOME … 3D Printed  Rick Sanchez - Creality CR-10 Print!,0,0,0,0
Formfeuer,@formfeuer,2017-11-12T17:40:25.000Z,"4 Fun DIY  3D Printing  Projects - portable rail-gun, duplicate keys, aquatic car tires, customized doors…  http:// #3dprint  …",0,0,0,0
Anna Maria,@AnnaLoudenback,2017-11-12T17:37:42.000Z,"I entered a giveaway to win ""SainSmart x Anet A8 Prusa i3  3D Printer ..."" by  #SainSmart !  #GiveToEmpower https:// 7993/?ref_=tsm_4_tw_p_tw … #giveaway",0,0,0,0
All3DP,@All3DP,2017-11-12T18:07:05.000Z,"Eggs, Bread,  3D Printer , Chicken Nuggets.... Balco  3D Printer  on Sale for £300 at UK Aldi for the First Time  https:// er-sale-300-uk-aldi-first-time/ …",0,2,1,0
3D Printing,@Just_Print_It,2017-11-12T19:54:01.000Z,SLM Solutions to showcase SLM 800 live at formnext  https:// mnext-powered-by-tct/slm-solutions-to-showcase-slm-800-live-at-formnext/ …,0,0,0,0
Markus Kruse,@KruseMarkus,2017-11-12T19:41:51.000Z,I added a video to a  @YouTube  playlist  http://  TA-12 transport stop motion with  3D printed  terrain,0,0,0,0
Jeferson Lima,@Jelimax,2017-11-12T18:28:07.000Z,Gostei de um vídeo  @YouTube http:// earn …  to  3D Print  || Learn Quick,0,0,0,0
Sculpteo,@sculpteo,2017-11-12T18:15:06.000Z,Have you ever dreamed of working for a leading company in  3D printing  industry? Check out  @Sculpteo  job opening positions and maybe you find a match!   https:// #hiring #job #jobopening #carrer #CV,0,2,1,0
Superkamiwaifu,@SuperKamiWaifu,2017-11-12T20:27:29.000Z,Mr. Pointy prop made by  3D Printing  Egg on Etsy.  #makeuptest #cosplaytest #cosplans #buffy …  https://,0,0,0,0
Amit Dilip Sawant,@coolamitsawant5,2017-11-12T19:02:05.000Z,FUTURA TECH EVENT | ENGG. EVENT | MINI DRONE |  3D PRINTER  | PVPPCOE:  http://  via  @YouTube,0,0,0,0
diego garibay,@diegolicenciado,2017-11-12T17:34:31.000Z,Liked on YouTube: What if  3D printing  was 100x faster? | Joseph DeSimone  https://,0,0,0,0
Steve Scor,@3DPrinterDepot1,2017-11-12T17:37:43.000Z,"4 Fun DIY  3D Printing  Projects - portable rail-gun, duplicate keys, aquatic car tires, customized doors",0,0,0,0
Steve Spano,@srspano,2017-11-13T00:15:18.000Z,"I entered a giveaway to win ""SainSmart x Anet A8 Prusa i3  3D Printer ..."" by  #SainSmart !  #GiveToEmpower https:// 7993/?ref_=tsm_4_tw_p_tw … #giveaway",0,0,0,0
Laura bernard,@Iwubcats,2017-11-12T17:33:09.000Z,Help me win a  3D printer  with  @All3DP !  https://,0,0,0,0
3Dsteampen(3D스팀펜),@thesteampen,2017-11-12T20:06:13.000Z,Fun and exciting  3D printing  pen movie collection on youtube  #3Dprint #3Dpen #3dprintingpen #stencil,0,0,0,0
3D Bee,@3DBeeA,2017-11-12T18:04:16.000Z,"4 Fun DIY  3D Printing  Projects -  3D printed  portable rail-gun, duplicate keys, aquatic car tire..  #3D #bhivelabs http://",0,0,0,0
Phil Lorigo,@plorigo,2017-11-12T19:39:42.000Z,just  3D printed  some thoughts and prayers,4,65,17,0
Repton Design and Technology,@ReptonDesign,2017-11-12T19:46:30.000Z,"Some great examples of iterative design, collaborative thinking, and now  3D printing  on  #BBC2 #BigLifeFix @BBCTech @Ultimaker",0,3,0,0
Susan Miner,@FinsnfurSusan,2017-11-12T22:26:11.000Z,"I entered a giveaway to win ""SainSmart x Anet A8 Prusa i3  3D Printer ..."" by  #SainSmart !  #GiveToEmpower https:// 7993/?ref_=tsm_4_tw_p_tw … #giveaway",0,0,0,0
Iman Suherman,@sapi_biru_lucu,2017-11-12T20:22:35.000Z,The iPhone X's Face ID can be broken with a  3D printer  and a whole lot of time - BGR  http:// #technology,0,0,0,0
Dev Diner,@DevDiner,2017-11-12T21:53:07.000Z,An Arduino-powered walking robot that is fully  3D printed !  https:// #robot #IoT #Arduino,0,3,1,0
Not A Games Dev Ollie,@Reksaurian,2017-11-12T23:52:42.000Z,"Besides, I calculated that 0 to -500 bank debt allows me 20/month fee, and I need 500, so once I hit 0 its not terrible getting the printer and exchanging Elder Scrolls Legends for learning how to model and paint. I just cant do that with -1000 to -1500 because its 60/month fee.",0,0,0,0
Ian,@yanster57,2017-11-12T19:03:29.000Z,"Anyone with an interest in  3D Printing  give this Youtube channel a like, awesome prints and well worth a watch http://",0,0,0,0
Nexus Governance,@NexusGov,2017-11-12T19:25:48.000Z,Cheap  #3D  printing enclosure ...  #VR #VRGames #Drone #Gaming http://  | D ... -  https:// ing-enclosure-modified-to-add-heat-results-video/ … https:// oads/2017/11/cheap-3d-printing-enclosure-modified-to-add-heat-results-video.jpg … #3dPrinted #3dPrinter  ...,0,0,0,0
OpenSource Economy,@OpenSourceTimes,2017-11-12T17:16:03.000Z,The iPhone X's Face ID can be broken – with a  3D printer  and a lot of time  http://   -  #3Dprinting,0,0,0,0
Tech News HQ,@TechNewsHQ,2017-11-12T20:20:36.000Z,The iPhone X's Face ID can be broken with a  3D printer  and a whole lot of time - BGR  http://,0,0,0,0
RSS Deal Feed,@RSSDealFeeds,2017-11-12T18:31:08.000Z,ad: HATCHBOX 1.75mm HIPS for ABS  3D Printer  Filament - 1kg Spool (2.2 lbs) - Dimensional Accuracy +/- 0.05mm -  http:// #3DPrinting,0,0,0,0
Zanshuri,@Zanshuri,2017-11-12T23:45:04.000Z,Algorithm cuts  3D printing  time in half - Futurity  http://,0,0,0,0
Dr. Isaad Sainkoudje,@dr_sainkoudje,2017-11-12T21:23:42.000Z,3D-Printed  Drug Ushers in Era of Downloadable Medicine ☞  https:// st-3d-printed-drug-ushers-in-era-of-downloadable-medicine/?utm_content=buffer19840&utm_medium=social&utm_source=twitter-su&utm_campaign=buffer … #xMed #3Dprinting #levetiracetam #FDA,0,4,3,0
Matthieu Laverne,@MattYooh,2017-11-12T17:08:26.000Z,HP launches new materials and Jet Fusion upgrade with 4210  3D printing  system  https://,0,0,0,0
Not A Games Dev Ollie,@Reksaurian,2017-11-12T23:47:46.000Z,I hate my life.,0,0,0,0
Nexus Governance,@NexusGov,2017-11-12T23:02:15.000Z,Flexible Filament  #3D  Printing on the  #CR -10  #VR #VRGames #Drone #Gaming http://  | Datacracy Marketplace -  https:// ent-3d-printing-on-the-cr-10/ … https:// oads/2017/11/flexible-filament-3d-printing-on-the-cr-10.jpg … #3dPrinting #DroneVideos  ...,0,0,0,0
Claire Marshall,@greeneyesclaire,2017-11-12T19:43:28.000Z,3D printed  moulds making 3D tasty treats,0,0,0,0
Mondrain AE,@Mondrianae,2017-11-12T17:41:48.000Z,An Industry First: Carbon Introduces New  3D Printing  Silicone And Biocompatibility of Si...  http://,0,0,0,0
alberta_magnus,@lakebum4life,2017-11-12T19:19:24.000Z,Want to  #win  STANLEY® Model 1  3D Printer ? I just entered to win and you can too.  http://,0,0,0,0
TechnologyAU,@TechGovAu,2017-11-12T23:52:02.000Z,#InnovationWk  showcase: Vic firm Anatomics works with  @CSIRONews  to create world’s first  3D-printed  body parts:  http://,0,10,5,0
Sam,@SewingGardner,2017-11-13T00:07:13.000Z,Just entered to win a STANLEY® Model 1  3D Printer  courtesy of  @dudeshopping !  http://,0,0,0,0
daringdicestudio,@daringdiceshop,2017-11-12T20:07:47.000Z,Check out my shop for some sweet  3d printed  terrain.  #dragonlock http://,0,0,0,0
Nexus Governance,@NexusGov,2017-11-13T00:21:07.000Z,"Today's  #3D  Print 147 Deal Alert 11 11 Printer Sale CR 10s, CR 10 Mini, Tevo Tornado  #VR #VRGames #Drone #Gaming http://  | Datacracy Marketplace - ...",0,0,0,0
doddy sulastiko,@DoddySulastiko,2017-11-12T18:47:23.000Z,Tas Pouch Makeup Kosmetik  3D Printing https:// ta/tas-wanita/pouch-bags/ccren9-jual-tas-pouch-makeup-kosmetik-3d-printing?utm_source=twitter&utm_medium=sharelapak&utm_campaign=socmed …,0,0,0,0
Durham 3D Printing,@durham3dprint,2017-11-12T18:36:05.000Z,Our WinGun 7-BB Shotgun Shells are now available through Shapeways!  https:// 7SG/airsoft-wingun-revolver-compatible-6mm-7-bb-shotgu?optionId=64050065 … #Airsoft #WinGun,0,0,0,0
ashley porter,@ajarman0,2017-11-12T23:10:10.000Z,"I entered a giveaway to win ""SainSmart x Anet A8 Prusa i3  3D Printer ..."" by  #SainSmart !  #GiveToEmpower https:// 7993/?ref_=tsm_4_tw_p_tw … #giveaway",0,0,0,0
Jessie,@tubbybutt,2017-11-12T22:18:25.000Z,Want to win STANLEY® Model 1  3D Printer ? I just entered to win and you can too.  http://,0,0,0,0
FFJournal,@FFJournalUpdate,2017-11-12T21:15:10.000Z,3D printer  farms and robotics start pointing to future of manufacturing.  http:// @Forbes,0,0,0,0
t white,@whitet70,2017-11-12T22:34:28.000Z,"I entered a giveaway to win ""SainSmart x Anet A8 Prusa i3  3D Printer ..."" by  #SainSmart !  #GiveToEmpower https:// 7993/?ref_=tsm_4_tw_p_tw … #giveaway",0,0,0,0
REBECCA STEPHEN,@SWEETHOME4,2017-11-12T17:20:46.000Z,"I entered a giveaway to win ""SainSmart x Anet A8 Prusa i3  3D Printer ..."" by  #SainSmart !  #GiveToEmpower https:// 7993/?ref_=tsm_4_tw_p_tw … #giveaway",0,0,0,0
Predmaster,@predmaxter,2017-11-12T22:39:13.000Z,Me ha gustado un vídeo de  @YouTube  ( http://  - Experimenting with  3D Printed  Fabric).,0,0,0,0
Stephen,@stretch246246,2017-11-12T22:41:06.000Z,Want to win STANLEY® Model 1  3D Printer ? I just entered to win and you can too.  http://,0,0,0,0
Extruder Joe,@ExtruderJoe,2017-11-12T17:39:20.000Z,"3D Printing : 4 Fun DIY  3D Printing  Projects - portable rail-gun, duplicate keys, aquatic car tires, customized doo…  http:// 112-4-fun-diy-3d-printing-projects--3d-printed-portable-rail-gun-duplicate-keys-aquatic-car-tires-customized-doors.html …",0,0,0,0
3dprintfeed,@3dprintfeed,2017-11-12T20:25:07.000Z,3D PRINT  READY!!  http://,0,0,0,0
Greg Dayli,@greg_deyli,2017-11-12T23:10:24.000Z,"The fourth industrial revolution is here and the key technologies:

1  #AI  ( #MachineLearning )
2  #IoT 3  #Blockchain 4  #3D  Print
5  #Cloud 6  #Mobile 7  #Social 8  #AR /VR
9 ",0,6,0,0
GoldenGooseGiveaways,@GooseGiveaways,2017-11-12T21:10:18.000Z,Win a STANLEY Model 1  3D Printer  – Ends Nov 21st  https:// del-1-3d-printer-ends-nov-21st/ …,0,0,0,0
Gary Weston,@GaryWeston11,2017-11-12T21:09:17.000Z,3D Printing  - Machine Design  http://,0,0,0,0
Alloya,@AlloyaMo,2017-11-12T21:18:48.000Z,"I entered a giveaway to win ""SainSmart x Anet A8 Prusa i3  3D Printer ..."" by  #SainSmart !  #GiveToEmpower https:// 7993/?ref_=tsm_4_tw_p_tw … #giveaway",0,0,0,0
Vote3D.COM,@Vote3D,2017-11-12T19:18:42.000Z,3D Printer  Technology At Barcelona Show https:// hnology-barcelona-show/ … #barcelona #spain #tech #technology #3d #3dprint #3dprinter #3dprints #3dprinting #3dprinted #display #electronics #europe #european #TechNews #exhibition #future #futuristic,0,0,0,0
Tiffany Stoiber,@TiffanyStoiber,2017-11-12T21:24:05.000Z,Students at Franklin High School were able to  3D print  a Pokemon (and much more) in the new Accelerator lab  https://,0,0,0,0
3Dmaster,@masterfett1,2017-11-12T19:58:58.000Z,#captainmarvel #marvelcomics #3dprintartist #3DPrinters  WIP First image of my Captain Marvel  3d print  sculpture.,0,0,0,0
Nexus Governance,@NexusGov,2017-11-12T19:52:03.000Z,#3D #Printed #Spitfire #RC #Plane  body -  #Free #STL  parts  #VR #VRGames #Drone #Gaming http://  | Datacracy Marketplace -  https:// tfire-rc-plane-body-free-stl-parts/ … https:// oads/2017/11/3d-printed-spitfire-rc-plane-body-free-stl-parts.jpg … # #3D #Airplane  ...,0,0,0,0
Clotheshorse,@dopehorse,2017-11-12T18:21:04.000Z,The iPhone X’s Face ID can be broken – with a  3D printer  and a lot of time  http://,0,0,0,0
The Tech News Bot,@TheTechNewsBot,2017-11-12T18:05:44.000Z,#iPhone  X Face ID beaten with  3D-printed  mask http://,0,0,0,0
South Amboy Library,@salibrary,2017-11-12T18:42:11.000Z,"Tomorrow:  3D Printing  for Seniors 3D Printing  for Seniors - 12:30pm -  #DowdellEvents Nov 13, 2017 12:30PM https://",0,0,0,0
#SEOMarketing,@SEO_Mktg,2017-11-12T23:47:05.000Z,#iPhone  X Face ID beaten with  3D-printed  mask  http://,0,0,0,0
Kelli,@KlondikeKelli,2017-11-12T22:39:30.000Z,Just entered to win a STANLEY® Model 1  3D Printer  courtesy of  @dudeshopping !  http://,0,0,0,0
Pierre-Edouard G.,@p36p,2017-11-12T20:22:56.000Z,"""Custom e-MTB with  3d Printed  Parts"" :  http://  via  @YouTube",0,0,0,0
LEO Lane,@LEOLane3D,2017-11-12T20:20:03.000Z,.@FraunhoferILT to launch large-scale SLM  3D printing  system at  @formnext_expo   2017.  http://,0,0,0,0
Test User,@gainfullytest3,2017-11-12T22:00:00.000Z,Cancer patient receives  3D-printed  sternum and ribs - CNET  https:// R5lK1-pc/67456/ …,0,0,0,0
Suresh Kumar,@srajmali,2017-11-12T23:10:20.000Z,I liked a  @YouTube  video  http://  Building The TEVO Tarantula  3D Printer  Kit,0,0,0,0
Staminga Grooming Co,@staminga_beard,2017-11-12T23:19:10.000Z,"Futuristic airless tire is  3D printed , won't go flat or need replacement (Video)  http://",0,0,0,0
Hiya Jaiswal,@hiya_jaiswal,2017-11-12T18:05:40.000Z,3DWithUs - SelfCAD – Design Software for  3D Printing  Review  https:// withus-selfcad-design-software-for-3d-printing-printed-software-best …,0,2,0,0
Anthony,@slover123,2017-11-12T19:04:58.000Z,Just entered to win a STANLEY® Model 1  3D Printer  courtesy of  @dudeshopping !  http://,0,0,0,0
Five-Dollar Frenzy Deals,@5FrenzyDeals,2017-11-13T00:16:16.000Z,Just saw this on Amazon: youvimi Unisex  3d Printed  Drawstring Pocket... by youvimi for $19.99  http://  via  @amazon,0,0,0,0
Rami,@Ramidababa,2017-11-12T21:45:44.000Z,"I entered a giveaway to win ""SainSmart x Anet A8 Prusa i3  3D Printer ..."" by  #SainSmart !  #GiveToEmpower https:// 7993/?ref_=tsm_4_tw_p_tw … #giveaway",0,0,0,0
Blitz,@Darkspiral_94,2017-11-13T00:08:15.000Z,3D-printing  gets a turbo boost -  3D Printing  Progress  http://,0,0,0,0
Rohan Pinto,@RohanPinto,2017-11-12T19:47:23.000Z,The iPhone X's Face ID can be broken with a  3D printer  and a whole lot of time - BGR  http://,0,0,0,0
Chollazos China,@ChollazosChina,2017-11-12T19:35:08.000Z,"Tevo Tarantula  3D Printer  DIY Kit   #Gearbest Precio Oferta    129€ /  154€ Enlace Oferta  http://  Coupon: 9EU11113D

Principales características:
● El área de impresión es 200 x 200 x 200 mm Visto en  @chollazoschina",0,0,0,0
DIY 3Dprinted com,@DIY3dprinted,2017-11-12T18:13:12.000Z,Desktop Metal now taking international pre-orders for 'Studio System' metal  3D printer  -  https://,0,0,0,0
kicqtr,@kicqtr,2017-11-12T20:20:26.000Z,The iPhone X's Face ID can be broken with a  3D printer  and a whole lot of time - BGR  http:// #technology  The iPhone X's Fa…,0,0,0,0
For a Better World,@z_007_z,2017-11-12T18:14:58.000Z,Nanoparticles Keep  3D-Printed  Alloys From Cracking - Making Aluminium objects as strong as Steel...but lighter  https:// /nanoparticles-keep-3d-printed-alloys-from-cracking …,0,0,0,0
Model Boats Website,@ModelBoatsTweet,2017-11-12T20:33:12.000Z,"1:16 scale figures for a model trawler ?: i mentioned this method before on another site and was shot down about copyright ,anyway method is if you have a figure take it to a copy shop where it can be scanned and then  3D print  at the scale required the…  http://",0,0,0,0
ScienceSeeker Feed,@SciSeekFeed,2017-11-12T17:49:08.000Z,3D-Printing  human tissues using cellulose: will science fiction become reality?  http://,0,0,0,0
Anil Monga,@anilmonga55,2017-11-12T18:20:34.000Z,"Additive Manufacturing  of Metals: From Fundamental Technology to Rocket Nozzles, Medical…  http:// acturing-of-metals-from-fundamental-technology-to-rocket-nozzles-medical-implants-and-custom-jewelry-springer-series-in-materials-science/ …",0,0,0,0
Curbed,@Curbed,2017-11-12T20:44:02.000Z,"Yes, even houses are  3D printed  now.  https:// 458/3d-printed-houses-construction-apis-cor …",0,12,4,0
